index,url,valid,domain,title,description,image,published,archive,content,quote,language,keyword
https://www.thestar.com.my/news/environment/2025/06/11/ecowatch-smart-tech-takes-flight-in-malaysian-jungles,https://www.thestar.com.my/news/environment/2025/06/11/ecowatch-smart-tech-takes-flight-in-malaysian-jungles,0,www.thestar.com.my,Ecowatch: Smart tech takes flight in Malaysian jungles,Here's how one researcher wants to use AI to track hornbills in Malaysian jungles and help protect them. Read full story,https://apicms.thestar.com.my/uploads/images/2025/06/10/3359482.jpg,2025-06-10T23:30:00Z,,"FOR years, lecturer Dr Mehran Behjati and his wife would spend their weekends outdoors, taking to the bike trails and cycling into the remote areas and villages of Selangor, and even as far as Bukit … [+9070 chars]",,en,'biodiversity'
https://www.thestar.com.my/news/environment/2025/06/11/planetary-health-matters-we-must-move-beyond-silos-for-the-planet039s-health,https://www.thestar.com.my/news/environment/2025/06/11/planetary-health-matters-we-must-move-beyond-silos-for-the-planet039s-health,0,www.thestar.com.my,Planetary Health Matters: We must move beyond silos for the planet's health,Asean has the chance to deploy regional cooperation fit for our turbulent times. Read full story,https://apicms.thestar.com.my/uploads/images/2025/06/10/3359519.jpg,2025-06-10T23:00:00Z,,"AT the 46th Asean Summit in Kuala Lumpur in May 2025, regional leaders adopted Asean 2045: Our Shared Future a comprehensive vision for the regions development over the next two decades. It is a care… [+6523 chars]",,en,'biodiversity'
https://press.un.org/en/2025/db250610.doc.htm,https://press.un.org/en/2025/db250610.doc.htm,0,press.un.org,Daily Press Briefing by the Office of the Spokesperson for the Secretary-General,"A United Nations Population Fund (UNFPA) report, released today, finds that one in five people globally do not expect to have the number of children they desire. Key drivers include the prohibitive cost of parenthood, job insecurity, housing, concerns over th…",,2025-06-10T22:48:52Z,,"The following is a near-verbatim transcript of todays briefing by Farhan Haq, Deputy Spokesman for the Secretary-General.
**Programming Note
All right, good afternoon, everyone.
Today, there wont … [+24855 chars]",,en,'biodiversity'
https://www.globenewswire.com/news-release/2025/06/10/3097190/0/en/AMBROSIA-NEKTAR-Introduces-Premium-High-End-Organic-Food-from-Greece-with-a-Commitment-to-Purity-and-Provenance.html,https://www.globenewswire.com/news-release/2025/06/10/3097190/0/en/AMBROSIA-NEKTAR-Introduces-Premium-High-End-Organic-Food-from-Greece-with-a-Commitment-to-Purity-and-Provenance.html,0,www.globenewswire.com,AMBROSIA & NEKTAR Introduces Premium High-End Organic Food from Greece with a Commitment to Purity and Provenance,"Brand emphasizes absolute transparency and traceability, sourcing single-ingredient food from small artisan producers Brand emphasizes absolute transparency and traceability, sourcing single-ingredient food from small artisan producers",https://ml.globenewswire.com/Resource/Download/3eb325f8-8e09-49ff-86ce-4e4aaf0b019f,2025-06-10T21:26:00Z,,"MOUNTAIN BROOK, Ala., June 10, 2025 (GLOBE NEWSWIRE) -- AMBROSIA-NEKTAR INC., a new entrant in the international organic food market, announces the launch of its product line featuring premium high-e… [+2639 chars]",,en,'biodiversity'
https://www.ipsnews.net/2025/06/pacific-states-territories-gift-the-world-its-largest-conservation-project/,https://www.ipsnews.net/2025/06/pacific-states-territories-gift-the-world-its-largest-conservation-project/,0,www.ipsnews.net,"Pacific States, Territories Gift the World its ‘Largest Conservation Project’","While the island states in the Pacific may be modest, the ocean that surrounds them represents a huge oceanic state—an area equivalent to the entire European Continent. And for the first time, 22 Pacific Island countries and territories have pledged to manage…",https://www.ipsnews.net/Library/2025/06/Pacific-community-fam-photo.jpeg,2025-06-10T21:16:45Z,,"Asia-Pacific, Climate Change, Climate Change Finance, Climate Change Justice, Conservation, Development &amp; Aid, Editors' Choice, Featured, Headlines, Ocean Health, PACIFIC COMMUNITY, Pacific Commu… [+3912 chars]",,en,'biodiversity'
https://www.bostonherald.com/2025/06/10/climate-high-seas-treaty-explainer/,https://www.bostonherald.com/2025/06/10/climate-high-seas-treaty-explainer/,0,www.bostonherald.com,High Seas Treaty gains momentum as 18 new countries pledge support,The High Seas Treaty could shift how the world governs the open ocean.,https://www.bostonherald.com/wp-content/uploads/2025/06/Climate_High_Seas_Treaty_Explainer_77791-1.jpg?w=1024&h=682,2025-06-10T21:11:15Z,,"By ANNIKA HAMMERSCHLAG
NICE, France (AP) Eighteen countries ratified the High Seas Treaty on Monday, bringing the total to 49 just 11 short of the 60 needed for the ocean agreement to enter into for… [+4759 chars]",,en,'biodiversity'
https://www.foxnews.com/health/ditching-lawnmower-may-have-unexpected-health-benefits-according-experts,https://www.foxnews.com/health/ditching-lawnmower-may-have-unexpected-health-benefits-according-experts,0,www.foxnews.com,"Ditching the lawnmower may have unexpected health benefits, according to experts","""Let It Bloom June"" provides health advantages by reducing strain from mowing, decreasing exposure to lawn chemicals, and promoting mental wellness through connection with nature, a doctor says.",https://static.foxnews.com/foxnews.com/content/uploads/2025/06/lawn2.jpg,2025-06-10T20:42:35Z,,"As more homeowners embrace the trend of ""Let It Bloom June"" a natural successor to the popular ""No Mow May"" movement there is growing momentum on social media in support of wild lawns.
While these c… [+3909 chars]",,en,'biodiversity'
https://www.abajournal.com/news/article/law-journal-publishes-full-volume-with-the-help-of-ai,https://www.abajournal.com/news/article/law-journal-publishes-full-volume-with-the-help-of-ai,0,www.abajournal.com,AI takes on starring role in 4 articles published by law journal,The Texas A&M Journal of Property Law has published a collection of four articles on the loss of biodiversity that were drafted with the help of artificial intelligence.,https://www.abajournal.com/images/main_images/AI_ideas_classroom_750Shutterstock.png,2025-06-10T20:21:00Z,,"<ol><li>Home</li><li>Daily News</li><li>AI takes on starring role in 4 articles published…</li></ol>By Debra Cassens Weiss
June 10, 2025, 3:21 pm CDT
The Texas A&amp;M Journal of Property Law has p… [+2325 chars]",,en,'biodiversity'
https://www.odt.co.nz/business/orc-opposes-mine-expansion,https://www.odt.co.nz/business/orc-opposes-mine-expansion,0,www.odt.co.nz,ORC opposes mine expansion,"The planned expansion to an East Otago gold mine should be ""declined in full"", the Otago Regional Council says. After visiting OceanaGold’s Macraes...",https://www.odt.co.nz/sites/default/files/styles/odt_story_opengraph_1200w/public/story/2025/06/macraes_aerial_07_220325.jpg?itok=1-6nFrYG,2025-06-10T19:31:57Z,,"The planned expansion to an East Otago gold mine should be ""declined in full"", the Otago Regional Council says.After visiting OceanaGolds Macraes gold mine, north of Dunedin, 10 times, Otago Regional… [+4641 chars]",,en,'biodiversity'
https://www.forbes.com/sites/natashagural/2025/06/10/auction-of-globally-renowned-artists-on-the-french-riviera-benefits-coral-reef-protection-and-restoration/,https://www.forbes.com/sites/natashagural/2025/06/10/auction-of-globally-renowned-artists-on-the-french-riviera-benefits-coral-reef-protection-and-restoration/,0,www.forbes.com,Auction Of Globally-Renowned Artists On The French Riviera Benefits Coral Reef Protection And Restoration,"Móyòsóré Martins, Emi Ko (It’s Not Me) (2023) is among the 36 artworks featured in Thirty Six for Coral, an exhibition presented by The Coral Collective, an initiative by ocean charity  Project Zero, on view June 12-20 at the Grand-Hôtel du Cap-Ferrat on the …",https://imageio.forbes.com/specials-images/imageserve/684883d54bf8371bca1a3029/0x0.jpg?format=jpg&height=900&width=1600&fit=bounds,2025-06-10T19:30:27Z,,"Móyòsóré Martins, 'Emi Ko (Its Not Me) (2023) 62 x 52 inches Oil, Oil Stick, Pigment, Graphite on ... More Canvas
Móyòsóré Martins
Vibrant yellow googly eyes outlined in pale blue oil stick peer ou… [+5074 chars]",,en,'biodiversity'
https://freerepublic.com/focus/f-chat/4322206/posts,https://freerepublic.com/focus/f-chat/4322206/posts,0,freerepublic.com,Discovery of a Lifetime: Student Discovers Ancient “Living Fossil” Underneath Rock,"Peripatopsis barnardi represents the first ever species from the little Karoo, which indicates that the area was historically more forested than at present. It is one of seven new species from the Cape Fold Mountains described by researchers from Stellenbosch…",,2025-06-10T18:34:01Z,,"Skip to comments.
Discovery of a Lifetime: Student Discovers Ancient Living Fossil Underneath RockScitech Daily ^
 | June 08, 2025
 | Wiida Fourie-Basson, Stellenbosch University
Posted on 06/10/… [+7685 chars]",,en,'biodiversity'
https://news.mit.edu/2025/data-systems-and-society-0610,https://news.mit.edu/2025/data-systems-and-society-0610,0,news.mit.edu,"Melding data, systems, and society","“Data, Systems, and Society: Harnessing AI for Societal Good,” a book by MIT Professor Munther Dahleh, details the creation of the MIT Institute for Data, Systems and Society, a unique transdisciplinary center that unites many specialties through a common nee…",https://news.mit.edu/sites/default/files/images/202505/mit-Data-Systems-Dahleh-book.jpg,2025-06-10T18:25:00Z,,"Research that crosses the traditional boundaries of academic disciplines, and boundaries between academia, industry, and government, is increasingly widespread, and has sometimes led to the spawning … [+6835 chars]",,en,'biodiversity'
https://statetimes.in/dr-jitendra-addresses-un-conference-pushes-for-global-ocean-pact/,https://statetimes.in/dr-jitendra-addresses-un-conference-pushes-for-global-ocean-pact/,0,statetimes.in,"Dr Jitendra addresses UN Conference, pushes for ‘global ocean pact’","STATE TIMES NEWS FRANCE: India called for urgent global action on ocean health at the Third United Nations Ocean Conference (UNOC3) in Nice, with Union Minister of Earth Sciences (Independent Charge), Dr. Jitendra Singh pushing for “global ocean pact” and unv…",https://statetimes.in/wp-content/uploads/2025/06/Dr-Jitendra-addresses-UN-Conference.jpg,2025-06-10T17:45:38Z,,"STATE TIMES NEWS
FRANCE: India called for urgent global action on ocean health at the Third United Nations Ocean Conference (UNOC3) in Nice, with Union Minister of Earth Sciences (Independent Charge… [+3643 chars]",,en,'biodiversity'
https://en.antaranews.com/news/358737/from-herbs-to-mangroves-eco-guardians-plant-seeds-of-sustainability,https://en.antaranews.com/news/358737/from-herbs-to-mangroves-eco-guardians-plant-seeds-of-sustainability,0,en.antaranews.com,From herbs to mangroves: Eco-guardians plant seeds of sustainability,"Stressing the interdependence of all life forms on Earth, Indonesia&rsquo;s first environment minister, Emil Salim, once said that humans must respect nature ...",https://cdn.antaranews.com/cache/1200x800/2025/06/10/WhatsApp-Image-2025-06-10-at-13.15.31.jpeg,2025-06-10T17:35:08Z,,"Jakarta (ANTARA) - 
Stressing the interdependence of all life forms on Earth, Indonesia’s first environment minister, Emil Salim, once said that humans must respect nature and treat it the same way … [+4953 chars]",,en,'biodiversity'
https://variety.com/2025/film/news/women-in-animation-annecy-2-1236424504/,https://variety.com/2025/film/news/women-in-animation-annecy-2-1236424504/,0,variety.com,"Animation Makers Urged to Embrace Social Media, Put the IP Into Audience’s Hands: ‘It’s About Being Co-Creators’","Emerging animation creators should learn to stop worrying and love social media, looking beyond established production and distribution models. But there are a few pointers. “Talk back to the people who comment. They don’t want to talk to a wall,” said Hayley…",https://variety.com/wp-content/uploads/2025/06/MixCollage-10-Jun-2025-11-18-AM-5329.jpg?w=1000&h=563&crop=1,2025-06-10T17:28:20Z,,"Emerging animation creators should learn to stop worrying and love social media, looking beyond established production and distribution models. But there are a few pointers.
“Talk back to the people… [+5875 chars]",,en,'biodiversity'
https://journals.plos.org/plosone/article?id=10.1371/journal.pone.0324857,https://journals.plos.org/plosone/article?id=10.1371/journal.pone.0324857,0,journals.plos.org,"First report of field-evolved resistance to insecticides in Spodoptera frugiperda (Lepidoptera: Noctuidae) from Punjab, Pakistan","The fall armyworm, Spodoptera frugiperda, is one of the major destructive pests of agriculture in Pakistan. The widespread use of insecticides for the management of S. frugiperda has resulted in the field-evolved resistance to insecticides in different strain…",https://journals.plos.org/plosone/article/figure/image?id=10.1371/journal.pone.0324857.g003&size=inline,2025-06-10T14:00:00Z,,"Abstract
The fall armyworm, Spodoptera frugiperda, is one of the major destructive pests of agriculture in Pakistan. The widespread use of insecticides for the management of S. frugiperda has result… [+28055 chars]",,en,'insect mortality'
https://theconversation.com/from-sovereignty-to-sustainability-a-brief-history-of-ocean-governance-258200,https://theconversation.com/from-sovereignty-to-sustainability-a-brief-history-of-ocean-governance-258200,0,theconversation.com,From sovereignty to sustainability: a brief history of ocean governance,"The United Nations Ocean Conference (UNOC 3) will open in Nice, France on June 9, 2025. Will it help to consolidate a new international law of the oceans?",https://images.theconversation.com/files/672147/original/file-20250530-62-uguglr.jpg?ixlib=rb-4.1.0&rect=0%2C400%2C3999%2C1999&q=45&auto=format&w=1356&h=668&fit=crop,2025-06-04T14:05:58Z,,"The United Nations Ocean Conference (UNOC 3) will open in Nice, France, on June 9, 2025. It is the third conference of its kind, following events in New York in 2017 and Lisbon in 2022. Co-hosted by … [+9458 chars]",,en,'SDG 14'
https://iasbaba.com/2025/06/upsc-quiz-2025-iasbabas-daily-current-affairs-quiz-12th-june-2025/,https://iasbaba.com/2025/06/upsc-quiz-2025-iasbabas-daily-current-affairs-quiz-12th-june-2025/,0,iasbaba.com,UPSC Quiz – 2025 : IASbaba’s Daily Current Affairs Quiz 12th June 2025,"For Previous Daily Quiz (ARCHIVES) – CLICK HERE The Current Affairs questions are based on sources like ‘The Hindu’, ‘Indian Express’ and ‘PIB’, which are very important sources for UPSC Prelims Exam. The questions are focused on both the concepts and facts. …",https://iasbaba.com/wp-content/uploads/2023/12/Daily-Current-Affairs-Quiz-2024.jpg,2025-06-12T08:12:55Z,,"For Previous Daily Quiz (ARCHIVES) – CLICK HERE
The Current Affairs questions are based on sources like The Hindu, Indian Express and PIB, which are very important sources for UPSC Prelims Exam. The… [+6423 chars]",,en,'SDG 14'
https://economictimes.indiatimes.com/news/india/in-process-of-ratifying-high-seas-treaty-india/articleshow/121758757.cms,https://economictimes.indiatimes.com/news/india/in-process-of-ratifying-high-seas-treaty-india/articleshow/121758757.cms,0,economictimes.indiatimes.com,In process of ratifying High Seas Treaty: India,"India is actively ratifying the High Seas Treaty, demonstrating its dedication to global marine biodiversity conservation. Union Minister Jitendra Singh highlighted India's commitment at the UN Ocean Conference, emphasizing the ocean's importance to the natio…","https://img.etimg.com/thumb/msid-121758790,width-1200,height-630,imgsize-28864,overlay-economictimes/articleshow.jpg",2025-06-10T16:37:26Z,,"India on Tuesday said it is in the process of ratifying the High Seas Treaty, a global agreement for the protection and sustainable use of biodiversity in international waters.Delivering the country … [+2624 chars]",,en,'SDG 14'
https://press.un.org/en/2025/sea2220.doc.htm,https://press.un.org/en/2025/sea2220.doc.htm,0,press.un.org,Ocean Conference General Debate Continues,"The high-level 2025 United Nations Conference to Support the Implementation of Sustainable Development Goal (SDG) 14, conserve and sustainably use the oceans, seas and marine resources for sustainable development (the 2025 UN Ocean Conference), continues its …",,2025-06-10T10:07:22Z,,"The high-level 2025 United Nations Conference to Support the Implementation of Sustainable Development Goal (SDG) 14, conserve and sustainably use the oceans, seas and marine resources for sustainabl… [+648 chars]",,en,'SDG 14'
https://press.un.org/en/2025/sea2226.doc.htm,https://press.un.org/en/2025/sea2226.doc.htm,0,press.un.org,UNOC3 Day 4 — General Debate Continues,"The high-level 2025 United Nations Conference to Support the Implementation of Sustainable Development Goal (SDG) 14, conserve and sustainably use the oceans, seas and marine resources for sustainable development (the 2025 UN Ocean Conference), continues its …",,2025-06-12T08:21:39Z,,"The high-level 2025 United Nations Conference to Support the Implementation of Sustainable Development Goal (SDG) 14, conserve and sustainably use the oceans, seas and marine resources for sustainabl… [+648 chars]",,en,'SDG 14'
https://press.un.org/en/2025/sea2217.doc.htm,https://press.un.org/en/2025/sea2217.doc.htm,0,press.un.org,2025 United Nations Ocean Conference Officially Opens,"The high-level 2025 United Nations Conference to Support the Implementation of Sustainable Development Goal (SDG) 14, conserve and sustainably use the oceans, seas and marine resources for sustainable development (the 2025 UN Ocean Conference), opens today in…",,2025-06-09T07:36:48Z,,"The high-level 2025 United Nations Conference to Support the Implementation of Sustainable Development Goal (SDG) 14, conserve and sustainably use the oceans, seas and marine resources for sustainabl… [+939 chars]",,en,'SDG 14'
https://news.un.org/en/story/2025/06/1164306,https://news.un.org/en/story/2025/06/1164306,0,news.un.org,‘No Ocean Declaration without small islands’: Delegates push for inclusion as UN summit nears end,"With one day remaining before the conclusion of the Third UN Ocean Conference, delegates in Nice are preparing for the adoption of the summit’s eagerly anticipated political declaration. Small island developing States, facing the direct effects of climate cha…",https://global.unitednations.entermediadb.net/assets/mediadb/services/module/asset/downloads/preset/Libraries/Production%20Library/12-06-25-UNOC-fishers-Grenada.jpg/image770x420cropped.jpg,2025-06-12T12:00:00Z,,"With the conference, known as UNOC3, set to close Friday, the stakes couldnt be higher.
Li Junhua, the UNs Under-Secretary-General for Economic and Social Affairs, told UN News on Thursday that the … [+6116 chars]",,en,'SDG 14'
https://press.un.org/en/2025/sgsm22678.doc.htm,https://press.un.org/en/2025/sgsm22678.doc.htm,0,press.un.org,"Ocean of Our Ancestors ‘Can Be More than Legend, It Can Be Our Legacy’ Says Secretary-General, Opening Nice Conference","Following are UN Secretary-General António Guterres’ opening remarks to the United Nations Ocean Conference, in Nice, France, today:",,2025-06-09T15:08:29Z,,"Following are UN Secretary-General António Guterres opening remarks to the United Nations Ocean Conference, in Nice, France, today:
Monsieur le Président de la République française, Cher Emmanuel Ma… [+6745 chars]",,en,'SDG 14'
https://press.un.org/en/2025/db250609.doc.htm,https://press.un.org/en/2025/db250609.doc.htm,0,press.un.org,Daily Press Briefing by the Office of the Spokesperson for the Secretary-General,"UN Emergency Relief Coordinator Tom Fletcher has released $6 million from the Central Emergency Response Fund to respond to the worst malnutrition crisis to hit the north-east Nigeria in five years. One million children under age 5 in Borno, Adamawa and Yobe …",,2025-06-09T22:00:28Z,,"The following is a near-verbatim transcript of todays briefing by Farhan Haq, Deputy Spokesman for the Secretary-General.
All right, good afternoon, everyone.
**Secretary-General  Ocean Conference… [+20292 chars]",,en,'SDG 14'
https://www.ipsnews.net/2025/06/un-ocean-decade-vs-coastal-reality-they-took-our-sea-say-vizhinjam-fishworkers/,https://www.ipsnews.net/2025/06/un-ocean-decade-vs-coastal-reality-they-took-our-sea-say-vizhinjam-fishworkers/,0,www.ipsnews.net,"UN Ocean Decade vs. Coastal Reality: ‘They Took Our Sea,’ Say Vizhinjam Fishworkers","As the UN Ocean Conference (UNOC3) approaches, bringing renewed attention to SDG 14 (Life Below Water) and the rights of ocean-dependent communities, India’s Vizhinjam coast highlights the environmental injustice and human cost of unchecked coastal developmen…",https://www.ipsnews.net/Library/2025/06/Vizhinjam-port-pic.jpg,2025-06-08T07:12:27Z,,"Asia-Pacific, Biodiversity, Civil Society, Economy &amp; Trade, Editors' Choice, Environment, Featured, Headlines, Human Rights, Ocean Health, Sustainable Development Goals, TerraViva United Nations,… [+6812 chars]",,en,'SDG 14'
https://www.capecodtimes.com/story/news/environment/2025/06/10/sandy-neck-beach-closed-barnstable-ma-piping-plovers-west-dennis-orleans/84032107007/,https://www.capecodtimes.com/story/news/environment/2025/06/10/sandy-neck-beach-closed-barnstable-ma-piping-plovers-west-dennis-orleans/84032107007/,0,www.capecodtimes.com,Nor'easter swept Cape Cod piping plover nests to sea. Beach closures protect survivors.,"With plover chicks hatching, much of Sandy Neck in Barnstable closes and Cape Cod steps up vigilance to protect the threatened shorebirds.",https://s.yimg.com/ny/api/res/1.2/wW_iEI2vxWeI7NBDmCEzvg--/YXBwaWQ9aGlnaGxhbmRlcjt3PTEyMDA7aD03Mjg-/https://media.zenfs.com/en/cape-cod-times/32bebe7e6f88c2184d221ceb210483c5,2025-06-10T09:02:12Z,,"The powerful May 23 storm that swept across the Cape destroyed most piping plover nests at Sandy Neck Beach Park in Barnstable.
We lost about three-quarters of our nests to that noreaster, said Nina… [+5015 chars]",,en,'threatened species'
https://www.sciencedaily.com/releases/2025/06/250606231257.htm,https://www.sciencedaily.com/releases/2025/06/250606231257.htm,0,www.sciencedaily.com,Extreme weather is wiping out amphibians—Here’s where it’s worst,"Frogs, salamanders, and other amphibians are not just battling habitat loss and pollution they're now also contending with increasingly brutal heat waves and droughts. A sweeping 40-year study shows a direct link between the rise in extreme weather events and…",https://www.sciencedaily.com/images/1920/Fire-Salamander.webp,2025-06-07T03:12:57Z,,"Habitat loss, diseases, pollution, and climate change are already massively affecting amphibians - frogs, salamanders, and the caecilians native to tropical regions. The new study from the Institute … [+2811 chars]",,en,'threatened species'
https://phys.org/news/2025-06-australia-pledging-vulnerable-seas.html,https://phys.org/news/2025-06-australia-pledging-vulnerable-seas.html,0,phys.org,Australia's government is pledging better protection for our vulnerable seas—but will it work?,"Ahead of this week's crucial United Nations ocean conference, federal Environment Minister Murray Watt promised that by 2030, 30% of Australian waters would be ""highly protected.""",https://scx2.b-cdn.net/gfx/news/hires/2025/kelp-forest.jpg,2025-06-10T15:29:21Z,,"Ahead of this week's crucial United Nations ocean conference, federal Environment Minister Murray Watt promised that by 2030, 30% of Australian waters would be ""highly protected.""
This is a telling … [+6475 chars]",,en,'threatened species'
https://www.forbes.com/sites/feliciajackson/2025/06/12/tunas-hidden-catch-a-risk-investors-cant-afford-to-ignore/,https://www.forbes.com/sites/feliciajackson/2025/06/12/tunas-hidden-catch-a-risk-investors-cant-afford-to-ignore/,0,www.forbes.com,Tuna's Hidden Catch: A Risk Investors Can’t Afford To Ignore,"New report reveals nearly half the global tuna catch is untraceable. This poses major legal, financial, and ESG risks for investors in the $40 billion tuna industry.",https://imageio.forbes.com/specials-images/imageserve/684a997cd245dc4bf01b9df7/0x0.jpg?format=jpg&height=900&width=1600&fit=bounds,2025-06-12T09:21:51Z,,"Shrimper's catch from shrimp drag net on the beach showing shrimps, crabs and fish like sole, lesser ... More weever, mackerel caught along the North Sea coast. (Photo by: Philippe Clement/Arterra/Un… [+8763 chars]",,en,'threatened species'
http://twistedsifter.com/2025/06/grizzly-bears-havent-been-seen-in-california-for-over-100-years-but-that-may-be-changing-soon/,http://twistedsifter.com/2025/06/grizzly-bears-havent-been-seen-in-california-for-over-100-years-but-that-may-be-changing-soon/,0,twistedsifter.com,"Grizzly Bears Haven’t Been Seen In California For Over 100 Years, But That May Be Changing Soon","These large bears are considered threatened, with just 1923 living in the contiguous USA.",https://twistedsifter.com/wp-content/uploads/2025/05/Grizzly-1.png,2025-06-10T16:55:59Z,,"Shutterstock
When you look at the California state flag or its official seal, you will see a grizzly bear featured proudly. This is a little odd, however, because no grizzly bears have been found in… [+2706 chars]",,en,'threatened species'
