index,url,valid,domain,title,description,image,published,archive,content,quote,language,keyword
https://theconversation.com/a-healthy-earth-may-be-ugly-how-literary-art-can-help-us-value-insect-conservation-237363,https://theconversation.com/a-healthy-earth-may-be-ugly-how-literary-art-can-help-us-value-insect-conservation-237363,0,theconversation.com,‘A healthy earth may be ugly’: How literary art can help us value insect conservation,"Some 500,000 insect species are facing extinction. Poetry, fiction and nonfiction prose can help raise awareness of the essential roles these creatures play in our ecosystems.",https://images.theconversation.com/files/635306/original/file-20241129-15-8dk4na.jpg?ixlib=rb-4.1.0&rect=0%2C0%2C6934%2C3462&q=45&auto=format&w=1356&h=668&fit=crop,2024-12-03T16:21:32Z,https://web.archive.org/web/20241204033742/https://theconversation.com/a-healthy-earth-may-be-ugly-how-literary-art-can-help-us-value-insect-conservation-237363,"Our Earth is home to an estimated 5.5 million species of insects, with only one fifth of these named. Considered as the most diverse animals, these creatures account for about 80% of them. Sometimes … [+7379 chars]",,en,'insect extinction'
https://pubs.rsc.org/en/content/articlelanding/2025/lc/d4lc00660g,https://pubs.rsc.org/en/content/articlelanding/2025/lc/d4lc00660g,0,pubs.rsc.org,OoTrap: Enhancing Oocyte Collection and Maturation with a Field-Deployable Fluidic Device,"Lab Chip, 2025, Accepted ManuscriptDOI: 10.1039/D4LC00660G, Paper Open Access &nbsp This article is licensed under a Creative Commons Attribution 3.0 Unported Licence.Roksan Franko, Marcia de Almeida Monteiro Melo FerrazAssisted reproductive technologies (ART…",,2024-12-03T00:00:00Z,,"Assisted reproductive technologies (ART) are pivotal for contemporary reproductive medicine and species conservation. However, the manual handling required in these processes introduces stress that c… [+1007 chars]",,en,'species conservation'
https://www.nbcnews.com/science/science-news/killer-whale-orca-salmon-head-rcna182697,https://www.nbcnews.com/science/science-news/killer-whale-orca-salmon-head-rcna182697,0,www.nbcnews.com,"Killer whale spotted balancing a salmon on its head, intriguing scientists and orca watchers","A killer whale was spotted balancing a salmon on its head. It’s not clear what the behavior means, but orcas were observed doing the same thing in the 1980s.","https://media-cldnry.s-nbcnews.com/image/upload/t_nbcnews-fp-1200-630,f_auto,q_auto:best/rockcms/2024-12/241203-orca-ch-1415-b5e444.jpg",2024-12-04T20:00:00Z,http://wayback.archive-it.org/all/20241204200551/https://www.nbcnews.com/science/science-news/killer-whale-orca-salmon-head-rcna182697,"A killer whale was spotted balancing a salmon on its head earlier this fall near the coastline in Washington state, surprising scientists and intriguing orca watchers. 
The critically endangered sou… [+4082 chars]",,en,'species conservation'
https://www.livemint.com/industry/retail/winter-wear-sales-winter-seasons-imd-fashion-retailers-myntra-environment-climate-inventory-fast-fashion-crisil-ratings-11733648750802.html,https://www.livemint.com/industry/retail/winter-wear-sales-winter-seasons-imd-fashion-retailers-myntra-environment-climate-inventory-fast-fashion-crisil-ratings-11733648750802.html,0,www.livemint.com,Winter wear sales pick up after warm November slows start,"Unpredictable weather patterns continue to pose challenges for inventory management, as retailers now face shorter but more intense winter seasons.",https://www.livemint.com/lm-img/img/2024/12/08/1600x900/20241129-MTH-PGD-MN-Cold-001005-0_1732893564108_1733658382196.JPG,2024-12-08T12:14:36Z,,"New Delhi: A surprisingly warm November led to a slow start to winter apparel sales, but a steady dip in temperature recently has boosted demand, bringing relief to retailers.
Unpredictable weather … [+3451 chars]",,en,'ecosystem'
https://www.thehindubusinessline.com/specials/emerging-entrepreneurs/companies-with-a-founding-principle-of-treating-employees-well/article68961856.ece,https://www.thehindubusinessline.com/specials/emerging-entrepreneurs/companies-with-a-founding-principle-of-treating-employees-well/article68961856.ece,0,www.thehindubusinessline.com,Companies with a founding principle of treating employees well,"Entrepreneurs create jobs for aspiring youth, but this achievement turns meaningless if employees are treated with disdain",https://bl-i.thgim.com/public/incoming/tpw820/article68961877.ece/alternates/LANDSCAPE_1200/CCI_UDHindu_KSL_UT83MKVA2_R1522227648_0_1f1d9c44-3513-4641-b67a-ad4960c26e38.jpg,2024-12-08T12:10:22Z,,"Recently, the founder of a leading food delivery startup announced a key open position in his company, offering close access to the entrepreneur, a great learning opportunity and an annual package of… [+2701 chars]",,en,'ecosystem'
https://www.cnet.com/deals/treat-yourself-to-a-playstation-vr-2-bundle-with-horizon-for-its-lowest-price-yet/,https://www.cnet.com/deals/treat-yourself-to-a-playstation-vr-2-bundle-with-horizon-for-its-lowest-price-yet/,0,www.cnet.com,Treat Yourself to a PlayStation VR 2 Bundle With Horizon for Its Lowest Price Yet,A 42% discount at Amazon takes this great PSVR 2 bundle to $349.,https://www.cnet.com/a/img/resize/2d36659eaf69f7fb7ca1e58432665832577da45e/hub/2024/05/30/cc36399f-7ffd-41ed-b79e-cc4e2d7e2a72/psvr-2-horizon-bundle-commerce-image.jpg?auto=webp&fit=crop&height=675&width=1200,2024-12-08T12:10:00Z,,Black Friday may have ended but one of its best video game deals is hanging on for the holiday season. The deal in question is a PlayStation VR 2 bundle that comes with the immersive action-adventure… [+1515 chars],,en,'ecosystem'
https://www.techradar.com/televisions/home-theater/kaleidescape-strato-v-movie-player-review,https://www.techradar.com/televisions/home-theater/kaleidescape-strato-v-movie-player-review,0,www.techradar.com,Kaleidescape Strato V Movie Player review: 4K Blu-ray video and audio quality minus the discs,Kaleidescape's Strato V combines a movie player and server in one for a more simple and affordable home theater content solution.,https://cdn.mos.cms.futurecdn.net/DVxFCAo2kCCy45gfP9FnUS-1200-80.jpg,2024-12-08T12:00:30Z,,"KALEIDESCAPE STRATO V: One-minute review
The Kaleidescape Strato V is the latest Movie Player from Kaleidescape, and it represents a definite shift for the company. Kaleidescape is synonymous with a… [+17635 chars]",,en,'ecosystem'
https://www.zdnet.com/article/gift-an-apple-watch-se-for-24-off-at-walmart-ahead-of-the-holidays/,https://www.zdnet.com/article/gift-an-apple-watch-se-for-24-off-at-walmart-ahead-of-the-holidays/,0,www.zdnet.com,Gift an Apple Watch SE for 24% off at Walmart ahead of the holidays,"The Apple Watch SE (2nd gen) on sale for $189 right now, and it's the perfect smartwatch for those looking for basic features.",https://www.zdnet.com/a/img/resize/e37cfb023a583644568be34dcade606c9a0381ca/2024/11/21/d2d215c9-42c7-4f76-98ff-f0ad989fdade/screenshot-2024-11-21-at-3-25-14-pm-removebg-preview.png?auto=webp&fit=crop&height=675&width=1200,2024-12-08T12:00:16Z,,"Apple/ZDNET
Apple's popular watch wearables are available in several models, and the Watch SE (2nd Gen) is still the latest base model watch to hit the market. Despite Apple unveiling the new Watch … [+1756 chars]",,en,'ecosystem'
https://www.geeky-gadgets.com/one-ui-7-hands-on-you-need-to-see-this/,https://www.geeky-gadgets.com/one-ui-7-hands-on-you-need-to-see-this/,0,www.geeky-gadgets.com,One UI 7 Hands-on: You NEED to See This!,"Samsung has unveiled One UI 7, its most recent software update, which promises to deliver a substantial overhaul for Galaxy devices. This update is designed to provide users with a more seamless and intuitive experience by combining visual enhancements, impro…",https://www.geeky-gadgets.com/wp-content/uploads/2024/12/One-UI-7-2.jpg,2024-12-08T12:00:06Z,,"Samsung has unveiled One UI 7, its most recent software update, which promises to deliver a substantial overhaul for Galaxy devices. This update is designed to provide users with a more seamless and … [+6831 chars]",,en,'ecosystem'
https://www.cnet.com/home/security/adt-2024-review-adt-leverages-nest-for-a-more-promising-future/,https://www.cnet.com/home/security/adt-2024-review-adt-leverages-nest-for-a-more-promising-future/,0,www.cnet.com,ADT 2024 Review: ADT+ Leverages Nest for a More Promising Future,"More Google Nest integration and improved tech breathe much-needed fresh air into ADT, home security, but high cost issues remain.",https://www.cnet.com/a/img/resize/ad372d2c3c4f41d75246d5489c0f005fd7a24e96/hub/2024/12/06/c6ec96f4-dd30-467a-a6a5-5a4ad500268d/adt-sign-pic.jpg?auto=webp&fit=crop&height=675&width=1200,2024-12-08T12:00:00Z,,"Over the past decade, ADT has made several attempts to push its well-known security system into the future. Many have floundered. Now ADT has launched another effort called ADT+, with a new platform,… [+17989 chars]",,en,'ecosystem'
https://www.androidpolice.com/google-pixel-9-pro-xl-vs-apple-iphone-16-pro-max/,https://www.androidpolice.com/google-pixel-9-pro-xl-vs-apple-iphone-16-pro-max/,0,www.androidpolice.com,Google Pixel 9 Pro XL vs. Apple iPhone 16 Pro Max: The big phone showdown,How does Google's XL flagship stack up against Apple's latest Pro Max smartphone?,https://static1.anpoimages.com/wordpress/wp-content/uploads/2024/11/google-pixel-9-pro-xl-vs-apple-iphone-16-pro-max.jpg,2024-12-08T11:30:11Z,,"<ul><li>Your changes have been saved
Email has already been sent
FollowFollowed Follow with Notifications Follow Unfollow 
Google's premium flagship
The Pixel 9 Pro XL is Google's traditional lar… [+11435 chars]",,en,'ecosystem'
https://www.thehindubusinessline.com/specials/corporate-file/what-gives-the-zip-zap-zoom-to-quick-commerce/article68961721.ece,https://www.thehindubusinessline.com/specials/corporate-file/what-gives-the-zip-zap-zoom-to-quick-commerce/article68961721.ece,0,www.thehindubusinessline.com,"What gives the zip, zap, zoom to quick commerce","Quick commerce in India is booming, with major players like Blinkit and Zepto leading the market evolution.",https://bl-i.thgim.com/public/incoming/wi5smz/article68961722.ece/alternates/LANDSCAPE_1200/BL0912_Corp_swiggy%20dark%20room.jpg,2024-12-08T11:16:47Z,,"On a lazy Saturday afternoon, Abhishek and his friends decided to make tea and were dismayed to discover they had run out of tea leaves. No sweat. One of them tapped open a quick-commerce app a platf… [+5610 chars]",,en,'ecosystem'
https://www.etfdailynews.com/2024/12/08/ncino-nasdaqncno-price-target-lowered-to-42-00-at-robert-w-baird/,https://www.etfdailynews.com/2024/12/08/ncino-nasdaqncno-price-target-lowered-to-42-00-at-robert-w-baird/,0,www.etfdailynews.com,nCino (NASDAQ:NCNO) Price Target Lowered to $42.00 at Robert W. Baird,"nCino (NASDAQ:NCNO – Free Report) had its target price reduced by Robert W. Baird from $43.00 to $42.00 in a report released on Thursday morning,Benzinga reports. They currently have a neutral rating on the stock. Several other equities analysts have also com…",https://www.americanbankingnews.com/wp-content/timthumb/timthumb.php?src=https://www.marketbeat.com/logos/ncino-inc-logo.png?v=20240410092914&w=240&h=240&zc=2,2024-12-08T11:16:46Z,,"nCino (NASDAQ:NCNO – Free Report) had its target price reduced by Robert W. Baird from $43.00 to $42.00 in a report released on Thursday morning,Benzinga reports. They currently have a neutral rating… [+4752 chars]",,en,'ecosystem'
https://economictimes.indiatimes.com/industry/services/consultancy-/-audit/aligning-indian-auditing-with-global-standards-to-boost-investor-confidence-attract-more-funds-nfra-chief/articleshow/116105502.cms,https://economictimes.indiatimes.com/industry/services/consultancy-/-audit/aligning-indian-auditing-with-global-standards-to-boost-investor-confidence-attract-more-funds-nfra-chief/articleshow/116105502.cms,0,economictimes.indiatimes.com,"Aligning Indian auditing with global standards to boost investor confidence, attract more funds: NFRA chief","India's National Financial Reporting Authority (NFRA) chief advocates aligning auditing standards with global norms to boost investor confidence and attract funds.  The NFRA is working to update standards, addressing gaps and aligning with international pract…","https://img.etimg.com/thumb/msid-116105666,width-1200,height-630,imgsize-85996,overlay-economictimes/articleshow.jpg",2024-12-08T11:15:59Z,,"Aligning India's auditing with global standards will help boost investors' confidence, attract more funds and ensure greater credibility to the financial data, National Financial Reporting Authority'… [+3233 chars]",,en,'ecosystem'
https://www.msnbc.com/opinion/msnbc-opinion/trump-big-lie-2024-election-2000-mules-rcna183112,https://www.msnbc.com/opinion/msnbc-opinion/trump-big-lie-2024-election-2000-mules-rcna183112,0,www.msnbc.com,"No matter how many times they’re debunked, Trump’s 2020 election fraud lies keep winning",Trump’s big lie that the 2020 election was stolen has been debunked for years. But the basic message of that lie will never die.,"https://media-cldnry.s-nbcnews.com/image/upload/t_nbcnews-fp-1200-630,f_auto,q_auto:best/rockcms/2023-12/210924-donald-trump-ac-436p-13095c.jpg",2024-12-08T11:00:00Z,,"Dinesh DSouza, the right-wing author and filmmaker, admitted last week that one of the key pieces of evidence in his film 2000 Mules, a 2022 documentary alleging a vast conspiracy involving thousands… [+6994 chars]",,en,'ecosystem'
https://blog.succinct.xyz/introducing-sp1/,https://blog.succinct.xyz/introducing-sp1/,0,blog.succinct.xyz,"SP1: A performant, 100% open-source, contributor-friendly zkVM",We’re excited to announce Succinct Processor 1 (SP1): our first-generation zero-knowledge virtual machine (zkVM) that verifies the execution of arbitrary Rust (or any LLVM-compiled language) programs. SP1 targets an order of magnitude performance improvement …,https://blog.succinct.xyz/content/images/size/w1200/2024/10/blog-header-aspect-11.png,2024-12-08T10:38:03Z,http://archive.md/20241208155516/https://blog.succinct.xyz/introducing-sp1/,Were excited to announce Succinct Processor 1 (SP1): our first-generation zero-knowledge virtual machine (zkVM) that verifies the execution of arbitrary Rust (or any LLVM-compiled language) programs.… [+9855 chars],,en,'ecosystem'
https://www.yahoo.com/news/officials-thrilled-significant-decrease-poaching-103002664.html,https://www.yahoo.com/news/officials-thrilled-significant-decrease-poaching-103002664.html,0,www.yahoo.com,Officials thrilled after significant decrease in poaching incidents of iconic animal: 'They are our pride and the crown jewel of our biodiversity',"Ending poaching is critical for several reasons, including species survival, avoiding disruption of ecological systems, and impeding the illegal animal trade...",https://s.yimg.com/ny/api/res/1.2/IpgwycBklXppOZZ7tJSpbg--/YXBwaWQ9aGlnaGxhbmRlcjt3PTEyMDA7aD04MDA-/https://media.zenfs.com/en/the_cool_down_737/cbb4b1bab45510cc2bdf9cdebe78bdcb,2024-12-08T10:30:02Z,,"Yahoo is using AI to generate takeaways from this article. This means the info may not always match what's in the article. Reporting mistakes helps us improve the experience.Generate Key Takeaways
I… [+2579 chars]",,en,'ecosystem'
https://en.antaranews.com/news/337333/deepening-mutual-learning-for-a-shared-future-huanyu-entertainment-attends-the-29th-asian-television-awards,https://en.antaranews.com/news/337333/deepening-mutual-learning-for-a-shared-future-huanyu-entertainment-attends-the-29th-asian-television-awards,0,en.antaranews.com,Deepening Mutual Learning for a Shared Future: Huanyu Entertainment Attends the 29th Asian Television Awards,"On November 29, Beijing time, the 29th Asian Television Awards officially opened in Jakarta. Huanyu Entertainment attended and engaged with participants on ...",https://cdn.antaranews.com/cache/1200x800/2024/12/08/The_29th_Asian_Television_Awards-DESKTOP-BINM1UH.jpg,2024-12-08T10:14:52Z,,"Jakarta, Indonesia (ANTARA/PRNewswire)- On November 29, Beijing time, the 29th Asian Television Awards officially opened in Jakarta. Huanyu Entertainment attended and engaged with participants on the… [+3049 chars]",,en,'ecosystem'
https://www.etfdailynews.com/2024/12/08/ncinos-ncno-neutral-rating-reiterated-at-piper-sandler/,https://www.etfdailynews.com/2024/12/08/ncinos-ncno-neutral-rating-reiterated-at-piper-sandler/,0,www.etfdailynews.com,nCino’s (NCNO) Neutral Rating Reiterated at Piper Sandler,"Piper Sandler reaffirmed their neutral rating on shares of nCino (NASDAQ:NCNO – Free Report) in a research note released on Thursday morning, MarketBeat reports. Piper Sandler currently has a $38.00 target price on the stock. Other equities analysts also rece…",https://www.americanbankingnews.com/wp-content/timthumb/timthumb.php?src=https://www.marketbeat.com/logos/ncino-inc-logo.png?v=20240410092914&w=240&h=240&zc=2,2024-12-08T10:09:07Z,,"Piper Sandler reaffirmed their neutral rating on shares of nCino (NASDAQ:NCNO – Free Report) in a research note released on Thursday morning, MarketBeat reports. Piper Sandler currently has a $38.00 … [+4684 chars]",,en,'ecosystem'
https://www.cbc.ca/news/canada/newfoundland-labrador/land-and-sea-shark-fishing-1.7399640,https://www.cbc.ca/news/canada/newfoundland-labrador/land-and-sea-shark-fishing-1.7399640,0,www.cbc.ca,"Land & Sea goes fishing for sharks, history and education","A tourism operator in Hare Bay takes people shark fishing, but also gathers information on these apex predators for researchers at Fisheries and Oceans Canada.",https://i.cbc.ca/1.7399711.1733243539!/fileImage/httpImage/image.jpg_gen/derivatives/16x9_620/shark-bonavista-bay.jpg,2024-12-08T09:30:00Z,,"There is so much to learn about the ocean off of Newfoundland and Labrador's coast and all the different creatures living in that amazing environment.
So, when someone pitches a Land &amp; Sea idea … [+5304 chars]",,en,'ecosystem'
https://www.geeky-gadgets.com/how-to-use-apple-notes-to-organize-your-life/,https://www.geeky-gadgets.com/how-to-use-apple-notes-to-organize-your-life/,0,www.geeky-gadgets.com,10 Apple Notes Features to Organize Your Life More Effeciently,"Life can feel like a juggling act sometimes, can’t it? Between work deadlines, personal goals, and the endless stream of to-dos, staying organized often feels like an uphill battle. If you’ve ever found yourself scribbling reminders on sticky notes or frantic…",https://www.geeky-gadgets.com/wp-content/uploads/2024/12/how-to-use-apple-notes-effectively.jpg,2024-12-08T09:01:02Z,https://web.archive.org/web/20241209122332/https://www.geeky-gadgets.com/how-to-use-apple-notes-to-organize-your-life/,"Life can feel like a juggling act sometimes, cant it? Between work deadlines, personal goals, and the endless stream of to-dos, staying organized often feels like an uphill battle. If youve ever foun… [+7018 chars]",,en,'ecosystem'
https://bitcoinist.com/bitcoin-rally-fuels-demand-for-crypto-loans/,https://bitcoinist.com/bitcoin-rally-fuels-demand-for-crypto-loans/,0,bitcoinist.com,Bitcoin Rally Fuels Demand For Crypto Loans: Lending Sector On The Rebound,"The recent Bitcoin price surge, which surpassed $100,000 for the first time, is creating ripples in the long-struggling crypto lending sector, particularly through decentralized finance (DeFi) applications.  According to a Bloomberg report, the speculative ex…",https://bitcoinist.com/wp-content/uploads/2024/11/Screenshot_590.jpg,2024-12-08T09:00:31Z,https://web.archive.org/web/20241209122454/https://bitcoinist.com/bitcoin-rally-fuels-demand-for-crypto-loans/,"The recent Bitcoin price surge, which surpassed $100,000 for the first time, is creating ripples in the long-struggling crypto lending sector, particularly through decentralized finance (DeFi) applic… [+3994 chars]",,en,'ecosystem'
https://hackaday.com/2024/12/08/wasm-4-retro-game-dev-right-in-your-browser/,https://hackaday.com/2024/12/08/wasm-4-retro-game-dev-right-in-your-browser/,0,hackaday.com,WASM-4: Retro Game Dev Right in Your Browser,"Have you ever dreamt of developing games that run on practically anything, from a modern browser to a microcontroller? Enter WASM-4, a minimalist fantasy console where constraints spark creativity. Unlike …read more",https://hackaday.com/wp-content/uploads/2024/12/wasm-games-1200.jpg,2024-12-08T09:00:17Z,,"Have you ever dreamt of developing games that run on practically anything, from a modern browser to a microcontroller? Enter WASM-4, a minimalist fantasy console where constraints spark creativity. U… [+1294 chars]",,en,'ecosystem'
https://www.macobserver.com/tips/how-to/rcs-on-iphone-what-it-really-means-and-how-to-unlock-its-full-potential/,https://www.macobserver.com/tips/how-to/rcs-on-iphone-what-it-really-means-and-how-to-unlock-its-full-potential/,0,www.macobserver.com,RCS on iPhone: What It Really Means and How to Unlock Its Full Potential,"iPhone users have been begging for RCS messaging for years, and for good reason. It lets you send high-quality photos, videos, and group texts without the MMS compression that blurs everything. While iMessage works well between Apple devices, it isn’t availab…",https://www.macobserver.com/wp-content/uploads/2024/10/RCS-Not-Working-on-iPhone-Running-iOS-18.png,2024-12-08T08:53:32Z,https://web.archive.org/web/20241209122902/https://www.macobserver.com/tips/how-to/rcs-on-iphone-what-it-really-means-and-how-to-unlock-its-full-potential/,"iPhone users have been begging for RCS messaging for years, and for good reason. It lets you send high-quality photos, videos, and group texts without the MMS compression that blurs everything. While… [+4063 chars]",,en,'ecosystem'
https://www.etfdailynews.com/2024/12/08/rockefeller-capital-management-l-p-has-1-35-million-stock-position-in-td-synnex-co-nysesnx/,https://www.etfdailynews.com/2024/12/08/rockefeller-capital-management-l-p-has-1-35-million-stock-position-in-td-synnex-co-nysesnx/,0,www.etfdailynews.com,Rockefeller Capital Management L.P. Has $1.35 Million Stock Position in TD SYNNEX Co. (NYSE:SNX),"Rockefeller Capital Management L.P. raised its holdings in TD SYNNEX Co. (NYSE:SNX – Free Report) by 1.3% during the 3rd quarter, according to the company in its most recent disclosure with the SEC. The firm owned 11,227 shares of the business services provid…",https://www.americanbankingnews.com/wp-content/timthumb/timthumb.php?src=https://www.marketbeat.com/logos/td-synnex-co-logo-1200x675.png?v=20240119115716&w=240&h=240&zc=2,2024-12-08T08:49:02Z,,"Rockefeller Capital Management L.P. raised its holdings in TD SYNNEX Co. (NYSE:SNX – Free Report) by 1.3% during the 3rd quarter, according to the company in its most recent disclosure with the SEC. … [+5947 chars]",,en,'ecosystem'
https://www.etfdailynews.com/2024/12/08/townsquare-capital-llc-takes-position-in-vontier-co-nysevnt/,https://www.etfdailynews.com/2024/12/08/townsquare-capital-llc-takes-position-in-vontier-co-nysevnt/,0,www.etfdailynews.com,Townsquare Capital LLC Takes Position in Vontier Co. (NYSE:VNT),"Townsquare Capital LLC bought a new stake in shares of Vontier Co. (NYSE:VNT – Free Report) during the third quarter, according to the company in its most recent filing with the Securities and Exchange Commission. The fund bought 6,086 shares of the company’s…",https://www.americanbankingnews.com/wp-content/timthumb/timthumb.php?src=https://www.marketbeat.com/logos/vontier-co-logo-1200x675.jpg?v=20210511124307&w=240&h=240&zc=2,2024-12-08T08:28:51Z,,"Townsquare Capital LLC bought a new stake in shares of Vontier Co. (NYSE:VNT – Free Report) during the third quarter, according to the company in its most recent filing with the Securities and Exchan… [+4782 chars]",,en,'ecosystem'
https://www.wowebook.org/so-you-want-to-work-in-crypto/,https://www.wowebook.org/so-you-want-to-work-in-crypto/,0,www.wowebook.org,So You Want to Work in Crypto,"eBook Details: Paperback: 274 pages Publisher: WOW! eBook (December 4, 2024) Language: English ISBN-10: 8868805028 ISBN-13: 978-8868805028 eBook Description: So You Want to Work in Crypto: Not Law, Not Medicine, But Crypto Gain the necessary technical skills,…",,2024-12-08T08:18:38Z,,"eBook Details:
<ul><li>Paperback: 274 pages</li><li>Publisher: WOW! eBook (December 4, 2024)</li><li>Language: English</li><li>ISBN-10: 8868805028</li><li>ISBN-13: 978-8868805028</li></ul>eBook Desc… [+1665 chars]",,en,'ecosystem'
https://soldiersystems.net/2024/12/08/uf-pro-expands-into-the-us-insights-from-joze-kastelic-on-the-companys-next-step/,https://soldiersystems.net/2024/12/08/uf-pro-expands-into-the-us-insights-from-joze-kastelic-on-the-companys-next-step/,0,soldiersystems.net,UF PRO Expands into the US: Insights from Jože Kastelic on the Company’s Next Step,"KOMENDA, SLOVENIA (05.12.2024) Jože Kastelic, Managing Director of UF PRO, recentlyprovided valuable insights into UF PRO’s vision and goals for expanding into the US market, addressing the unique challenges and opportunities it presents. As part of UF PRO’s …",https://soldiersystems.net/wp-content/uploads/2024/12/IMG_4648.jpeg,2024-12-08T08:00:00Z,https://web.archive.org/web/20241209123146/https://soldiersystems.net/2024/12/08/uf-pro-expands-into-the-us-insights-from-joze-kastelic-on-the-companys-next-step/,"KOMENDA, SLOVENIA (05.12.2024)
Joe Kastelic, Managing Director of UF PRO, recentlyprovided valuable insights into UF PROs vision and goals for expanding into the US market, addressing the unique cha… [+8838 chars]",,en,'ecosystem'
