index,url,valid,domain,title,description,image,published,archive,content,quote,language,keyword
https://www.yahoo.com/news/articles/jaguar-spotted-arizona-points-progress-234952107.html,https://www.yahoo.com/news/articles/jaguar-spotted-arizona-points-progress-234952107.html,0,www.yahoo.com,A new jaguar spotted in Arizona points to progress in the endangered species' recovery,"Just like a human fingerprint, the rosette pattern on each jaguar is unique so researchers knew they had a new animal on their hands after reviewing images...",https://s.yimg.com/ny/api/res/1.2/kihJZfw0m9.syOx_lvv9OA--/YXBwaWQ9aGlnaGxhbmRlcjt3PTEyMDA7aD04MDA7Y2Y9d2VicA--/https://media.zenfs.com/en/ap.org/efe57d504b3441f7f72d4baedc2bebc9,2025-12-04T23:49:52Z,,"The spots gave it away. Just like a human fingerprint, the rosette pattern on each jaguar is unique so researchers knew they had a new animal on their hands after reviewing images captured by a remot… [+2527 chars]",,en,'endangered species'
https://www.yahoo.com/news/articles/authorities-horrifying-discovery-stopping-man-101513864.html,https://www.yahoo.com/news/articles/authorities-horrifying-discovery-stopping-man-101513864.html,0,www.yahoo.com,"Authorities make horrifying discovery after stopping man with swollen stomach at airport: 'Completely overcrowded, mistreated'",The bizarre encounter started in Lima’s Jorge Chávez International Airport.,https://s.yimg.com/ny/api/res/1.2/VnJFPlwiM_CQhUSuZf47JQ--/YXBwaWQ9aGlnaGxhbmRlcjt3PTEyMDA7aD02NzU7Y2Y9d2VicA--/https://media.zenfs.com/en/the_cool_down_737/5c471673efa09e4cb1c8fe5196bfa9b4,2025-12-02T11:30:00Z,,"Peruvian police recently detained a South Korean man who was attempting to smuggle hundreds of endangered tarantulas onto a plane.
What's happening?
The Washington Post reported the bizarre encount… [+2324 chars]",,en,'endangered species'
https://www.yahoo.com/news/articles/experts-stunned-rare-predator-population-090000377.html,https://www.yahoo.com/news/articles/experts-stunned-rare-predator-population-090000377.html,0,www.yahoo.com,Experts stunned as rare predator population tops 200 for first time in 80 years: 'They are trying to stay',"""Our goal is a recovery that is sustainable, resilient, and grounded in practical coexistence.""",https://s.yimg.com/ny/api/res/1.2/O9D.EvUXbbyqNNqs5WS5EA--/YXBwaWQ9aGlnaGxhbmRlcjt3PTEyMDA7aD02NzU7Y2Y9d2VicA--/https://media.zenfs.com/en/the_cool_down_737/02658a7da9ef4de91d910a74aa661ac5,2025-12-04T09:00:00Z,,"A recent discovery in Oregon indicates promising progress for a rare species that was once on the brink of extinction.
As explained by the Bulletin, a recent report from the Oregon Department of Fis… [+2565 chars]",,en,'endangered species'
https://www.yahoo.com/news/articles/homeowner-sparks-outrage-photo-neighbors-063000193.html,https://www.yahoo.com/news/articles/homeowner-sparks-outrage-photo-neighbors-063000193.html,0,www.yahoo.com,Homeowner sparks outrage with photo of neighbor's unbelievable pets: 'That fence will not stop them',"""Had to jump through a lot of legal loopholes to get them.""",https://s.yimg.com/ny/api/res/1.2/isgsjF.RykHsFTf4aRMSog--/YXBwaWQ9aGlnaGxhbmRlcjt3PTEyMDA7aD02ODE7Y2Y9d2VicA--/https://media.zenfs.com/en/the_cool_down_737/9834c6a199448875001e2b13530488c4,2025-12-09T06:30:00Z,,"A Texas homeowner took to Reddit to share a bizarre sight: three rhinos roaming around in their neighbor's yard. The surreal image sparked a flood of comments, with users questioning how and why thes… [+2787 chars]",,en,'endangered species'
https://www.yahoo.com/news/articles/hiker-captures-video-unbelievable-encounter-221500424.html,https://www.yahoo.com/news/articles/hiker-captures-video-unbelievable-encounter-221500424.html,0,www.yahoo.com,Hiker captures video of unbelievable encounter with wild animal: 'Saw my life flash before my eyes',The best course of action is to avoid interactions with wild animals.,https://s.yimg.com/ny/api/res/1.2/QLvSAKVwpb4bAaodNRvcCw--/YXBwaWQ9aGlnaGxhbmRlcjt3PTEyMDA7aD04MDA7Y2Y9d2VicA--/https://media.zenfs.com/en/the_cool_down_737/c9ce7570372a5daadcb810af504f75a6,2025-12-01T22:15:00Z,,"A hiker took to TikTok to share a video of a situation that could have ended in injury or even death. The video captures the split second when a wild mountain goat could have charged the hiker, all b… [+1951 chars]",,en,'endangered species'
https://www.lifesciencesworld.com/what-do-coral-fish-eat/,https://www.lifesciencesworld.com/what-do-coral-fish-eat/,0,www.lifesciencesworld.com,What do coral fish eat?,"What Do Coral Reef Fish Eat? A Deep Dive into Reef Ecology Coral reef fish eat a wide array of foods, ranging from tiny plankton and algae to larger invertebrates and even other fish, depending on the species and their role in the complex reef ecosystem. This…",,2025-12-23T00:43:04Z,,"What Do Coral Reef Fish Eat? A Deep Dive into Reef Ecology
Coral reef fish eat a wide array of foods, ranging from tiny plankton and algae to larger invertebrates and even other fish, depending on t… [+9606 chars]",,en,'biodiversity'
https://www.lifesciencesworld.com/what-is-the-most-beneficial-animal-to-the-earth/,https://www.lifesciencesworld.com/what-is-the-most-beneficial-animal-to-the-earth/,0,www.lifesciencesworld.com,What is the most beneficial animal to the earth?,"What is the Most Beneficial Animal to the Earth? The most beneficial animal to the earth is arguably the humble earthworm, vital for soil health, nutrient cycling, and overall ecosystem function. They significantly improve soil structure, aeration, and fertil…",,2025-12-23T00:11:58Z,,"What is the Most Beneficial Animal to the Earth?
The most beneficial animal to the earth is arguably the humble earthworm, vital for soil health, nutrient cycling, and overall ecosystem function. Th… [+9883 chars]",,en,'biodiversity'
https://www.nature.com/articles/s41598-025-33402-y,https://www.nature.com/articles/s41598-025-33402-y,0,www.nature.com,Moringa bio-stimulant promoted cotton production via coordinating anti-oxidants and physiological behaviors to combat reproductive drought stress,Drought impaired the cotton performance owing to the global problem of sudden climatic fluctuation. Bio-stimulant represents a prominent and environmentally friendly approach to improving sustainable cotton production in drought-prone regions around the world…,,2025-12-23T00:00:00Z,,"<li>Riaz, M. et al. Genotypic variability for root/shoot parameters under water stress in some advanced lines of cotton (Gossypium hirsutum L). Genet. Mol. Res.12, 552561. https://doi.org/10.4238/201… [+12878 chars]",,en,'biodiversity'
https://www.abc.net.au/news/2025-12-23/treetop-protester-wins-red-tingle-trees-fight/106171960,https://www.abc.net.au/news/2025-12-23/treetop-protester-wins-red-tingle-trees-fight/106171960,0,www.abc.net.au,Plans to burn rare forest abandoned after man camps in tree for six nights,The WA government abandons plans to burn a parcel of forest that is home to a species of rare tree after a 70-year-old man spent six nights living in the canopy.,https://live-production.wcms.abc-cdn.net.au/cbc2a1f8a4976a27e3d007202adad2e5?impolicy=wcms_watermark_news&cropH=420&cropW=746&xPos=91&yPos=156&width=862&height=485&imformat=generic,2025-12-22T22:35:40Z,,"A 70-year-old man who spent six nights camped 20 metres above a forest floor protesting the prescribed burning of giant red tingle trees in WA's south has succeeded in halting an ""imminent"" burn. 
A… [+4428 chars]",,en,'biodiversity'
https://www.nzherald.co.nz/whanganui-chronicle/news/pouri-hut-in-whanganui-national-park-destroyed-in-mystery-fire/R4UFZTUVY5FJZJV4V34CYWQC3I/,https://www.nzherald.co.nz/whanganui-chronicle/news/pouri-hut-in-whanganui-national-park-destroyed-in-mystery-fire/R4UFZTUVY5FJZJV4V34CYWQC3I/,0,www.nzherald.co.nz,Pouri Hut in Whanganui National Park destroyed in mystery fire,Fire and Emergency NZ investigators could not work out how Pouri Hut burned to the ground.,https://www.nzherald.co.nz/resizer/v2/TQRW65RXEVB6XCSOPDFCJSAQAM.jpg?auth=6623544a485f598cd7585d8a71e341e87fbb380da0f8f4e1e850d9d1b5a78e20&width=1200&height=675&quality=70&focal=1316%2C747&smart=false,2025-12-22T21:05:02Z,,"The origins of the fire were unable to be determined by Fire and Emergency New Zealand investigators. 
Hut visitors who had left in the morning on December 11 saw no signs of the fire and the wood b… [+1145 chars]",,en,'biodiversity'
https://www.futurity.org/manta-rays-mobile-ecosystems-3314782/,https://www.futurity.org/manta-rays-mobile-ecosystems-3314782/,0,www.futurity.org,"Manta rays create small, moving ecosystems",A new study reveals how manta rays form unique interactions with other fishes in South Florida waters.,https://www.futurity.org/wp/wp-content/uploads/2025/12/manta-rays-ecosystems-1600.jpg,2025-12-22T18:57:40Z,,"A new study  finds that young Caribbean manta rays (Mobula yarae) often swim with groups of other fish, creating small, moving ecosystems that support a variety of marine species.
South Floridaparti… [+2793 chars]",,en,'biodiversity'
https://www.dw.com/en/donald-trump-backs-bayer-in-roundup-weedkiller-cancer-battle-court-case/a-75188139,https://www.dw.com/en/donald-trump-backs-bayer-in-roundup-weedkiller-cancer-battle-court-case/a-75188139,0,www.dw.com,Why Trump backs Bayer in Roundup weedkiller cancer battle,"The Trump administration has diverged from the position of former US President Joe Biden, throwing its weight behind German chemical giant Bayer in its courtroom battle over the pesticide Roundup. The long-running legal fight over Bayer's weedkiller Roundup h…",https://static.dw.com/image/75196568_6.jpg,2025-12-22T18:48:00Z,,"The long-running legal fight over Bayer's weedkiller Roundup has seen nearly 200,000 cancer claims filed in US courts over the past seven years and is now being turned into a political tug of war.
I… [+6984 chars]",,en,'biodiversity'
https://economictimes.indiatimes.com/news/india/amid-criticism-centre-clarifies-aravalli-stand/articleshow/126127676.cms,https://economictimes.indiatimes.com/news/india/amid-criticism-centre-clarifies-aravalli-stand/articleshow/126127676.cms,0,economictimes.indiatimes.com,"Amid criticism, Centre clarifies Aravalli stand",Environment Minister Bhupender Yadav clarified the new Aravalli hills definition applies only to mining. This aims to stop illegal mining and permit sustainable operations. Only 277.89 sq km of the Aravalli landscape is open for mining. No new leases will be …,"https://img.etimg.com/thumb/msid-126127715,width-1200,height-630,imgsize-59638,overlay-economictimes/articleshow.jpg",2025-12-22T18:44:54Z,,New Delhi: Union environment minister Bhupender Yadav on Monday said that the new definition of Aravalli hills is applicable only for mining purposes and it aims to curb illegal mining and allow sust… [+2054 chars],,en,'biodiversity'
https://www.thestar.com.my/news/world/2025/12/23/undp-approves-58-mln-usd-project-to-protect-ubari-lakes-in-libya,https://www.thestar.com.my/news/world/2025/12/23/undp-approves-58-mln-usd-project-to-protect-ubari-lakes-in-libya,0,www.thestar.com.my,UNDP approves 5.8-mln-USD project to protect Ubari Lakes in Libya,"TRIPOLI, Dec. 22 (Xinhua) -- The United Nations Development Program (UNDP) in Libya said on Monday it had approved a 5.8-million-U.S.-dollar project funded by the Global Environment Facility (GEF) to address environmental and development challenges in the Uba…",https://cdn.thestar.com.my/Themes/img/newTsol_logo_socmedia.png,2025-12-22T18:18:00Z,,"TRIPOLI, Dec. 22 (Xinhua) -- The United Nations Development Program (UNDP) in Libya said on Monday it had approved a 5.8-million-U.S.-dollar project funded by the Global Environment Facility (GEF) to… [+985 chars]",,en,'biodiversity'
https://timesofindia.indiatimes.com/education/campus-talks/noida-school-shines-at-un-summit-only-up-school-among-global-top-8/articleshow/125972380.cms,https://timesofindia.indiatimes.com/education/campus-talks/noida-school-shines-at-un-summit-only-up-school-among-global-top-8/articleshow/125972380.cms,0,timesofindia.indiatimes.com,Noida school shines at UN summit; Only UP school among global top 8,"Mayoor School, Noida, achieved a significant international honour at the UN in Geneva, receiving the Global Goals Incubator Award. A student team presented their project on SDG 14: Life Below Water, earning praise from global leaders. This recognition highlig…","https://static.toiimg.com/thumb/msid-125972382,width-1070,height-580,imgsize-731099,resizemode-75,overlay-toi_sw,pt-32,y_pad-500/photo.jpg",2025-12-15T06:21:08Z,,"Mayoor School, Noida, achieved a significant international honour at the UN in Geneva, receiving the Global Goals Incubator Award. A student team presented their project on SDG 14: Life Below Water, … [+310 chars]",,en,'SDG 14'
https://www.lifesciencesworld.com/how-fast-do-corals-bleach/,https://www.lifesciencesworld.com/how-fast-do-corals-bleach/,0,www.lifesciencesworld.com,How fast do corals bleach?,"How Fast Do Corals Bleach? Understanding the Speed of Coral Decline How fast do corals bleach? Corals can bleach in a matter of days or weeks under severe stress, with the speed depending on the intensity and duration of the stressor, the type of coral, and e…",,2025-12-25T06:43:13Z,,"How fast do corals bleach?Corals can bleach in a matter of days or weeks under severe stress, with the speed depending on the intensity and duration of the stressor, the type of coral, and existing e… [+10483 chars]",,en,'species diversity'
https://journals.plos.org/plosone/article?id=10.1371/journal.pone.0339466,https://journals.plos.org/plosone/article?id=10.1371/journal.pone.0339466,0,journals.plos.org,Deer impact seedbanks and plant communities over 18 years of post-agricultural succession,"White-tailed deer (Odocoileus virginianus) are known to alter the composition of plant communities and the course of secondary succession. We present 18 years of data from a long-term deer exclosure experiment near Ithaca, NY, USA, to evaluate seedbank dynami…",https://journals.plos.org/plosone/article/figure/image?id=10.1371/journal.pone.0339466.g005&size=inline,2025-12-23T14:00:00Z,,"Abstract
White-tailed deer (Odocoileus virginianus) are known to alter the composition of plant communities and the course of secondary succession. We present 18 years of data from a long-term deer … [+56969 chars]",,en,'species diversity'
https://theconversation.com/from-stadium-to-the-wild-sports-clubs-as-new-champions-of-biodiversity-272300,https://theconversation.com/from-stadium-to-the-wild-sports-clubs-as-new-champions-of-biodiversity-272300,0,theconversation.com,From stadium to the wild: Sports clubs as new champions of biodiversity,"Animals feature in sports club logos and become mascots, but their actual populations are declining. What if we turned this sporting attachment into concrete action?",https://images.theconversation.com/files/709435/original/file-20251103-66-orybj.jpg?ixlib=rb-4.1.0&rect=0%2C457%2C4256%2C2128&q=45&auto=format&w=1356&h=668&fit=crop,2025-12-22T16:41:32Z,,"When you walk around the Groupama Stadium in Lyon (France), you cant miss them. Four majestic lions in the colours of Olympique Lyonnais stand proudly in front of the stadium, symbols of the influenc… [+9842 chars]",,en,'species diversity'
https://www.sciencedaily.com/releases/2025/12/251222080127.htm,https://www.sciencedaily.com/releases/2025/12/251222080127.htm,0,www.sciencedaily.com,Why evolution rewarded ants that sacrificed protection,"Some ants thrive by choosing numbers over strength. Instead of heavily protecting each worker, they invest fewer resources in individual armor and produce far more ants. Larger colonies then compensate with collective behaviors like group defense and coordina…",https://www.sciencedaily.com/images/1920/worker-ant-exoskeleton.webp,2025-12-22T13:49:12Z,,"The question is playful and unrealistic, but it points to a serious idea: the tension between quantity and quality. New research suggests this same tradeoff has shaped evolution, especially in the ri… [+6682 chars]",,en,'species diversity'
https://www.lifesciencesworld.com/do-grosbeaks-eat-grape-jelly/,https://www.lifesciencesworld.com/do-grosbeaks-eat-grape-jelly/,0,www.lifesciencesworld.com,Do Grosbeaks eat grape jelly?,"Do Grosbeaks Eat Grape Jelly? A Comprehensive Guide Yes, grosbeaks are indeed known to enjoy grape jelly, making it a popular treat for attracting these colorful birds to your backyard. It’s a supplemental food source that can be especially helpful during mig…",,2025-12-22T00:25:42Z,,"Yes, grosbeaks are indeed known to enjoy grape jelly, making it a popular treat for attracting these colorful birds to your backyard. Its a supplemental food source that can be especially helpful dur… [+7571 chars]",,en,'species diversity'
https://www.lifesciencesworld.com/is-fish-an-irregular-word/,https://www.lifesciencesworld.com/is-fish-an-irregular-word/,0,www.lifesciencesworld.com,Is fish an irregular word?,"Is “Fish” an Irregular Word? Unraveling a Linguistic Mystery The question of whether fish is an irregular word hinges on its plural form. While often regularized to “fishes,” the continued, and sometimes preferential, use of “fish” as both singular and plural…",,2025-12-20T06:35:46Z,,"The question of whether fish is an irregular word hinges on its plural form. While often regularized to “fishes,” the continued, and sometimes preferential, use of “fish” as both singular and plural … [+7306 chars]",,en,'species diversity'
https://www.lifesciencesworld.com/is-chattanooga-or-atlanta-aquarium-better/,https://www.lifesciencesworld.com/is-chattanooga-or-atlanta-aquarium-better/,0,www.lifesciencesworld.com,Is Chattanooga or Atlanta aquarium better?,"Chattanooga vs. Atlanta: Which Aquarium Reigns Supreme? The question of “Is Chattanooga or Atlanta aquarium better?” is a tough one, but ultimately, the Georgia Aquarium in Atlanta is the superior choice for its sheer scale, diversity of exhibits, and overall…",,2025-12-20T05:16:01Z,,"Chattanooga vs. Atlanta: Which Aquarium Reigns Supreme?
The question of “Is Chattanooga or Atlanta aquarium better?” is a tough one, but ultimately, the Georgia Aquarium in Atlanta is the superior c… [+8873 chars]",,en,'species diversity'
https://journals.plos.org/plosone/article?id=10.1371/journal.pone.0339132,https://journals.plos.org/plosone/article?id=10.1371/journal.pone.0339132,0,journals.plos.org,The relationships between box turtle gut microbiomes and personality,"Though well understood in model animals, the microbiome-brain axis has only recently been found to be important in wildlife health. Host behavior is an important component of this axis, and variation in individual animal personalities can shape the dynamics, …",https://journals.plos.org/plosone/article/figure/image?id=10.1371/journal.pone.0339132.g005&size=inline,2025-12-19T14:00:00Z,,"Abstract
Though well understood in model animals, the microbiome-brain axis has only recently been found to be important in wildlife health. Host behavior is an important component of this axis, and… [+58147 chars]",,en,'species diversity'
https://journals.plos.org/plosone/article?id=10.1371/journal.pone.0338441,https://journals.plos.org/plosone/article?id=10.1371/journal.pone.0338441,0,journals.plos.org,Species diversity within morpho-functional groups drives diversity dependence in reef ecosystems,Changes in species diversity can alter reef ecosystem composition by impacting the origination and extinction of species within co-existing groups. A massive literature exists on exploring the impact of species diversity shifts through a taxonomic centered pe…,https://journals.plos.org/plosone/article/figure/image?id=10.1371/journal.pone.0338441.g007&size=inline,2025-12-17T14:00:00Z,,"Citation: Chandroth A, Johnson CC (2025) Species diversity within morpho-functional groups drives diversity dependence in reef ecosystems. PLoS One 20(12):
 e0338441.
https://doi.org/10.1371/journa… [+49809 chars]",,en,'species diversity'
https://journals.plos.org/plospathogens/article?id=10.1371/journal.ppat.1013774,https://journals.plos.org/plospathogens/article?id=10.1371/journal.ppat.1013774,0,journals.plos.org,Aptazyme-mediated gene regulation in Strongyloides stercoralis for functional studies of insulin receptor isoform specificity,"Author summary Hammerhead ribozymes have been widely used as gene regulation tools in various biological systems, yet their potential in parasitic nematode research remains unexplored. In this study, we established the first synthetic ribozyme-based transgeni…",https://journals.plos.org/plospathogens/article/figure/image?id=10.1371/journal.ppat.1013774.g009&size=inline,2025-12-17T14:00:00Z,,"Citation: Zhang B, Zhou T, Zhu R, Qin P, Li J, Wang C, et al. (2025) Aptazyme-mediated gene regulation in Strongyloides stercoralis for functional studies of insulin receptor isoform specificity. PLo… [+66491 chars]",,en,'species diversity'
https://www.wired.com/story/ring-promo-code/,https://www.wired.com/story/ring-promo-code/,0,www.wired.com,Ring Promo Codes and Discounts: Up to 50% Off,"Get the latest Ring promo codes and discounts for this month, including up to 50% off select cameras. Find more deals like this at WIRED.","https://media.wired.com/photos/67b63b9079f27a355461c964/191:100/w_1280,c_limit/WIRED-Coupons-R2_2.png",2025-12-19T07:10:00Z,,"If youre a fan of Amazons ecosystem, whether thats asking your Alexa speaker to tell you about the weather or compulsively checking the video feed from your Ring doorbell, then it makes sense to expa… [+2819 chars]",,en,'ecosystem'
https://www.wired.com/story/amazon-aws-ceo-matt-garman-ai-agents/,https://www.wired.com/story/amazon-aws-ceo-matt-garman-ai-agents/,0,www.wired.com,AWS CEO Matt Garman Wants to Reassert Amazon’s Cloud Dominance in the AI Era,"As Google and Microsoft continue to surge, the AWS chief lays out his pitch: cheaper, reliable AI delivered at hyperscale.","https://media.wired.com/photos/69262e0a63eaab204bc381ad/191:100/w_1280,c_limit/Model-Behavior-Interview-with-AWS-CEO-Matt-Garman-Business-2243442799.jpg",2025-12-02T16:00:00Z,,"You might think Amazons biggest swing in the AI race was its $8 billion investment in Anthropic. But AWS has also been building in-house foundation models, new chips, massive data centers, and agents… [+2279 chars]",,en,'ecosystem'
https://www.wired.com/story/the-ultra-realistic-ai-face-swapping-platform-driving-romance-scams/,https://www.wired.com/story/the-ultra-realistic-ai-face-swapping-platform-driving-romance-scams/,0,www.wired.com,The Ultra-Realistic AI Face Swapping Platform Driving Romance Scams,"Capable of creating “nearly perfect” face swaps during live video chats, Hoatian has made millions, mainly via Telegram. But its main channel vanished after WIRED's inquiry into scammers using the app.","https://media.wired.com/photos/6941b2b7df7648d0f38774bb/191:100/w_1280,c_limit/sec-ai-faceswap-app-1382901144.jpg",2025-12-18T17:45:46Z,,The Chinese-language artificial intelligence app Haotian is so effective that its made millions of dollars selling its face-swapping technology on Telegram. The service integrates easily with messagi… [+3099 chars],,en,'ecosystem'
https://www.wired.com/story/expired-tired-wired-chinese-scammer-crypto-markets/,https://www.wired.com/story/expired-tired-wired-chinese-scammer-crypto-markets/,0,www.wired.com,Chinese Crypto Scammers on Telegram Are Fueling the Biggest Darknet Markets Ever,"Online black markets once lurked in the shadows of the dark web. Today, they’ve moved onto public platforms like Telegram—and are racking up historic illicit fortunes.","https://media.wired.com/photos/694a0648d87b06f89ce466d3/191:100/w_1280,c_limit/122225-ETW-Chinese-Crypto-Scams%20(0-00-02-03).jpg",2025-12-23T11:00:00Z,,"When black markets for drugs, guns, and all manner of contraband first sprang up on the dark web more than a decade ago, it seemed that cryptocurrency and the technical sophistication of the anonymit… [+2851 chars]",,en,'ecosystem'
https://www.wired.com/story/best-cyber-monday-google-pixel-deals-2025/,https://www.wired.com/story/best-cyber-monday-google-pixel-deals-2025/,0,www.wired.com,Best Cyber Monday Google Pixel Deals (2025),"This Cyber Monday, score hundreds off the new Pixel 10 range, or snag a discounted Pixel Watch 4 or Pixel Buds.","https://media.wired.com/photos/691eb5b2d121d26c390d65a4/191:100/w_1280,c_limit/Google's%20Black%20Friday%20Sale%20Starts%20Today%20on%20Pixel%20Phones_.png",2025-12-01T13:31:14Z,,"Google Pixel deals abound! The company has kicked off its Cyber Monday promotions on all of its Pixel hardware, from the value-friendly Pixel 9a to the flagship Pixel 10 Pro XL. There are even discou… [+3606 chars]",,en,'ecosystem'
https://www.wired.com/story/cyber-monday-tv-deals-2025/,https://www.wired.com/story/cyber-monday-tv-deals-2025/,0,www.wired.com,20 Best Cyber Monday TV Deals (2025),"Here are the best deals on screens from Hisense, TCL, Samsung, Sony, and more this shopping holiday.","https://media.wired.com/photos/6923e421c68e1875e6bc3d18/191:100/w_1280,c_limit/Best%20Black%20Friday%20TV%20Deals.png",2025-12-01T08:30:00Z,,"Looking for a new screen this holiday season? Every TV has been released for the year, which makes now a good time to upgrade yours to whatever has been tickling your fancy (now that you've read our … [+7231 chars]",,en,'ecosystem'
