index,url,valid,domain,title,description,image,published,archive,content,quote,language,keyword
https://www.thehindubusinessline.com/news/national/telangana-secures-investments-worth-7000-crore/article68961398.ece,https://www.thehindubusinessline.com/news/national/telangana-secures-investments-worth-7000-crore/article68961398.ece,0,www.thehindubusinessline.com,"Telangana secures investments worth ₹7,000 crore","Telangana government secures investments of ₹7,000 crore, launches new initiatives for innovation and national security collaborations.",https://bl-i.thgim.com/public/incoming/uhhgua/article68961417.ece/alternates/LANDSCAPE_1200/DSC0524.jpg,2024-12-08T07:54:34Z,,"The Telangana government on Sunday announced securing investments worth about 7,000 crore. Celebrating the first anniversary of the Revanth Reddy-led Congress government, the States IT and Industries… [+1710 chars]",,en,'ecosystem'
https://www.etfdailynews.com/2024/12/08/ncino-nasdaqncno-given-new-38-00-price-target-at-stephens/,https://www.etfdailynews.com/2024/12/08/ncino-nasdaqncno-given-new-38-00-price-target-at-stephens/,0,www.etfdailynews.com,nCino (NASDAQ:NCNO) Given New $38.00 Price Target at Stephens,"nCino (NASDAQ:NCNO – Free Report) had its price target increased by Stephens from $35.00 to $38.00 in a research report sent to investors on Thursday,Benzinga reports. Stephens currently has an equal weight rating on the stock. Several other research firms al…",https://www.americanbankingnews.com/wp-content/timthumb/timthumb.php?src=https://www.marketbeat.com/logos/ncino-inc-logo.png?v=20240410092914&w=240&h=240&zc=2,2024-12-08T07:46:49Z,,"nCino (NASDAQ:NCNO – Free Report) had its price target increased by Stephens from $35.00 to $38.00 in a research report sent to investors on Thursday,Benzinga reports. Stephens currently has an equal… [+4963 chars]",,en,'ecosystem'
https://www.livemint.com/opinion/online-views/the-uk-is-open-for-business-and-india-features-high-on-its-speed-dial-trade-fdi-narendra-modi-keir-starmer-g20-economy-11733382363566.html,https://www.livemint.com/opinion/online-views/the-uk-is-open-for-business-and-india-features-high-on-its-speed-dial-trade-fdi-narendra-modi-keir-starmer-g20-economy-11733382363566.html,0,www.livemint.com,The UK is open for business and India features high on its speed-dial,The meeting between Keir Starmer and Narendra Modi at the G20 summit in Brazil reinforced the mutual will to take bilateral ties to new heights. We can expect many new UK-India bridges to be built.,https://www.livemint.com/lm-img/img/2024/12/05/1600x900/BRAZIL-G20-SUMMIT-153_1732095118141_1733382854492.jpg,2024-12-08T07:30:04Z,,Prime Minister Keir Starmer and Prime Minister Narendra Modi sat down together at the G20 Summit in Brazil for what both have described as an extremely productive meeting. The directive from the top … [+5032 chars],,en,'ecosystem'
https://www.etfdailynews.com/2024/12/08/digital-ally-nasdaqdgly-research-coverage-started-at-stocknews-com-2/,https://www.etfdailynews.com/2024/12/08/digital-ally-nasdaqdgly-research-coverage-started-at-stocknews-com-2/,0,www.etfdailynews.com,Digital Ally (NASDAQ:DGLY) Research Coverage Started at StockNews.com,StockNews.com initiated coverage on shares of Digital Ally (NASDAQ:DGLY – Free Report) in a research note released on Thursday. The brokerage issued a sell rating on the scientific and technical instruments company’s stock. Digital Ally Trading Up 14.1 % NASD…,https://www.americanbankingnews.com/wp-content/timthumb/timthumb.php?src=https://www.marketbeat.com/logos/digital-ally-inc-logo.jpg&w=240&h=240&zc=2,2024-12-08T07:14:54Z,,StockNews.com initiated coverage on shares of Digital Ally (NASDAQ:DGLY – Free Report) in a research note released on Thursday. The brokerage issued a sell rating on the scientific and technical inst… [+1613 chars],,en,'ecosystem'
https://www.yugatech.com/news/samyang-launches-af-12mm-f-2-rf-s-lens-for-canon-rf-mount/,https://www.yugatech.com/news/samyang-launches-af-12mm-f-2-rf-s-lens-for-canon-rf-mount/,0,www.yugatech.com,Samyang Launches AF 12mm f/2 RF-S Lens for Canon RF Mount,"Samyang has officially unveiled its AF 12mm f/2 RF-S Ultra-Wide Angle Prime Lens, marking its entry into Canon’s RF-S mount ecosystem. This lens is designed for landscape, architecture, and night photography, offering a fast aperture and a wide 96.8-degree fi…",https://www.yugatech.com/wp-content/uploads/2024/12/AF-12mm-F2.0-RF-S-Ultra-Wide-Angle-Lens-Canon-RF-S-5.png,2024-12-08T07:13:28Z,,"Samyang has officially unveiled its AF 12mm f/2 RF-S Ultra-Wide Angle Prime Lens, marking its entry into Canons RF-S mount ecosystem. 
This lens is designed for landscape, architecture, and night ph… [+1672 chars]",,en,'ecosystem'
https://www.etfdailynews.com/2024/12/08/macquarie-forecasts-strong-price-appreciation-for-ncino-nasdaqncno-stock/,https://www.etfdailynews.com/2024/12/08/macquarie-forecasts-strong-price-appreciation-for-ncino-nasdaqncno-stock/,0,www.etfdailynews.com,Macquarie Forecasts Strong Price Appreciation for nCino (NASDAQ:NCNO) Stock,"nCino (NASDAQ:NCNO – Get Free Report) had its target price upped by investment analysts at Macquarie from $40.00 to $43.00 in a report issued on Friday,Benzinga reports. The brokerage currently has an “outperform” rating on the stock. Macquarie’s target price…",https://www.americanbankingnews.com/wp-content/timthumb/timthumb.php?src=https://www.marketbeat.com/logos/ncino-inc-logo-1200x675.png?v=20240410092914&w=240&h=240&zc=2,2024-12-08T06:50:44Z,,"nCino (NASDAQ:NCNO – Get Free Report) had its target price upped by investment analysts at Macquarie from $40.00 to $43.00 in a report issued on Friday,Benzinga reports. The brokerage currently has a… [+4809 chars]",,en,'ecosystem'
https://coinjournal.net/news/idegens-pre-market-auction-surpasses-550m-tokens-as-btc-stays-around-100k/,https://coinjournal.net/news/idegens-pre-market-auction-surpasses-550m-tokens-as-btc-stays-around-100k/,0,coinjournal.net,iDEGEN’s pre-market auction surpasses 550m tokens as BTC stays around $100k,"Key takeaways Bitcoin continues to trade around $100k after hitting a new all-time high of $103k a few days ago. iDEGEN’s pre-market auction has surpassed 550 million tokens, raising over $3 million. BTC stays around $100k Bitcoin, the leading cryptocurrency …",https://coinjournal.net/wp-content/uploads/2024/08/bitcoin-etf.jpg,2024-12-08T06:48:30Z,,"Key takeaways
<ul><li>Bitcoin continues to trade around $100k after hitting a new all-time high of $103k a few days ago.</li><li>iDEGEN’s pre-market auction has surpassed 550 million tokens, raising… [+3062 chars]",,en,'ecosystem'
https://www.etfdailynews.com/2024/12/08/serco-group-lonsrp-sets-new-12-month-low-whats-next/,https://www.etfdailynews.com/2024/12/08/serco-group-lonsrp-sets-new-12-month-low-whats-next/,0,www.etfdailynews.com,Serco Group (LON:SRP) Sets New 12-Month Low – What’s Next?,"Serco Group plc (LON:SRP – Get Free Report)’s share price reached a new 52-week low on Friday . The company traded as low as GBX 147.70 ($1.88) and last traded at GBX 150.90 ($1.92), with a volume of 15755762 shares traded. The stock had previously closed at …",https://www.americanbankingnews.com/wp-content/timthumb/timthumb.php?src=https://www.marketbeat.com/logos/serco-group-plc-logo-1200x675.jpg?v=20240604142909&w=240&h=240&zc=2,2024-12-08T06:40:50Z,,"Serco Group plc (LON:SRP – Get Free Report)’s share price reached a new 52-week low on Friday . The company traded as low as GBX 147.70 ($1.88) and last traded at GBX 150.90 ($1.92), with a volume of… [+1876 chars]",,en,'ecosystem'
https://www.etfdailynews.com/2024/12/08/contrasting-direct-digital-nasdaqdrct-oliveda-international-otcmktsolvi/,https://www.etfdailynews.com/2024/12/08/contrasting-direct-digital-nasdaqdrct-oliveda-international-otcmktsolvi/,0,www.etfdailynews.com,Contrasting Direct Digital (NASDAQ:DRCT) & Oliveda International (OTCMKTS:OLVI),"Direct Digital (NASDAQ:DRCT – Get Free Report) and Oliveda International (OTCMKTS:OLVI – Get Free Report) are both small-cap business services companies, but which is the superior business? We will compare the two businesses based on the strength of their ris…",https://www.americanbankingnews.com/wp-content/timthumb/timthumb.php?src=https://www.marketbeat.com/logos/oliveda-international-inc-logo-1200x675.png?v=20240105170444&w=240&h=240&zc=2,2024-12-08T06:39:04Z,,"Direct Digital (NASDAQ:DRCT – Get Free Report) and Oliveda International (OTCMKTS:OLVI – Get Free Report) are both small-cap business services companies, but which is the superior business? We will c… [+3749 chars]",,en,'ecosystem'
https://www.etfdailynews.com/2024/12/08/contrasting-amtd-digital-nysehkd-and-perella-weinberg-partners-nasdaqpwp/,https://www.etfdailynews.com/2024/12/08/contrasting-amtd-digital-nysehkd-and-perella-weinberg-partners-nasdaqpwp/,0,www.etfdailynews.com,Contrasting AMTD Digital (NYSE:HKD) and Perella Weinberg Partners (NASDAQ:PWP),"Perella Weinberg Partners (NASDAQ:PWP – Get Free Report) and AMTD Digital (NYSE:HKD – Get Free Report) are both finance companies, but which is the better stock? We will contrast the two businesses based on the strength of their dividends, valuation, risk, ea…",https://www.americanbankingnews.com/wp-content/timthumb/timthumb.php?src=https://www.marketbeat.com/logos/amtd-digital-inc-logo-1200x675.png?v=20220726113610&w=240&h=240&zc=2,2024-12-08T06:38:59Z,,"Perella Weinberg Partners (NASDAQ:PWP – Get Free Report) and AMTD Digital (NYSE:HKD – Get Free Report) are both finance companies, but which is the better stock? We will contrast the two businesses b… [+5150 chars]",,en,'ecosystem'
https://variety.com/2024/film/news/indonesia-jogja-festival-market-takeaways-1236242479/,https://variety.com/2024/film/news/indonesia-jogja-festival-market-takeaways-1236242479/,0,variety.com,Indonesia Intel: Takeaways From the Jogja Festival and Market,"The 19th edition of Indonesia’s Jogja-Netpac Asian Film Festival (JAFF) was its most successful one yet and the inaugural JAFF Market proved to be an auspicious debut. Variety was present to report on both. To put matters in context, films from Indonesia now …",https://variety.com/wp-content/uploads/2024/12/JAFF-Jury.jpg?w=1000&h=563&crop=1,2024-12-08T06:02:56Z,,The 19th edition of Indonesia’s Jogja-Netpac Asian Film Festival (JAFF) was its most successful one yet and the inaugural JAFF Market proved to be an auspicious debut. Variety was present to report o… [+8400 chars],,en,'ecosystem'
https://www.wallpaper.com/design-interiors/salone-del-mobile-report,https://www.wallpaper.com/design-interiors/salone-del-mobile-report,0,www.wallpaper.com,The future of Salone del Mobile: new report quantifies impact of the world's biggest furniture fair,"For the first time, Salone del Mobile reports on its size and impact. ‘Milan Design (Eco) System’ puts Salone into numbers, allowing its future and challenges to be addressed",https://cdn.mos.cms.futurecdn.net/U3xuEaQTDfXNnvv4EcE8B7-1200-80.jpg,2024-12-08T06:00:00Z,,"For the first time, Salone del Mobile has presented a report – titled ‘Milan Design (Eco) System’ – that aims to quantify the size, dynamics and impact of the annual international furniture fair, whi… [+4727 chars]",,en,'ecosystem'
https://www.thehindubusinessline.com/economy/big-tech-under-spotlight-as-house-panel-trains-lens-on-digital-markets/article68961184.ece,https://www.thehindubusinessline.com/economy/big-tech-under-spotlight-as-house-panel-trains-lens-on-digital-markets/article68961184.ece,0,www.thehindubusinessline.com,Big Tech under spotlight as house panel trains lens on digital markets,The development comes at a crucial time when the Ministry of Corporate Affairs (MCA) is finalizing the draft of the much-anticipated Digital Competition Bill,https://bl-i.thgim.com/public/incoming/dtm30m/article68951992.ece/alternates/LANDSCAPE_1200/PO30_Trading.jpg,2024-12-08T05:25:31Z,https://web.archive.org/web/20241209052627/https://www.thehindubusinessline.com/economy/big-tech-under-spotlight-as-house-panel-trains-lens-on-digital-markets/article68961184.ece,"In a move to address the rapidly evolving challenges of the digital economy, the Parliamentary Standing Committee on Finance, headed by ruling partys lawmaker Bhartruhari Mahtab, has identified the E… [+4749 chars]",,en,'ecosystem'
https://www.juancole.com/2024/12/climate-international-justice.html,https://www.juancole.com/2024/12/climate-international-justice.html,0,www.juancole.com,"On Climate Change, the International Court of Justice faces a pivotal Choice","By Claudia Ituarte-Lima, Lund University (The Conversation) - What legal obligations do states have to fight climate change? Should high-emitting countries be held responsible for the harm they’ve caused? And should states safeguard the climate for future gen…",https://media.juancole.com/images/2024/12/IMG_4645.jpg,2024-12-08T05:04:04Z,,"By Claudia Ituarte-Lima, Lund University
(The Conversation) – What legal obligations do states have to fight climate change? Should high-emitting countries be held responsible for the harm theyve ca… [+6127 chars]",,en,'ecosystem'
https://www.c-sharpcorner.com/article/what-are-meme-coins/,https://www.c-sharpcorner.com/article/what-are-meme-coins/,0,www.c-sharpcorner.com,What are Meme Coins?,"Meme coins or meme tokens are one of the biggest hypes today. Learn about what meme coins are all about. Meme coins, inspired by internet humor, thrive on community support but lack utility and face high volatility. Popular examples include Dogecoin and Shiba…",https://www.c-sharpcorner.com/images/csharp-corner.png,2024-12-08T03:01:07Z,,"Meme Coins
Meme coins or meme tokens are a type of cryptocurrency inspired by internet memes, trends, or cultural phenomena. They are often created as a parody or to capture the humor of the meme, a… [+9157 chars]",,en,'ecosystem'
