index,url,valid,domain,title,description,image,published,archive,content,quote,language,keyword
https://ftw.usatoday.com/story/sports/outdoors/2026/02/06/woman-caught-poaching-endangered-species-abalone-wildlife-crime-california/88542545007/,https://ftw.usatoday.com/story/sports/outdoors/2026/02/06/woman-caught-poaching-endangered-species-abalone-wildlife-crime-california/88542545007/,0,ftw.usatoday.com,"Woman caught poaching endangered species, hiding them in her pants","A poacher in California uses “an unconventional storage method” for trying to hide her unlawful catch, but a wildlife officer was watching.",https://s.yimg.com/os/en/ftw_outdoors_usa_today_article_609/aba2bce58d181b8773218a9e7949168e,2026-02-06T16:25:09Z,,"A woman in California used an unconventional storage method for trying to hide her unlawful catch of two abalone, an endangered species. Unfortunately for her, a wildlife officer was watching.
The u… [+1647 chars]",,en,'poaching'
https://www.businessinsider.com/mira-murati-thinking-machines-lab-hires-competitive-coder-neal-wu-2026-2,https://www.businessinsider.com/mira-murati-thinking-machines-lab-hires-competitive-coder-neal-wu-2026-2,0,www.businessinsider.com,Mira Murati's Thinking Machines Lab quietly hired a legendary coder amid top leaders leaving,"Thinking Machines Lab, led by former OpenAI CTO Mira Murati, attracts an award-winning coder, amid AI talent wars and a record funding push.",https://i.insider.com/6983a4e5e1ba468a96ab6810?width=1200&format=jpeg,2026-02-04T20:47:39Z,,"Thinking Machines Lab CEO Mira Murati.Slaven Vlasic/Getty Images
<ul><li>Neal Wu, a top competitive coder, has quietly been working at Thinking Machines Lab.</li><li>Thinking Machines Lab, led by fo… [+2386 chars]",,en,'poaching'
https://www.businessinsider.com/investment-banking-advising-secondaries-became-hottest-job-wall-street-2026-2,https://www.businessinsider.com/investment-banking-advising-secondaries-became-hottest-job-wall-street-2026-2,0,www.businessinsider.com,How this job went from the Wall Street equivalent of a used car dealer to the hottest gig for 2026,Private equity's years-long waiting game has sparked a $240 billion race on Wall Street. Inside the battle between banks to dominate in secondaries.,https://i.insider.com/69835d05a645d1188188a743?width=1200&format=jpeg,2026-02-09T10:34:01Z,,"Getty Images; Alyssa Powell/BI
<ul><li>As private equity firms hold companies longer, banks are eyeing a moneymaking opportunity.</li><li>JPMorgan stood up a private markets-focused investment banki… [+5276 chars]",,en,'poaching'
https://abcnews.go.com/US/police-chief-trump-told-goodness-stopping-epstein-2006/story?id=130010254,https://abcnews.go.com/US/police-chief-trump-told-goodness-stopping-epstein-2006/story?id=130010254,0,abcnews.go.com,Ex-police chief says Trump told him 'thank goodness you're stopping' Epstein in 2000s,Former Palm Beach police chief Michael Reiter was a central figure in the first law enforcement probe of Epstein in Florida.,https://i.abcnewsfe.com/a/f0782e8f-bfcd-4b35-b7da-422394ced733/epstein-trump-2-ht-gmh-251212_1765567512666_hpMain_2_16x9.jpg?w=1600,2026-02-10T03:46:29Z,,"A former Palm Beach, Florida, police chief who investigated Jeffrey Epstein in the mid-2000s told the FBI he had received a call from Donald Trump at the time to say ""thank goodness youre stopping hi… [+2672 chars]",,en,'poaching'
https://abcnews.com/US/epstein-files-questions-swirl-redacted-2009-email-subject/story?id=130036353,https://abcnews.com/US/epstein-files-questions-swirl-redacted-2009-email-subject/story?id=130036353,0,abcnews.com,Epstein files: Questions swirl over redacted 2009 email with subject line 'Trump',"Rep. Jamie Raskin says the unredacted version of an email regarding President Trump ""seems to be at odds"" with some of the things Trump has said about Jeffrey Epstein.",https://i.abcnewsfe.com/a/99e83cc0-d450-4f77-b33b-2bccedaaac09/donald-trump-5-gty-gmh-260204_1770225735529_hpMain_16x9.jpg?w=1600,2026-02-11T00:28:39Z,,"The subject line reads ""Trump.""
The date is Oct. 14, 2009.
The email is from criminal defense attorney Jack Goldberger to his client, Jeffrey Epstein -- which Epstein in turn forwarded to his assoc… [+4452 chars]",,en,'poaching'
https://www.rt.com/africa/632253-south-africa-records-decline-rhino-poaching/,https://www.rt.com/africa/632253-south-africa-records-decline-rhino-poaching/,0,www.rt.com,South Africa records decline in rhino poaching,"South Africa’s Forestry Ministry has reported that 352 rhinos were poached in the country in 2025, down from 420 in 2024 Read Full Article at RT.com",https://mf.b37mrtl.ru/files/2026.02/article/698b261d85f5407a525c1292.jpg,2026-02-10T12:44:46Z,,"South Africa recorded a 16% decline in rhino poaching in 2025, a sign that intensified anti-poaching and anti-trafficking measures are beginning to yield results, Minister of Forestry, Fisheries, and… [+3144 chars]",,en,'poaching'
https://www.baltimorebeatdown.com/baltimore-ravens-coaching-staff/80413/ravens-to-hire-former-steelers-rbs-coach-eddie-faulkner,https://www.baltimorebeatdown.com/baltimore-ravens-coaching-staff/80413/ravens-to-hire-former-steelers-rbs-coach-eddie-faulkner,0,www.baltimorebeatdown.com,Ravens to hire former Steelers RBs coach Eddie Faulkner,The Ravens are poaching one of the Steelers’ top assistants to serve on their offensive coaching staff.,https://s.yimg.com/ny/api/res/1.2/QcJLmack9_hH3VRNRs1p8A--/YXBwaWQ9aGlnaGxhbmRlcjt3PTEyMDA7aD04MDA7Y2Y9d2VicA--/https://media.zenfs.com/en/sb_nation_articles_115/3e8d5fccf91e0aa6487b33c053678598,2026-02-10T02:00:00Z,,The Ravens are poaching one of Mike Tomlins top assistants during his time in Pittsburgh. Steelers running backs coach Eddie Faulkner is expected to take the same job on Jesse Minters new staff in Ba… [+90 chars],,en,'poaching'
https://www.salon.com/2026/02/01/thats-not-a-friend-trump-threatens-lawsuit-against-epstein-estate-for-conspiring-with-wolff/,https://www.salon.com/2026/02/01/thats-not-a-friend-trump-threatens-lawsuit-against-epstein-estate-for-conspiring-with-wolff/,0,www.salon.com,“That’s not a friend”: Trump threatens lawsuit against Epstein estate for “conspiring” with Wolff,"The president said the newly released Epstein files ""absolve"" him of any wrongdoing and reveal a plot against him",https://www.salon.com/app/uploads/2025/08/trump-maxwell-1192977790.jpg,2026-02-01T16:32:17Z,,"President Donald Trump threatened to sue the estate of Jeffrey Epstein following the latest release of the Department of Justices case files on the late sex trafficker.
Speaking to reporters aboard … [+1399 chars]",,en,'poaching'
http://longreads.com/2026/02/11/the-myth-of-the-police-state/,http://longreads.com/2026/02/11/the-myth-of-the-police-state/,0,longreads.com,The Myth of the Police State,"""No one, not even the supposed beneficiaries, is protected.""",,2026-02-11T11:00:00Z,,"A year ago, Donald Trump extended expedited refugee status to Afrikaners, based on the lie that white South Africans have been oppressed and targeted for revenge by their Black neighbors since the en… [+1394 chars]",,en,'poaching'
https://www.theatlantic.com/photography/2026/02/peoples-choice-wildlife-photographer-of-the-year-2026/685879/,https://www.theatlantic.com/photography/2026/02/peoples-choice-wildlife-photographer-of-the-year-2026/685879/,0,www.theatlantic.com,People’s Choice: Wildlife Photographer of the Year 2026,Organizers of the Wildlife Photographer of the Year contest are inviting the public to vote for their favorite images from this year’s competition.,https://cdn.theatlantic.com/thumbor/XqW1_oxVwnAEkKXYPFohEVVlSeg=/0x38:2556x1369/1200x625/media/img/mt/2026/02/a01_Sarikhani/original.jpg,2026-02-04T17:08:14Z,,"© Nima Sarikhani / Wildlife Photographer of the Year
The Final Portrait. A polar-bear cub looks into the camera as it accompanies its mother on an unsuccessful hunting trip. There’s a sad story behi… [+7680 chars]",,en,'poaching'
https://www.techradar.com/home/coffee-machines/can-you-cook-eggs-with-an-espresso-machine-i-tested-5-popular-steam-wand-hacks-to-see-how-well-they-work-and-how-much-mess-they-make,https://www.techradar.com/home/coffee-machines/can-you-cook-eggs-with-an-espresso-machine-i-tested-5-popular-steam-wand-hacks-to-see-how-well-they-work-and-how-much-mess-they-make,0,www.techradar.com,Can you cook eggs with an espresso machine? I tested 5 popular steam wand hacks to see how well they work — and how much mess they make,"How do you like your eggs in the morning? I tried these steam wand hacks, so you don't have to.",https://cdn.mos.cms.futurecdn.net/4YvBr6MBKidSJaCWUY8gr3-2000-80.jpg,2026-02-04T17:54:33Z,,"If you're just using your espresso machine to make coffee, you might be missing out. Social media is packed with suggestions for crafty hacks and alternative ways to use its steam wand, from the prac… [+6400 chars]",,en,'poaching'
http://longreads.com/2026/02/11/tiktok-grey-parrot-black-market/,http://longreads.com/2026/02/11/tiktok-grey-parrot-black-market/,0,longreads.com,TikTok Is Obsessed With Talking Parrots. It’s Fueling a Global Black Market.,"""A yearlong investigation into the African-grey trade reveals a web of poachers, egg smugglers, wealthy businessmen — and multitudes who want a talking bird.""",,2026-02-11T15:00:00Z,,"Rene Ebersole’s investigation into the illegal parrot trade touches virtually every part of the African grey parrot ecosystem, from the clever birds flexing their vocabularies in viral videos to the … [+2562 chars]",,en,'poaching'
https://petapixel.com/2026/02/07/street-photography-has-a-predator-problem/,https://petapixel.com/2026/02/07/street-photography-has-a-predator-problem/,0,petapixel.com,Street Photography Has a Predator Problem,"In her seminal collection of essays, On Photography, Susan Sontag famously argued that ""there is something predatory in the act of taking a picture."" She described the camera as a ""sublimation of the gun,"" a tool used to ""violate"" subjects, turning them into …",https://petapixel.com/assets/uploads/2026/02/street-photography-oped-david-m-m-taffet-ftrd.jpg,2026-02-07T13:00:57Z,,"In her seminal collection of essays, On Photography, Susan Sontag famously argued that “there is something predatory in the act of taking a picture.” She described the camera as a “sublimation of the… [+7128 chars]",,en,'poaching'
https://consent.yahoo.com/v2/collectConsent?sessionId=1_cc-session_83a6c8fa-0b4f-46d7-9b23-69c99a021c46,https://consent.yahoo.com/v2/collectConsent?sessionId=1_cc-session_83a6c8fa-0b4f-46d7-9b23-69c99a021c46,0,consent.yahoo.com,Houston Texans Are In Danger Of Losing A Key Piece Of The Coaching Staff,"Other teams are poaching Houston's talented assistants, threatening to dismantle the Texans' acclaimed defensive coaching staff.",,2026-02-06T01:42:47Z,,"If you click 'Accept all', we and our partners, including 246 who are part of the IAB Transparency &amp; Consent Framework, will also store and / or access information on a device (in other words, us… [+1046 chars]",,en,'poaching'
https://hbr.org/tip/2026/02/hire-from-another-team-without-burning-bridges,https://hbr.org/tip/2026/02/hire-from-another-team-without-burning-bridges,0,hbr.org,Hire from Another Team—Without Burning Bridges,"You have an opening on your team, and the ideal candidate already works inside the company—just not for you. Hiring a standout from another internal team can be smart, but moving too fast can be perceived as poaching or favoritism. Here’s how to sensitively m…",https://hbr.org/resources/images/hbr_opengraph_940x490.png,2026-02-10T05:01:10Z,,"You have an opening on your team, and the ideal candidate already works inside the company—just not for you. Hiring a standout from another internal team can be smart, but moving too fast can be perc… [+1455 chars]",,en,'poaching'
https://crooksandliars.com/2026/02/doj-spied-epstein-file-searches-thats-not,https://crooksandliars.com/2026/02/doj-spied-epstein-file-searches-thats-not,0,crooksandliars.com,DOJ Spied On Epstein File Searches By Congress Members,"On Morning Joe, Mika Brzezinski asked national security reporter Ken Delanian about something many people spotted during yesterday's Pam Bondi hearing.
""Ken, I'm interested in something specific that we could see from one camera angle yesterday, and it looked…",https://crooksandliars.com/files/mediaposters/2026/02/58540.jpg,2026-02-12T13:52:00Z,,"On Morning Joe, Mika Brzezinski asked national security reporter Ken Delanian about something many people spotted during yesterday's Pam Bondi hearing.
""Ken, I'm interested in something specific tha… [+1944 chars]",,en,'poaching'
https://journals.plos.org/plosone/article?id=10.1371/journal.pone.0342911,https://journals.plos.org/plosone/article?id=10.1371/journal.pone.0342911,0,journals.plos.org,Climate resilience through bioeconomy: A mixed-methods protocol for assessing adaptation policies in rural settlements on the Amazon,"Introduction Climate change intensifies social, economic, and environmental vulnerabilities in Amazonian rural communities, where dependence on natural resources and limited institutional capacity constrain adaptation. The bioeconomy is often proposed as an a…",https://journals.plos.org/plosone/article/figure/image?id=10.1371/journal.pone.0342911.t002&size=inline,2026-02-13T14:00:00Z,,"Abstract
Introduction
Climate change intensifies social, economic, and environmental vulnerabilities in Amazonian rural communities, where dependence on natural resources and limited institutional … [+61246 chars]",,en,'SDG 15'
https://journals.plos.org/plosone/article?id=10.1371/journal.pone.0342800,https://journals.plos.org/plosone/article?id=10.1371/journal.pone.0342800,0,journals.plos.org,"Dietary diversity among Sundarbans forest-dependent communities: Prevalence, determinants, and livelihood implications","The resources of the Sundarbans mangrove forest have provided livelihoods for communities in Bangladesh and India that depend on it. However, the role of the Sundarbans in ensuring the household dietary diversity of Sundarbans mangrove forest resource-depende…",https://journals.plos.org/plosone/article/figure/image?id=10.1371/journal.pone.0342800.g005&size=inline,2026-02-11T14:00:00Z,,"Introduction
The Sundarbans mangrove forest (SMF) the largest single-track mangrove forest in the world [1] is unique because it is composed of forest, coastal, and wetland ecosystems, housing both … [+65427 chars]",,en,'SDG 15'
https://www.lifesciencesworld.com/what-do-bears-love-the-most/,https://www.lifesciencesworld.com/what-do-bears-love-the-most/,0,www.lifesciencesworld.com,What do bears love the most?,"What Bears Love the Most: A Deep Dive into Ursine Desires Bears, fascinating apex predators, have a surprisingly complex set of preferences, but at their core, bears love the most access to a consistent and abundant source of high-calorie food, particularly d…",,2026-02-16T00:35:38Z,,"Bears, fascinating apex predators, have a surprisingly complex set of preferences, but at their core, bears love the most access to a consistent and abundant source of high-calorie food, particularly… [+9310 chars]",,en,'poaching'
https://touchdownwire.usatoday.com/story/sports/nfl/touchdown/2026/02/15/seattle-seahawks-poach-san-francisco-49ers-coach-in-shocking-move/88695346007/,https://touchdownwire.usatoday.com/story/sports/nfl/touchdown/2026/02/15/seattle-seahawks-poach-san-francisco-49ers-coach-in-shocking-move/88695346007/,0,touchdownwire.usatoday.com,Seattle Seahawks poach San Francisco 49ers coach in shocking move,"After beating them in the playoffs and then winning the Super Bowl in their stadium, the Seahawks are taking a coach from the 49ers.",https://s.yimg.com/ny/api/res/1.2/28K7nPO4Hh5hQb6_K8dhaA--/YXBwaWQ9aGlnaGxhbmRlcjt3PTEyMDA7aD04MDA7Y2Y9d2VicA--/https://media.zenfs.com/en/touchdown_wire_usa_today_sports_articles_829/9732781ab57541c32bffe47865393430,2026-02-15T23:33:20Z,,"The Seattle Seahawks destroyed the San Francisco 49ers in the playoffs in one of the biggest postseason blowouts of the last decade.
They then went on to win Super Bowl LX at Levi's Stadium in Santa… [+1632 chars]",,en,'poaching'
https://www.sportingnews.com/us/nba/golden-state-warriors/news/giannis-antetokounmpo-report-isnt-good-news-warriors-lakers/5a0b1ccd9d8a3657fba65f62,https://www.sportingnews.com/us/nba/golden-state-warriors/news/giannis-antetokounmpo-report-isnt-good-news-warriors-lakers/5a0b1ccd9d8a3657fba65f62,0,www.sportingnews.com,"Giannis Antetokounmpo report isn't good news for Warriors, Lakers",The Golden State Warriors and Los Angeles Lakers shouldn't feel encouraged by a recent report.,https://s.yimg.com/os/en/the_sporting_news_articles_584/db8b398a315016c0dd930eed11d266fc,2026-02-15T20:25:12Z,,"Giannis Antetokounmpo report isn't good news for Warriors, Lakers originally appeared on The Sporting News. Add The Sporting News as a Preferred Source by clicking here.
The Golden State Warriors an… [+1739 chars]",,en,'poaching'
https://www.lifesciencesworld.com/is-the-strongest-animal-in-africa/,https://www.lifesciencesworld.com/is-the-strongest-animal-in-africa/,0,www.lifesciencesworld.com,Is the strongest animal in Africa?,"Is the Strongest Animal in Africa? Deciphering Power and Prowess on the Continent The question, Is the strongest animal in Africa?, doesn’t have a single, straightforward answer. While the African elephant often comes to mind due to its immense size, true str…",,2026-02-15T06:08:00Z,,"Is the Strongest Animal in Africa? Deciphering Power and Prowess on the Continent
The question, Is the strongest animal in Africa?, doesn’t have a single, straightforward answer. While the African e… [+7875 chars]",,en,'poaching'
https://www.lifesciencesworld.com/what-are-some-rare-facts-about-chinchillas/,https://www.lifesciencesworld.com/what-are-some-rare-facts-about-chinchillas/,0,www.lifesciencesworld.com,What are some rare facts about chinchillas?,"What Are Some Rare and Fascinating Facts About Chinchillas? Chinchillas, those incredibly soft and perpetually inquisitive creatures, are more than just fluffy pets; they possess a trove of surprising traits. This article uncovers rare and fascinating facts a…",,2026-02-15T04:33:21Z,,"Chinchillas, those incredibly soft and perpetually inquisitive creatures, are more than just fluffy pets; they possess a trove of surprising traits. This article uncovers rare and fascinating facts a… [+9238 chars]",,en,'poaching'
https://www.lifesciencesworld.com/has-any-cheetah-killed-a-human/,https://www.lifesciencesworld.com/has-any-cheetah-killed-a-human/,0,www.lifesciencesworld.com,Has any cheetah killed a human?,"Has any cheetah killed a human? A Look at Cheetah Attacks and Safety The short answer is definitively no, there are no reliably documented cases of wild cheetahs killing a human. While cheetahs are powerful predators, their primary prey are relatively small a…",,2026-02-15T04:05:45Z,,"The short answer is definitively no, there are no reliably documented cases of wild cheetahs killing a human. While cheetahs are powerful predators, their primary prey are relatively small antelopes … [+7387 chars]",,en,'poaching'
https://www.lifesciencesworld.com/what-animal-did-bears-evolve-from/,https://www.lifesciencesworld.com/what-animal-did-bears-evolve-from/,0,www.lifesciencesworld.com,What animal did bears evolve from?,"What Animal Did Bears Evolve From? Unraveling the Ursine Ancestry The evolutionary lineage of bears traces back to a small, dog-like carnivoran called Ursavus, who lived approximately 25 million years ago; therefore, the answer to what animal did bears evolve…",,2026-02-15T03:20:17Z,,"The evolutionary lineage of bears traces back to a small, dog-like carnivoran called Ursavus, who lived approximately 25 million years ago; therefore, the answer to what animal did bears evolve from?… [+8872 chars]",,en,'poaching'
https://www.lifesciencesworld.com/can-i-eat-2-servings-of-fish-a-day/,https://www.lifesciencesworld.com/can-i-eat-2-servings-of-fish-a-day/,0,www.lifesciencesworld.com,Can I eat 2 servings of fish a day?,"Can I Eat 2 Servings of Fish a Day?: A Comprehensive Guide Generally, yes, most people can eat two servings of fish a day, and it can be incredibly beneficial for their health, provided you make informed choices about the types of fish you consume to minimize…",,2026-02-15T02:54:56Z,,"Can I Eat 2 Servings of Fish a Day?: A Comprehensive Guide
Generally, yes, most people can eat two servings of fish a day, and it can be incredibly beneficial for their health, provided you make inf… [+8012 chars]",,en,'poaching'
https://economictimes.indiatimes.com/news/india/tale-of-two-lit-fests-sunita-williams-kerala-visit-ignites-a-high-stakes-literary-showdown/articleshow/128368680.cms,https://economictimes.indiatimes.com/news/india/tale-of-two-lit-fests-sunita-williams-kerala-visit-ignites-a-high-stakes-literary-showdown/articleshow/128368680.cms,0,economictimes.indiatimes.com,Tale of two Lit fests: Sunita Williams’ Kerala visit ignites a high-stakes literary showdown,"Astronaut Sunita Williams’ visit to Kerala after her retirement from NASA triggered an intense rivalry among the state’s literary festivals. DC Books, which had been inviting her since 2019, quickly secured her appearance at the Kerala Literature Festival in …","https://img.etimg.com/thumb/msid-128368687,width-1200,height-630,imgsize-109624,overlay-economictimes/articleshow.jpg",2026-02-15T02:28:27Z,,Astronaut Sunita Williams touched down on Earth last March after orbiting the planet for nine long months. Ten days hadnt passed before she received a message from a publishing house in Kerala. Soon … [+14167 chars],,en,'poaching'
https://www.lifesciencesworld.com/why-did-bears-go-extinct-in-africa/,https://www.lifesciencesworld.com/why-did-bears-go-extinct-in-africa/,0,www.lifesciencesworld.com,Why did bears go extinct in Africa?,"Why Did Bears Vanish From Africa? Unraveling a Continental Mystery Why did bears go extinct in Africa? Bears, once present in North Africa, disappeared due to a confluence of factors, primarily habitat loss, hunting pressure, and competition with other large …",,2026-02-15T01:43:40Z,,"Why Did Bears Vanish From Africa? Unraveling a Continental Mystery
Why did bears go extinct in Africa? Bears, once present in North Africa, disappeared due to a confluence of factors, primarily habi… [+6968 chars]",,en,'poaching'
https://www.unexplained-mysteries.com/news/394514/does-de-extinction-make-people-more-comfortable-with-extinction,https://www.unexplained-mysteries.com/news/394514/does-de-extinction-make-people-more-comfortable-with-extinction,0,www.unexplained-mysteries.com,Does 'de-extinction' make people more comfortable with extinction ?,"If science can simply resurrect an extinct species, will humanity be more inclined to allow more species to go extinct ? Christopher Lean, Andrew Jame...",https://www.unexplained-mysteries.com/images/news_large_retina/news-hq-dire-wolves-pups.jpg,2026-02-06T18:39:02Z,,"Science &amp; Technology
February 6, 2026 ·  1 commentTwo 'dire wolf' pups created by Colossal Biosciences. Image Credit: Colossal Biosciences / TwitterIf science can simply resurrect an extinct spe… [+6714 chars]",,en,'species extinction'
https://theconversation.com/some-companies-claim-they-can-resurrect-species-does-that-make-people-more-comfortable-with-extinction-273583,https://theconversation.com/some-companies-claim-they-can-resurrect-species-does-that-make-people-more-comfortable-with-extinction-273583,0,theconversation.com,Some companies claim they can ‘resurrect’ species. Does that make people more comfortable with extinction?,"If de-extinction tech can bring back species, are people more comfortable with them going extinct? A new study tests this idea.",https://images.theconversation.com/files/715054/original/file-20260129-64-f8jdl.jpg?ixlib=rb-4.1.0&rect=0%2C534%2C4300%2C2150&q=45&auto=format&w=1356&h=668&fit=crop,2026-02-02T01:03:52Z,,"Ross Stone/Unsplash
Less than a year ago, United States company Colossal Biosciences announced it had “resurrected” the dire wolf, a megafauna-hunting wolf species that had been extinct for 10,000 y… [+6763 chars]",,en,'species extinction'
https://www.lifesciencesworld.com/are-humans-the-most-powerful-species-on-earth/,https://www.lifesciencesworld.com/are-humans-the-most-powerful-species-on-earth/,0,www.lifesciencesworld.com,Are humans the most powerful species on Earth?,"Are Humans the Most Powerful Species on Earth? Are humans truly the most powerful species? The answer is a complex yes, but this power comes with unprecedented responsibility and potential for self-destruction, making it a uniquely precarious position. Introd…",,2026-02-04T01:39:19Z,,"Are humans truly the most powerful species? The answer is a complex yes, but this power comes with unprecedented responsibility and potential for self-destruction, making it a uniquely precarious pos… [+8427 chars]",,en,'species extinction'
