index,url,valid,domain,title,description,image,published,archive,content,quote,language,keyword
https://www.theverge.com/bulletin/839889/the-verge-subscription-turns-one,https://www.theverge.com/bulletin/839889/the-verge-subscription-turns-one,0,www.theverge.com,The Verge subscription turns one,"We're one year into the experiment of running The Verge with subscriptions, and so far things are going quite well - but we've heard a lot of feedback so far, and we've got some exciting changes in store to try and make this thing even better. We hit our subs…",https://platform.theverge.com/wp-content/uploads/sites/2/2025/12/258171_verge_announcement_CVirginia.jpg?quality=90&strip=all&crop=0%2C10.732984293194%2C100%2C78.534031413613&w=1200,2025-12-08T15:55:58Z,,"<ul><li></li></ul>
Looking back at one year of The Verges subscription and ahead to whats next.
Looking back at one year of The Verges subscription and ahead to whats next.
by
Nilay PatelClose
N… [+4542 chars]",,en,'ecosystem'
https://gizmodo.com/jeff-bezoss-blue-origin-wants-to-dump-millions-of-gallons-of-waste-into-a-protected-lagoon-2000694583,https://gizmodo.com/jeff-bezoss-blue-origin-wants-to-dump-millions-of-gallons-of-waste-into-a-protected-lagoon-2000694583,0,gizmodo.com,Jeff Bezos’s Blue Origin Wants to Dump Millions of Gallons of Waste Into a Protected Lagoon,"Space Coast communities have spent years and millions of dollars restoring the Indian River Lagoon. Now, they hope to stop Blue Origin from reversing that progress.",https://gizmodo.com/app/uploads/2025/12/Indian-River-Lagoon-Florida--1200x675.jpg,2025-12-02T18:10:08Z,,"Jeff Bezoss aerospace company, Blue Origin, has applied for a permit to dump half a million gallons of wastewater each day into Floridas Indian River Lagoon. The proposal has caused quite a stir amon… [+3455 chars]",,en,'ecosystem'
https://www.businessinsider.com/why-concert-tickets-are-so-expensive-and-whos-to-blame-2025-12,https://www.businessinsider.com/why-concert-tickets-are-so-expensive-and-whos-to-blame-2025-12,0,www.businessinsider.com,Why concert tickets are so expensive — and who's to blame,Seeing your favorite artist live is more expensive than ever. We spoke with people across the live music ecosystem to unravel the real reasons why.,https://i.insider.com/693c862e832e0ef1ead62be7?width=1200&format=jpeg,2025-12-15T16:14:37Z,,"Seeing your favorite artist onstage has never been more expensive. In the 1960s, a ticket to see The Beatles could cost around $5. In 2024, the average concert ticket in the US was nearly $136. And o… [+518 chars]",,en,'ecosystem'
https://www.androidcentral.com/wearables/ticwatch/mobvoi-removes-ticwatches-from-sale-potentially-leaving-wear-os-behind,https://www.androidcentral.com/wearables/ticwatch/mobvoi-removes-ticwatches-from-sale-potentially-leaving-wear-os-behind,0,www.androidcentral.com,The Wear OS ecosystem shrinks even further as TicWatches vanish from stores and Mobvoi pivots to AI,"First, Fossil gave up smartwatches for basic watches; now, this well-known Android smartwatch brand has stopped selling them, pivoting to AI tech.",https://cdn.mos.cms.futurecdn.net/6zqBc6gYeCRLLeQBPwmg3T-2500-80.jpg,2025-12-09T11:56:00Z,,"What you need to know
<ul><li>The Mobvoi TicWatch series has begun to disappear from retailers and Mobvoi's site, which now prioritizes home gym and AI tech.</li><li>Mobvoi has yet to comment, excep… [+4304 chars]",,en,'ecosystem'
https://www.razor.blog/2025/12/you-will-never-be-in-two-person.html,https://www.razor.blog/2025/12/you-will-never-be-in-two-person.html,0,www.razor.blog,You are dating an ecosystem,RAZOR.BLOG: SEEING THINGS AS THEY ARE. Where Philosophy meets the road + questions matter more than answers.,,2025-12-12T09:48:52Z,,"You Are Dating an Ecosystem There was a time when a relationship meant two people in one household, trying to live with each other. That era...",,en,'ecosystem'
https://consent.yahoo.com/v2/collectConsent?sessionId=1_cc-session_3ea70ae9-ea69-4174-9ff8-2c0a68160b0e,https://consent.yahoo.com/v2/collectConsent?sessionId=1_cc-session_3ea70ae9-ea69-4174-9ff8-2c0a68160b0e,0,consent.yahoo.com,OpenAI's 'code red' is a warning for the 'whole AI ecosystem',,,2025-12-02T16:00:00Z,,"If you click 'Accept all', we and our partners, including 240 who are part of the IAB Transparency &amp; Consent Framework, will also store and/or access information on a device (in other words, use … [+714 chars]",,en,'ecosystem'
https://tomtunguz.com/founder-age-median-trend/,https://tomtunguz.com/founder-age-median-trend/,0,tomtunguz.com,The Average Founder Ages 6 Months Each Year,"Statistical analysis reveals evolving trends in founder ages across the startup ecosystem, with implications for investment patterns & ecosystem dynamics.",https://res.cloudinary.com/dzawgnnlr/image/upload/v1/gqq4gpnmc7oab4bzw1kv,2025-12-12T19:41:46Z,,"No, founders are not adopting Bryan Johnson’s regimen to reverse aging. Quite the opposite : the average founder raising capital ages six months every year.1
I suspect founder age has been increasin… [+991 chars]",,en,'ecosystem'
https://www.docker.com/blog/docker-hardened-images-for-every-developer/,https://www.docker.com/blog/docker-hardened-images-for-every-developer/,0,www.docker.com,A Safer Container Ecosystem with Docker: Free Docker Hardened Images,"Security for everyone. Docker Hardened Images are now free to use, share, and build on with no licensing surprises.",https://www.docker.com/app/uploads/2025/03/image.png,2025-12-17T17:13:03Z,,"Containers are the universal path to production for most developers, and Docker has always been the steward of the ecosystem. Docker Hub has over 20 billion monthly pulls, with nearly 90% of organiza… [+15272 chars]",,en,'ecosystem'
https://consent.yahoo.com/v2/collectConsent?sessionId=1_cc-session_1d119fc8-0567-4068-a6f5-4430be1b262d,https://consent.yahoo.com/v2/collectConsent?sessionId=1_cc-session_1d119fc8-0567-4068-a6f5-4430be1b262d,0,consent.yahoo.com,"Anthony Scaramucci Says Nobody Saw The Rise Of Solana, Calls It The 'Fastest-Growing App Ecosystem On Earth'",,,2025-12-09T02:31:11Z,,"If you click 'Accept all', we and our partners, including 241 who are part of the IAB Transparency &amp; Consent Framework, will also store and/or access information on a device (in other words, use … [+714 chars]",,en,'ecosystem'
https://www.scientificamerican.com/article/bizarre-ecosystem-discovered-more-than-two-miles-beneath-arctic-ocean/,https://www.scientificamerican.com/article/bizarre-ecosystem-discovered-more-than-two-miles-beneath-arctic-ocean/,0,www.scientificamerican.com,Bizarre Ecosystem Discovered More Than Two Miles beneath Arctic Ocean,"Dynamic mounds made of methane at a depth of some 3,640 meters act like “frozen reefs” for a bizarre array of deep-sea creatures, new observations reveal",https://static.scientificamerican.com/dam/m/6e7c44cb70cf51fe/original/deep-sea-seep.jpg?m=1766524824.399&w=1200,2025-12-25T11:30:00Z,,"Deep down in the Arctic Ocean, life becomes bizarre. One might suppose that at its greatest depths, the icy, dark water would be inhospitable to much—but a new discovery reminds us that that is far f… [+2341 chars]",,en,'ecosystem'
https://www.androidpolice.com/found-google-photos-alternative-on-android/,https://www.androidpolice.com/found-google-photos-alternative-on-android/,0,www.androidpolice.com,I found the best Google Photos alternative on Android after years of switching back and forth,Escaped the Google Photos ecosystem,https://static0.anpoimages.com/wordpress/wp-content/uploads/2025/09/hand-holding-a-blue-google-pixel-smartphone-with-stacks-of-cat-photos-displayed-on-each-side-against-a-green-background.png?w=1600&h=900&fit=crop,2025-12-21T13:00:10Z,,"Google Photos has spent the last few years evolving from a simple gallery into a massive, AI-driven cloud service. For many of us, its become too much.
I tried switching to the new OneDrive app (whi… [+4705 chars]",,en,'ecosystem'
https://www.theatlantic.com/family/2025/12/kids-allowance-investing-parenting/685214/,https://www.theatlantic.com/family/2025/12/kids-allowance-investing-parenting/685214/,0,www.theatlantic.com,What Happened to Plain Old Allowances?,"As the financial ecosystem has gotten more complex, so have parents’ payments to kids.",https://cdn.theatlantic.com/thumbor/hThB91W4SjogdY2y8nRl0hJPAdA=/0x122:5751x3117/1200x625/media/img/mt/2025/12/2025_11_17_What_Modern_Allowance_Teaches_Kids/original.jpg,2025-12-10T19:09:00Z,,"Around the 1920s, a certain class of parents—those with enough money to indulge their kids from time to time—started to panic. Toy companies and trinket manufacturers were buffeting kids with ads, an… [+7689 chars]",,en,'ecosystem'
https://hbr.org/2025/12/how-to-do-influencer-marketing-that-customers-actually-trust,https://hbr.org/2025/12/how-to-do-influencer-marketing-that-customers-actually-trust,0,hbr.org,How to Do Influencer Marketing That Customers Actually Trust,"Focusing on five key dimensions can help your company communicate with authenticity, even as customer faith in influencers is declining.",https://hbr.org/resources/images/article_assets/2025/12/Aug25_00_1269348831_1481662032_boliviainteligente-5rgcytY7Gu0-unsplash.jpg,2025-12-08T14:00:00Z,,"Influencer marketing is now a $24 billion industry. Yet CMOs face a paradox: Influencer marketing is booming, but trust is eroding. One study shows that while 88% of consumers say authenticity matter… [+322 chars]",,en,'ecosystem'
https://news.slashdot.org/story/25/12/05/0146253/av1-open-video-codec-now-powers-30-of-netflix-streaming,https://news.slashdot.org/story/25/12/05/0146253/av1-open-video-codec-now-powers-30-of-netflix-streaming,0,news.slashdot.org,AV1 Open Video Codec Now Powers 30% of Netflix Streaming,"Netflix says its open AV1 video codec now powers about 30% of all streaming on the platform and is rapidly becoming its primary delivery format thanks to major gains in compression, bandwidth efficiency, HDR support, and film-grain rendering. TVTechnology rep…",https://a.fsdn.com/sd/topics/media_64.png,2025-12-05T14:14:00Z,,The Fine Print: The following comments are owned by whoever posted them. We are not responsible for them in any way.,,en,'ecosystem'
https://www.macrumors.com/2025/12/25/what-you-can-and-cant-use-an-apple-gift-card-for/,https://www.macrumors.com/2025/12/25/what-you-can-and-cant-use-an-apple-gift-card-for/,0,www.macrumors.com,What You Can (and Can't) Use an Apple Gift Card For,"Apple Gift Cards are one of the most common Apple-related gifts given during the holidays, so if you've received one today, here are all of the things you can and cannot use it for.





After redeeming an Apple Gift Card, the value is added to the Apple Acco…",https://images.macrumors.com/t/mHoqCmMuIQH_EzBInR8IuY6OgJM=/1600x/article-new/2021/11/apple-gift-card-new-red-holiday.jpg,2025-12-25T10:30:00Z,,"Apple Gift Cards are one of the most common Apple-related gifts given during the holidays, so if you've received one today, here are all of the things you can and cannot use it for.
After redeeming … [+1953 chars]",,en,'ecosystem'
https://www.yahoo.com/news/articles/scientists-rediscover-creature-thought-extinct-140000159.html,https://www.yahoo.com/news/articles/scientists-rediscover-creature-thought-extinct-140000159.html,0,www.yahoo.com,Scientists rediscover creature thought to be extinct for more than 20 years: 'It is something special',"""We now have the opportunity to preserve this species in the wild.""",https://s.yimg.com/ny/api/res/1.2/X8AIbjNdbx0GkjstxiSH6Q--/YXBwaWQ9aGlnaGxhbmRlcjt3PTEyMDA7aD02NzY7Y2Y9d2VicA--/https://media.zenfs.com/en/the_cool_down_737/56046bb98f4be2a9a3f41ae86d086546,2025-12-23T14:00:00Z,,"A fish species not recorded in the wild for more than 20 years was rediscovered in Bolivia, providing a boost for biodiversity.
As published in the journal Nature Conservation, scientists discovered… [+3159 chars]",,en,'species extinction'
https://improbable.com/2025/12/18/to-sir-with-no-love-for-pubic-lice/,https://improbable.com/2025/12/18/to-sir-with-no-love-for-pubic-lice/,0,improbable.com,"To Sir, With No Love for Pubic Lice",[NOTE: The photo shows historic — and rare — pubic lice specimens in the collection of the Natural History Museum in Rotterdam.] The Telegraph of India today published a letter of concern about the current work of Ig Nobel Prize winner Kees Moeliker. The lett…,https://improbable.com/wp-content/uploads/2025/12/pubic-louse-historic-specimen-NMR.jpg,2025-12-18T13:22:50Z,,"[NOTE: The photo shows historic and rare pubic lice specimens in the collection of the Natural History Museum in Rotterdam.]
The Telegraph of India today published a letter of concern about the curr… [+2353 chars]",,en,'species extinction'
https://legalinsurrection.com/2025/12/why-arent-polar-bears-going-extinct-like-the-experts-said-they-would/,https://legalinsurrection.com/2025/12/why-arent-polar-bears-going-extinct-like-the-experts-said-they-would/,0,legalinsurrection.com,Why Aren’t Polar Bears Going Extinct Like the “Experts” Said They Would?,"Climate cultists are blaming accelerated evolution, which is possibly the most laughable explanation they could have offered.
The post Why Aren’t Polar Bears Going Extinct Like the “Experts” Said They Would? first appeared on Le·gal In·sur·rec·tion.",https://legalinsurrection.com/wp-content/uploads/2024/09/LI-016-Polar-Bear.png,2025-12-14T02:00:41Z,,Back in 2019. I covered a book entitled The Polar Bear Catastrophe that Never Happened by Dr. Susan Crockford. The University of Victoria professor analyzed the latest data and reviewed the questiona… [+6331 chars],,en,'species extinction'
https://lithub.com/on-the-urgency-of-climate-change-creating-hope-in-a-crisis-and-the-limits-of-western-storytelling/,https://lithub.com/on-the-urgency-of-climate-change-creating-hope-in-a-crisis-and-the-limits-of-western-storytelling/,0,lithub.com,"On the Urgency of Climate Change, Creating Hope in a Crisis, and the Limits of Western Storytelling","It’s genuinely difficult to cultivate a hopeful perspective on the climate crisis, and prospects for climate action, in 2025. While I was writing this introductory note, COP30, this year’s United Nations climate summit in Belém, Brazil, ended without an agree…",https://s26162.pcdn.co/wp-content/uploads/2025/12/wind-turbines.jpg,2025-12-15T09:58:21Z,,"Its genuinely difficult to cultivate a hopeful perspective on the climate crisis, and prospects for climate action, in 2025. While I was writing this introductory note, COP30, this years United Natio… [+28823 chars]",,en,'species extinction'
https://journals.plos.org/plosone/article?id=10.1371/journal.pone.0339562,https://journals.plos.org/plosone/article?id=10.1371/journal.pone.0339562,0,journals.plos.org,Toward a unified understanding of climate anxiety: Examining measures of climate and eco-anxiety,"Despite recent research efforts to understand climate anxiety, related measurement is challenged by multiple definitions and the emergence of several seemingly similar measures, warranting a thorough and joint investigation of their validity. This study (N = …",https://journals.plos.org/plosone/article/figure/image?id=10.1371/journal.pone.0339562.g004&size=inline,2025-12-29T14:00:00Z,,"Abstract
Despite recent research efforts to understand climate anxiety, related measurement is challenged by multiple definitions and the emergence of several seemingly similar measures, warranting … [+67947 chars]",,en,'species extinction'
https://matadornetwork.com/read/25-unforgettable-places-go-2026-salt-lake-city/,https://matadornetwork.com/read/25-unforgettable-places-go-2026-salt-lake-city/,0,matadornetwork.com,25 Unforgettable Places to Go in 2026: Salt Lake City,A film festival going out with a bang and unparalleled access to the outdoors.,https://cdn1.matadornetwork.com/blogs/1/2025/10/shutterstock_2450998215-1200x900.jpg,2025-12-18T23:10:47Z,,"It’s also home to one of the country’s best aquariums, the Loveland Living Planet Aquarium, which features multiple exhibit halls hosting not just marine life but flora and fauna from around the worl… [+1405 chars]",,en,'species conservation'
https://www.quantamagazine.org/how-dads-fitness-may-be-packaged-and-passed-down-in-sperm-rna-20251222/,https://www.quantamagazine.org/how-dads-fitness-may-be-packaged-and-passed-down-in-sperm-rna-20251222/,0,www.quantamagazine.org,How Dad’s Fitness May Be Packaged and Passed Down in Sperm RNA,"Research into how a father’s choices, including diet, exercise, stress and nicotine use, may transfer traits to his children epigenetically has become impossible to ignore. The post How Dad’s Fitness May Be Packaged and Passed Down in Sperm RNA first appeared…",https://www.quantamagazine.org/wp-content/uploads/2025/12/Epigenetic-Sperm-cr-Weerasekera-Social.jpg,2025-12-22T14:15:07Z,,"In March 2025, in a preprint uploaded to biorxiv.org, Mansuy and colleagues reported that EVs in mice can transport certain RNAs, metabolites and lipids linked to early-life stress from circulating b… [+5617 chars]",,en,'species conservation'
https://www.lifesciencesworld.com/how-many-tigons-exist/,https://www.lifesciencesworld.com/how-many-tigons-exist/,0,www.lifesciencesworld.com,How many tigons exist?,"How Many Tigons Exist? Delving into the Rarity of Tigons The exact number of tigons in existence is impossible to determine with certainty, but it is estimated to be extremely low, likely fewer than a few dozen worldwide. This rarity stems from tigons existin…",,2025-12-24T01:49:23Z,,"The exact number of tigons in existence is impossible to determine with certainty, but it is estimated to be extremely low, likely fewer than a few dozen worldwide. This rarity stems from tigons exis… [+7808 chars]",,en,'species conservation'
https://www.lifesciencesworld.com/where-do-catfish-live-in-the-world/,https://www.lifesciencesworld.com/where-do-catfish-live-in-the-world/,0,www.lifesciencesworld.com,Where do catfish live in the world?,"Where Do Catfish Live in the World? A Global Guide Catfish, renowned for their barbels and diverse sizes, inhabit a vast range of aquatic environments across the globe. They are found on every continent except Antarctica, thriving in both freshwater and saltw…",,2025-12-20T00:03:03Z,,"Catfish, renowned for their barbels and diverse sizes, inhabit a vast range of aquatic environments across the globe. They are found on every continent except Antarctica, thriving in both freshwater … [+7793 chars]",,en,'species conservation'
https://www.lifesciencesworld.com/where-did-the-least-killifish-come-from/,https://www.lifesciencesworld.com/where-did-the-least-killifish-come-from/,0,www.lifesciencesworld.com,Where did the least killifish come from?,"Where Did the Least Killifish Come From? Unraveling the Origins of Heterandria formosa The least killifish, Heterandria formosa, is a diminutive freshwater fish endemic to the Southeastern United States. Understanding where did the least killifish come from r…",,2025-12-30T05:36:43Z,,"The least killifish, Heterandria formosa, is a diminutive freshwater fish endemic to the Southeastern United States. Understanding where did the least killifish come from requires tracing its evoluti… [+9027 chars]",,en,'species conservation'
https://www.lifesciencesworld.com/are-there-any-fish-that-live-on-land/,https://www.lifesciencesworld.com/are-there-any-fish-that-live-on-land/,0,www.lifesciencesworld.com,Are there any fish that live on land?,"Are There Any Fish That Live on Land? Yes, there are fish that can live on land for extended periods, defying the conventional understanding of aquatic life; the most notable example is the mudskipper, a fascinating amphibian fish species. Introduction: The S…",,2025-12-09T04:55:32Z,,"Yes, there are fish that can live on land for extended periods, defying the conventional understanding of aquatic life; the most notable example is the mudskipper, a fascinating amphibian fish specie… [+7029 chars]",,en,'species conservation'
https://www.lifesciencesworld.com/do-you-get-crocodiles-in-colombia/,https://www.lifesciencesworld.com/do-you-get-crocodiles-in-colombia/,0,www.lifesciencesworld.com,Do you get crocodiles in Colombia?,"Crocodiles in Colombia: A Comprehensive Guide to Crocodilian Habitats Yes, you do get crocodiles in Colombia. The nation is home to several crocodilian species, making it an important habitat for these ancient reptiles. Colombia, a country renowned for its bi…",,2025-12-15T00:57:52Z,,"Crocodiles in Colombia: A Comprehensive Guide to Crocodilian Habitats
Yes, you do get crocodiles in Colombia. The nation is home to several crocodilian species, making it an important habitat for th… [+10019 chars]",,en,'species conservation'
https://www.lifesciencesworld.com/do-grizzlies-ever-mate-with-black-bears/,https://www.lifesciencesworld.com/do-grizzlies-ever-mate-with-black-bears/,0,www.lifesciencesworld.com,Do grizzlies ever mate with black bears?,"Grizzly-Black Bear Hybrids: When Species Lines Blur Do grizzlies ever mate with black bears? Yes, under specific circumstances where habitats overlap and other mating options are limited, grizzlies and black bears can and do mate, producing hybrid offspring o…",,2025-12-15T01:45:19Z,,"Do grizzlies ever mate with black bears?Yes, under specific circumstances where habitats overlap and other mating options are limited, grizzlies and black bears can and do mate, producing hybrid offs… [+9360 chars]",,en,'species conservation'
https://www.lifesciencesworld.com/do-birds-lose-the-ability-to-fly/,https://www.lifesciencesworld.com/do-birds-lose-the-ability-to-fly/,0,www.lifesciencesworld.com,Do birds lose the ability to fly?,"Do Birds Lose the Ability to Fly? The Evolutionary Path to Flightlessness The answer to “Do birds lose the ability to fly?” is a resounding yes. While flight offers immense advantages, some birds, through evolutionary pressures, have traded it for other survi…",,2025-12-22T02:49:36Z,,"Do Birds Lose the Ability to Fly? The Evolutionary Path to Flightlessness
The answer to “Do birds lose the ability to fly?” is a resounding yes. While flight offers immense advantages, some birds, t… [+9392 chars]",,en,'species conservation'
https://www.lifesciencesworld.com/what-is-the-point-on-a-sailfish-called/,https://www.lifesciencesworld.com/what-is-the-point-on-a-sailfish-called/,0,www.lifesciencesworld.com,What is the point on a sailfish called?,"What is the Point on a Sailfish Called? Unveiling the Billfish’s Defining Feature The point on a sailfish is called its bill, or sometimes its rostrum, and it’s a defining characteristic that plays a vital role in hunting and defense. This elongated upper jaw…",,2025-12-11T05:23:49Z,,"The point on a sailfish is called its bill, or sometimes its rostrum, and its a defining characteristic that plays a vital role in hunting and defense. This elongated upper jaw is what distinguishes … [+8282 chars]",,en,'species conservation'
https://www.popularmechanics.com/science/environment/a69638301/china-reforesting-changed-hydrology/,https://www.popularmechanics.com/science/environment/a69638301/china-reforesting-changed-hydrology/,0,www.popularmechanics.com,China Planted 78 Billion New Trees—and Seriously Messed Up Its Water Cycle,"China’s planted a bunch of new trees since 1981, but that extra foliage is shifting more precipitation to some areas while drying out others.",https://s.yimg.com/ny/api/res/1.2/qcCkz2lAMxU.2HG1RGvUZw--/YXBwaWQ9aGlnaGxhbmRlcjt3PTEyMDA7aD02NzU7Y2Y9d2VicA--/https://media.zenfs.com/en/popular_mechanics_642/1ca963208e419d813bfa34e16af6a9a9,2025-12-12T14:30:00Z,,"Heres what youll learn when reading this story:
<ul><li>Reforesting areas of the world comes with major benefits, but adding billions of trees can come with unintended consequences.
</li><li>A new … [+3540 chars]",,en,'reforestation'
https://www.makeuseof.com/chrome-alternative-plants-trees-while-you-browse/,https://www.makeuseof.com/chrome-alternative-plants-trees-while-you-browse/,0,www.makeuseof.com,"This Chrome alternative plants trees while you browse—yes, really",And it's not as gimmicky as it sounds.,https://static0.makeuseofimages.com/wordpress/wp-content/uploads/wm/2025/12/ecosia-browser-on-a-laptop.jpg?w=1600&h=900&fit=crop,2025-12-03T23:00:15Z,,"I've been using Google Chrome for years, and I've experimented with and switched my browser's default search engine. But when I came across Ecosiaa browser that claims to plant trees with your search… [+5834 chars]",,en,'reforestation'
https://www.nature.com/articles/s41586-025-09837-8,https://www.nature.com/articles/s41586-025-09837-8,0,www.nature.com,Protected area management has significant spillover effects on vegetation,"Analysis of effect sizes of vegetation spillovers from protected areas in Australia shows that 71% of over 3,063 analysed&nbsp;protected areas had a positive spillover effect, and that these effects covary with protected area management type.",https://media.springernature.com/m685/springer-static/image/art%3A10.1038%2Fs41586-025-09837-8/MediaObjects/41586_2025_9837_Fig1_HTML.png,2025-12-10T00:00:00Z,,"<li>Convention on Biological Diversity. KunmingMontreal Global Biodiversity Framework, 15th Meeting of the Conference of Parties to the UN Convention on Biological Diversity, CBD/COP/15/L25 (2022).
… [+14908 chars]",,en,'reforestation'
