index,url,valid,domain,title,description,image,published,archive,content,quote,language,keyword
https://nypost.com/2023/09/14/red-fire-ants-one-of-worlds-most-invasive-species-storms-europe/,https://nypost.com/2023/09/14/red-fire-ants-one-of-worlds-most-invasive-species-storms-europe/,0,nypost.com,"Red fire ants, one of world’s most invasive species, storms Europe: ‘We knew this day would come’","Red fire ants have finally made the pilgrimage to Italy -- and are threatening to take over the country, according to a new study.",https://nypost.com/wp-content/uploads/sites/2/2023/09/red-ants-comp-1.jpg?quality=75&strip=all&w=1024,2023-09-14T04:14:08Z,,"It’s a milit-ant takeover.
Red fire ants have finally made the pilgrimage to Europe — and are threatening to take over the continent, according to a new study.
The tiny insects — considered one of … [+3196 chars]",,en,'invasive alien species'
https://www.ibtimes.com/world-losing-high-stakes-fight-against-alien-species-3710623,https://www.ibtimes.com/world-losing-high-stakes-fight-against-alien-species-3710623,0,www.ibtimes.com,World Losing High-stakes Fight Against Alien Species,"Invasive species that wreck crops, ravage forests, spread disease, and upend ecosystems are spreading ever faster across the globe, and humanity has not been able to stem the tide, a major scientific assessment said Monday.",https://d.ibtimes.com/en/full/4483963/florida-everglades-teeming-destructive-offspring-erstwhile-pets-house-plants-including.jpg,2023-09-04T12:21:36Z,,"Invasive species that wreck crops, ravage forests, spread disease, and upend ecosystems are spreading ever faster across the globe, and humanity has not been able to stem the tide, a major scientific… [+4909 chars]",,en,'invasive alien species'
https://www.ibtimes.com/invasive-species-growing-costly-threat-key-report-find-3710545,https://www.ibtimes.com/invasive-species-growing-costly-threat-key-report-find-3710545,0,www.ibtimes.com,"Invasive Species A Growing And Costly Threat, Key Report To Find","Invasive species that destroy forests, ravage crops and cause extinctions are a major and growing threat worldwide, a landmark UN-backed assessment is poised to report.",https://d.ibtimes.com/en/full/4483825/most-invasive-animal-species.jpg,2023-09-04T01:51:36Z,,"Invasive species that destroy forests, ravage crops and cause extinctions are a major and growing threat worldwide, a landmark UN-backed assessment is poised to report.
From water hyacinth choking L… [+2643 chars]",,en,'invasive alien species'
https://www.bangkokpost.com/world/2641110/invasive-species-a-growing-and-costly-threat-key-report-to-find,https://www.bangkokpost.com/world/2641110/invasive-species-a-growing-and-costly-threat-key-report-to-find,0,www.bangkokpost.com,"Invasive species a growing and costly threat, key report to find","PARIS: Invasive species that destroy forests, ravage crops and cause extinctions are a major and growing threat worldwide, a landmark UN-backed assessment is poised to report.",https://static.bangkokpost.com/media/content/20230904/c1_4882022_700.jpg,2023-09-04T02:45:00Z,,"PARIS: Invasive species that destroy forests, ravage crops and cause extinctions are a major and growing threat worldwide, a landmark UN-backed assessment is poised to report.
From water hyacinth ch… [+2478 chars]",,en,'invasive alien species'
https://www.france24.com/en/africa/20230904-invasive-species-a-growing-and-costly-threat-worldwide-key-report-to-find,https://www.france24.com/en/africa/20230904-invasive-species-a-growing-and-costly-threat-worldwide-key-report-to-find,0,www.france24.com,"Invasive species a growing and costly threat worldwide, key report to find","Invasive species that destroy forests, ravage crops and cause extinctions are a major and growing threat worldwide, a landmark UN-backed assessment is poised to report.",https://s.france24.com/media/display/5b43d7ae-4acd-11ee-b4f3-005056a90321/w:1280/p:16x9/2023-08-28T113808Z_1678660045_RC2AU2AINZVV_RTRMADP_3_CLIMATE-CHANGE-LEBANON-WETLANDS.JPG,2023-09-04T02:50:59Z,,"Invasive species that destroy forests, ravage crops and cause extinctions are a major and growing threat worldwide, a landmark UN-backed assessment is poised to report. From water hyacinth choking La… [+2491 chars]",,en,'invasive alien species'
https://www.euractiv.com/section/agriculture-food/news/highly-invasive-fire-ant-reaches-europe-scientists-call-for-urgent-action/,https://www.euractiv.com/section/agriculture-food/news/highly-invasive-fire-ant-reaches-europe-scientists-call-for-urgent-action/,0,www.euractiv.com,"Highly invasive fire ant reaches Europe, scientists call for urgent action","Scientists are urging national and EU authorities to take swift action against the rapid spread of the fire ant, a highly invasive species with the potential to cause major health and environmental damage.",https://www.euractiv.com/wp-content/uploads/sites/2/2023/09/shutterstock_2027964644-1-800x450.jpg,2023-09-14T07:19:33Z,,"Scientists are urging national and EU authorities to take swift action against the rapid spread of the fire ant, a highly invasive species with the potential to cause major health and environmental d… [+4665 chars]",,en,'invasive alien species'
https://phys.org/news/2023-09-invasive-alien-species-threat-planet.html,https://phys.org/news/2023-09-invasive-alien-species-threat-planet.html,0,phys.org,Invasive alien species are a serious threat to the planet: Four key messages for Africa,"Climate change has negatively—and irreversibly, in some cases—affected ecosystems around the globe. Sadly, though, it is not the only phenomenon that's altering our natural world.",https://scx2.b-cdn.net/gfx/news/hires/2023/invasive-species.jpg,2023-09-24T16:50:01Z,,"Climate change has negativelyand irreversibly, in some casesaffected ecosystems around the globe. Sadly, though, it is not the only phenomenon that's altering our natural world.
In 2019, the Intergo… [+6791 chars]",,en,'invasive alien species'
https://indianexpress.com/article/cities/mumbai/engineering-grad-arrested-for-trying-to-sell-ambergris-worth-1-crore-8962070/,https://indianexpress.com/article/cities/mumbai/engineering-grad-arrested-for-trying-to-sell-ambergris-worth-1-crore-8962070/,0,indianexpress.com,Engineering grad among two arrested for trying to sell Ambergris worth Rs 1 cr,One of the accused is from Ratnagiri district in Maharashtra and is an engineering graduate.,https://images.indianexpress.com/2023/09/whale-ambergris.jpg,2023-09-29T14:39:02Z,,"The Meghwadi police have arrested two persons for allegedly trying to sell Ambergris (whale’s vomit) in the Andheri area on Tuesday. The police have seized around 1 kg of Ambergris, estimated to be w… [+2002 chars]",,en,'protected species'
https://www.latimes.com/environment/story/2023-09-29/as-heat-waves-grip-pacific-what-happens-to-ocean-life,https://www.latimes.com/environment/story/2023-09-29/as-heat-waves-grip-pacific-what-happens-to-ocean-life,0,www.latimes.com,"As heat waves warm the Pacific Ocean, effects on marine life remain murky","While satellites and offshore buoys can inform scientists about marine heat waves, the effects on ocean species are less understood.",https://ca-times.brightspotcdn.com/dims4/default/3e73ed1/2147483647/strip/true/crop/4200x2205+0+103/resize/1200x630!/quality/75/?url=https%3A%2F%2Fcalifornia-times-brightspot.s3.amazonaws.com%2F8f%2F01%2Ff7597137447a82886c569e07dcb7%2Fla-photos-1staff-590355-la-summer-pandemic-weekend-catalina-34-ajs.jpg,2023-09-29T10:00:07Z,,"Scientists are pretty good at recognizing marine heat waves: A global network of thousands of oceanic buoys and orbiting satellites allow them to see, in real time, ocean surface temperatures, changi… [+7247 chars]",,en,'protected species'
https://www.cbsnews.com/news/this-week-on-sunday-morning-october-1-2023/,https://www.cbsnews.com/news/this-week-on-sunday-morning-october-1-2023/,0,www.cbsnews.com,"This week on ""Sunday Morning"" (October 1)","A look at the features for this week's broadcast of the 2023 News & Documentary Emmy-winner for Outstanding Recorded News Program, hosted by Jane Pauley.",https://assets2.cbsnewsstatic.com/hub/i/r/2023/09/28/cd96ca01-6dfa-43c8-87ec-38d8bb73c8d8/thumbnail/1200x630/d2d42fc23025b7142351f06fe5081f04/oprah-sun.jpg?v=242034d9ab4afded7ccae23353fd75fe,2023-09-28T23:06:00Z,,"The Emmy Award-winning ""CBS News Sunday Morning"" is broadcast on CBS Sundays beginning at 9:00 a.m. ET.  ""Sunday Morning"" also streams on the CBS News app beginning at 12:00 p.m. ET. (Download it her… [+5533 chars]",,en,'protected species'
https://berwicknews.starcommunity.com.au/news/2023-09-29/higher-responsibility-for-cat-owners/,https://berwicknews.starcommunity.com.au/news/2023-09-29/higher-responsibility-for-cat-owners/,0,berwicknews.starcommunity.com.au,Higher responsibility for cat owners,Casey Council has urged residents to take responsibility for feral and semi-owned cats and to stop feeding strays. Casey Council […],https://berwicknews.starcommunity.com.au/files/2023/09/catgen_313313_01.jpg,2023-09-28T23:00:50Z,,"Casey Council has urged residents to take responsibility for feral and semi-owned cats and to stop feeding strays. 
Casey Council connected communities manager Callum Pattie cats were one of the mos… [+1354 chars]",,en,'protected species'
https://www.skynews.com.au/business/senator-singles-out-two-people-who-allegedly-masterminded-dumping-a-qatar-airways-bid-to-boost-flights-in-australia/news-story/eddb14bb4054f0297902b8e3b1a17817,https://www.skynews.com.au/business/senator-singles-out-two-people-who-allegedly-masterminded-dumping-a-qatar-airways-bid-to-boost-flights-in-australia/news-story/eddb14bb4054f0297902b8e3b1a17817,0,www.skynews.com.au,Senator singles out ‘two people’ who allegedly masterminded dumping a Qatar Airways bid to boost flights in Australia,"Senator Bridget McKenzie has declared war on the “two people” involved in overturning Qatar Airways’ bid for extra flights, warning a Senate inquiry into the decision would get to the bottom of the controversial decision.",https://content.api.news/v3/images/bin/7f24e91d8e2fc1d72a8aaa5802174236,2023-09-28T02:35:53Z,,"Senator Bridget McKenzie has declared war on the “two people” involved in overturning Qatar Airways’ bid for extra flights, warning a Senate inquiry into the decision would get to the bottom of the c… [+3062 chars]",,en,'protected species'
https://phys.org/news/2023-09-reveals-dynamic-factors-biodiversity-small.html,https://phys.org/news/2023-09-reveals-dynamic-factors-biodiversity-small.html,0,phys.org,New research reveals dynamic factors shaping biodiversity at small scales,The fundamental question of biodiversity research aims to better understand how many different species manage to coexist in one place. A group of researchers believe they now have a more robust picture of what this looks like at some of the finest local scale…,https://scx2.b-cdn.net/gfx/news/2023/new-research-reveals-d.jpg,2023-09-27T14:25:04Z,,The fundamental question of biodiversity research aims to better understand how many different species manage to coexist in one place. A group of researchers believe they now have a more robust pictu… [+4115 chars],,en,'protected species'
https://www.bbc.co.uk/news/uk-politics-66938308,https://www.bbc.co.uk/news/uk-politics-66938308,0,www.bbc.co.uk,Boris Johnson given green light to build swimming pool,The former prime minister's plans at his new home had been threatened by the presence of great crested newts.,https://ichef.bbci.co.uk/news/1024/branded_news/16D38/production/_131269439_fd4f06630203a6ebf05690857c092c5e08815039.jpg,2023-09-27T14:24:55Z,,"Ex-PM Boris Johnson has been given permission to build a swimming pool in his Oxfordshire home, despite initial concerns it could impact nearby newts.
The development had been put on hold over fears… [+2394 chars]",,en,'protected species'
https://www.theatlantic.com/international/archive/2023/09/bakhmut-memories-former-resident/675458/?utm_source=feed,https://www.theatlantic.com/international/archive/2023/09/bakhmut-memories-former-resident/675458/?utm_source=feed,0,www.theatlantic.com,"Bakhmut, Before It Vanished",The world first heard of my hometown only after Russia destroyed it.,,2023-09-27T06:00:00Z,,"“President Joe Biden has made a statement about the situation in Bakhmut”: If anyone had said this sentence to me two years ago, I would have laughed. Back then, most Ukrainians couldn’t have found B… [+12210 chars]",,en,'protected species'
https://www.prnewswire.com/news-releases/delta-electronics-foundation-and-national-museum-of-marine-science--technology-set-up-asias-first-zero-carbon-coral-conservation-center-for-endangered-corals-301938193.html,https://www.prnewswire.com/news-releases/delta-electronics-foundation-and-national-museum-of-marine-science--technology-set-up-asias-first-zero-carbon-coral-conservation-center-for-endangered-corals-301938193.html,0,www.prnewswire.com,Delta Electronics Foundation and National Museum of Marine Science & Technology Set Up Asia's First Zero-Carbon Coral Conservation Center for Endangered Corals,"TAIPEI, Sept. 25, 2023 /PRNewswire/ -- Delta Electronics Foundation and the National Museum of Marine Science & Technology (NMMST) have jointly announced the opening of the Chaojing Coral Conservation Center on September 23rd with the aim of restoring interna…",,2023-09-26T01:20:00Z,,"TAIPEI, Sept. 25, 2023 /PRNewswire/ -- Delta Electronics Foundation and the National Museum of Marine Science &amp; Technology (NMMST) have jointly announced the opening of the Chaojing Coral Conserv… [+5840 chars]",,en,'protected species'
https://www.gov.uk/guidance/ministry-of-justice-climate-change-and-sustainability,https://www.gov.uk/guidance/ministry-of-justice-climate-change-and-sustainability,0,www.gov.uk,Guidance: Ministry of Justice Climate Change and Sustainability,Embedding sustainability on the MOJ estate.,https://www.gov.uk/assets/static/govuk-opengraph-image-dade2dad5775023b0568381c4c074b86318194edb36d3d68df721eea7deeac4b.png,2023-09-25T13:15:33Z,,"Sustainable development
Sustainable development is about applying economic, social and environmental thinking to an issue and paying particular attention to the long-term consequences. It can be tho… [+10825 chars]",,en,'protected species'
https://www.euronews.com/2023/09/25/hundreds-of-animal-skulls-from-africa-seized-at-paris-airport,https://www.euronews.com/2023/09/25/hundreds-of-animal-skulls-from-africa-seized-at-paris-airport,0,www.euronews.com,Hundreds of animal skulls from Africa seized at Paris airport,"Trade in the skulls of ""critically endangered"" animals is causing pointed conservation concerns.",https://static.euronews.com/articles/stories/07/91/31/00/1000x563_cmsv2_41cc2fb0-7fcd-51b4-b0a5-5b651dfff95f-7913100.jpg,2023-09-25T11:32:47Z,,"Trade in the skulls of ""critically endangered"" animals is causing pointed conservation concerns. 
 Customs at Paris' Roissy Charles-de-Gaulle could indeed open a natural history museum.
In seven mo… [+3498 chars]",,en,'protected species'
https://www.hurriyetdailynews.com/france-sounds-alert-on-primates-skulls-trafficking-186483,https://www.hurriyetdailynews.com/france-sounds-alert-on-primates-skulls-trafficking-186483,0,www.hurriyetdailynews.com,France sounds alert on primates' skulls trafficking,"French customs has said that they had seized almost 400 skulls from protected primate species in just seven months, in a sign of a rise in the lucrative trade.",https://image.hurimg.com/i/hurriyet/75/200x200/650d47aa4e3fe117e8a6ad3d.jpg,2023-09-23T04:00:00Z,,"PARIS
French customs has said that they had seized almost 400 skulls from protected primate species in just seven months, in a sign of a rise in the lucrative trade.
Agents at the Paris Charles-de-… [+1588 chars]",,en,'protected species'
https://www.cbsnews.com/news/primate-skulls-headed-us-seized-france-airport/,https://www.cbsnews.com/news/primate-skulls-headed-us-seized-france-airport/,0,www.cbsnews.com,"Nearly 400 primate skulls headed for U.S. seized in France: ""Staggering""",More than 392 packages filled with primate skulls and other remains were found over the course of several months at Paris Charles de Gaulle Airport.,https://assets1.cbsnewsstatic.com/hub/i/r/2023/09/22/92d29050-e894-44fd-864a-672518cc7b28/thumbnail/1200x630g9/d378eb9eb99c637e21ca874895ec6f19/f6jvdldxwaaqd8c.jpg?v=f5251b37272e6b1bc4e5456ab4445a67,2023-09-22T14:39:00Z,,"Customs agents at France's largest airport have spent months stockpiling a shocking discovery – the trafficked skulls and other remains of more than 700 animals headed for the U.S. 
The skulls were … [+2310 chars]",,en,'protected species'
https://www.news24.com/news24/world/news/french-customs-seize-some-400-monkey-and-baboon-skulls-destined-for-the-us-worth-up-to-r20-000-each-20230922,https://www.news24.com/news24/world/news/french-customs-seize-some-400-monkey-and-baboon-skulls-destined-for-the-us-worth-up-to-r20-000-each-20230922,0,www.news24.com,"News24 | French customs seize some 400 monkey and baboon skulls destined for the US, worth up to R20 000 each","Primate skulls likely meant for collectors, hunting clubs in US, where they are reportedly given as gifts and prizes.",https://cdn.24.co.za/files/Cms/General/d/9134/b5ed79546196445eabafbac1da618eaf.jpg,2023-09-22T08:10:58Z,,"Customs officials at Charles de Gaulle Airport in Paris say they have seized almost 400 skulls from protected monkey species over seven months last year.
Customs agents at the French capital’s large… [+2065 chars]",,en,'protected species'
https://www.aljazeera.com/news/2023/9/22/french-customs-seize-nearly-400-monkey-skulls-destined-for-the-us,https://www.aljazeera.com/news/2023/9/22/french-customs-seize-nearly-400-monkey-skulls-destined-for-the-us,0,www.aljazeera.com,French customs seize nearly 400 monkey skulls destined for the US,"Primate skulls likely meant for collectors, hunting clubs in US, where they are reportedly given as gifts and prizes.",https://www.aljazeera.com/wp-content/uploads/2023/09/33VX8FN-highres-1695360684.jpg?resize=1920%2C1440,2023-09-22T05:56:57Z,http://wayback.archive-it.org/all/20230922211225/https://www.aljazeera.com/news/2023/9/22/french-customs-seize-nearly-400-monkey-skulls-destined-for-the-us,"Customs officials at Charles de Gaulle Airport in Paris say they have seized almost 400 skulls from protected monkey species over seven months last year.
Customs agents at the French capitals larges… [+2195 chars]",,en,'protected species'
https://www.france24.com/en/europe/20230921-france-warns-of-rise-in-large-scale-trafficking-of-primates-skulls,https://www.france24.com/en/europe/20230921-france-warns-of-rise-in-large-scale-trafficking-of-primates-skulls,0,www.france24.com,France warns of rise in large-scale trafficking of primates’ skulls,"French customs said Thursday that they had seized almost 400 skulls from protected primate species in just seven months, in a sign of a rise in the lucrative trade.",https://s.france24.com/media/display/e8252d2a-589d-11ee-b2a8-005056a90321/w:1280/p:16x9/000_33VY4T3.jpg,2023-09-21T16:49:52Z,,"French customs said Thursday that they had seized almost 400 skulls from protected primate species in just seven months, in a sign of a rise in the lucrative trade. Agents at the Paris Charles-de-Gau… [+1592 chars]",,en,'protected species'
https://www.euractiv.com/section/biodiversity/news/top-eu-court-finds-berlin-failed-to-protect-nature/,https://www.euractiv.com/section/biodiversity/news/top-eu-court-finds-berlin-failed-to-protect-nature/,0,www.euractiv.com,Top EU court finds Berlin failed to protect nature,"More than a decade after EU-wide nature reserves were created to protect the continent’s most vulnerable species, the European Court of Justice (ECJ) found on Thursday (21 September) that Germany failed to adequately protect them.",https://www.euractiv.com/wp-content/uploads/sites/2/2023/09/10880767-800x450.jpg,2023-09-21T11:58:28Z,,"More than a decade after EU-wide nature reserves were created to protect the continents most vulnerable species, the European Court of Justice (ECJ) found on Thursday (21 September) that Germany fail… [+3210 chars]",,en,'protected species'
https://phys.org/news/2023-09-dolphins-whales-highly-vulnerable-climate.html,https://phys.org/news/2023-09-dolphins-whales-highly-vulnerable-climate.html,0,phys.org,"Dolphins, seals and whales managed by the US are highly vulnerable to climate change, study finds","According to a study published in PLOS ONE, 72% of cetacean and pinniped stocks managed under U.S. jurisdiction are highly or very highly vulnerable to climate change. The research was led by Matthew D. Lettrich at NOAA Fisheries, in Silver Spring, Maryland, …",https://scx2.b-cdn.net/gfx/news/hires/2023/dolphins-seals-and-wha.jpg,2023-09-20T18:00:01Z,,"According to a study published in PLOS ONE, 72% of cetacean and pinniped stocks managed under U.S. jurisdiction are highly or very highly vulnerable to climate change. The research was led by Matthew… [+3862 chars]",,en,'protected species'
https://www.cbc.ca/news/canada/nova-scotia/cormorants-mess-sydney-harbour-1.6971477,https://www.cbc.ca/news/canada/nova-scotia/cormorants-mess-sydney-harbour-1.6971477,0,www.cbc.ca,Bombs away: Cormorants making a mess on both sides of Sydney harbour,Marine Atlantic and the Port of Sydney Development Corporation say bird poop is becoming an expensive headache on the ferry and cruise ship docks.,https://i.cbc.ca/1.6971587.1695145816!/cumulusImage/httpImage/image.jpg_gen/derivatives/16x9_620/cruise-ship-dock.jpg,2023-09-20T09:00:00Z,,"Docks on both sides of the harbour in Sydney, N.S., are under aerial attack, leaving behind an expensive and gross mess.
Seabirds, particularly cormorants, are leaving droppings on the concrete infr… [+3684 chars]",,en,'protected species'
https://www.cbc.ca/news/canada/newfoundland-labrador/ncc-salmonier-reserve-expansion-1.6971160,https://www.cbc.ca/news/canada/newfoundland-labrador/ncc-salmonier-reserve-expansion-1.6971160,0,www.cbc.ca,Conservation group buys church land for huge expansion of Salmonier Nature Reserve,"The Nature Conservancy of Canada has bought 233 hectares of forest habitat, doubling the size of the Salmonier River Nature Reserve.",https://i.cbc.ca/1.6971269.1695135503!/fileImage/httpImage/image.JPG_gen/derivatives/16x9_620/salmonier-nature-reserve.JPG,2023-09-19T18:10:03Z,,"The Nature Conservancy of Canada is buzzing after a small victory in Newfoundland and Labrador. 
The national non-profit land conservation organization bought 233 hectares of intact boreal forest, h… [+2840 chars]",,en,'protected species'
https://www.businessinsider.com/massive-lithium-deposit-game-changer-clean-energy-hurts-native-americans-2023-9,https://www.businessinsider.com/massive-lithium-deposit-game-changer-clean-energy-hurts-native-americans-2023-9,0,www.businessinsider.com,Scientists found a massive lithium deposit inside an ancient US volcano that could be a game-changer for American clean energy but spell disaster for Native Americans,"The new findings could translate to more than 132 million tons of lithium on US soil, which helps make rechargeable batteries for electric vehicles.",https://i.insider.com/6501f50e992da60019eba736?width=1200&format=jpeg,2023-09-14T03:11:54Z,,"A general view shows the brine pools of Albemarle Chile lithium plant placed on the Atacama salt flat.REUTERS/Ivan Alvarado/File Photo
<ul>
<li>Scientists measured significant levels of lithium trap… [+3384 chars]",,en,'land degradation'
https://phys.org/news/2023-09-pyrenean-glacier-maladeta-decade.html,https://phys.org/news/2023-09-pyrenean-glacier-maladeta-decade.html,0,phys.org,The Pyrenean glacier of Maladeta could disappear by the end of the next decade,"Adrián Martínez Fernández, the specialist technician in charge of the Digital Mapping and 3D Analysis Laboratory at the Centro Nacional de Investigación sobre la Evolución Humana (CENIEH), is the lead author of a paper published in the journal Land Degradatio…",https://scx2.b-cdn.net/gfx/news/hires/2023/the-pyrenean-glacier-o.jpg,2023-09-06T20:39:46Z,,"Adrián Martínez Fernández, the specialist technician in charge of the Digital Mapping and 3D Analysis Laboratory at the Centro Nacional de Investigación sobre la Evolución Humana (CENIEH), is the lea… [+2859 chars]",,en,'land degradation'
https://www.npr.org/sections/goatsandsoda/2023/09/21/1200693989/the-u-n-plan-to-improve-the-world-by-2030-is-failing-does-that-make-it-a-failure,https://www.npr.org/sections/goatsandsoda/2023/09/21/1200693989/the-u-n-plan-to-improve-the-world-by-2030-is-failing-does-that-make-it-a-failure,0,www.npr.org,The U.N. plan to improve the world by 2030 is failing. Does that make it a failure?,"The 17 Sustainable Development Goals — starting with an end to poverty — were set in 2015. At the halfway mark, the world is reeling from crises. Progress is stunted. Do the goals still help?",https://media.npr.org/assets/img/2023/09/21/un-sustainablegoals-graphic_wide-8d3308b2e77ef1f560e6602fad0e0dd701004a0c-s1400-c100.jpg,2023-09-21T16:42:00Z,,"The United Nations Sustainable Development Goals (SDGs) to achieve by 2030.
United Nations
What if you made a self-improvement plan and failed to meet your goals.
Imagine that in a moment of unusu… [+9722 chars]",,en,'land degradation'
