index,url,valid,domain,title,description,image,published,archive,content,quote,language,keyword
https://www.irishtimes.com/life-style/travel/2024/09/02/back-on-the-ranch-a-dream-holiday-for-horse-lovers-in-the-american-west/,https://www.irishtimes.com/life-style/travel/2024/09/02/back-on-the-ranch-a-dream-holiday-for-horse-lovers-in-the-american-west/,0,www.irishtimes.com,Back on the ranch: a dream holiday for horse lovers in the American west,"A dude ranch holiday in Tucson, Arizona, is among exciting offerings for experienced riders and novices alike",https://www.irishtimes.com/resizer/v2/ARBJD3HI6NGCPABBWBE7MFFOIY.JPG?smart=true&auth=fd3f728a54619bff8056d5c948257825f6428a45e63b46835e531f176d2b7016&width=1200&height=630,2024-09-02T04:00:00Z,,"Sipping a margarita as the sun sets over the White Stallion Ranch, I ponder my choices. Do I want to do the Fast Ride to Suicide Ridge, or a Slow Ride with Beer and Cheetos? The margaritas are slippi… [+12177 chars]",,en,'poaching'
https://rlsbb.cc/yellowstone-wardens-s05e08-1080p-web-h264-frequency/,https://rlsbb.cc/yellowstone-wardens-s05e08-1080p-web-h264-frequency/,0,rlsbb.cc,Yellowstone Wardens S05E08 1080p WEB h264-FREQUENCY,"Season 5, Episode 08 – Discover the lives of conservation officers of Montana defending public lands, handling anti-poaching sting operations, and more.Links: HOMEPAGE – TVMZYellowstone.Wardens.S05E08.1080p.WEB.H264-FREQUENCYMKV | AAC | 2.86GBNFO – Subtitles …",,2024-09-02T02:36:39Z,,"Season 5, Episode 08 Discover the lives of conservation officers of Montana defending public lands, handling anti-poaching sting operations, and more.
Links:HOMEPAGE  TVMZ
Yellowstone.Wardens.S05E0… [+459 chars]",,en,'poaching'
https://rlsbb.ru/yellowstone-wardens-s05e08-1080p-web-h264-frequency/,https://rlsbb.ru/yellowstone-wardens-s05e08-1080p-web-h264-frequency/,0,rlsbb.ru,Yellowstone Wardens S05E08 1080p WEB h264-FREQUENCY,"Season 5, Episode 08 – Discover the lives of conservation officers of Montana defending public lands, handling anti-poaching sting operations, and more.Links: HOMEPAGE – TVMZYellowstone.Wardens.S05E08.1080p.WEB.H264-FREQUENCYMKV | AAC | 2.86GBNFO – Subtitles …",,2024-09-02T02:22:40Z,,"Season 5, Episode 08 Discover the lives of conservation officers of Montana defending public lands, handling anti-poaching sting operations, and more.
Links:HOMEPAGE  TVMZ
Yellowstone.Wardens.S05E0… [+341 chars]",,en,'poaching'
https://insidethemagic.net/2024/09/busch-gardens-tampa-bay-second-gorilla-death-ad1/,https://insidethemagic.net/2024/09/busch-gardens-tampa-bay-second-gorilla-death-ad1/,0,insidethemagic.net,Busch Gardens Theme Park Issues Rapid Statement Amid Multiple Tragic Death Reports Within Weeks,"One of Florida’s biggest theme parks, Busch Gardens Tampa Bay is suffering a period of mourning after multiple deaths have struck the animal-filled theme park in just one month. Busch Gardens Tampa Bay, a renowned theme park nestled in Florida, is more than j…",https://insidethemagic.net/wp-content/uploads/2023/08/Untitled-design-55-1.jpg,2024-09-01T23:00:11Z,,"One of Florida’s biggest theme parks, Busch Gardens Tampa Bay is suffering a period of mourning after multiple deaths have struck the animal-filled theme park in just one month.
Credit: Busch Garden… [+6413 chars]",,en,'poaching'
https://www.pbs.org/newshour/show/daughters-directors-on-the-complex-bond-between-men-behind-bars-and-their-daughters,https://www.pbs.org/newshour/show/daughters-directors-on-the-complex-bond-between-men-behind-bars-and-their-daughters,0,www.pbs.org,'Daughters' directors on the complex bond between men behind bars and their daughters,"The relationship between fathers and daughters can play a crucial role in a young girl's life. But what if the fathers are behind bars? A new documentary, ""Daughters,"" follows four girls and their fathers preparing for a daddy-daughter dance in the Washington…",https://d3i6fh83elv35t.cloudfront.net/static/2024/09/frame_7198-1024x576.jpg,2024-09-01T22:58:35Z,,"By Lorna Baldwin
 Lorna Baldwin
Lorna Baldwin is an Emmy and Peabody award winning producer at the PBS NewsHour. In her two decades at the NewsHour, Baldwin has crisscrossed the US reporting on iss… [+384 chars]",,en,'poaching'
https://english.khabarhub.com/2024/01/392898/,https://english.khabarhub.com/2024/01/392898/,0,english.khabarhub.com,Today’s news in a nutshell,"KATHMANDU: Khabarhub brings you a glimpse of major developments of the day in Nepal, including politics, business/economy, sports, entertainment, and more. Nepali Congress endorses Gagan Thapa’s proposal to contest upcoming elections independently The Nepali …",https://english.khabarhub.com/wp-content/uploads/2024/05/Khabar-Hub-_Nepal-Today_1200px-630X-px-Final_2022.03.22-Final-1.jpg,2024-09-01T16:15:19Z,,"KATHMANDU: Khabarhub brings you a glimpse of major developments of the day in Nepal, including politics, business/economy, sports, entertainment, and more.
Nepali Congress endorses Gagan Thapas prop… [+9909 chars]",,en,'poaching'
https://www.indiewire.com/news/general-news/kino-film-collection-tiff-program-streaming-september-1235042441/,https://www.indiewire.com/news/general-news/kino-film-collection-tiff-program-streaming-september-1235042441/,0,www.indiewire.com,Kino Film Collection Streamer Spotlights TIFF with Program of Films That Previously Screened at the Festival,"87 titles, including Christian Petzold's ""Barbara"" and Bi Gan's ""Long Day's Journey Into Night,"" will be featured on the service starting today.",https://www.indiewire.com/wp-content/uploads/2024/08/MCDLODA_EC021.jpg?w=650,2024-09-01T14:00:00Z,,"Can’t make it to Toronto International Film Festival next week? Have no fear, KinoFilm Collection is here to make you feel less left out. Though the streamer won’t be offering the latest selections f… [+5379 chars]",,en,'poaching'
https://english.khabarhub.com/2024/01/392696/,https://english.khabarhub.com/2024/01/392696/,0,english.khabarhub.com,34 rhino poachers arrested by Chitwan National Park,CHITWAN: The Chitwan National Park (CNP) has arrested 34 individuals who had been on the run for their alleged involvement in rhino poaching. This marks the largest arrest of poachers linked to the illegal hunting of one-horned rhinos in a single year. Last y…,https://english.khabarhub.com/wp-content/uploads/2021/05/Jail-_-Arrest-_-Prison.jpg,2024-09-01T10:45:55Z,,"CHITWAN: The Chitwan National Park (CNP) has arrested 34 individuals who had been on the run for their alleged involvement in rhino poaching.
This marks the largest arrest of poachers linked to the … [+971 chars]",,en,'poaching'
https://punchng.com/inside-nigerias-struggle-to-end-animal-cruelty/,https://punchng.com/inside-nigerias-struggle-to-end-animal-cruelty/,0,punchng.com,Inside Nigeria’s struggle to end animal cruelty,"Nigeria, Africa’s most populous country, is home to a vast array of wildlife, ranging from elephants in the savannas to unique bird species in its forests. However, this rich biodiversity is under significant threat due to habitat destruction, poaching, and i…",https://cdn.punchng.com/wp-content/uploads/2024/08/31215600/animal-cruelty.jpg,2024-09-01T00:31:53Z,,"Nigeria, Africas most populous country, is home to a vast array of wildlife, ranging from elephants in the savannas to unique bird species in its forests.
However, this rich biodiversity is under si… [+12523 chars]",,en,'poaching'
https://designyoutrust.com/2024/09/winning-photos-from-the-australian-geographic-nature-photographer-of-the-year-2024/,https://designyoutrust.com/2024/09/winning-photos-from-the-australian-geographic-nature-photographer-of-the-year-2024/,0,designyoutrust.com,Winning Photos From The Australian Geographic Nature Photographer Of The Year 2024,"Overall Winner: Bubble-net by Scott Portelli, New South Wales The Australian Geographic Nature Photographer of the Year 2024 has revealed stunning winning photos that celebrate the beauty and diversity of nature, capturing raw moments, rare wildlife, and the …",https://designyoutrust.com/wp-content/uploads/2024/09/australian-geographic-nature-photographer-of-the-year-2024-11.jpg,2024-09-01T16:15:33Z,,"Overall Winner: Bubble-net by Scott Portelli, New South Wales
The Australian Geographic Nature Photographer of the Year 2024 has revealed stunning winning photos that celebrate the beauty and divers… [+1663 chars]",,en,'threatened species'
https://www.forbes.com/sites/lesliekatz/2024/09/02/beluga-whale-accused-of-spying-for-russia-found-dead/,https://www.forbes.com/sites/lesliekatz/2024/09/02/beluga-whale-accused-of-spying-for-russia-found-dead/,0,www.forbes.com,Beluga Whale Accused Of Spying For Russia Found Dead,"Hvaldimir, a whale suspected of being a Russian spy after being spotted in a harness with the words ""Equipment St. Petersburg,"" is found dead off the coast of Norway.","https://imageio.forbes.com/specials-images/imageserve/66d619e8daca54d7d3513ee9/0x0.jpg?format=jpg&crop=867,487,x160,y326,safe&height=900&width=1600&fit=bounds",2024-09-02T20:26:06Z,,"Hvaldimir the beluga whale appears to be smiling in this photo. The animal was found dead over the ... [+] weekend.
Marine Mind
Hvaldimir, a beluga whale famously suspected of being a Russian spy, … [+3532 chars]",,en,'threatened species'
https://www.abc.net.au/news/2024-09-01/nsw-calls-for-government-to-take-next-step-and-get-rid-of-shark-/104296510,https://www.abc.net.au/news/2024-09-01/nsw-calls-for-government-to-take-next-step-and-get-rid-of-shark-/104296510,0,www.abc.net.au,"Sydney mayor, NSW MP join campaign calling on government to 'find courage' to end shark net program","Controversial nets have gone into 51 beaches from Newcastle to Wollongong, as campaigners say the government needs to catch up with community sentiments and drop the outdated practice.",https://live-production.wcms.abc-cdn.net.au/02488b4265a6abe5a78683eef7d5d5eb?impolicy=wcms_watermark_news&cropH=1330&cropW=2364&xPos=0&yPos=0&width=862&height=485&imformat=generic,2024-09-01T05:59:07Z,,"A Sydney mayor and a state MP have joined anti-shark nets campaigners at Bondi Beach to call on the New South Wales government to ban the practice.
The controversial nets have gone into 51 beaches a… [+4347 chars]",,en,'threatened species'
