index,url,valid,domain,title,description,image,published,archive,content,quote,language,keyword
https://www.bbc.com/news/articles/cwy3yw042nro,https://www.bbc.com/news/articles/cwy3yw042nro,0,www.bbc.com,Possible rare whale sighting being investigated,The Isles of Scilly Wildlife Trust is trying to identify the whale.,https://ichef.bbci.co.uk/news/1024/branded_news/223c/live/90de4b30-ce69-11ef-ac66-d75895875609.jpg,2025-01-09T20:39:12Z,https://web.archive.org/web/20250110045906/https://www.bbc.com/news/articles/cwy3yw042nro,"Wildlife experts believe a rare species of whale has been spotted near Cornwall.
The Isles of Scilly Wildlife Trust said it had received reports of 17 whale sightings in the waters around the island… [+1239 chars]",,en,'rare species'
https://theconversation.com/nature-benefits-when-logged-tropical-forests-are-left-to-recover-heres-how-246718,https://theconversation.com/nature-benefits-when-logged-tropical-forests-are-left-to-recover-heres-how-246718,0,theconversation.com,Nature benefits when logged tropical forests are left to recover – here’s how,"While tropical forests are home to rare species, logged forests still feel and sound like forests, while oil palm plantations are agricultural landscapes.",https://images.theconversation.com/files/640736/original/file-20250106-15-fj8p8o.jpg?ixlib=rb-4.1.0&rect=0%2C357%2C7860%2C3930&q=45&auto=format&w=1356&h=668&fit=crop,2025-01-09T19:00:28Z,https://web.archive.org/web/20250111092834/https://theconversation.com/nature-benefits-when-logged-tropical-forests-are-left-to-recover-heres-how-246718,"A green-crested lizard. Biodiversity remained relatively high even after logging of old-
growth forests, suggesting that there is value in conserving logged forests. Charlie Marsh, CC BY-NC-ND
In pa… [+6255 chars]",,en,'rare species'
https://theconversation.com/tropical-forests-can-be-revived-after-logging-if-theyre-not-turned-into-oil-palm-plantations-246718,https://theconversation.com/tropical-forests-can-be-revived-after-logging-if-theyre-not-turned-into-oil-palm-plantations-246718,0,theconversation.com,Tropical forests can be revived after logging – if they’re not turned into oil palm plantations,"While tropical forests are home to rare species, logged forests still feel and sound like forests, while oil palm plantations are agricultural landscapes.",https://images.theconversation.com/files/640736/original/file-20250106-15-fj8p8o.jpg?ixlib=rb-4.1.0&rect=0%2C357%2C7860%2C3930&q=45&auto=format&w=1356&h=668&fit=crop,2025-01-09T19:00:28Z,https://web.archive.org/web/20250111171636/https://theconversation.com/tropical-forests-can-be-revived-after-logging-if-theyre-not-turned-into-oil-palm-plantations-246718,"A green-crested lizard. Biodiversity remained relatively high even after logging of old-
growth forests, suggesting that there is value in conserving logged forests. Charlie Marsh, CC BY-NC-ND
In pa… [+6255 chars]",,en,'rare species'
https://biztoc.com/x/8df58a75118a7627,https://biztoc.com/x/8df58a75118a7627,0,biztoc.com,Conservation: Britons are keener than ever to bring back lost and rare species,"Britons are keener than ever to bring back lost and rare species
Immigrants that everyone can get behind
The large blue butterfly has a strange life. After munching on wild thyme flowers for a few days, it drops to the ground and persuades a particular specie…",https://biztoc.com/cdn/808/og.png,2025-01-09T14:12:56Z,https://web.archive.org/web/20250110153719/https://biztoc.com/x/8df58a75118a7627,Britons are keener than ever to bring back lost and rare speciesImmigrants that everyone can get behindThe large blue butterfly has a strange life. After munching on wild thyme flowers for a few days… [+146 chars],,en,'rare species'
https://www.holidaypirates.com/destinations/seychelles,https://www.holidaypirates.com/destinations/seychelles,0,www.holidaypirates.com,Holiday in The Seychelles Islands—The land of perpetual summer,"Everyone's heard about the gorgeous white-sand beaches and crystal-clear waters of the Seychelles, but we are here to give you an inside scoop on how to make the most of your holiday there.This guide is packed with useful information on how to get there, whic…",https://image.urlaubspiraten.de/720/image/upload/v1634820143/Impressions%20and%20Other%20Assets/DJI_0941_otoakm.jpg,2025-01-09T05:34:06Z,https://web.archive.org/web/20241003131228/https://www.holidaypirates.com/destinations/seychelles,"The Seychelles archipelago is made up of a total of 115 islands (split between what is known as the Inner and Outer Islands), all located off the east coast of Africa.
Tourism in the Seychelles is a… [+517 chars]",,en,'rare species'
https://www.nationalgeographic.com/travel/article/searching-for-pangolins-south-african-safari-reserve,https://www.nationalgeographic.com/travel/article/searching-for-pangolins-south-african-safari-reserve,0,www.nationalgeographic.com,On the trail of the elusive pangolin at a South African safari reserve,"On a private game reserve in south africa’s KwaZulu-Natal province, an unlikely creature is making a tentative comeback— and visitors are offered a glimpse into the conservation efforts to save it and other native wildlife.<br>",https://i.natgeofe.com/n/b0438951-0bf5-48a5-a9ab-1a3427695d22/southafrica10_16x9.png?w=1200,2025-01-09T00:00:00Z,https://web.archive.org/web/20250109192455/https://www.nationalgeographic.com/travel/article/searching-for-pangolins-south-african-safari-reserve,"This article was produced by National Geographic Traveller (UK).
Consider for one moment the unlikely existence of the pangolin. The worlds only scaly mammal looks like an armadillo but has more in … [+16315 chars]",,en,'rare species'
https://whyevolutionistrue.com/2025/01/08/readers-wildlife-photos-2252/,https://whyevolutionistrue.com/2025/01/08/readers-wildlife-photos-2252/,0,whyevolutionistrue.com,Readers’ wildlife photos,"Ecologist Susan Harrison of UC Davis has return with a fresh batch of photos. Susan’s captions and IDs are indented, and you can enlarge her photos by clicking on them. Miscellaneous birds of late 2024 The only theme of this post is “birds I saw in late 2024 …",https://whyevolutionistrue.com/wp-content/uploads/2025/01/1.-Pelicans-720x480.jpg,2025-01-08T14:15:44Z,https://web.archive.org/web/20250110235311/https://whyevolutionistrue.com/2025/01/08/readers-wildlife-photos-2252/,"Ecologist Susan Harrison of UC Davis has return with a fresh batch of photos. Susan’s captions and IDs are indented, and you can enlarge her photos by clicking on them.
Miscellaneous birds of late 2… [+1899 chars]",,en,'rare species'
https://bikerumor.com/2025-rapha-x-ef-pro-cycling-team-pink-argyle-diamonds-kit/,https://bikerumor.com/2025-rapha-x-ef-pro-cycling-team-pink-argyle-diamonds-kit/,0,bikerumor.com,"Argyle Is Back in New 2025 EF Pro Cycling Pink Team Kit, Teasing Rapha Innovation","New pink argyle & diamonds 2025 EF Education Pro Cycling Rapha kit teases new Pro Team collection innovations, coming soon…
The post Argyle Is Back in New 2025 EF Pro Cycling Pink Team Kit, Teasing Rapha Innovation appeared first on Bikerumor.",https://bikerumor.com/wp-content/uploads/2025/01/2025-Rapha-EF-Pro-Cycling-pink-argyle-Pro-Team-kit_training-jpg.webp,2025-01-08T13:08:44Z,https://web.archive.org/web/20250108130910/https://bikerumor.com/2025-rapha-x-ef-pro-cycling-team-pink-argyle-diamonds-kit/,It’s that time of year when we appreciate pro cycling kit that breaks from the norm to create designs that stand out in the peloton and that fans will actually want to wear. And this latest Rapha kit… [+2866 chars],,en,'rare species'
https://www.kqed.org/news/12020548/remembering-jimmy-carter-and-his-impact-in-california,https://www.kqed.org/news/12020548/remembering-jimmy-carter-and-his-impact-in-california,0,www.kqed.org,Remembering Jimmy Carter And His Impact In California,Former President Carter's legacy still remains top of mind for many Californians.,https://cdn.kqed.org/wp-content/uploads/sites/10/2024/12/carter-russia-getty_custom-ab3c50bbf469aec4125be388bfbb8aabba9c3048-copy-1020x680.jpg,2025-01-07T18:41:47Z,https://web.archive.org/web/20250110175314/https://www.kqed.org/news/12020548/remembering-jimmy-carter-and-his-impact-in-california,"As he unveiled his $322.2 billion spending plan for the 2025–26 budget year, Newsom called on the Legislature to approve modest new investments in economic development and funding potential court bat… [+2261 chars]",,en,'rare species'
https://abcnews.go.com/Politics/biden-establishes-largest-corridor-protected-land-adding-2/story?id=117403648,https://abcnews.go.com/Politics/biden-establishes-largest-corridor-protected-land-adding-2/story?id=117403648,0,abcnews.go.com,Biden establishes largest corridor of protected land by adding 2 new monuments,"The two new monuments -- the Chuckwalla and Sáttítla Highlands -- total nearly 850,000 acres, according to the administration.",https://i.abcnewsfe.com/a/1d36b1ab-bb0f-4d14-afbb-67643d797e16/joe-biden-1-rt-gmh-241229_1735518687464_hpMain_2_16x9.jpg?w=1600,2025-01-07T10:16:20Z,https://web.archive.org/web/20250107111727/https://abcnews.go.com/Politics/biden-establishes-largest-corridor-protected-land-adding-2/story?id=117403648,"President Joe Biden on Tuesday is set to designate two new monuments and, in doing so, establish the largest tract of protected land in the continental United States by expanding a corridor out West,… [+2392 chars]",,en,'rare species'
https://www.huffpost.com/entry/biden-national-monuments-california_n_677c761ae4b0315c0ef34bd9,https://www.huffpost.com/entry/biden-national-monuments-california_n_677c761ae4b0315c0ef34bd9,0,www.huffpost.com,Biden Moves To Seal Environmental Legacy With Major Conservation Announcement,"Biden has protected more federal land and water than any president in history, the White House said.",https://img.huffingtonpost.com/asset/677c764318000026005fad86.jpeg?ops=1200_630,2025-01-07T10:00:14Z,https://web.archive.org/web/20250107101237/https://www.huffpost.com/entry/biden-national-monuments-california_n_677c761ae4b0315c0ef34bd9,"President Joe Biden on Tuesday will travel to California to designate a pair of new national monuments, safeguarding nearly 850,000 acres of ecologically and culturally significant land in the Golden… [+5198 chars]",,en,'rare species'
https://www.npr.org/2025/01/07/nx-s1-5250312/biden-national-monuments-california,https://www.npr.org/2025/01/07/nx-s1-5250312/biden-national-monuments-california,0,www.npr.org,"Biden creates 2 new national monuments, setting a conservation record",The White House says President Biden has now protected a total of 674 million acres of lands and waters — a record for any administration. This includes two new national monuments in California.,https://npr.brightspotcdn.com/dims3/default/strip/false/crop/3000x1688+0+313/resize/1400/quality/100/format/jpeg/?url=http%3A%2F%2Fnpr-brightspot.s3.amazonaws.com%2Fe2%2F2e%2F14492b564506ac0b11b8cd8e1293%2Fgettyimages-80069911.jpg,2025-01-07T10:00:00Z,,"President Biden is creating two new national monuments in California on Tuesday, preserving the lands from development and setting a record for the most land and waters conserved by any president, th… [+986 chars]",,en,'rare species'
https://www.ndtv.com/offbeat/video-of-snow-leopards-frolicking-in-snow-covered-zanskar-valley-delights-internet-7416506,https://www.ndtv.com/offbeat/video-of-snow-leopards-frolicking-in-snow-covered-zanskar-valley-delights-internet-7416506,0,www.ndtv.com,Video Of Snow Leopards Frolicking In Snow-Covered Ladakh Delights Internet,"Rarely spotted and hardly photographed as they are, a recent sighting of two snow leopards in Ladakh has left the internet awestruck.",https://c.ndtvimg.com/2025-01/o8n7tll8_snow-leopards_625x300_07_January_25.jpeg,2025-01-07T02:34:01Z,https://web.archive.org/web/20250108150002/https://www.ndtv.com/offbeat/video-of-snow-leopards-frolicking-in-snow-covered-zanskar-valley-delights-internet-7416506,"Also known as the ""ghost of the mountains"", snow leopards are notoriously elusive and live in the snowy peaks of the Himalayas. Recently, IAS officer Supriya Sahu thrilled wildlife enthusiasts by sha… [+1982 chars]",,en,'rare species'
https://matadornetwork.com/read/samburu-national-reserve-kenya-gallery/,https://matadornetwork.com/read/samburu-national-reserve-kenya-gallery/,0,matadornetwork.com,The Lesser-Known Wildlife Reserve Where In-the-Know Travelers Are Going on Safari,Samburu National Reserve gets fewer visitors than places like the Maasai Mara. But these photos may convince you to add it to your Kenya travel plan.,https://cdn1.matadornetwork.com/blogs/1/2025/01/IMG_4590-1200x900.jpg,2025-01-07T01:54:17Z,https://web.archive.org/web/20250108221648/https://matadornetwork.com/read/samburu-national-reserve-kenya-gallery/,But it’s not just the crowd-free experience that makes Samburu special: it’s a group of animals literally called the “Samburu Special Five.” The five unique species are endemic to the region and are … [+13262 chars],,en,'rare species'
https://www.jpost.com/israel-news/article-836143,https://www.jpost.com/israel-news/article-836143,0,www.jpost.com,KKL-JNF launches planting campaign to save rare butterfly species in Israel,KKL-JNF and volunteers in the Jerusalem Mountains are restoring the habitat of the rare Tomares nesimachus butterfly.,"https://images.jpost.com/image/upload/f_auto,fl_lossy/c_fill,g_faces:center,h_407,w_690/642231",2025-01-05T09:27:41Z,https://web.archive.org/web/20250106013053/https://www.jpost.com/israel-news/article-836143,"KKL-JNF and butterfly enthusiasts are teaming up to restore the habitat of the rare Tomares nesimachus butterfly by reintroducing its host plant, the organization announced on Thursday.
One rare, pr… [+2151 chars]",,en,'rare species'
https://www.pcgamer.com/movies-tv/the-witcher-season-4-netflix/,https://www.pcgamer.com/movies-tv/the-witcher-season-4-netflix/,0,www.pcgamer.com,The Witcher season 4: Everything we know about Hemsworth's debut on The Continent,"Season 4 of The Witcher will pick up with the third Witcher novel, Baptism of Fire.",https://cdn.mos.cms.futurecdn.net/j8AMosYNi759EjQAJnAGeY-1200-80.jpg,2025-01-03T22:14:03Z,https://web.archive.org/web/20250103223950/https://www.pcgamer.com/movies-tv/the-witcher-season-4-netflix/,"The Witcher season 4—not to be confused with the also upcoming The Witcher 4
 game—is likely headed our way this year. Filming on the season has reportedly wrapped, although all we've seen of the ne… [+6389 chars]",,en,'rare species'
https://gizmodo.com/the-quiet-death-of-bidens-climate-corps-and-what-comes-next-2000550875,https://gizmodo.com/the-quiet-death-of-bidens-climate-corps-and-what-comes-next-2000550875,0,gizmodo.com,The Quiet Death of Biden’s Climate Corps—and What Comes Next,Biden's green jobs program was never what it seemed. Now it's shutting down before Trump takes office.,https://gizmodo.com/app/uploads/2025/01/American-Climate-Corps.jpg,2025-01-18T15:00:26Z,http://archive.md/20250119040437/https://gizmodo.com/the-quiet-death-of-bidens-climate-corps-and-what-comes-next-2000550875,Giorgio Zampaglione loved his two-hour commute from the town of Mount Shasta into the surrounding northern California forests last summer. The way the light filtered through the trees on the morning … [+15462 chars],,en,'reforestation'
https://time.com/7207873/sweden-stockholm-wood-city-sustainability/,https://time.com/7207873/sweden-stockholm-wood-city-sustainability/,0,time.com,Sweden is Building the World’s Largest City Made Entirely From Timber,Stockholm Wood City is swapping polluting steel and concrete for a more climate-friendly construction material: timber.,https://api.time.com/wp-content/uploads/2025/01/GettyImages-1602028151.jpg?quality=85&w=1024&h=628&crop=1,2025-01-18T13:00:00Z,http://archive.md/20250119094917/https://time.com/7207873/sweden-stockholm-wood-city-sustainability/,"A yellow crane hovers above a building site in Sickla, a former industrial neighbourhood thats home to one of Stockholms biggest real estate projects. But instead of delivering concrete, its manoeuvr… [+9827 chars]",,en,'reforestation'
https://www.digitaltrends.com/space/astronaut-stunning-earth-photo-looks-like-arteries-in-your-retina/,https://www.digitaltrends.com/space/astronaut-stunning-earth-photo-looks-like-arteries-in-your-retina/,0,www.digitaltrends.com,Astronaut’s stunning Earth photo looks like ‘arteries in your retina’,"NASA astronaut Don Pettit has captured another remarkable shot, this one showing the Betsiboka River estuary in Madagascar.",https://www.digitaltrends.com/wp-content/uploads/2025/01/betsiboka-river.jpeg?resize=1200%2C630&p=1,2025-01-24T05:45:43Z,,"NASA astronaut Don Pettit has captured another remarkable shot, this one showing the Betsiboka River estuary in Madagascar.
“Betsiboka river in Madagascar, remind me of the arteries in your retina,”… [+1966 chars]",,en,'reforestation'
https://www.sciencedaily.com/releases/2025/01/250113134001.htm,https://www.sciencedaily.com/releases/2025/01/250113134001.htm,0,www.sciencedaily.com,Ash tree variability may offer restoration path post-beetle decimation,"The invasive emerald ash borer, according to the U.S. Department of Agriculture, was first found in the United States in southeast Michigan in 2002. In the decades since, the wood-boring beetle has spread east and west across the U.S. and Canada, killing tens…",https://www.sciencedaily.com/images/scidaily-icon.png,2025-01-13T18:40:01Z,,"The invasive emerald ash borer, according to the U.S. Department of Agriculture, was first found in the United States in southeast Michigan in 2002. In the decades since, the wood-boring beetle has s… [+4435 chars]",,en,'reforestation'
https://www.forbes.com/councils/forbestechcouncil/2025/01/22/what-companies-should-know-about-carbon-removal-technology/,https://www.forbes.com/councils/forbestechcouncil/2025/01/22/what-companies-should-know-about-carbon-removal-technology/,0,www.forbes.com,What Companies Should Know About Carbon Removal Technology,Companies creating their sustainability plans should have a strong understanding of carbon removal technologies.,https://imageio.forbes.com/specials-images/imageserve/678fd78cc3307f666498d9ae/0x0.jpg?format=jpg&height=900&width=1600&fit=bounds,2025-01-22T11:45:00Z,,"Swish Goswami, building the next big sci-fi franchise at Parallel Studios.
getty
Companies in the technology industry are looking at reducing their overall carbon dioxide (CO2) emissions. To do so,… [+5564 chars]",,en,'reforestation'
https://www.forbes.com/sites/lanceeliot/2025/01/20/this-generative-ai-prompting-technique-uses-multiple-expert-personas-to-derive-first-class-answers/,https://www.forbes.com/sites/lanceeliot/2025/01/20/this-generative-ai-prompting-technique-uses-multiple-expert-personas-to-derive-first-class-answers/,0,www.forbes.com,This Generative AI Prompting Technique Uses Multiple Expert Personas To Derive First-Class Answers,"A vital prompt engineering technique consists of invoking multiple expert personas. It is an advanced method, yet simple to enact. Here's the insider scoop.","https://imageio.forbes.com/specials-images/imageserve/678ec9f2ea10ea98ae24b70a/0x0.jpg?format=jpg&crop=2143,1605,x568,y0,safe&height=900&width=1600&fit=bounds",2025-01-20T22:19:29Z,http://archive.md/20250121094139/https://www.forbes.com/sites/lanceeliot/2025/01/20/this-generative-ai-prompting-technique-uses-multiple-expert-personas-to-derive-first-class-answers/,"Using multiple expert personas in generative AI is relatively easy to do and has sizable payoffs.
getty
In todays column, I showcase a valuable prompting technique that uses multiple expert persona… [+20218 chars]",,en,'reforestation'
https://www.project-syndicate.org/commentary/cop30-belem-brazil-must-be-climate-turning-point-by-ana-toni-2025-01,https://www.project-syndicate.org/commentary/cop30-belem-brazil-must-be-climate-turning-point-by-ana-toni-2025-01,0,www.project-syndicate.org,How to Make COP30 a Climate Turning Point,"As host of COP30, Brazil is committed to lead by example through decisive action at home and abroad. But to ensure a successful summit, every country must come to Belém committed to developing and implementing ambitious national goals, and to creating interna…",https://webapi.project-syndicate.org/library/7c71370523c4223c03837d7a7f27e0f4.2-1-super.1.jpg,2025-01-24T16:20:50Z,http://archive.md/20250127114144/https://www.project-syndicate.org/commentary/cop30-belem-brazil-must-be-climate-turning-point-by-ana-toni-2025-01,"As host of COP30, Brazil is committed to lead by example through decisive action at home and abroad. But to ensure a successful summit, every country must come to Belém committed to developing and im… [+7666 chars]",,en,'reforestation'
http://skift.com/2025/01/15/hotel-greenhouse-gas-emissions-reducion-plan-and-actions/,http://skift.com/2025/01/15/hotel-greenhouse-gas-emissions-reducion-plan-and-actions/,0,skift.com,Emissions from Hotels: The Gap Between Plans and Actions,"Hotels have big plans to lower the amount of greenhouse gas emissions they generate. However, this report could show a gap between those plans and actual progress, especially when it comes to energy usage. -Darin Graham",https://skift.com/wp-content/uploads/2025/01/AdobeStock_104135791.jpg,2025-01-15T17:55:22Z,http://archive.md/20250118213741/https://skift.com/2025/01/15/hotel-greenhouse-gas-emissions-reducion-plan-and-actions/,"Over 90% of 20,000 hotels surveyed worldwide have a plan to cut greenhouse gas emissions, according to a joint report from the World Travel and Tourism Council and Greenview, published on Tuesday.
H… [+3172 chars]",,en,'reforestation'
https://cleantechnica.com/2025/01/10/ancient-pongamia-tree-breathes-new-life-into-sustainable-aviation-fuel/,https://cleantechnica.com/2025/01/10/ancient-pongamia-tree-breathes-new-life-into-sustainable-aviation-fuel/,0,cleantechnica.com,Ancient Pongamia Tree Breathes New Life Into Sustainable Aviation Fuel,"The hardy bean-producing pongamia tree is carving out a niche in the sustainable aviation fuel industry, with the potential for producing human food, and animal feed as well.
The post Ancient Pongamia Tree Breathes New Life Into Sustainable Aviation Fuel appe…",https://cleantechnica.com/wp-content/uploads/2025/01/SAF-pongamia-terviva-idemitsu.png,2025-01-10T19:29:40Z,,"Sign up for daily news updates from CleanTechnica on email. Or follow us on Google News!
Biofuel stakeholders are angling for a piece of the sustainable aviation fuel market, and the pongamia tree m… [+7677 chars]",,en,'reforestation'
https://gardenrant.com/2025/01/what-the-hell-is-horticulture-and-why-does-it-matter.html,https://gardenrant.com/2025/01/what-the-hell-is-horticulture-and-why-does-it-matter.html,0,gardenrant.com,What the Hell is Horticulture and Why Does it Matter?,"I am a horticulturist who works at a zoo. And this is often terribly humbling. Although the zoo where I work is also a botanical garden, and a damned good one (great plant collection, a beautiful tree canopy, colorful gardens, research, community work, conser…",https://gardenrant.com/wp-content/uploads/2025/01/Arbnet-Trees-3-scaled.jpg,2025-01-16T17:45:53Z,,"I am a horticulturist who works at a zoo. And this is often terribly humbling. Although the zoo where I work is also a botanical garden, and a damned good one (great plant collection, a beautiful tre… [+7990 chars]",,en,'reforestation'
https://www.spacedaily.com/reports/Researchers_create_AI_tool_for_realistic_satellite_images_of_climate_impacts_999.html,https://www.spacedaily.com/reports/Researchers_create_AI_tool_for_realistic_satellite_images_of_climate_impacts_999.html,0,www.spacedaily.com,Researchers create AI tool for realistic satellite images of climate impacts,"Madrid, Spain (SPX) Jan 22, 2025


Researchers from the University of Granada (UGR) have unveiled a major advancement in using artificial intelligence to generate realistic satellite images depicting the impacts of climate change. This innovation holds promis…",https://www.spxdaily.com/images-hg/esa-truths-climate-satellite-marker-hg.jpg,2025-01-23T10:11:43Z,,"Researchers create AI tool for realistic satellite images of climate impactsby Hugo RitmicoMadrid, Spain (SPX) Jan 22, 2025
Researchers from the University of Granada (UGR) have unveiled a major adv… [+2791 chars]",,en,'reforestation'
https://journals.plos.org/plosone/article?id=10.1371/journal.pone.0316661,https://journals.plos.org/plosone/article?id=10.1371/journal.pone.0316661,0,journals.plos.org,De novo transcriptome assembly and discovery of drought-responsive genes in white spruce (Picea glauca),"Forests face an escalating threat from the increasing frequency of extreme drought events driven by climate change. To address this challenge, it is crucial to understand how widely distributed species of economic or ecological importance may respond to droug…",https://journals.plos.org/plosone/article/figure/image?id=10.1371/journal.pone.0316661.g006&size=inline,2025-01-03T14:00:00Z,,"Citation: Ribeyre Z, Depardieu C, Prunier J, Pelletier G, Parent GJ, Mackay J, et al. (2025) De novo transcriptome assembly and discovery of drought-responsive genes in white spruce (Picea glauca). P… [+58038 chars]",,en,'reforestation'
