index,url,valid,domain,title,description,image,published,archive,content,quote,language,keyword
https://theecologist.org/2025/jun/02/unlevelling-land,https://theecologist.org/2025/jun/02/unlevelling-land,0,theecologist.org,Unlevelling the land,"The ten largest transnational landowners in the world control an area larger than Japan, according to a new report.",https://theecologist.org/sites/default/files/styles/facebook/public/2025-05/industrial_farming_vs_forest_cerradoretoc0190.jpg?h=e5565190&itok=-ZO5_UdA,2025-06-02T06:00:00Z,,"Others in this elite group include financial investors like Blue Carbon from the UAE, Australia-based Macquarie and Canadas Manulife, agribusiness giants Olam and Wilmar from Singapore, Chilean timbe… [+5919 chars]",,en,'deforestation'
https://www.bangkokpost.com/thailand/special-reports/3039852/stemming-the-floodwaters,https://www.bangkokpost.com/thailand/special-reports/3039852/stemming-the-floodwaters,0,www.bangkokpost.com,Stemming the floodwaters,"Last year, floods in Mae Sai district of Chiang Rai province caused economic losses in the millions.",https://static.bangkokpost.com/media/content/20250602/c1_3039852_250602054311_700.jpg,2025-06-01T22:39:00Z,https://web.archive.org/web/20250602024041/https://www.bangkokpost.com/thailand/special-reports/3039852/stemming-the-floodwaters,"Last year, floods in Mae Sai district of Chiang Rai province caused economic losses in the millions.
Experts believe this could be the beginning of an annual pattern of damage caused by severe natur… [+4674 chars]",,en,'deforestation'
https://economictimes.indiatimes.com/news/economy/foreign-trade/india-eu-can-wrap-up-fta-talks-before-year-end-piyush-goyal/articleshow/121555492.cms,https://economictimes.indiatimes.com/news/economy/foreign-trade/india-eu-can-wrap-up-fta-talks-before-year-end-piyush-goyal/articleshow/121555492.cms,0,economictimes.indiatimes.com,"India, EU can wrap up FTA talks before year-end: Piyush Goyal","Commerce Minister Piyush Goyal expressed optimism that India and the EU could finalize a comprehensive free trade agreement by year's end, citing significant progress and complementary economies. While sensitive issues remain, both sides are committed to reso…","https://img.etimg.com/thumb/msid-121555500,width-1200,height-630,imgsize-231092,overlay-economictimes/articleshow.jpg",2025-06-01T19:02:27Z,https://web.archive.org/web/20250601192420/https://economictimes.indiatimes.com/news/economy/foreign-trade/india-eu-can-wrap-up-fta-talks-before-year-end-piyush-goyal/articleshow/121555492.cms,"Paris: India and the European Union can conclude talks for a comprehensive free trade agreement (FTA) before the end of this year, commerce and industry minister Piyush Goyal said Sunday.However, he … [+1899 chars]",,en,'deforestation'
https://www.wnd.com/2025/06/the-iranian-people-want-regime-change-now/,https://www.wnd.com/2025/06/the-iranian-people-want-regime-change-now/,0,www.wnd.com,The Iranian people want regime change NOW!,"Labor unrest, civil disobedience, protest all laying foundation for 'revolution'",https://www.wnd.com/wp-content/uploads/2023/10/Iran-flag-Unsplash-2.jpg,2025-06-01T18:33:27Z,https://web.archive.org/web/20250601185549/https://www.wnd.com/2025/06/the-iranian-people-want-regime-change-now/,"In the past week alone, Iran has witnessed an extraordinary wave of labor unrest and civil disobedience. Truck drivers in over 100 cities have launched coordinated strikes. Bakeries and shoe stores h… [+5750 chars]",,en,'deforestation'
https://clarkesworldmagazine.com/marcus_06_25/,https://clarkesworldmagazine.com/marcus_06_25/,0,clarkesworldmagazine.com,Faces of the Antipode by Matthew Marcus,"1. Quezel There are memories in the world that linger beyond the lives of the bodies that birthed them. They scale cathedrals as lichen, dance and wrench in the shadows […]",https://clarkesworldmagazine.com/covers/cw_225_800.jpg?3,2025-06-01T17:06:14Z,https://web.archive.org/web/20250601171701/https://clarkesworldmagazine.com/marcus_06_25,"1. Quezel
There are memories in the world that linger beyond the lives of the bodies that birthed them. They scale cathedrals as lichen, dance and wrench in the shadows of alleys and mountains, and … [+51510 chars]",,en,'deforestation'
https://theconversation.com/kids-care-deeply-about-our-planet-so-adults-need-to-start-listening-257304,https://theconversation.com/kids-care-deeply-about-our-planet-so-adults-need-to-start-listening-257304,0,theconversation.com,"Kids care deeply about our planet, so adults need to start listening","A recent survey finds that many kids understand that individual action alone is not enough, and most recognize that systemic accountability is necessary to tackle the climate crisis.",https://images.theconversation.com/files/671007/original/file-20250529-62-f8h5qt.jpg?ixlib=rb-4.1.0&rect=0%2C713%2C6420%2C3210&q=45&auto=format&w=1356&h=668&fit=crop,2025-06-01T12:18:53Z,http://archive.md/20250602061707/https://theconversation.com/kids-care-deeply-about-our-planet-so-adults-need-to-start-listening-257304,"“I wish adults knew that I really care about the environment and want to help, but I sometimes feel like my ideas don’t matter because I’m just a kid.” 



This is what a nine-year-old respondent to… [+6994 chars]",,en,'deforestation'
https://www.aljazeera.com/news/2025/6/1/nigeria-flash-floods-which-is-most-affected-area-what-caused-the-deluge,https://www.aljazeera.com/news/2025/6/1/nigeria-flash-floods-which-is-most-affected-area-what-caused-the-deluge,0,www.aljazeera.com,"Nigeria flash floods: Which is most affected area, what caused the deluge?",At least 150 people killed and many more missing after torrential rains cause flooding in Mokwa city in Niger State.,https://www.aljazeera.com/wp-content/uploads/2025/06/AP25150778188586-1748760717.jpg?resize=1920%2C1440,2025-06-01T11:44:02Z,https://web.archive.org/web/20250601121019/http://www.aljazeera.com/news/2025/6/1/nigeria-flash-floods-which-is-most-affected-area-what-caused-the-deluge,"Flash floods triggered by heavy rains have devastated a central Nigerian state, killing at least 150 people and displacing thousands since Thursday, and rescue workers say the toll could rise.
Searc… [+6233 chars]",,en,'deforestation'
https://www.forbes.com/councils/forbesbusinesscouncil/2025/06/02/whats-the-right-net-zero-strategy-for-your-business-why-one-size-fits-all-doesnt-work/,https://www.forbes.com/councils/forbesbusinesscouncil/2025/06/02/whats-the-right-net-zero-strategy-for-your-business-why-one-size-fits-all-doesnt-work/,0,www.forbes.com,What’s The Right Net-Zero Strategy For Your Business? Why One-Size-Fits-All Doesn’t Work,"Nature-based solutions offer co-benefits like biodiversity and water protection, while tech-based removals offer scalability over time.",https://imageio.forbes.com/specials-images/imageserve/683a3a18d1c59fa06bb5c9e9/0x0.jpg?format=jpg&height=900&width=1600&fit=bounds,2025-06-02T14:30:00Z,https://web.archive.org/web/20250603062941/https://www.forbes.com/councils/forbesbusinesscouncil/2025/06/02/whats-the-right-net-zero-strategy-for-your-business-why-one-size-fits-all-doesnt-work/,"Romain Pison, CEO of NoviCarbon - an entrepreneur and decarbonization expert known for his work in ESG and green infrastructure.
getty
As global climate targets become more urgent, businesses are u… [+5441 chars]",,en,'reforestation'
https://www.livescience.com/planet-earth/its-like-trying-to-grow-a-tree-in-an-oven-gold-mining-is-sucking-the-amazon-rainforest-dry,https://www.livescience.com/planet-earth/its-like-trying-to-grow-a-tree-in-an-oven-gold-mining-is-sucking-the-amazon-rainforest-dry,0,www.livescience.com,'It's like trying to grow a tree in an oven': Gold mining is sucking the Amazon rainforest dry,Gold mining in the Amazon removes so much water from the ground that it's too hot and dry for seedlings to survive.,https://cdn.mos.cms.futurecdn.net/N2wcr7fgubvtWd2R3UyCdZ.jpg,2025-06-02T16:46:28Z,https://web.archive.org/web/20250602172534/https://www.livescience.com/planet-earth/its-like-trying-to-grow-a-tree-in-an-oven-gold-mining-is-sucking-the-amazon-rainforest-dry,"Gold mining is literally sucking the Amazon rainforest dry, creating an environment where trees cannot grow, according to a new study.
Researchers found that suction mining not only degrades the soi… [+4695 chars]",,en,'reforestation'
https://fox40.com/news/local-news/lake-tahoe/lake-tahoe-invasive-golden-mussels-intercepted-boat-threat-water-lake/,https://fox40.com/news/local-news/lake-tahoe/lake-tahoe-invasive-golden-mussels-intercepted-boat-threat-water-lake/,0,fox40.com,Lake Tahoe inspectors find golden mussels in a boat in Alpine Meadows,"Lake Tahoe watercraft inspectors discovered golden mussels on a boat on Friday, the first interception of the invasive species since the first acknowledgment...",https://media.zenfs.com/en/ktxl_articles_604/bc85e8a567e523dd5d6da432e7b8fb03,2025-06-01T02:56:55Z,https://web.archive.org/web/20250601025807/http://fox40.com/news/local-news/lake-tahoe/lake-tahoe-invasive-golden-mussels-intercepted-boat-threat-water-lake/,(FOX40.COM) Lake Tahoe watercraft inspectors identified highly invasive golden mussels on a boat on Friday at the Alpine Meadows inspection station. Video above: Officials have no idea how Golden Mus… [+3276 chars],,en,'invasive species'
https://www.yahoo.com/news/authorities-disturbing-discovery-searching-mans-113052963.html,https://www.yahoo.com/news/authorities-disturbing-discovery-searching-mans-113052963.html,0,www.yahoo.com,Authorities make disturbing discovery after searching man's vehicle at US-Mexico border: 'We are committed to holding accountable ...',"Authorities have arrested the man, who now faces “charges of importation contrary to law.""",https://s.yimg.com/ny/api/res/1.2/w3ljLURTFhf9c06U_wmFBQ--/YXBwaWQ9aGlnaGxhbmRlcjt3PTEyMDA7aD03Mzg-/https://media.zenfs.com/en/the_cool_down_737/88a9428e6b269f2466bfd547f0e336e9,2025-06-01T11:30:52Z,https://web.archive.org/web/20250601193654/https://www.yahoo.com/news/authorities-disturbing-discovery-searching-mans-113052963.html,"In San Diego, authorities arrested a man for smuggling protected birds from Mexico into the U.S., according to a report by Patch. Twelve orange-fronted parakeets were concealed among his belongings, … [+2018 chars]",,en,'invasive species'
https://phys.org/news/2025-06-decades-chance-discovery-leadbeater-possum.html,https://phys.org/news/2025-06-decades-chance-discovery-leadbeater-possum.html,0,phys.org,Decades of searching and a chance discovery: Why finding Leadbeater's possum in NSW is such big news,"Until now, Victorians believed their state was the sole home for Leadbeater's possum, their critically endangered state faunal emblem. This tiny marsupial is clinging to life in a few pockets of mountain ash and snow gum habitat in the Central Highlands of Vi…",https://scx2.b-cdn.net/gfx/news/2025/decades-of-searching-a-2.jpg,2025-06-02T18:20:01Z,https://web.archive.org/web/20250602183208/https://phys.org/news/2025-06-decades-chance-discovery-leadbeater-possum.html,"Until now, Victorians believed their state was the sole home for Leadbeater's possum, their critically endangered state faunal emblem. This tiny marsupial is clinging to life in a few pockets of moun… [+7026 chars]",,en,'invasive species'
http://grist.org/politics/as-trump-comes-after-research-forest-service-scientists-keep-working/,http://grist.org/politics/as-trump-comes-after-research-forest-service-scientists-keep-working/,0,grist.org,"As Trump comes after research, Forest Service scientists keep working",Scientists describe how they’re preparing for the upcoming field season despite the challenges.,https://grist.org/wp-content/uploads/2025/05/USFSMontana.jpg?quality=75&strip=all,2025-06-01T13:00:00Z,https://web.archive.org/web/20250601132022/https://grist.org/politics/as-trump-comes-after-research-forest-service-scientists-keep-working/,"This story was originally published by High Country News and is reproduced here as part of the Climate Desk collaboration.
The research and development team at the U.S. Forest Service employs about … [+6935 chars]",,en,'invasive species'
https://www.geeksaresexy.net/2025/06/02/rise-of-the-zombie-bugs-takes-readers-on-a-jaw-dropping-tour-of-the-parasite-world/,https://www.geeksaresexy.net/2025/06/02/rise-of-the-zombie-bugs-takes-readers-on-a-jaw-dropping-tour-of-the-parasite-world/,0,www.geeksaresexy.net,Rise of the Zombie Bugs takes readers on a jaw-dropping tour of the parasite world,"A “zombie” snail infected with a flatworm. JoostP/Shutterstock Alex Dittrich, Nottingham Trent University Rise of the Zombie Bugs, by Mindy Weisberger, is a non-fiction book that borrows from popular culture to make one of the most complex and grisly interact…",https://images.theconversation.com/files/670872/original/file-20250528-56-6c0sk0.jpg?ixlib=rb-4.1.0&rect=0%2C262%2C5015%2C2820&q=45&auto=format&w=754&fit=clip,2025-06-02T14:01:35Z,,"A zombie snail infected with a flatworm. JoostP/Shutterstock
Alex Dittrich, Nottingham Trent University
Rise of the Zombie Bugs, by Mindy Weisberger, is a non-fiction book that borrows from popular… [+4597 chars]",,en,'invasive species'
https://www.livescience.com/animals/snakes/florida-bobcat-bites-the-head-off-of-13-foot-burmese-python-in-the-everglades,https://www.livescience.com/animals/snakes/florida-bobcat-bites-the-head-off-of-13-foot-burmese-python-in-the-everglades,0,www.livescience.com,Florida bobcat bites the head off of 13-foot Burmese python in the Everglades,Wildlife experts believe that predators native to the Everglades are beginning to fight back against the invasive species of snake.,https://cdn.mos.cms.futurecdn.net/Xbf3z8AZhaQDFme2bXvgh4.jpg,2025-06-02T12:42:28Z,https://web.archive.org/web/20250602131057/https://www.livescience.com/animals/snakes/florida-bobcat-bites-the-head-off-of-13-foot-burmese-python-in-the-everglades,"A Florida bobcat has managed to take down a Burmese python in what wildlife biologists are calling a win for native Everglades predators.
Scientists are still investigating how and when local predat… [+3875 chars]",,en,'invasive species'
https://theconversation.com/the-top-ends-tropical-savannas-are-a-natural-wonder-but-weak-environment-laws-mean-their-future-is-uncertain-241893,https://theconversation.com/the-top-ends-tropical-savannas-are-a-natural-wonder-but-weak-environment-laws-mean-their-future-is-uncertain-241893,0,theconversation.com,The Top End’s tropical savannas are a natural wonder – but weak environment laws mean their future is uncertain,A new report reveals the perilous state of nature in the Top End of the Northern Territory. Here’s how to arrest the decline of threatened species and habitat.,https://images.theconversation.com/files/672437/original/file-20250605-56-di7yn6.jpeg?ixlib=rb-4.1.0&rect=0%2C541%2C3241%2C1620&q=45&auto=format&w=1356&h=668&fit=crop,2025-06-05T05:34:46Z,https://web.archive.org/web/20250605055503/https://theconversation.com/the-top-ends-tropical-savannas-are-a-natural-wonder-but-weak-environment-laws-mean-their-future-is-uncertain-241893,"François Brassard
The Top End of Australia’s Northern Territory contains an extensive, awe-inspiring expanse of tropical savanna landscapes. It includes well-known and much-loved regions such as Dar… [+5563 chars]",,en,'invasive species'
https://www.today.com/news/puerto-rican-coqui-frogs-are-loud-islanders-want-keep-way-rcna211076,https://www.today.com/news/puerto-rican-coqui-frogs-are-loud-islanders-want-keep-way-rcna211076,0,www.today.com,Puerto Rican Coquí Frogs Are Loud. Islanders Want to Keep It That Way.,"For many Puerto Ricans, the nightly chirping of “coh-KEE” — the sound of a tiny frog known as the coquí — is like a national lullaby.","https://media-cldnry.s-nbcnews.com/image/upload/t_social_share_1200x630_center,f_auto,q_auto:best/rockcms/2025-06/250604-coqui-frog-vl-1049a-75a511.jpg",2025-06-05T00:43:20Z,,"For many Puerto Ricans, the nightly chirping of coh-KEE the sound of a tiny frog known as the coquí is like a national lullaby.
But for one purported tourist, the noise felt more like a nightmare, a… [+3166 chars]",,en,'invasive species'
https://www.nbcnews.com/news/latino/puerto-rican-coqui-frogs-online-effort-protection-tourism-rcna210662,https://www.nbcnews.com/news/latino/puerto-rican-coqui-frogs-online-effort-protection-tourism-rcna210662,0,www.nbcnews.com,Puerto Rican coquí frogs are loud. Islanders want to keep it that way.,"For many Puerto Ricans, the nightly chirping of “coh-KEE” — the sound of a tiny frog known as the coquí — is like a national lullaby.","https://media-cldnry.s-nbcnews.com/image/upload/t_nbcnews-fp-1200-630,f_auto,q_auto:best/rockcms/2025-06/250604-coqui-frog-vl-1049a-75a511.jpg",2025-06-04T21:28:31Z,https://web.archive.org/web/20250604213918/https://www.nbcnews.com/news/latino/puerto-rican-coqui-frogs-online-effort-protection-tourism-rcna210662,"For many Puerto Ricans, the nightly chirping of coh-KEE the sound of a tiny frog known as the coquí is like a national lullaby. 
But for one purported tourist, the noise felt more like a nightmare, … [+3171 chars]",,en,'invasive species'
https://www.bostonherald.com/2025/06/04/puerto-rican-crested-toad-bad-bunny-brookfield-zoo/,https://www.bostonherald.com/2025/06/04/puerto-rican-crested-toad-bad-bunny-brookfield-zoo/,0,www.bostonherald.com,Puerto Rican rapper Bad Bunny champions endangered toad,The amphibian stars in videos for Bad Bunny's recent album.,https://www.bostonherald.com/wp-content/uploads/2025/06/CTC-L-Puerto-Rican-toads05.jpg?w=1024&h=768,2025-06-04T17:48:07Z,,"A chatty animated amphibian starring in videos for Bad Bunnys recent album 
has launched the Puerto Rican crested toad  an endangered species native to the island  into newfound fame, following year… [+6535 chars]",,en,'invasive species'
https://www.thelocal.de/20250604/how-to-manage-seasonal-allergies-in-germany,https://www.thelocal.de/20250604/how-to-manage-seasonal-allergies-in-germany,0,www.thelocal.de,How to manage seasonal allergies in Germany,"Allergy season runs from March to September in Germany, and can be particularly hard on newcomers to the country. Here's a look at why allergies seem to be getting worse, and at what you can do to deal with them.",https://assets.thelocal.com/cdn-cgi/rs:fit:1200/quality:75/plain/https://apiwp.thelocal.com/wp-content/uploads/2025/06/watermarks-logo-87784673.jpg@webp,2025-06-04T15:36:59Z,http://archive.md/20250605063039/https://www.thelocal.de/20250604/how-to-manage-seasonal-allergies-in-germany,"Allergy season runs from March to September in Germany, and can be particularly hard on newcomers to the country. Here's a look at why allergies seem to be getting worse, and at what you can do to de… [+4729 chars]",,en,'invasive species'
https://blog.education.nationalgeographic.org/2025/06/04/8-national-geographic-classroom-resources-all-about-the-ocean/,https://blog.education.nationalgeographic.org/2025/06/04/8-national-geographic-classroom-resources-all-about-the-ocean/,0,blog.education.nationalgeographic.org,8 National Geographic Classroom Resources All About the Ocean,"Photograph by Gabriel Scarlett The ocean covers 70 percent of the Earth’s surface, and, yet, with its vastness, we are still learning about all the wonders of the undersea world. How deep is the ocean? What causes tides in the ocean? Have we explored the whol…",https://i0.wp.com/blog.education.nationalgeographic.org/wp-content/uploads/2025/06/cr-Gabriel-Scarlett-NationalGeographic_2751171_3D.jpg?fit=1200%2C600&ssl=1,2025-06-04T14:30:35Z,,"Photograph by Gabriel Scarlett
The ocean covers 70 percent of the Earths surface, and, yet, with its vastness, we are still learning about all the wonders of the undersea world. How deep is the ocea… [+4230 chars]",,en,'invasive species'
https://www.activistpost.com/crypto-fascism-inc/,https://www.activistpost.com/crypto-fascism-inc/,0,www.activistpost.com,"Crypto-Fascism, Inc.","Imiss the old-school neo-Nazis. You know, the skinheads with the swastika tattoos and the big Nazi flags on the walls of their living rooms. The Aryan Brotherhood-type neo-Nazis. You don’t get neo-Nazis like that anymore. These days, it’s all about the crypto…",https://www.activistpost.com/wp-content/uploads/2025/06/cj-crypto-fascism-banner.jpg,2025-06-04T09:57:00Z,,"Imiss the old-school neo-Nazis. You know, the skinheads with the swastika tattoos and the big Nazi flags on the walls of their living rooms. The Aryan Brotherhood-type neo-Nazis.
You dont get neo-Na… [+7971 chars]",,en,'invasive species'
https://www.wired.com/video/watch/tech-support-entomologist-answers-insect-questions/,https://www.wired.com/video/watch/tech-support-entomologist-answers-insect-questions/,0,www.wired.com,Tech Support - Entomologist Answers Insect Questions,Entomologist Dr. Jessica Ware joins WIRED to answer the internet's burning questions about the world of insects. Are cockroaches so resilient that they'd survive a nuclear war? Why do praying mantis behead their partners after mating? Why do crickets chirp? A…,"https://dwgyu36up6iuz.cloudfront.net/heru80fdn/image/upload/c_fill,d_placeholder_wired.png,fl_progressive,g_face,h_1080,q_80,w_1920/v1748956488/wired_tech-support-entomologist-answers-insect-questions.jpg",2025-06-03T16:00:00Z,https://web.archive.org/web/20250603165618/https://www.wired.com/video/watch/tech-support-entomologist-answers-insect-questions,"On my arm right now is a cave roach.
Now on my hair.
One second.
I'm entomologist Jessica Ware
from the American Museum of Natural History.
Let's answer your questions from the internet.
This i… [+37537 chars]",,en,'invasive species'
https://wattsupwiththat.com/2025/06/02/augusta-chronicles-climate-myth-invasive-species-in-georgia-not-driven-by-warming/,https://wattsupwiththat.com/2025/06/02/augusta-chronicles-climate-myth-invasive-species-in-georgia-not-driven-by-warming/,0,wattsupwiththat.com,Augusta Chronicle’s Climate Myth: Invasive Species in Georgia Not Driven by Warming,"So, since neither temperature, precipitation, drought, nor hurricane trends have changed much in Georgia, contrary to the Augusta Chronicle’s slant a “changing climate” can’t be behind any perceived or observed increase in the spread of invasive species. To t…",https://i0.wp.com/wattsupwiththat.com/wp-content/uploads/2025/06/charlesrotter_atlanta_skyline_36c1dc03-35kmidjourney53a3.webp?fit=1024%2C512&ssl=1,2025-06-02T21:00:00Z,https://web.archive.org/web/20250603021459/https://wattsupwiththat.com/2025/06/02/augusta-chronicles-climate-myth-invasive-species-in-georgia-not-driven-by-warming/,"From ClimateREALISM
By H. Sterling Burnett
The August Chronicle published an article claiming climate change was causing the spread of invasive plant species. This is false. Data from Georgia does … [+5635 chars]",,en,'invasive species'
https://phys.org/news/2025-06-imported-ladybird-beetles-grenada-ice.html,https://phys.org/news/2025-06-imported-ladybird-beetles-grenada-ice.html,0,phys.org,Imported ladybird beetles save Grenada's ice cream fruit,"When Laurel Williams thinks of soursop, she thinks of ice cream. Not just any ice cream, but the one made from the soursop she grows on her farm in Grenada, a small island nation in the Caribbean Sea.",https://scx2.b-cdn.net/gfx/news/2025/imported-ladybird-beet.jpg,2025-06-02T20:00:01Z,https://web.archive.org/web/20250602201502/https://phys.org/news/2025-06-imported-ladybird-beetles-grenada-ice.html,"When Laurel Williams thinks of soursop, she thinks of ice cream. Not just any ice cream, but the one made from the soursop she grows on her farm in Grenada, a small island nation in the Caribbean Sea… [+12176 chars]",,en,'invasive species'
https://www.yahoo.com/news/state-officials-unveil-secret-weapon-111525727.html,https://www.yahoo.com/news/state-officials-unveil-secret-weapon-111525727.html,0,www.yahoo.com,State officials unveil secret weapon to take down dangerous invasive species: 'They picked the right breed for the job',It’s too easy for the naked human eye to miss the pest.,https://s.yimg.com/ny/api/res/1.2/d1t.hTJExiyxLZ8shqvmPQ--/YXBwaWQ9aGlnaGxhbmRlcjt3PTEyMDA7aD04MDE-/https://media.zenfs.com/en/the_cool_down_737/f991912b935bc1bcb0dbed2f841c1ef5,2025-06-02T11:15:25Z,https://web.archive.org/web/20250603033442/https://www.yahoo.com/news/state-officials-unveil-secret-weapon-111525727.html,"Officials in British Columbia, Canada, campaigning against a destructive invasive species have unveiled their secret weapon: a very good boy.
Zebra mussels are native to Russia and Ukraine but have … [+2070 chars]",,en,'invasive species'
https://wattsupwiththat.com/2025/06/02/weekly-climate-and-energy-news-roundup-644/,https://wattsupwiththat.com/2025/06/02/weekly-climate-and-energy-news-roundup-644/,0,wattsupwiththat.com,Weekly Climate and Energy News Roundup #644,"Quote of the Week: “The important thing is not to stop questioning. Curiosity has its own reason for existing. One cannot help but be in awe when one contemplates the mysteries of eternity, of life, of the marvelous structure of reality. It is enough if one t…",https://i0.wp.com/wattsupwiththat.com/wp-content/uploads/2025/06/charlesrotter_Mt_Denali_at_night_with_Aurora_Borealis_midjourney.webp?fit=1024%2C512&ssl=1,2025-06-02T09:00:00Z,https://web.archive.org/web/20250602211631/https://wattsupwiththat.com/2025/06/02/weekly-climate-and-energy-news-roundup-644/,"Quote of the Week: The important thing is not to stop questioning. Curiosity has its own reason for existing. One cannot help but be in awe when one contemplates the mysteries of eternity, of life, o… [+58753 chars]",,en,'invasive species'
