index,url,valid,domain,title,description,image,published,archive,content,quote,language,keyword
https://www.cnet.com/science/biology/features/dodo-de-extinction-how-scientists-plan-to-resurrect-an-iconic-species/,https://www.cnet.com/science/biology/features/dodo-de-extinction-how-scientists-plan-to-resurrect-an-iconic-species/,0,www.cnet.com,Dodo De-Extinction: How Scientists Plan to Resurrect an Iconic Species - CNET,The dodo's demise was caused by humans. Now scientists think they can bring the bird back. Should they?,https://www.cnet.com/a/img/resize/d65bb1e953068549325f45d1203589a7e884ba3c/hub/2023/01/31/c89d3764-9592-4c80-9f01-b4894a2a4716/dodo1.jpg?auto=webp&fit=crop&height=675&width=1200,2023-02-01T21:30:02Z,https://web.archive.org/web/20230202010829/https://www.cnet.com/science/biology/features/dodo-de-extinction-how-scientists-plan-to-resurrect-an-iconic-species/,"The wildlife of Mauritius, a tropical island in the Indian Ocean about 500 miles east of Madagascar, couldn't have known that the giant shadows cast across the bay in 1598 would signal doom. 
A flee… [+15485 chars]",,en,'invasive species'
https://www.abc.net.au/news/2023-02-08/supreme-court-rejects-australia-brumby-alliance-petition-culling/101945668,https://www.abc.net.au/news/2023-02-08/supreme-court-rejects-australia-brumby-alliance-petition-culling/101945668,0,www.abc.net.au,Brumby protection group loses Supreme Court bid to stop the culling of wild horses in Victoria,The Australian Brumby Alliance says a Supreme Court decision allowing the culling of wild horses will deny the animals a chance to be rehomed. But Parks Victoria says it has an obligation to control invasive species.,https://live-production.wcms.abc-cdn.net.au/d590454fe7d89df329a806070293ddb9?impolicy=wcms_crop_resize&cropH=513&cropW=911&xPos=393&yPos=260&width=862&height=485,2023-02-08T04:18:18Z,https://web.archive.org/web/20230208042137/https://www.abc.net.au/news/2023-02-08/supreme-court-rejects-australia-brumby-alliance-petition-culling/101945668,"The Australian Brumby Alliance says it is seeking legal advice on whether it will appeal a Supreme Court decision to allow the killing of wild brumbies in the Alpine National Park.
Key points:
<ul>… [+1911 chars]",,en,'invasive species'
https://www.npr.org/2023/02/03/1154049233/yale-honors-9-year-old-black-girl-neighbor-reported-police-lanternfly,https://www.npr.org/2023/02/03/1154049233/yale-honors-9-year-old-black-girl-neighbor-reported-police-lanternfly,0,www.npr.org,Yale honors the work of a 9-year-old Black girl whose neighbor reported her to police,"Bobbi Wilson went on a mission to save New Jersey's trees, capturing spotted lanternflies. That frightened her neighbor, who called the cops. Now, her bug collection is part of a Yale museum.",https://media.npr.org/assets/img/2023/02/02/bobbi-wilson_wide-3fd4da26cc47cfaf439894537424dcb1a8839593-s1400-c100.jpg,2023-02-03T10:30:29Z,,"Bobbi Wilson holds her collection of spotted lanternflies as she is honored at the Yale School of Public Health on Jan. 20.
Andrew Hurley/Yale University
Nine-year-old Bobbi Wilson may be in the fo… [+4698 chars]",,en,'invasive species'
https://news.yahoo.com/texas-hunters-shoot-feral-pigs-182949007.html,https://news.yahoo.com/texas-hunters-shoot-feral-pigs-182949007.html,0,news.yahoo.com,"In Texas, hunters shoot feral pigs from helicopters","On a bitterly cold January morning, a helicopter soars above central Texas farmland.  The four passengers hanging outside the aircraft are hunting - going...",https://media.zenfs.com/en/reuters.com/5577a1f1c74a74a3941e57a4edd2e0f0,2023-02-03T18:29:49Z,https://web.archive.org/web/20230203185254/https://news.yahoo.com/texas-hunters-shoot-feral-pigs-182949007.html,"By Evan Garcia
BRYAN, Texas (Reuters) - On a bitterly cold January morning, a helicopter soars above central Texas farmland. The four passengers hanging outside the aircraft are hunting - going afte… [+1611 chars]",,en,'invasive species'
https://phys.org/news/2023-02-loss-reptiles-poses-threat-small.html,https://phys.org/news/2023-02-loss-reptiles-poses-threat-small.html,0,phys.org,Loss of reptiles poses threat for small islands where humans may have caused extinctions,"A new examination of ancient and current species of reptiles conducted by a University of Texas at Austin paleobiologist reveals the serious impact of the disappearance of even a few species of reptiles in some island areas. The study, published in the Procee…",https://scx2.b-cdn.net/gfx/news/hires/2023/loss-of-reptiles-poses.jpg,2023-02-06T20:00:05Z,https://web.archive.org/web/20230206203339/https://phys.org/news/2023-02-loss-reptiles-poses-threat-small.html,A new examination of ancient and current species of reptiles conducted by a University of Texas at Austin paleobiologist reveals the serious impact of the disappearance of even a few species of repti… [+4983 chars],,en,'invasive species'
https://www.theguardian.com/uk-news/2023/feb/08/meet-jinx-the-dog-on-a-mission-to-protect-welsh-bird-colonies-from-rats,https://www.theguardian.com/uk-news/2023/feb/08/meet-jinx-the-dog-on-a-mission-to-protect-welsh-bird-colonies-from-rats,0,www.theguardian.com,"Meet Jinx, the dog on a mission to protect Welsh bird colonies from rats","As part of a £250,000 Senned fund for new biosecurity measures, the spaniel will work to sniff out rodentsA lively spaniel with a nose for sniffing out rats has been unveiled as a new weapon in the fight to protect precious seabird colonies on small islands o…",https://i.guim.co.uk/img/media/c011dcd3745f50ce7be8a7b7f6e20ec9adb39802/0_0_3000_1800/master/3000.jpg?width=1200&height=630&quality=85&auto=format&fit=crop&overlay-align=bottom%2Cleft&overlay-width=100p&overlay-base64=L2ltZy9zdGF0aWMvb3ZlcmxheXMvdGctZGVmYXVsdC5wbmc&enable=upscale&s=f50a2a6f0609e2b3336a5c16c9a213d9,2023-02-08T15:33:46Z,https://web.archive.org/web/20230208163805/https://www.theguardian.com/uk-news/2023/feb/08/meet-jinx-the-dog-on-a-mission-to-protect-welsh-bird-colonies-from-rats,"A lively spaniel with a nose for sniffing out rats has been unveiled as a new weapon in the fight to protect precious seabird colonies on small islands off the Welsh coast.
Billed as the UKs first c… [+3223 chars]",,en,'invasive species'
https://www.cbc.ca/news/canada/british-columbia/goldfish-munson-pond-kelowna-1.6738922,https://www.cbc.ca/news/canada/british-columbia/goldfish-munson-pond-kelowna-1.6738922,0,www.cbc.ca,B.C. conservation group warns of goldfish invasion in Kelowna pond,"The province says pet owners have been intentionally releasing goldfish into local water bodies in Kelowna B.C., which could endanger fish habitats. The invasive species can rapidly reproduce even under extreme conditions.",https://i.cbc.ca/1.6738942.1675718177!/fileImage/httpImage/image.jpg_gen/derivatives/16x9_620/516149036.jpg,2023-02-07T14:00:00Z,,"An environmental conservation group says goldfish, a provincially-designated invasive species, are now thriving in a popular pond in Kelowna, B.C.
Lisa Scott, executive director of the Okanagan and … [+2827 chars]",,en,'invasive species'
https://www.cbc.ca/news/canada/british-columbia/goldfish-monson-pond-kelowna-1.6738922,https://www.cbc.ca/news/canada/british-columbia/goldfish-monson-pond-kelowna-1.6738922,0,www.cbc.ca,B.C. conservation group warns of goldfish invasion in Kelowna pond,"The province says pet owners have been intentionally releasing goldfish into local water bodies in Kelowna B.C., which could endanger fish habitats. The invasive species can rapidly reproduce even under extreme conditions.",https://i.cbc.ca/1.6738942.1675718177!/fileImage/httpImage/image.jpg_gen/derivatives/16x9_620/516149036.jpg,2023-02-07T14:00:00Z,,"An environmental conservation group says goldfish, a provincially-designated invasive species, are now thriving in a popular pond in Kelowna, B.C.
Lisa Scott, executive director of the Okanagan and … [+2827 chars]",,en,'invasive species'
https://www.techspot.com/news/97470-company-trying-bring-back-woolly-mammoth-wants-resurrect.html,https://www.techspot.com/news/97470-company-trying-bring-back-woolly-mammoth-wants-resurrect.html,0,www.techspot.com,Company trying to bring back the woolly mammoth wants to resurrect the dodo,"Colossal Biosciences previously announced that it planned to bring back the woolly mammoth and the thylacine, also known as the Tasmanian tiger. The Dallas, Texas-based company has now set its sights on resurrecting the dodo, or at least a semblance of it. Th…",https://static.techspot.com/images2/news/bigimage/2023/02/2023-02-02-image-2.jpg,2023-02-02T13:59:00Z,https://web.archive.org/web/20230202154225/https://www.techspot.com/news/97470-company-trying-bring-back-woolly-mammoth-wants-resurrect.html,"WTF?! In what sounds worryingly like the plot of a certain movie franchise, scientists are trying to bring an extinct species back to life. It's not a dinosaur, thankfully, but the dodo, a flightless… [+2469 chars]",,en,'invasive species'
https://www.memeorandum.com/230202/p67,https://www.memeorandum.com/230202/p67,0,www.memeorandum.com,Someone Called the Police on a Girl Catching Lanternflies. Then Yale Honored Her. (Maya King/New York Times),"Maya King / New York Times:
Someone Called the Police on a Girl Catching Lanternflies.  Then Yale Honored Her.  —  Bobbi Wilson, 9, was hunting for spotted lanternflies, an invasive species, in New Jersey.  A neighbor called the police, but her effort has sin…",https://static01.nyt.com/images/2023/01/31/multimedia/31xp-bobbiwilson-02/31xp-bobbiwilson-02-facebookJumbo.jpg,2023-02-02T21:10:01Z,https://web.archive.org/web/20230202211818/http://www.memeorandum.com/230202/p67,"memeorandum is an auto-generated summary of the stories that US political commentators are discussing online right now.
Unlike sister sites Techmeme and Mediagazer, it is not a human-edited news out… [+72 chars]",,en,'invasive species'
http://www.vulture.com/2023/02/snl-bowen-yang-chinese-spy-balloon-weekend-update.html,http://www.vulture.com/2023/02/snl-bowen-yang-chinese-spy-balloon-weekend-update.html,0,www.vulture.com,"Bowen Yang Is a Deflated, Distraught Chinese Spy Balloon on ‘Weekend Update’","Bowen Yang stopped by Saturday Night Live’s ‘Weekend Update’ to star as the suspected Chinese spy balloon that was recently shot down. Yang joked that he was President Biden’s Osama, and discussed the privacy concerns of the American people.",https://pyxis.nymag.com/v1/imgs/f5e/75c/71c9b2524fa5cbced705f8aef912c223b0-bowen-spy-balloon-snl.1x.rsocial.w1200.png,2023-02-05T20:35:56Z,https://web.archive.org/web/20230206020857/https://www.vulture.com/2023/02/snl-bowen-yang-chinese-spy-balloon-weekend-update.html,"Bowen Yang is once again here to give a voice to the voiceless. After playing the iceberg that sank the Titanic and a spotted lanterfly wreaking havoc as an invasive species, Yang called into Saturda… [+967 chars]",,en,'invasive species'
