index,url,valid,domain,title,description,image,published,archive,content,quote,language,keyword
https://www.businesswire.com/news/home/20230202005457/en/Northern-Trust-Asset-Management-Launches-Natural-Capital-Paris-Aligned-Strategy,https://www.businesswire.com/news/home/20230202005457/en/Northern-Trust-Asset-Management-Launches-Natural-Capital-Paris-Aligned-Strategy,0,www.businesswire.com,Northern Trust Asset Management Launches Natural Capital Paris-Aligned Strategy,"LONDON--(BUSINESS WIRE)--Northern Trust Asset Management (NTAM), one of the world’s leading investment managers, continues to expand its sustainable index investment solutions with the launch of the World Natural Capital Paris-Aligned Index strategy. Efficien…",https://mms.businesswire.com/media/20230202005457/en/507749/23/NorthernTrust_Logo.jpg,2023-02-02T09:54:07Z,https://web.archive.org/web/20230202095250/https://www.businesswire.com/news/home/20230202005457/en/Northern-Trust-Asset-Management-Launches-Natural-Capital-Paris-Aligned-Strategy,"LONDON--(BUSINESS WIRE)--Northern Trust Asset Management (NTAM), one of the worlds leading investment managers, continues to expand its sustainable index investment solutions with the launch of the W… [+7627 chars]",,en,'SDG 15'
https://www.marketscreener.com/quote/stock/NORTHERN-TRUST-CORPORATIO-40311094/news/Northern-Trust-Asset-Management-Launches-Natural-Capital-Paris-Aligned-Strategy-42875765/?utm_medium=RSS&utm_content=20230202,https://www.marketscreener.com/quote/stock/NORTHERN-TRUST-CORPORATIO-40311094/news/Northern-Trust-Asset-Management-Launches-Natural-Capital-Paris-Aligned-Strategy-42875765/?utm_medium=RSS&utm_content=20230202,0,www.marketscreener.com,Northern Trust Asset Management Launches Natural Capital Paris-Aligned Strategy,"(marketscreener.com) 
The Northern Trust World Natural Capital Paris-Aligned Index Strategy Provides Institutional Clients with an Enhanced Net Zero Solution
https://www.marketscreener.com/quote/stock/NORTHERN-TRUST-CORPORATIO-40311094/news/Northern-Trust-Ass…",https://www.marketscreener.com/images/twitter_MS_fdnoir.png,2023-02-02T09:42:02Z,,"Northern Trust Asset Management (NTAM), one of the world’s leading investment managers, continues to expand its sustainable index investment solutions with the launch of the World Natural Capital Par… [+7718 chars]",,en,'SDG 15'
https://boingboing.net/2023/02/02/lead-ammunition-is-poisoning-bald-eagles.html,https://boingboing.net/2023/02/02/lead-ammunition-is-poisoning-bald-eagles.html,0,boingboing.net,Lead ammunition is poisoning bald eagles,"Having been removed from the endangered species list in 2007, the American bald eagle still has its struggles. In Michigan, the lead ammunition used by hunters is poisoning the birds at an increasing rate. 



MLive:




An eight-year study published in 2022 …",https://i0.wp.com/boingboing.net/wp-content/uploads/2023/02/shutterstock_700432165.jpg?fit=1200%2C794&ssl=1,2023-02-02T17:18:34Z,https://web.archive.org/web/20230202185634/https://boingboing.net/2023/02/02/lead-ammunition-is-poisoning-bald-eagles.html,"Having been removed from the endangered species list in 2007, the American bald eagle still has its struggles. In Michigan, the lead ammunition used by hunters is poisoning the birds at an increasing… [+1475 chars]",,en,'endangered species'
https://www.theguardian.com/environment/2023/feb/06/rainforest-colombia-farc-amazon-river-dolphins-peace-aoe,https://www.theguardian.com/environment/2023/feb/06/rainforest-colombia-farc-amazon-river-dolphins-peace-aoe,0,www.theguardian.com,Pink dolphins and reformed Colombian rebels turn no-go zone into ecotourism hit,"Far upriver in the rainforest, the lure of rare pink river dolphins is creating jobs and promoting conservation and reconciliation after a 50-year war“The dolphins are more playful than us,” says Diego Cifuentes, co-founder of Villa Lilia Agroecoturistico, a …",https://i.guim.co.uk/img/media/4c6ee65905cb977498491d649f467e3f749efa12/0_11_1024_614/master/1024.jpg?width=1200&height=630&quality=85&auto=format&fit=crop&overlay-align=bottom%2Cleft&overlay-width=100p&overlay-base64=L2ltZy9zdGF0aWMvb3ZlcmxheXMvdGctZGVmYXVsdC5wbmc&enable=upscale&s=87c5a90dd223166d7b23d0a9a9051d4a,2023-02-06T11:15:19Z,,"The dolphins are more playful than us, says Diego Cifuentes, co-founder of Villa Lilia Agroecoturistico, a community dolphin-watching project on Colombias Lake Nare. If you give off good energy, they… [+7475 chars]",,en,'endangered species'
https://www.npr.org/2023/02/05/1153922137/dead-whale-strandings,https://www.npr.org/2023/02/05/1153922137/dead-whale-strandings,0,www.npr.org,An unusually high number of whales are washing up on U.S. beaches,The unexpected deaths are hitting humpbacks and North Atlantic right whales on the East Coast and gray whales on the West Coast — populations that were already under watch.,https://media.npr.org/assets/img/2023/02/03/gettyimages-1147444722_wide-5e10653716377a756d7771a4823af3625ad21212-s1400-c100.jpg,2023-02-05T10:03:37Z,,"People look at a dead gray whale at Ocean Beach in San Francisco, Calif., in May 2019, a year when 122 gray whales died in the U.S., according to the National Oceanic and Atmospheric Administration. … [+7135 chars]",,en,'endangered species'
https://crooksandliars.com/2023/02/ron-desantis-protects-new-endangered,https://crooksandliars.com/2023/02/ron-desantis-protects-new-endangered,0,crooksandliars.com,DeSantis Protects New Endangered Species: Gas Stoves,"On Wednesday, Florida Gov. Ron DeSantis put forth his 2023 budget, dubbing it the ""Framework for Freedom."" 
But millions of dollars are going to save the newly endangered specious in DeSantis' mind -- gas stoves.
""And then we just added because I think it nee…",https://crooksandliars.com/files/mediaposters/2023/02/51848.jpg,2023-02-02T17:02:21Z,https://web.archive.org/web/20230202172054/https://crooksandliars.com/2023/02/ron-desantis-protects-new-endangered,"On Wednesday, Florida Gov. Ron DeSantis put forth his 2023 budget, dubbing it the ""Framework for Freedom."" 
But millions of dollars are going to save the newly endangered specious in DeSantis' mind … [+1214 chars]",,en,'endangered species'
https://www.theguardian.com/us-news/2023/feb/02/whale-hawaii-swallowed-fishing-gear-plastic,https://www.theguardian.com/us-news/2023/feb/02/whale-hawaii-swallowed-fishing-gear-plastic,0,www.theguardian.com,Swallowed fishing gear and plastic most likely cause of Hawaii whale’s death,"Large volumes of traps, nets and marine debris in sperm whale’s intestinal tract highlight plastic pollution’s threat to wildlifeA sperm whale that washed ashore in Hawaii over the weekend probably died in part because it ate large volumes of fishing traps, f…",https://i.guim.co.uk/img/media/fcd2a127a084e0fd8e270c53edc35bdaaab5bf8d/0_226_6000_3600/master/6000.jpg?width=1200&height=630&quality=85&auto=format&fit=crop&overlay-align=bottom%2Cleft&overlay-width=100p&overlay-base64=L2ltZy9zdGF0aWMvb3ZlcmxheXMvdGctZGVmYXVsdC5wbmc&enable=upscale&s=4128d131a3ed439c7a03bb520612ad00,2023-02-02T21:59:13Z,https://web.archive.org/web/20230202221203/https://www.theguardian.com/us-news/2023/feb/02/whale-hawaii-swallowed-fishing-gear-plastic,"A sperm whale that washed ashore in Hawaii over the weekend probably died in part because it ate large volumes of fishing traps, fishing nets, plastic bags and other marine debris, scientists said on… [+2823 chars]",,en,'endangered species'
https://newrepublic.com/article/170301/biden-biodiversity-ecosystems-rawa,https://newrepublic.com/article/170301/biden-biodiversity-ecosystems-rawa,0,newrepublic.com,The Vanishing of Biden’s Biodiversity Agenda,"In the 1980s, millions of monarch butterflies fluttered across North America, migrating north and east from California and even parts of Mexico, upward through the South and Midwest before stretching up through the plains and Northeast, spanning even to south…",https://images.newrepublic.com/bf9a2d07076178ef58411a00968a1c84356c9184.jpeg?w=1109&h=577&crop=faces&fit=crop&fm=jpg,2023-02-01T11:00:00Z,https://web.archive.org/web/20230201112413/https://newrepublic.com/article/170301/biden-biodiversity-ecosystems-rawa,"RAWA would address some of the gaps in the Endangered Species Act, whose protections dont generally activate until a species is deemed threatened or endangered; in other words, the negative chain rea… [+1938 chars]",,en,'endangered species'
https://www.abc.net.au/news/2023-02-03/2023-pacific-games-mascots-turtles-endangered-species/101923736,https://www.abc.net.au/news/2023-02-03/2023-pacific-games-mascots-turtles-endangered-species/101923736,0,www.abc.net.au,"Meet the living, travelling 2023 Pacific Games mascots, raising awareness for endangered species","Solomon Islands boast the largest turtle nesting grounds in the Pacific, with sea turtles intrinsic to the archipelago's culture. However, three species are now endangered, two critically so.",https://live-production.wcms.abc-cdn.net.au/1c6fb1380df552a458a34f5da5b2a3c6?impolicy=wcms_crop_resize&cropH=720&cropW=1280&xPos=0&yPos=130&width=862&height=485,2023-02-03T02:23:21Z,https://web.archive.org/web/20230203033144/https://www.abc.net.au/news/2023-02-03/2023-pacific-games-mascots-turtles-endangered-species/101923736,"For the first time in Pacific Games history, there is a living, breathing mascot.
Not that she's aware of it.
After the 167cm leatherback turtle laid her precious eggs on a select few beaches in So… [+4441 chars]",,en,'endangered species'
https://www.forbes.com/sites/melissacristinamarquez/2023/02/02/costa-rice-has-been-accused-of-international-and-us-fishing-violations/,https://www.forbes.com/sites/melissacristinamarquez/2023/02/02/costa-rice-has-been-accused-of-international-and-us-fishing-violations/,0,www.forbes.com,Costa Rice Has Been Accused Of International And US Fishing Violations,"An international coalition of 18 Marine Conservation Organizations (MCOs) has presented evidence to the Office of International Affairs, Trade, and Commerce (IATC) of the National Marine Fisheries Service (NMFS) that Costa Rica is in violation of internationa…","https://imageio.forbes.com/specials-images/imageserve/63d7627e3f94edf4f3a89c4b/0x0.jpg?format=jpg&crop=3278,1845,x0,y290,safe&width=1200",2023-02-02T05:45:00Z,,"An international coalition of 18 Marine Conservation Organizations (MCOs) has presented evidence to the Office of International Affairs, Trade, and Commerce (IATC) of the National Marine Fisheries Se… [+6139 chars]",,en,'endangered species'
https://www.cnn.com/travel/article/tizi-chinese-influencer-great-white-shark-intl-hnk/index.html,https://www.cnn.com/travel/article/tizi-chinese-influencer-great-white-shark-intl-hnk/index.html,0,www.cnn.com,Chinese influencer fined after eating protected great white shark on video,"A Chinese vlogger is facing widespread online backlash and a monetary fine after she livestreamed herself cooking and eating a great white shark, a protected species in China.",https://cdn.cnn.com/cnnnext/dam/assets/230203105326-yao-ming-campaign-super-tease.jpg,2023-02-03T04:40:41Z,https://web.archive.org/web/20230203053217/https://www.cnn.com/travel/article/tizi-chinese-influencer-great-white-shark-intl-hnk/index.html,"(CNN) A Chinese vlogger is facing widespread online backlash and a monetary fine after she livestreamed herself cooking and eating a great white shark, a protected species in China.
In the clip, the… [+3234 chars]",,en,'protected species'
https://www.theguardian.com/world/2023/feb/07/swedish-hunters-shoot-dead-54-wolves-in-largest-cull-ever-in-country,https://www.theguardian.com/world/2023/feb/07/swedish-hunters-shoot-dead-54-wolves-in-largest-cull-ever-in-country,0,www.theguardian.com,Hunters shoot dead 54 wolves in Sweden’s largest ever cull,"Scientists warn that wolf numbers not large enough to sustain healthy population Swedish hunters have shot dead 54 wolves in a month in the country’s largest and most controversial cull of the animals yet, prompting fury from conservationists and satisfaction…",https://i.guim.co.uk/img/media/4113d2e2cf34d6872f2076b53b5c4d0106ebaba9/0_179_5107_3064/master/5107.jpg?width=1200&height=630&quality=85&auto=format&fit=crop&overlay-align=bottom%2Cleft&overlay-width=100p&overlay-base64=L2ltZy9zdGF0aWMvb3ZlcmxheXMvdGctZGVmYXVsdC5wbmc&enable=upscale&s=8b9fa424a6e6331a88a4fc3f0f4aed50,2023-02-07T11:48:14Z,https://web.archive.org/web/20230207125140/https://www.theguardian.com/world/2023/feb/07/swedish-hunters-shoot-dead-54-wolves-in-largest-cull-ever-in-country,"Swedish hunters have shot dead 54 wolves in a month in the countrys largest and most controversial cull of the animals yet, prompting fury from conservationists and satisfaction among farmers who con… [+3301 chars]",,en,'protected species'
https://phys.org/news/2023-02-species-whitefish-central-switzerland.html,https://phys.org/news/2023-02-species-whitefish-central-switzerland.html,0,phys.org,Seven new species of whitefish described in Central Switzerland,"Biologists at Eawag have identified ten species of whitefish in the lakes of the Reuss river system. Of these, seven have been described as distinct species for the first time—although in two cases this required inspection of specimens from historical collect…",https://scx2.b-cdn.net/gfx/news/2023/seven-new-species-of-w.jpg,2023-02-06T18:24:29Z,https://web.archive.org/web/20230206183926/https://phys.org/news/2023-02-species-whitefish-central-switzerland.html,"Biologists at Eawag have identified ten species of whitefish in the lakes of the Reuss river system. Of these, seven have been described as distinct species for the first timealthough in two cases th… [+5523 chars]",,en,'protected species'
https://www.ny1.com/nyc/all-boroughs/ap-top-news/2023/02/01/brazil-authorities-probe-amazon-ties-to-capital-attacks,https://www.ny1.com/nyc/all-boroughs/ap-top-news/2023/02/01/brazil-authorities-probe-amazon-ties-to-capital-attacks,0,www.ny1.com,Brazil authorities probe Amazon ties to capital attacks - Spectrum News,An investigation into anti-democratic protests and a recent attack on Brazil&#39;s capital is centering in part on areas along an important highway that goes through the Amazon,https://s7d2.scene7.com/is/image/TWCNews/Spectrum-News-Default-Slate,2023-02-01T15:06:00Z,https://web.archive.org/web/20230203030936/https://www.ny1.com/nyc/all-boroughs/ap-top-news/2023/02/01/brazil-authorities-probe-amazon-ties-to-capital-attacks,"SAO PAULO (AP) On the edge of Brazils Amazon rainforest, the Rovaris family is a symbol of a pioneering success story. 
The family arrived in the state of Mato Grosso in the 1970s as part of a wave … [+6392 chars]",,en,'protected species'
https://abcnews.go.com/International/wireStory/brazil-authorities-probe-amazon-ties-capital-attacks-96818171,https://abcnews.go.com/International/wireStory/brazil-authorities-probe-amazon-ties-capital-attacks-96818171,0,abcnews.go.com,Brazil authorities probe Amazon ties to capital attacks - ABC News,An investigation into anti-democratic protests and a recent attack on Brazil's capital is centering in part on areas along an important highway that goes through the Amazon,https://s.abcnews.com/images/International/wirestory_47a6c804a946a194976f2d16d8be35f9_16x9_992.jpg,2023-02-01T15:23:16Z,https://web.archive.org/web/20230201153929/https://abcnews.go.com/International/wireStory/brazil-authorities-probe-amazon-ties-capital-attacks-96818171,"SAO PAULO -- On the edge of Brazils Amazon rainforest, the Rovaris family is a symbol of a pioneering success story. 
The family arrived in the state of Mato Grosso in the 1970s as part of a wave of… [+6237 chars]",,en,'protected species'
https://www.middletownpress.com/news/article/brazil-authorities-probe-amazon-ties-to-capital-17756458.php,https://www.middletownpress.com/news/article/brazil-authorities-probe-amazon-ties-to-capital-17756458.php,0,www.middletownpress.com,Brazil authorities probe Amazon ties to capital attacks - Middletown Press,"SAO PAULO (AP) — On the edge of Brazil’s Amazon rainforest, the Rovaris family is a...",https://s.hdnux.com/photos/01/31/27/01/23425119/3/rawImage.jpg,2023-02-01T15:29:01Z,,"SAO PAULO (AP) On the edge of Brazils Amazon rainforest, the Rovaris family is a symbol of a pioneering success story.The family arrived in the state of Mato Grosso in the 1970s as part of a wave of … [+6225 chars]",,en,'protected species'
https://www.wdio.com/front-page/world-national/brazil-authorities-probe-amazon-ties-to-capital-attacks/,https://www.wdio.com/front-page/world-national/brazil-authorities-probe-amazon-ties-to-capital-attacks/,0,www.wdio.com,Brazil authorities probe Amazon ties to capital attacks - WDIO,"An investigation into anti-democratic protests and a recent attack on Brazil's capital is centering in part on areas along an important highway that goes through the Amazon. Highway BR-163, built during the military dictatorship in the 1970s, connects areas o…",https://www.wdio.com/wp-content/uploads/apimg/2023/02/Brazil_Amazon_Capital_Attack_77498.jpg,2023-02-01T15:13:39Z,https://web.archive.org/web/20230202072940/https://www.wdio.com/front-page/world-national/brazil-authorities-probe-amazon-ties-to-capital-attacks/,"SAO PAULO (AP) On the edge of Brazils Amazon rainforest, the Rovaris family is a symbol of a pioneering success story. 
The family arrived in the state of Mato Grosso in the 1970s as part of a wave … [+7416 chars]",,en,'protected species'
https://www.latestly.com/agency-news/world-news-brazil-authorities-probe-amazon-ties-to-capital-attacks-4785049.html,https://www.latestly.com/agency-news/world-news-brazil-authorities-probe-amazon-ties-to-capital-attacks-4785049.html,0,www.latestly.com,World News | Brazil Authorities Probe Amazon Ties to Capital Attacks - LatestLY,"Get latest articles and stories on World at LatestLY.   On the edge of Brazil's Amazon rainforest, the Rovaris family is a symbol of a pioneering success story.",https://st1.latestly.com/wp-content/uploads/2020/10/Latestly-World-News-784x441.jpg,2023-02-01T15:18:17Z,,"Sao Paulo, Feb 1 (AP) On the edge of Brazil's Amazon rainforest, the Rovaris family is a symbol of a pioneering success story.
 The family arrived in the state of Mato Grosso in the 1970s as part of… [+6415 chars]",,en,'protected species'
https://www.msn.com/en-gb/news/us/brazil-authorities-probe-amazon-ties-to-capital-attacks/ar-AA16ZSZ4,https://www.msn.com/en-gb/news/us/brazil-authorities-probe-amazon-ties-to-capital-attacks/ar-AA16ZSZ4,0,www.msn.com,Brazil authorities probe Amazon ties to capital attacks - msnNOW,"SAO PAULO (AP) — On the edge of Brazil’s Amazon rainforest, the Rovaris family is a symbol of a pioneering success story. The family arrived in the state of Mato Grosso in the 1970s as part of a wave of agricultural expansion promoted by the country’s then-mi…",https://img-s-msn-com.akamaized.net/tenant/amp/entityid/AA16Zy6q.img?h=630&w=1200&m=6&q=60&o=t&l=f&f=jpg,2023-02-01T15:06:29Z,,"SAO PAULO (AP) On the edge of Brazils Amazon rainforest, the Rovaris family is a symbol of a pioneering success story. 
© Provided by The Associated Press
 FILE - Highway BR-163 stretches between t… [+8402 chars]",,en,'protected species'
https://www.independent.co.uk/news/jair-bolsonaro-ap-luiz-inacio-lula-da-silva-brazil-amazon-b2273723.html,https://www.independent.co.uk/news/jair-bolsonaro-ap-luiz-inacio-lula-da-silva-brazil-amazon-b2273723.html,0,www.independent.co.uk,Brazil authorities probe Amazon ties to capital attacks,An investigation into anti-democratic protests and a recent attack on Brazil's capital is centering in part on areas along an important highway that goes through the Amazon,https://static.independent.co.uk/2023/02/01/15/Brazil_Amazon_Capital_Attack_77498.jpg?quality=75&width=1200&auto=webp,2023-02-01T15:06:30Z,https://web.archive.org/web/20230202081131/https://www.independent.co.uk/news/jair-bolsonaro-ap-luiz-inacio-lula-da-silva-brazil-amazon-b2273723.html,"For free real time breaking news alerts sent straight to your inbox sign up to our breaking news emails
Sign up to our free breaking news emails
On the edge of Brazils Amazon rainforest, the Rovari… [+6371 chars]",,en,'protected species'
https://www.independent.co.uk/news/ap-mexico-andres-manuel-lopez-obrador-yucatan-unesco-b2275261.html,https://www.independent.co.uk/news/ap-mexico-andres-manuel-lopez-obrador-yucatan-unesco-b2275261.html,0,www.independent.co.uk,"In Mexico, worry that Maya Train will destroy jungle","A major rail project in Mexico’s Yucatan Peninsula is intended to drive economic development to some of the country’s poorest areas, in part by bringing up to three million tourists each year",https://static.independent.co.uk/2023/02/03/14/APTOPIX_Mexico_Train_Biodiversity_01021.jpg?quality=75&width=1200&auto=webp,2023-02-03T14:23:53Z,https://web.archive.org/web/20230204062918/https://www.independent.co.uk/news/ap-mexico-andres-manuel-lopez-obrador-yucatan-unesco-b2275261.html,"For free real time breaking news alerts sent straight to your inbox sign up to our breaking news emails
Sign up to our free breaking news emails
Miguel Ángel Díaz walks slowly so his footfall on dr… [+7840 chars]",,en,'protected species'
https://news.yahoo.com/mexico-worry-maya-train-destroy-142352144.html,https://news.yahoo.com/mexico-worry-maya-train-destroy-142352144.html,0,news.yahoo.com,"In Mexico, worry that Maya Train will destroy jungle",Miguel Ángel Díaz walks slowly so his footfall on dry leaves doesn’t drive away what he's trying to find in this dense forest of seeded breadnut and...,https://s.yimg.com/ny/api/res/1.2/7A1lxTk8tnZPcY.mT_w9GQ--/YXBwaWQ9aGlnaGxhbmRlcjt3PTEyMDA7aD04MDA-/https://media.zenfs.com/en/ap.org/2a922bedf24f922915bf03b807cd45f7,2023-02-03T14:23:52Z,https://web.archive.org/web/20230203143755/https://news.yahoo.com/mexico-worry-maya-train-destroy-142352144.html,"CALAKMUL BIOSPHERE RESERVE, Mexico (AP) Miguel Ángel Díaz walks slowly so his footfall on dry leaves doesnt drive away what he's trying to find in this dense forest of seeded breadnut and sapodilla t… [+7718 chars]",,en,'protected species'
https://www.ibtimes.com/emotions-run-high-swedens-biggest-wolf-hunt-3664761,https://www.ibtimes.com/emotions-run-high-swedens-biggest-wolf-hunt-3664761,0,www.ibtimes.com,Emotions Run High In Sweden's Biggest Wolf Hunt,Emotions run high in Sweden's biggest wolf hunt,https://d.ibtimes.com/en/full/4416021/hunter-lars-bjork-says-that-wolves-cause-trouble-rural-areas.jpg,2023-02-06T08:00:31Z,https://web.archive.org/web/20230206083630/https://www.ibtimes.com/emotions-run-high-swedens-biggest-wolf-hunt-3664761,"Hunter Lars Bjork says that wolves cause trouble in rural areasAFP
Hunter Lars Bjork points to fresh tracks in the snow as he lumbers through a whited-out forest in central Sweden, where the biggest… [+4998 chars]",,en,'protected species'
https://www.bbc.co.uk/news/in-pictures-64472234,https://www.bbc.co.uk/news/in-pictures-64472234,0,www.bbc.co.uk,International Garden Photographer of the Year competition 2023,The winning images of this year's International Garden Photographer of the Year competition.,https://ichef.bbci.co.uk/news/1024/branded_news/D581/production/_128475645_01tonynorth-408520.jpg,2023-02-03T00:12:52Z,https://web.archive.org/web/20230203002020/https://www.bbc.co.uk/news/in-pictures-64472234,"Tony North has been named winner of this year's International Garden Photographer of the Year competition.
His picture was taken in the island of La Palma, which is part of the Canary Islands. It is… [+4247 chars]",,en,'invasive species'
https://www.theguardian.com/us-news/2023/feb/08/super-bloom-california-lake-elsinore-tourists,https://www.theguardian.com/us-news/2023/feb/08/super-bloom-california-lake-elsinore-tourists,0,www.theguardian.com,California town hopes to put tourists off the scent as another super bloom looms,"Lake Elsinore was flooded with visitors in 2019 when wildflowers erupted over its landscape; this year, it doesn’t want themCalifornia’s lush hillsides and verdant valleys may soon be awash with color, as hints that another botanical bonanza is budding after …",https://i.guim.co.uk/img/media/ca1328268b9fb354964e5b6e1267d93a1da6ae2e/0_187_5472_3283/master/5472.jpg?width=1200&height=630&quality=85&auto=format&fit=crop&overlay-align=bottom%2Cleft&overlay-width=100p&overlay-base64=L2ltZy9zdGF0aWMvb3ZlcmxheXMvdGctZGVmYXVsdC5wbmc&enable=upscale&s=41cfd4b1301503ee1d9e37005f89f5d9,2023-02-08T21:27:40Z,https://web.archive.org/web/20230208223904/https://www.theguardian.com/us-news/2023/feb/08/super-bloom-california-lake-elsinore-tourists,"Californias lush hillsides and verdant valleys may soon be awashwith color, as hints that another botanical bonanza is budding after the state was doused with rain. Soaked soils could help set off an… [+4951 chars]",,en,'invasive species'
