index,url,valid,domain,title,description,image,published,archive,content,quote,language,keyword
https://wattsupwiththat.com/2026/02/02/steve-milloy-20-years-after-an-inconvenient-truth/,https://wattsupwiththat.com/2026/02/02/steve-milloy-20-years-after-an-inconvenient-truth/,0,wattsupwiththat.com,STEVE MILLOY: 20 Years After ‘An Inconvenient Truth’,Jan. 24 marked the 20th anniversary of the release of Al Gore’s alarmist global warming movie “An Inconvenient Truth.” Gore has surfed the movie and climate alarmism to a net worth estimated at $300 million and a Nobel Peace Prize.,https://i0.wp.com/wattsupwiththat.com/wp-content/uploads/2024/11/al-gore-at-cop-29-rumble.webp?fit=1024%2C512&quality=75&ssl=1,2026-02-03T06:00:00Z,,"From THE DAILY CALLER
Steve MilloyContributor
Jan. 24 marked the 20th anniversary of the release of Al Gores alarmist global warming movie An Inconvenient Truth. Gore has surfed the movie and clima… [+3893 chars]",,en,'species extinction'
https://www.lifesciencesworld.com/are-humans-the-biggest-threat-to-wildlife/,https://www.lifesciencesworld.com/are-humans-the-biggest-threat-to-wildlife/,0,www.lifesciencesworld.com,Are humans the biggest threat to wildlife?,"Are Humans the Biggest Threat to Wildlife? Yes, humans are, without a doubt, the biggest threat to wildlife today. Our actions, driven by population growth, consumption patterns, and disregard for the natural world, are pushing countless species towards extin…",,2026-02-16T03:15:08Z,,"Yes, humans are, without a doubt, the biggest threat to wildlife today. Our actions, driven by population growth, consumption patterns, and disregard for the natural world, are pushing countless spec… [+10468 chars]",,en,'species extinction'
http://lenscratch.com/2026/02/review-santa-fe-carolyn-monastra-divergence-of-birds/,http://lenscratch.com/2026/02/review-santa-fe-carolyn-monastra-divergence-of-birds/,0,lenscratch.com,Review Santa Fe: Carolyn Monastra: Divergence of Birds,"In early November 2025, I was invited to CENTER’s Review Santa Fe. Being my first time in the Southwest and experience on the Reviewer side of the table, I wasn’t quite sure what to expect. As an educator, I love reviewing work; when others hear “critique,” t…",http://lenscratch.com/wp-content/uploads/2026/02/01_Monastra_pine_grosbeaks.jpg,2026-02-02T09:21:52Z,,"©Carolyn Monastra, Pair of Pine Grosbeaks
In early November 2025, I was invited to CENTERs Review Santa Fe. Being my first time in the Southwest and experience on the Reviewer side of the table, I w… [+13441 chars]",,en,'species extinction'
https://wattsupwiththat.com/2026/02/02/weekly-climate-and-energy-news-roundup-677/,https://wattsupwiththat.com/2026/02/02/weekly-climate-and-energy-news-roundup-677/,0,wattsupwiththat.com,Weekly Climate and Energy News Roundup #677,Quote of the Week: “Insight must precede application.”,https://i0.wp.com/wattsupwiththat.com/wp-content/uploads/2026/02/charlesrotter_gorgeous_scenic_photo_of_mono_lake_with_snow_midjourney.webp?fit=1024%2C512&quality=75&ssl=1,2026-02-02T10:00:00Z,,"Quote of the Week: Insight must precede application. 
  Max Planck
Number of the Week: 1-day in10 Years.
*********************
THIS WEEK:By Ken Haapala, President, Science and Environmental Polic… [+76943 chars]",,en,'species extinction'
https://dailycaller.com/2026/02/01/opinion-20-years-after-an-inconvenient-truth-steve-milloy/,https://dailycaller.com/2026/02/01/opinion-20-years-after-an-inconvenient-truth-steve-milloy/,0,dailycaller.com,STEVE MILLOY: 20 Years After ‘An Inconvenient Truth’,"Jan. 24 marked the 20th anniversary of the release of Al Gore’s alarmist global warming movie, “An Inconvenient Truth.” Gore has surfed the movie and climate","https://images.dailycaller.com/image/width=1280,height=549,fit=cover,format=webp,f=auto/https://cdn01.dailycaller.com/wp-content/uploads/2026/01/GettyImages-2256852969-e1769024602924.jpg",2026-02-02T01:30:09Z,,Jan. 24 marked the 20th anniversary of the release of Al Gore’s alarmist global warming movie “An Inconvenient Truth.” Gore has surfed the movie and climate alarmism to a net worth estimated at $300 … [+3880 chars],,en,'species extinction'
https://www.lifesciencesworld.com/can-i-leave-a-dead-bird-in-my-yard/,https://www.lifesciencesworld.com/can-i-leave-a-dead-bird-in-my-yard/,0,www.lifesciencesworld.com,Can I leave a dead bird in my yard?,"Can I Leave a Dead Bird in My Yard? A Naturalist’s Guide Leaving a dead bird in your yard is generally discouraged due to potential disease risks and attracting scavengers, but there are circumstances where it may be acceptable or even beneficial to the ecosy…",,2026-02-18T01:02:38Z,,"Leaving a dead bird in your yardis generally discouraged due to potential disease risks and attracting scavengers, but there are circumstances where it may be acceptable or even beneficial to the eco… [+8825 chars]",,en,'endangered species'
https://www.bostonherald.com/2026/02/17/climate-fungi-conservation/,https://www.bostonherald.com/2026/02/17/climate-fungi-conservation/,0,www.bostonherald.com,"To aficionados, fungi are freaky, mystical and overlooked. They’re helping scientists learn more",Nearly all life-forms depend on the estimated 2.5 million fungi species on Earth.,https://www.bostonherald.com/wp-content/uploads/2026/02/Climate_Fungi_Conservation_15106-1-1.jpg?w=1024&h=682,2026-02-17T17:44:30Z,,"By DORANY PINEDA
ANGWIN, Calif. (AP) Jessica Allen crunched through fallen leaves among Manzanita trees hunting for something few have spotted before: the Manzanita butter clump a rare and little-kn… [+8455 chars]",,en,'endangered species'
https://journals.plos.org/plospathogens/article?id=10.1371/journal.ppat.1013861,https://journals.plos.org/plospathogens/article?id=10.1371/journal.ppat.1013861,0,journals.plos.org,"Zoological transmission of encephalomyocarditis virus in the United States: Virus evolution, host ecology, and capsid antigenicity derived from an outbreak","Author summary Much has been learned about the molecular biology and pathogenesis of encephalomyocarditis virus (EMCV) over the last several decades, as it has been used as an important model system on many fronts, including deducing mechanisms of myocardial …",https://journals.plos.org/plospathogens/article/figure/image?id=10.1371/journal.ppat.1013861.strk&size=inline,2026-02-17T14:00:00Z,,"Introduction
Encephalomyocarditis virus (EMCV) is a single-stranded, positive-sense RNA virus in the genus Cardiovirus, family Picornaviridae, that is classified as the species Cardiovirus rueckerti… [+106695 chars]",,en,'endangered species'
https://www.newser.com/story/383855/chinas-overfished-river-now-a-symbol-for-conservation.html,https://www.newser.com/story/383855/chinas-overfished-river-now-a-symbol-for-conservation.html,0,www.newser.com,China's Overfished River Now a Symbol for Conservation,"China's longest river, once a symbol of environmental decline, is starting to bounce back after the government did something drastic: it stopped most fishing. A 10-year fishing ban across the Yangtze, imposed in 2021 after decades of piecemeal restrictions, h…",https://img1-azrcdn.newser.com/image/1665442-12-20260217075448.jpeg,2026-02-17T13:48:00Z,,"China's longest river, once a symbol of environmental decline, is starting to bounce back after the government did something drastic: it stopped most fishing. A 10-year fishing ban across the Yangtze… [+1879 chars]",,en,'endangered species'
http://www.denofgeek.com/culture/colossal-new-ai-tools-might-save-the-gray-wolf/,http://www.denofgeek.com/culture/colossal-new-ai-tools-might-save-the-gray-wolf/,0,www.denofgeek.com,Colossal Is Using New AI Tools That Might Just Save the Gray Wolf,"The tooth-billed pigeon, which is sometimes referred to as “the little dodo” of the Pacific, is a variety of fowl indigenous only on the islands of Samoa. For more than a decade, it was also thought to be lost, if not outright extinct, after its last confirme…",https://www.denofgeek.com/wp-content/uploads/2026/02/Gray-Wolf-saved-by-Colossal-Foundation.jpg?fit=2000%2C1156,2026-02-17T13:00:00Z,,"So we now have a tool that basically can look at drone imagery, track elephants, and say we know exactly who this elephant is, James notes. What it begins to create is ethogram data, so its telling y… [+2426 chars]",,en,'endangered species'
https://ssir.org/books/excerpts/entry/climate-capital-tom-chi,https://ssir.org/books/excerpts/entry/climate-capital-tom-chi,0,ssir.org,Grief Is a Gift,An excerpt from Tom Chi&#8217;s Climate Capital on building forward for the future we need.,https://ssir.org/images/articles/climate-capital-cover-300x464.jpg,2026-02-17T13:00:00Z,,"Climate Capital: Investing in the Tools for a Regenerative Future
Tom Chi
320 pages, Wiley, 2026
Buy the book »
The three big challenges of the 21st century are climate destabilization, economic … [+14207 chars]",,en,'endangered species'
https://www.lifesciencesworld.com/what-was-the-largest-extinct-elephant/,https://www.lifesciencesworld.com/what-was-the-largest-extinct-elephant/,0,www.lifesciencesworld.com,What was the largest extinct elephant?,"What Was the Largest Extinct Elephant? A Journey Through Proboscidean Paleontology The largest extinct elephant, based on current fossil evidence, was the Steppe Mammoth (Mammuthus trogontherii), a truly colossal creature that roamed Eurasia during the Pleist…",,2026-02-17T08:07:50Z,,"What Was the Largest Extinct Elephant? A Journey Through Proboscidean Paleontology
The largest extinct elephant, based on current fossil evidence, was the Steppe Mammoth (Mammuthus trogontherii), a … [+8437 chars]",,en,'endangered species'
https://www.lifesciencesworld.com/do-fish-live-in-underground-lakes/,https://www.lifesciencesworld.com/do-fish-live-in-underground-lakes/,0,www.lifesciencesworld.com,Do fish live in underground lakes?,"Do Fish Live in Underground Lakes? Exploring Subterranean Aquatic Life The answer is a resounding yes! While not as common as their surface-dwelling counterparts, several species of fish have adapted to thrive in the unique and challenging environments of und…",,2026-02-17T07:54:08Z,,"The answer is a resounding yes! While not as common as their surface-dwelling counterparts, several species of fish have adapted to thrive in the unique and challenging environments of underground la… [+10229 chars]",,en,'endangered species'
https://www.lifesciencesworld.com/is-it-legal-to-eat-koalas/,https://www.lifesciencesworld.com/is-it-legal-to-eat-koalas/,0,www.lifesciencesworld.com,Is it legal to eat koalas?,Is Eating Koalas Legal? A Deep Dive into Australian Wildlife Laws The definitive answer is no: eating koalas is illegal in Australia and is subject to significant penalties under both state and federal conservation laws. This article explores the reasons behi…,,2026-02-17T07:09:11Z,,The definitive answer is no: eating koalas is illegal in Australia and is subject to significant penalties under both state and federal conservation laws. This article explores the reasons behind thi… [+8567 chars],,en,'endangered species'
https://www.abc.net.au/news/2026-02-17/rare-plains-wanderer-bird-recorded-on-cattle-station/106350256,https://www.abc.net.au/news/2026-02-17/rare-plains-wanderer-bird-recorded-on-cattle-station/106350256,0,www.abc.net.au,Rare bird spotted on outback cattle station for first time,A project with dozens of monitoring sites across the Queensland property confirms the presence of the critically endangered plains-wanderer by analysing bird calls.,https://live-production.wcms.abc-cdn.net.au/5fe353a70db1fadfcac085abb1163042?impolicy=wcms_watermark_news&cropH=900&cropW=1600&xPos=0&yPos=23&width=862&height=485&imformat=generic,2026-02-17T00:40:18Z,,"Ecologists say they have confirmed the presence of a critically endangered bird on a western Queensland pastoral lease where it was previously unrecorded.
Australian Wildlife Conservancy (AWC) staff… [+3743 chars]",,en,'endangered species'
https://www.spacedaily.com/reports/Study_maps_thousands_of_non_native_plants_that_could_colonize_Arctic_999.html,https://www.spacedaily.com/reports/Study_maps_thousands_of_non_native_plants_that_could_colonize_Arctic_999.html,0,www.spacedaily.com,Study maps thousands of non native plants that could colonize Arctic,"Berlin, Germany (SPX) Feb 04, 2026


Species that are not native to an area can displace the species that already live there, and the Intergovernmental Panel on Nature has identified invasive alien organisms as one of the greatest threats to global biodiversi…",https://www.spxdaily.com/images-hg/common-meadow-rue-thalictrum-flavum-svalbard-alien-species-arctic-hg.jpg,2026-02-05T12:52:01Z,,"by Robert SchreiberBerlin, Germany (SPX) Feb 04, 2026
Species that are not native to an area can displace the species that already live there, and the Intergovernmental Panel on Nature has identifie… [+5974 chars]",,en,'invasive alien species'
https://www.irishtimes.com/environment/2026/02/12/we-dont-have-a-plan-invasive-species-take-hold-as-implementation-lags-legislation/,https://www.irishtimes.com/environment/2026/02/12/we-dont-have-a-plan-invasive-species-take-hold-as-implementation-lags-legislation/,0,www.irishtimes.com,‘We don’t have a plan’: Invasive species take hold as action lags legislation,"Sitka spruce, sika deer and common garden plants are all invasive species with potential to cause harm to native varieties",https://www.irishtimes.com/resizer/v2/I52Z5OIJJJEOLKH7UDN3O26NKY.jpg?smart=true&auth=663dff0a1e6f3c0bb52131f07476adfc1cadf08c933b18cfb80d2f7583157f58&width=1200&height=630,2026-02-12T06:00:00Z,,"The tipping point has been reached, says Noeleen Smyth, head of horticulture at UCD, referring to non-native plant species now outnumbering native ones growing in Ireland. It raises profound question… [+8233 chars]",,en,'invasive alien species'
https://theconversation.com/dogs-and-cats-carry-invasive-land-flatworms-from-garden-to-garden-274999,https://theconversation.com/dogs-and-cats-carry-invasive-land-flatworms-from-garden-to-garden-274999,0,theconversation.com,Dogs and cats carry invasive land flatworms from garden to garden,"Citizen science allows us to discover how invasive flatworms travel from garden to garden… surprisingly, on the backs of dogs and cats!",https://images.theconversation.com/files/716295/original/file-20260204-56-a82ctn.jpg?ixlib=rb-4.1.0&rect=0%2C161%2C2400%2C1200&q=45&auto=format&w=1356&h=668&fit=crop,2026-02-11T15:22:17Z,,"What was discovered?

Domestic dogs and cats can carry invasive flatworms (Platyhelminthes) attached to their fur. Unwittingly, this is how they contribute to the spread of these invasive alien speci… [+4101 chars]",,en,'invasive alien species'
https://www.animenewsnetwork.com/news/2026-02-06/new-magical-girl-lyrical-nanoha-anime-confirms-more-cast-ending-song/.233902,https://www.animenewsnetwork.com/news/2026-02-06/new-magical-girl-lyrical-nanoha-anime-confirms-more-cast-ending-song/.233902,0,www.animenewsnetwork.com,"New Magical Girl Lyrical Nanoha Anime Confirms More Cast, Ending Song","Yuna Ogata, Akinari Sato, Yukana confirmed in cast with ending theme by Hina Aoki",https://www.animenewsnetwork.com/thumbnails/crop600x315gI2/herald/194971/nanoha-exgv-chara.jpg,2026-02-06T12:38:55Z,,"The staff for the Magical Girl Lyrical Nanohafranchise confirmed three more cast members, more information on the characters, and the ending theme song's artist for Magical Girl Lyrical Nanoha EXCEED… [+3782 chars]",,en,'invasive alien species'
https://journals.plos.org/plosone/article?id=10.1371/journal.pone.0341820,https://journals.plos.org/plosone/article?id=10.1371/journal.pone.0341820,0,journals.plos.org,"Genetic diversity, phylogeography, population structure, and demographic history of wild Catla catla at a transboundary scale across South Asia revealed by Mitochondrial COI sequences","This study presents the first assessment of mitochondrial cytochrome c oxidase I (COI) sequences from multiple countries to evaluate the genetic diversity, phylogeographic relationships, population structure, and demographic history of wild Catla catla in Sou…",https://journals.plos.org/plosone/article/figure/image?id=10.1371/journal.pone.0341820.g005&size=inline,2026-02-02T14:00:00Z,,"Abstract
This study presents the first assessment of mitochondrial cytochrome c oxidase I (COI) sequences from multiple countries to evaluate the genetic diversity, phylogeographic relationships, po… [+35011 chars]",,en,'invasive alien species'
