index,url,valid,domain,title,description,image,published,archive,content,quote,language,keyword
https://www.forbes.com/sites/simithambi/2025/06/12/ocean-jargon-made-simple-3-words-you-need-to-know-this-week/,https://www.forbes.com/sites/simithambi/2025/06/12/ocean-jargon-made-simple-3-words-you-need-to-know-this-week/,0,www.forbes.com,"Ocean Jargon, Made Simple: 3 Words You Need To Know This Week","World leaders have gathered this week for the United Nations Ocean Conference. To simplify your understanding of the conference's outcomes, here are three words to know.",https://imageio.forbes.com/specials-images/imageserve/684a6380918b33b3e5fca6e3/0x0.jpg?format=jpg&height=900&width=1600&fit=bounds,2025-06-12T10:00:32Z,,"France's Preside Macron delivers a speech ahead the third United Nations Ocean Conference (UNOC3), ... More which gathers leaders, researchers and activists to discuss how to protect marine life, in … [+6439 chars]",,en,'Sustainable Development Goal 14'
https://www.cleanthesky.com/innovation/one-ocean-finance,https://www.cleanthesky.com/innovation/one-ocean-finance,0,www.cleanthesky.com,Collaborative Ocean Conservation Funds - The UN and Partners Set Off to Establish One Ocean Finance (TrendHunter.com),"(TrendHunter.com) The United Nations and its partner organizations have launched a collaborative effort to establish One Ocean Finance, a global financial mechanism designed to address chronic underfunding of ocean...",https://cdn.trendhunterstatic.com/thumbs/573/one-ocean-finance.jpeg,2025-06-10T00:20:04Z,,"The United Nations and its partner organizations have launched a collaborative effort to establish One Ocean Finance, a global financial mechanism designed to address chronic underfunding of ocean co… [+998 chars]",,en,'Sustainable Development Goal 14'
https://news.un.org/en/story/2025/06/1164381,https://news.un.org/en/story/2025/06/1164381,0,news.un.org,UN ocean summit in Nice closes with wave of commitments,"Ships in the port of Nice sounded their fog-horns on Friday, a brassy crescendo to a rare moment of global unity as the Third UN Ocean Conference drew to a close. Moments earlier, more than 170 countries had adopted by consensus a sweeping political declarati…",https://global.unitednations.entermediadb.net/assets/mediadb/services/module/asset/downloads/preset/Collections/Embargoed/29-05-2025-World-Ocean-Day-Competition-03.jpg/image770x420cropped.jpg,2025-06-13T12:00:00Z,,"We close this historic week not just with hope, but with concrete commitment, clear direction, and undeniable momentum, Li Junhua, the UNs Under-Secretary-General for Economic and Social Affairs and … [+6698 chars]",,en,'Sustainable Development Goal 14'
https://press.un.org/en/2025/sea2231.doc.htm,https://press.un.org/en/2025/sea2231.doc.htm,0,press.un.org,"Nice Conference Adopts Declaration Underscoring Vital Importance of Ocean to Life on Our Planet, Essential Role in Mitigating Climate Change","NICE, FRANCE, 13 June — After a week of deliberation and discussion, the United Nations Ocean Conference today by consensus adopted a political declaration titled “Our ocean, our future: united for urgent action”, stressing that the ocean plays an essential r…",,2025-06-13T18:11:41Z,,"NICE, FRANCE, 13 June After a week of deliberation and discussion, the United Nations Ocean Conference today by consensus adopted a political declaration titled Our ocean, our future:  united for urg… [+6584 chars]",,en,'Sustainable Development Goal 14'
https://statetimes.in/dr-jitendra-leaves-for-france-to-lead-high-level-official-indian-delegation/,https://statetimes.in/dr-jitendra-leaves-for-france-to-lead-high-level-official-indian-delegation/,0,statetimes.in,Dr Jitendra leaves for France to lead high-level official Indian Delegation,"STATE TIMES NEWS NEW DELHI: Union Minister of Earth Sciences (Independent Charge) Dr Jitendra Singh on Saturday left for France to lead a high-level official Indian delegation. Scheduled to be held at the French picturesque coastal city of Nice, the Minister …",https://statetimes.in/wp-content/uploads/2025/06/Jitender-6.jpg,2025-06-07T18:23:17Z,,"STATE TIMES NEWS
NEW DELHI: Union Minister of Earth Sciences (Independent Charge) Dr Jitendra Singh on Saturday left for France to lead a high-level official Indian delegation.
Scheduled to be held… [+3523 chars]",,en,'Sustainable Development Goal 14'
https://blog.paavo.me/radiant-ai/,https://blog.paavo.me/radiant-ai/,0,blog.paavo.me,"What was Radiant AI, anyway?",A ridiculously deep dive into Oblivion's controversial AI system and its legacy,https://blog.paavo.me/processed_images/remastered.1b1d855ff841c3d5.png,2025-06-07T13:22:53Z,,"A ridiculously deep dive into Oblivion's controversial AI system and its legacy
2025-06-07 92 min read
Table of contents
<ol><li>Wake up, were here</li><li>What was promised</li><li>So what was Ra… [+97576 chars]",,en,'poaching'
https://www.yahoo.com/news/researchers-horrified-disturbing-discovery-captured-111540885.html,https://www.yahoo.com/news/researchers-horrified-disturbing-discovery-captured-111540885.html,0,www.yahoo.com,Researchers horrified by disturbing discovery captured in trendy cafes: 'There's a lot more … than we previously thought',"""It’s natural to feel affectionate toward otters, but we need to leave them in the wild.""",https://s.yimg.com/ny/api/res/1.2/XY.4pLOmmF8_rXHVx69D3w--/YXBwaWQ9aGlnaGxhbmRlcjt3PTEyMDA7aD04MDA-/https://media.zenfs.com/en/the_cool_down_737/5ff5f90e05ae9dd0e3a5760dccb99375,2025-06-07T11:15:40Z,,"Asian small-clawed otters have a cult following on the internet, particularly in Japan. However, researchers recently found evidence of extensive, behind-the-scenes poaching driven by their popularit… [+2753 chars]",,en,'poaching'
https://petapixel.com/2025/06/10/the-wild-ones-captured-worlds-most-endangered-species-with-over-350-custom-cameras/,https://petapixel.com/2025/06/10/the-wild-ones-captured-worlds-most-endangered-species-with-over-350-custom-cameras/,0,petapixel.com,‘The Wild Ones’ Captured World’s Most Endangered Species With Over 350 Custom Cameras,"The upcoming Apple TV+ documentary series The Wild Ones follows a team of wildlife experts on a globe-trotting journey to track and protect some of the world's most endangered species. The six-part series was filmed using over 350 custom-built remote cameras,…",https://petapixel.com/assets/uploads/2025/06/The_Wild_Ones_Photo_010404.jpg,2025-06-10T18:32:28Z,,The upcoming Apple TV+ documentary series The Wild Ones follows a team of wildlife experts on a globe-trotting journey to track and protect some of the world’s most endangered species. The six-part s… [+2574 chars],,en,'poaching'
https://www.droid-life.com/2025/06/09/apple-just-straight-copied-googles-call-screen-and-hold-for-me-features/,https://www.droid-life.com/2025/06/09/apple-just-straight-copied-googles-call-screen-and-hold-for-me-features/,0,www.droid-life.com,Apple Just Straight Copied Google’s Call Screen and Hold For Me Features,"I can’t tell you how often I see a post in a comment section or on reddit where people share the reasons they choose Google’s Pixel and they mention call screening. It’s got to be one of the top reasons people continue to stick with Google’s phones, because i…",https://www.droid-life.com/wp-content/uploads/2025/06/Apple-iOS-26-Hold-Assist-1200x628-cropped.jpg,2025-06-09T17:41:27Z,,I can’t tell you how often I see a post in a comment section or on reddit where people share the reasons they choose Google’s Pixel and they mention call screening. It’s got to be one of the top reas… [+2035 chars],,en,'poaching'
https://www.aljazeera.com/news/2025/6/11/dozens-of-white-rhinos-relocated-from-south-africa-to-rwanda,https://www.aljazeera.com/news/2025/6/11/dozens-of-white-rhinos-relocated-from-south-africa-to-rwanda,0,www.aljazeera.com,Dozens of white rhinos relocated from South Africa to Rwanda,Two batches of 35 rhinos moved by truck and airliner as part of major rewilding involving South Africa and Rwanda.,https://www.aljazeera.com/wp-content/uploads/2025/06/AFP__20230904__33UA6YM__v2__HighRes__FilesSafricaConservationRhino-1749621196.jpg?resize=1920%2C1440,2025-06-11T06:10:08Z,,"Seventy southern white rhinos have completed a journey of more than 3,400 kilometres (at least 2,112 miles) by truck and Boeing 747 from South Africa to Rwanda in what has been described as the large… [+2570 chars]",,en,'poaching'
http://deadline.com/2025/06/disney-justin-connolly-breach-of-contract-lawsuit-youtube-1236409098/,http://deadline.com/2025/06/disney-justin-connolly-breach-of-contract-lawsuit-youtube-1236409098/,0,deadline.com,YouTube Fires Back At Disney Over Justin Connolly Breach Of Contract Suit – Update,UPDATED with YouTube response: YouTube today blasted a lawsuit by Disney over the tech giant’s alleged poaching of 20-year Mouse veteran Justin Connolly. The suit filed in LA Superior Court seeks a preliminary injunction to block the recently departed preside…,https://deadline.com/wp-content/uploads/2025/05/Justin-Connolly-Mosk-Courthouse.jpg?w=1000,2025-06-03T20:33:00Z,,"UPDATED with YouTube response: YouTube today blasted a lawsuit by Disney over the tech giant’s alleged poaching of 20-year Mouse veteran Justin Connolly. 
The suit filed in LA Superior Court seeks a… [+5922 chars]",,en,'poaching'
http://deadline.com/2025/06/disney-justin-connelly-youtube-legal-battle-1236423592/,http://deadline.com/2025/06/disney-justin-connelly-youtube-legal-battle-1236423592/,0,deadline.com,Disney Can’t Stop Justin Connolly Working At YouTube As Court Says Fuhgeddaboudit,"Despite the best legal efforts of the Walt Disney Company, looks like Justin Connolly is going to be working at YouTube. A LA Superior Court judge this morning pulled the plug on the Bob Iger-run Mouse House’s efforts to hit the pause button on the so-called …",https://deadline.com/wp-content/uploads/2025/06/Justin-Connolly.jpg?w=1024,2025-06-04T22:38:23Z,,"Despite the best legal efforts of the Walt Disney Company, looks like Justin Connolly is going to be working at YouTube.
A LA Superior Court judge this morning pulled the plug on the Bob Iger-run Mo… [+3020 chars]",,en,'poaching'
https://www.forbes.com/sites/ceciliarodriguez/2025/06/08/16-iconic-wild-animal-photos-celebrating-10-years-of-remembering-wildlife/,https://www.forbes.com/sites/ceciliarodriguez/2025/06/08/16-iconic-wild-animal-photos-celebrating-10-years-of-remembering-wildlife/,0,www.forbes.com,16 Iconic Wild Animal Photos Celebrating 10 Years Of Remembering Wildlife,"The pangolin opens the new Remembering Wildlife, a book containing stunning images donated by many of the world’s top wildlife photographers.",https://imageio.forbes.com/specials-images/imageserve/683f5039df7970a7678eafa8/0x0.jpg?format=jpg&height=900&width=1600&fit=bounds,2025-06-08T14:00:01Z,,"Remembering Cheetahs
Kevin Dooley - Remembering WIldlife
To celebrate its 10th year anniversary, Remembering Wildlife - the book series that through wild animals photography raises funds to support… [+8278 chars]",,en,'poaching'
https://www.tomshardware.com/tech-industry/semiconductors/nvidia-accused-of-poaching-tsmc-engineers-in-taiwan-salaries-offered-for-talent-reach-up-to-usd180-000,https://www.tomshardware.com/tech-industry/semiconductors/nvidia-accused-of-poaching-tsmc-engineers-in-taiwan-salaries-offered-for-talent-reach-up-to-usd180-000,0,www.tomshardware.com,"Nvidia accused of poaching TSMC engineers in Taiwan – Salaries offered for talent reach up to $180,000",The media in Taiwan have highlighted the lucrative compensation packages being used to tempt engineers to fill key roles and fuel Nvidia’s ambitious expansion plans.,https://cdn.mos.cms.futurecdn.net/uSniTi8fQvbksjGQR6jBPL.jpg,2025-06-04T12:23:54Z,,The media in Taiwan have highlighted the lucrative compensation packages purportedly being used to tempt engineers to fill key roles and fuel Nvidia’s ambitious expansion plans. Senior engineers shou… [+2973 chars],,en,'poaching'
http://skift.com/2025/06/11/airbnbs-poaching-experiences-ihgs-u-s-bounce-and-melias-expansion-plans/,http://skift.com/2025/06/11/airbnbs-poaching-experiences-ihgs-u-s-bounce-and-melias-expansion-plans/,0,skift.com,"Airbnb’s Poaching Experiences, IHG's U.S. Bounce and Meliá's Expansion Plans","For today’s pod we look at Airbnb’s aggressive expansion approach, IHG’s good news in the U.S., and Melia’s equally good news about Mediterranean numbers.","https://skift.com/wp-content/uploads/2025/05/Services-flow-Summer-Release-2025-US.jpg?resize=1024,683",2025-06-11T07:57:00Z,,"Good morning from Skift. Its Wednesday, June 11. Heres what you need to know about the business of travel today. 
Airbnb has been outed by two tour platforms for trying to poach their guides as the … [+2128 chars]",,en,'poaching'
http://skift.com/2025/06/10/airbnb-accused-of-poaching-tour-guides-from-rival-platforms-to-grow-experiences/,http://skift.com/2025/06/10/airbnb-accused-of-poaching-tour-guides-from-rival-platforms-to-grow-experiences/,0,skift.com,Airbnb Accused of Poaching Tour Guides From Rival Platforms to Grow Experiences,"Whether the poaching attempts were a rogue or not, it's clear that Airbnb is going all-out to compete in its new experiences business.","https://skift.com/wp-content/uploads/2024/07/DE_TOURSBYLOCALS_SHOT10_8891-FINAL.jpg?resize=1024,683",2025-06-10T18:46:08Z,,"Airbnb needs to expand its tour supply for its newly relaunched Experiences business, and two rival tour platforms say Airbnb tried to poach their guides.
Canada-headquartered ToursByLocals and Neth… [+461 chars]",,en,'poaching'
https://www.forbes.com/councils/forbesbusinesscouncil/2025/06/11/from-crisis-to-response-addressing-the-climate-challenge/,https://www.forbes.com/councils/forbesbusinesscouncil/2025/06/11/from-crisis-to-response-addressing-the-climate-challenge/,0,www.forbes.com,From Crisis To Response: Addressing The Climate Challenge,Sustainability doesn't need to be the cost of doing business.,https://imageio.forbes.com/specials-images/imageserve/659c2d1488df177bd020a272/0x0.jpg?format=jpg&height=900&width=1600&fit=bounds,2025-06-11T11:30:00Z,,"Sahit Muja is Founder &amp; CEO at Albanian Minerals, Green Natural Wonders, Green Minerals, Global Mining, Metalplant.
getty
In an era where climate change is accelerating and driving record-high … [+6886 chars]",,en,'land degradation'
https://www.project-syndicate.org/commentary/anti-green-politics-doesnt-weaken-case-for-sustainable-production-and-climate-adaptation-by-jonathan-hall-2025-06,https://www.project-syndicate.org/commentary/anti-green-politics-doesnt-weaken-case-for-sustainable-production-and-climate-adaptation-by-jonathan-hall-2025-06,0,www.project-syndicate.org,Political Changes Don’t Weaken the Case for Green Business,"Businesses that fail to manage climate-driven risks will face higher costs, increased regulatory scrutiny, and reputational damage. Although political developments in some countries would seem to discourage “green” business strategies, consumer preferences an…",https://webapi.project-syndicate.org/library/8bde90a5d082dc5573a5649c69e81b04.2-1-super.1.jpg,2025-06-13T15:32:05Z,,"Businesses that fail to manage climate-driven risks will face higher costs, increased regulatory scrutiny, and reputational damage. Although political developments in some countries would seem to dis… [+6307 chars]",,en,'land degradation'
https://www.counterpunch.org/2025/06/13/plummeting-insects/,https://www.counterpunch.org/2025/06/13/plummeting-insects/,0,www.counterpunch.org,Plummeting Insects,"Insects are vanishing from pristine rainforests. “Around the world many insect populations are crashing.” (Natural History Museum, April 2025) Insects are crucial for the health of nature, whereas humans are not. And since insects are ‘dropping like flies’, d…",https://www.counterpunch.org/wp-content/uploads/2025/06/europeana-1P_rsdwdx0c-unsplash-scaled.jpg,2025-06-13T05:56:01Z,,"Image by Europeana.
Insects are vanishing from pristine rainforests. Around the world many insect populations are crashing. (Natural History Museum, April 2025)
Insects are crucial for the health o… [+6823 chars]",,en,'land degradation'
https://www.nationalobserver.com/2025/06/13/news/how-us-became-biggest-military-emitter-stopped-everyone-finding-out,https://www.nationalobserver.com/2025/06/13/news/how-us-became-biggest-military-emitter-stopped-everyone-finding-out,0,www.nationalobserver.com,How the US became the biggest military emitter and stopped everyone finding out,"Academic Neta Crawford warns that if Donald Trump follows through on his threats of war, emissions will soar and the planet will pay the price",https://www.nationalobserver.com/sites/default/files/img/2025/06/12/44579666601_42d8534793_b.jpg,2025-06-13T09:09:05Z,,"This story was originally published by The Guardian and appears here as part of the Climate Desk collaboration
The climate impact of Donald Trumps geopolitical ambitions could deepen planetary catas… [+11497 chars]",,en,'land degradation'
https://www.geeksaresexy.net/2025/06/05/new-trailer-for-alien-earth-drops-and-its-absolutely-crawling-with-nightmares/,https://www.geeksaresexy.net/2025/06/05/new-trailer-for-alien-earth-drops-and-its-absolutely-crawling-with-nightmares/,0,www.geeksaresexy.net,"New Trailer for Alien: Earth Drops, and It’s Absolutely Crawling With Nightmares","The wait is over, and the horror is here. FX has finally unleashed the full trailer for Alien: Earth, and if you thought facehuggers were your only problem, think again. This isn’t just another xenomorph rerun: this is an all-new invasion, and it’s happening …",https://www.geeksaresexy.net/wp-content/uploads/2025/06/alien.jpg,2025-06-05T14:06:58Z,,"The wait is over, and the horror is here. FX has finally unleashed the full trailer for Alien: Earth, and if you thought facehuggers were your only problem, think again. This isnt just another xenomo… [+1132 chars]",,en,'invasive alien species'
https://www.globalsecurity.org/intell/library/news/2025/intell-250611-globaltimes01.htm,https://www.globalsecurity.org/intell/library/news/2025/intell-250611-globaltimes01.htm,0,www.globalsecurity.org,"China's MSS discloses case of overseas recruitment for illegal biological data collection, safeguarding biological security","China's Ministry of State Security (MSS) on Wednesday reminded the public to be vigilant against overseas organizations recruiting volunteers to illegally collect information on China's biological species, in order to safeguard biological security.",,2025-06-11T06:40:10Z,,"Global Times
By Global Times Published: Jun 11, 2025 11:12 AM
China's Ministry of State Security (MSS) on Wednesday reminded the public to be vigilant against overseas organizations recruiting volu… [+4528 chars]",,en,'invasive alien species'
http://comicbook.com/tv-shows/news/alien-earth-tv-show-full-trailer-xenomorph-facehuggers/,http://comicbook.com/tv-shows/news/alien-earth-tv-show-full-trailer-xenomorph-facehuggers/,0,comicbook.com,Full Alien: Earth Trailer Finally Released (And It Looks Nuts),"Image courtesy of FX
The full-length trailer for Noah Hawley’s highly anticipated FX series, Alien: Earth, has officially been unleashed, providing audiences with their best look yet at the terrifying new chapter in the iconic sci-fi horror saga. This fresh g…","https://comicbook.com/wp-content/uploads/sites/4/2025/05/Sydney-Chandler-in-Alien-Earth.jpg?resize=2000,1125",2025-06-05T13:00:00Z,,"The full-length trailer for Noah Hawleys highly anticipated FX series, Alien: Earth, has officially been unleashed, providing audiences with their best look yet at the terrifying new chapter in the i… [+4172 chars]",,en,'invasive alien species'
https://www.thestar.com.my/news/nation/2025/06/18/usm-um-among-worlds-top-for-sdg-impact,https://www.thestar.com.my/news/nation/2025/06/18/usm-um-among-worlds-top-for-sdg-impact,0,www.thestar.com.my,"USM, UM among world’s top for SDG impact",PETALING JAYA: Universiti Sains Malaysia (USM) has emerged as Malaysia's highest-ranked institution in the Times Higher Education (THE) University Impact Rankings 2025. Read full story,https://apicms.thestar.com.my/uploads/images/2025/06/18/3372255.jpg,2025-06-18T00:14:00Z,,"PETALING JAYA: Universiti Sains Malaysia (USM) has emerged as Malaysias highest-ranked institution in the Times Higher Education (THE) University Impact Rankings 2025.
It sits in joint 14th position… [+2583 chars]",,en,'SDG 15'
https://www.hurriyetdailynews.com/pangolin-the-worlds-most-trafficked-mammal-210426,https://www.hurriyetdailynews.com/pangolin-the-worlds-most-trafficked-mammal-210426,0,www.hurriyetdailynews.com,"Pangolin, the world's most trafficked mammal","U.S. officials proposed on June 16 to protect the pangolin, a small, nocturnal mammal covered in scales, under the Endangered Species Act.",https://image.hurimg.com/i/hurriyet/75/200x200/68520854800566f0ba3eb8ec.jpg,2025-06-18T05:59:51Z,,"WASHINGTON
U.S. officials proposed on June 16 to protect the pangolin, a small, nocturnal mammal covered in scales, under the Endangered Species Act.
The pangolin is the most trafficked mammal in t… [+1919 chars]",,en,'species conservation'
https://www.pbs.org/newshour/politics/46-programs-trump-wants-to-eliminate-according-to-his-proposed-budget,https://www.pbs.org/newshour/politics/46-programs-trump-wants-to-eliminate-according-to-his-proposed-budget,0,www.pbs.org,"46 programs Trump wants to eliminate, according to his proposed budget",Here are programs and agencies Trump proposes to eliminate in his budget.,https://d3i6fh83elv35t.cloudfront.net/static/2025/06/2025-05-28T165240Z_530685734_RC2ZQEAM5ATM_RTRMADP_3_USA-TRUMP-1024x683.jpg,2025-06-05T20:14:24Z,,"For more politics coverage and analysis, sign up for Heres the Deal, our weekly politics newsletter, here.
Presidential budget proposals are usually seen as symbolic. But President Donald Trump is r… [+6792 chars]",,en,'species conservation'
https://journals.plos.org/plosone/article?id=10.1371/journal.pone.0325758,https://journals.plos.org/plosone/article?id=10.1371/journal.pone.0325758,0,journals.plos.org,"Factors affecting spatio-temporal occurrence of sympatric civets in Parsa-Koshi Complex, Nepal","Understanding the effect of biotic and abiotic factors, including habitat and interspecific competition, is crucial for species conservation. We quantified spatio-temporal patterns of sympatric large Indian civet (LIC; Viverra zibetha) and small Indian civet …",https://journals.plos.org/plosone/article/figure/image?id=10.1371/journal.pone.0325758.g004&size=inline,2025-06-11T14:00:00Z,,"Abstract
Understanding the effect of biotic and abiotic factors, including habitat and interspecific competition, is crucial for species conservation. We quantified spatio-temporal patterns of sympa… [+31082 chars]",,en,'species conservation'
https://theconversation.com/beyond-de-extinction-and-dire-wolves-gene-editing-can-help-todays-endangered-species-254670,https://theconversation.com/beyond-de-extinction-and-dire-wolves-gene-editing-can-help-todays-endangered-species-254670,0,theconversation.com,"Beyond de-extinction and dire wolves, gene editing can help today’s endangered species",A legal scholar with a Ph.D. in wildlife genetics explains the promise biotechnology techniques hold for some animals that are currently endangered.,https://images.theconversation.com/files/672624/original/file-20250605-74-i0vqba.jpg?ixlib=rb-4.1.0&rect=0%2C275%2C3316%2C1658&q=45&auto=format&w=1356&h=668&fit=crop,2025-06-06T12:53:06Z,,"Only a few hundred red wolves still exist, most in captivity. JeffGoulden/E+ via Getty Images
Have you been hearing about the dire wolf lately? Maybe you saw a massive white wolf on the cover of Tim… [+8555 chars]",,en,'species conservation'
https://www.nationalobserver.com/2025/06/17/opinion/doug-ford-threatening-environmental-stewardship-democratic-norms-indigenous,https://www.nationalobserver.com/2025/06/17/opinion/doug-ford-threatening-environmental-stewardship-democratic-norms-indigenous,0,www.nationalobserver.com,"Doug Ford is threatening environmental stewardship, democratic norms, and Indigenous rights","The Ford government's so-called ""economic growth"" law is a gross abuse of authority, threatening Ontario's biodiversity, Indigenous rights and democracy.",https://www.nationalobserver.com/sites/default/files/img/2025/06/12/doug_ford_joey_coleman_flickr.jpg,2025-06-18T09:09:04Z,,"In just over a month, Doug Fords Conservative government has rammed through perhaps its most serious attack on environmental stewardship, democratic norms and Indigenous rights. The Protect Ontario b… [+5152 chars]",,en,'species conservation'
https://www.pbs.org/newshour/science/how-gene-editing-can-help-todays-endangered-species,https://www.pbs.org/newshour/science/how-gene-editing-can-help-todays-endangered-species,0,www.pbs.org,How gene editing can help today’s endangered species,A legal scholar with a Ph.D. in wildlife genetics explains the promise biotechnology techniques hold for some animals that are currently endangered.,https://d3i6fh83elv35t.cloudfront.net/static/2025/06/2023-10-25T100032Z_99239151_RC2UPS9W4Q0K_RTRMADP_3_USA-RED-WOLVES-1024x683.jpg,2025-06-07T14:00:00Z,,"This article was originally published by The Conversation. Read the original article.
Have you been hearing about the dire wolf lately? Maybe you saw a massive white wolf on the cover of Time magazi… [+8817 chars]",,en,'species conservation'
