index,url,valid,domain,title,description,image,published,archive,content,quote,language,keyword
https://www.globenewswire.com/news-release/2023/09/06/2738455/0/en/New-Guidance-on-Blue-Bonds-to-Help-Unlock-Finance-for-a-Sustainable-Ocean-Economy.html,https://www.globenewswire.com/news-release/2023/09/06/2738455/0/en/New-Guidance-on-Blue-Bonds-to-Help-Unlock-Finance-for-a-Sustainable-Ocean-Economy.html,0,www.globenewswire.com,New Guidance on Blue Bonds to Help Unlock Finance for a Sustainable Ocean Economy,"Washington, DC, USA, Sept. 06, 2023 (GLOBE NEWSWIRE) -- The International Finance Corporation (IFC), a member of the World Bank Group, together with the International Capital Market Association (ICMA), United Nations Global Compact (UN Global Compact), United…",https://ml.globenewswire.com/Resource/Download/825c9a22-5498-4b3a-943e-d47b75cc2463,2023-09-06T13:00:00Z,,"Washington, DC, USA, Sept. 06, 2023 (GLOBE NEWSWIRE) -- The International Finance Corporation (IFC), a member of the World Bank Group, together with the International Capital Market Association (ICMA… [+8423 chars]",,en,'Sustainable Development Goal 14'
https://press.un.org/en/2023/ga12523.doc.htm,https://press.un.org/en/2023/ga12523.doc.htm,0,press.un.org,"General Assembly Adopts 5 Resolutions, 3 Decisions, including Text Urging States to Consider Need for Woman Secretary-General","The General Assembly adopted today 5 resolutions and 3 decisions, including one that reaffirms the organ’s role in peace, security and the veto initiative, while also encouraging States to keep in mind that there has yet to be a woman Secretary-General.",,2023-09-01T22:00:01Z,,"The General Assembly adopted today 5 resolutions and 3 decisions, including one that reaffirms the organs role in peace, security and the veto initiative, while also encouraging States to keep in min… [+29037 chars]",,en,'Sustainable Development Goal 14'
https://www.prnewswire.co.uk/news-releases/tuck-advisors-announces-environmental-partnership-with-evertreen-301930888.html,https://www.prnewswire.co.uk/news-releases/tuck-advisors-announces-environmental-partnership-with-evertreen-301930888.html,0,www.prnewswire.co.uk,Tuck Advisors Announces Environmental Partnership with Evertreen,"LONDON, Sept. 18, 2023 /PRNewswire/ -- Tuck Advisors, a global M&A Advisory firm that works with companies having a positive social impact in education and healthcare, is proud to announce its collaboration with UK-based Evertreen to help address the climate …",,2023-09-18T17:36:00Z,,"LONDON, Sept. 18, 2023 /PRNewswire/ -- T
uck Advisors
, a global M&amp;A Advisory firm that works with companies having a positive social impact in education and healthcare, is proud to announce it… [+3054 chars]",,en,'SDG 15'
https://www.marketscreener.com/quote/stock/KKR-CO-INC-44486777/news/Ontario-Teachers-Acquires-KKR-s-Stake-in-Environmental-Markets-Platform-GreenCollar-44862202/,https://www.marketscreener.com/quote/stock/KKR-CO-INC-44486777/news/Ontario-Teachers-Acquires-KKR-s-Stake-in-Environmental-Markets-Platform-GreenCollar-44862202/,0,www.marketscreener.com,Ontario Teachers' Acquires KKR's Stake in Environmental Markets Platform GreenCollar,"(marketscreener.com) 
Ontario Teachers’ Pension Plan and KKR, a leading global investment firm today announced the signing of a definitive agreement under which Ontario Teachers’ will acquire KKR and other shareholders’ stakes in GreenCollar, a leading Austra…",https://www.marketscreener.com/images/twitter_MS_fdnoir.png,2023-09-18T05:51:02Z,,"Ontario Teachers Pension Plan (Ontario Teachers) and KKR, a leading global investment firm today announced the signing of a definitive agreement under which Ontario Teachers will acquire KKR and othe… [+6814 chars]",,en,'SDG 15'
https://www.prnewswire.com/news-releases/tuck-advisors-announces-environmental-partnership-with-evertreen-301930881.html,https://www.prnewswire.com/news-releases/tuck-advisors-announces-environmental-partnership-with-evertreen-301930881.html,0,www.prnewswire.com,Tuck Advisors Announces Environmental Partnership with Evertreen,"LONDON, Sept. 18, 2023 /PRNewswire/ -- Tuck Advisors, a global M&A Advisory firm that works with companies having a positive social impact in education and healthcare, is proud to announce its collaboration with UK-based Evertreen to help address the climate …",,2023-09-18T17:33:00Z,,"LONDON, Sept. 18, 2023 /PRNewswire/ -- T
uck Advisors
, a global M&amp;A Advisory firm that works with companies having a positive social impact in education and healthcare, is proud to announce it… [+3032 chars]",,en,'SDG 15'
https://www.ibtimes.com.au/press-release/20230918/ontario-teachers-acquires-kkrs-stake-in-environmental-markets-platform-greencollar,https://www.ibtimes.com.au/press-release/20230918/ontario-teachers-acquires-kkrs-stake-in-environmental-markets-platform-greencollar,0,www.ibtimes.com.au,Ontario Teachers’ Acquires KKR’s Stake in Environmental Markets Platform GreenCollar,"SYDNEY & TORONTO--(BUSINESS WIRE)--Ontario Teachers’ Pension Plan (Ontario Teachers’) and KKR, a leading global investment firm today announced the signing of a definitive agreement under which Ontario Teachers’ will acquire KKR and other shareholders’ stakes…",,2023-09-18T06:40:12Z,,"SYDNEY &amp; TORONTO--(BUSINESS WIRE)--Ontario Teachers’ Pension Plan (Ontario Teachers’) and KKR, a leading global investment firm today announced the signing of a definitive agreement under which O… [+6971 chars]",,en,'SDG 15'
https://phys.org/news/2023-09-long-lived-lakes-evolution-freshwater-snails.html,https://phys.org/news/2023-09-long-lived-lakes-evolution-freshwater-snails.html,0,phys.org,Long-lived lakes as a driving force behind the evolution of freshwater snails,In long-lived lakes that existed for millions of years freshwater snails developed a particularly high diversity of species. A new study by SNSB paleobiologist Thomas A. Neubauer now shows the importance of these ecosystems for the evolution of freshwater sna…,https://scx2.b-cdn.net/gfx/news/hires/2023/long-lived-lakes-as-dr.jpg,2023-09-14T19:19:04Z,,In long-lived lakes that existed for millions of years freshwater snails developed a particularly high diversity of species. A new study by SNSB paleobiologist Thomas A. Neubauer now shows the import… [+4170 chars],,en,'diversity of species'
https://phys.org/news/2023-09-human-driven-mass-extinction-entire-tree.html,https://phys.org/news/2023-09-human-driven-mass-extinction-entire-tree.html,0,phys.org,Study finds human-driven mass extinction is eliminating entire branches of the tree of life,"The passenger pigeon. The Tasmanian tiger. The Baiji, or Yangtze river dolphin. These rank among the best-known recent victims of what many scientists have declared the sixth mass extinction, as human actions are wiping out vertebrate animal species hundreds …",https://scx2.b-cdn.net/gfx/news/hires/2023/tree-of-life-1.jpg,2023-09-18T19:00:01Z,,"The passenger pigeon. The Tasmanian tiger. The Baiji, or Yangtze river dolphin. These rank among the best-known recent victims of what many scientists have declared the sixth mass extinction, as huma… [+6802 chars]",,en,'diversity of species'
https://news.stanford.edu/2023/09/18/human-driven-mass-extinction-eliminating-entire-genera/,https://news.stanford.edu/2023/09/18/human-driven-mass-extinction-eliminating-entire-genera/,0,news.stanford.edu,Human-driven mass extinction is eliminating entire genera,"A new analysis of mass extinction at the genus level, from researchers at Stanford and the National Autonomous University of Mexico, finds a “mutilation of the tree of life” with massive potential harms to human society.",https://news.stanford.edu/wp-content/uploads/2023/09/Thylacinus_cynocephalus_Gould.jpg,2023-09-18T19:00:41Z,,"Illustration of Thylacinus cynocephalus from John Goulds The Mammals of Australia. This genus, also known as the Tasmanian tiger, was hunted to extinction by humans. (Image credit: Henry Constantine … [+6306 chars]",,en,'diversity of species'
https://www.prnewswire.com/news-releases/discovery-of-ancient-horn-chamber-reveals-ritual-performed-at-enigmatic-stone-structures-of-north-west-arabia-301923375.html,https://www.prnewswire.com/news-releases/discovery-of-ancient-horn-chamber-reveals-ritual-performed-at-enigmatic-stone-structures-of-north-west-arabia-301923375.html,0,www.prnewswire.com,Discovery of ancient 'Horn Chamber' reveals ritual performed at enigmatic stone structures of north-west Arabia,"- Two recently published studies detail nature and significance of apparent ceremonial offerings in mustatils, Neolithic structures where deposits of horns and skull parts suggest a sophisticated expression of deeply rooted beliefs - Research is supported by …",https://mma.prnewswire.com/media/2206896/Royal_Commission_AlUla_1.jpg?p=facebook,2023-09-11T13:30:00Z,,"- Two recently published studies detail nature and significance of apparent ceremonial offerings in mustatils, Neolithic structures where deposits of horns and skull parts suggest a sophisticated exp… [+10147 chars]",,en,'diversity of species'
https://journals.plos.org/plosone/article?id=10.1371/journal.pone.0291250,https://journals.plos.org/plosone/article?id=10.1371/journal.pone.0291250,0,journals.plos.org,"Legume-nodulating rhizobia are widespread in soils and plants across the island of O‘ahu, Hawai‘i","Legumes and their interaction with rhizobia represent one of the most well-characterized symbioses that are widespread across both natural and agricultural environments. However, larger distribution patterns and host associations on isolated Pacific islands w…",https://journals.plos.org/plosone/article/figure/image?id=10.1371/journal.pone.0291250.g003&size=inline,2023-09-11T14:00:00Z,,"Abstract
Legumes and their interaction with rhizobia represent one of the most well-characterized symbioses that are widespread across both natural and agricultural environments. However, larger dis… [+35372 chars]",,en,'diversity of species'
https://www.globenewswire.com/news-release/2023/09/19/2745289/0/en/Network-for-Teaching-Entrepreneurship-launches-competition-for-Sustainable-Development-Goals-innovations.html,https://www.globenewswire.com/news-release/2023/09/19/2745289/0/en/Network-for-Teaching-Entrepreneurship-launches-competition-for-Sustainable-Development-Goals-innovations.html,0,www.globenewswire.com,Network for Teaching Entrepreneurship launches competition for Sustainable Development Goals innovations,Young people aged 11 to 24 can now register for the annual World Series of Innovation Young people aged 11 to 24 can now register for the annual World Series of Innovation,https://ml.globenewswire.com/Resource/Download/bb844c23-64d9-405e-9a57-a19efded22d9,2023-09-19T06:00:00Z,,"NEW YORK, NY, Sept. 19, 2023 (GLOBE NEWSWIRE) -- Interested in solving some of the biggest challenges facing humanity? Starting today, young people aged 11 to 24 can compete for cash prizes in the an… [+3990 chars]",,en,'SDG 15'
https://www.npr.org/2023/09/06/1197835703/brazil-cyclone,https://www.npr.org/2023/09/06/1197835703/brazil-cyclone,0,www.npr.org,"A cyclone has killed over 20 people in Brazil, with more flooding expected",The southern Brazilian states of Rio Grande do Sul and neighboring Santa Catarina are reeling after a devastating cyclone killed 27 people and displaced thousands.,https://media.npr.org/assets/img/2023/09/06/brazil_floods_23248776314374_wide-992e4f0093a19b543d7cfc92732c2d77a4364c4d-s1400-c100.jpg,2023-09-06T13:30:41Z,,"RIO DE JANEIRO, Brazil A powerful cyclone ravaged southern Brazil, killing at least 27 people and displacing hundreds, local officials said Wednesday morning, raising the death toll as more victims h… [+2035 chars]",,en,'deforestation'
https://news.mongabay.com/2023/09/deforestation-in-the-amazon-rainforest-continues-to-plunge/,https://news.mongabay.com/2023/09/deforestation-in-the-amazon-rainforest-continues-to-plunge/,0,news.mongabay.com,Deforestation in the Amazon rainforest continues to plunge,"Deforestation in the Brazilian Amazon — Earth’s largest rainforest — is on a continued downward trajectory, according to data released today by Brazil’s national space research institute, INPE. INPE’s deforestation alert system, known as DETER, indicates that…",https://imgs.mongabay.com/wp-content/uploads/sites/20/2023/09/08182946/ecuador_236248-768x512.jpg,2023-09-13T21:09:06Z,,"<ul><li>Deforestation in the Brazilian Amazon continues to decline, according to data released today by Brazil’s national space research institute, INPE.</li><li>INPE’s deforestation alert system ind… [+2570 chars]",,en,'deforestation'
https://thenextweb.com/news/space-startup-open-comos-climate-change-satellites,https://thenextweb.com/news/space-startup-open-comos-climate-change-satellites,0,thenextweb.com,Space startup bags $50M to fight climate change with satellites,"Space startup Open Cosmos will accelerate its mission to protect our planet after raising $50mn in a new funding round. The UK-based company uses satellites to tackle environmental issues. By tapping AI, sensors, and Earth Observation (EO) imagery, the probes…",https://img-cdn.tnwcdn.com/image/tnw-blurple?filter_last=1&fit=1280%2C640&url=https%3A%2F%2Fcdn0.tnwcdn.com%2Fwp-content%2Fblogs.dir%2F1%2Ffiles%2F2023%2F09%2FUntitled-design-4.jpg&signature=bcb92415eab6121f21d91fde91b88116,2023-09-11T12:32:31Z,,"Space startup Open Cosmos will accelerate its mission to protect our planet after raising $50mn in a new funding round.
The UK-based company uses satellites to tackle environmental issues. By tappin… [+3461 chars]",,en,'deforestation'
https://thenextweb.com/news/carbon-offset-data-startup-treefera-raises-e2m-to-map-forests-with-ai,https://thenextweb.com/news/carbon-offset-data-startup-treefera-raises-e2m-to-map-forests-with-ai,0,thenextweb.com,Carbon offset data startup Treefera raises €2M to map forests with AI,"Treefera says it wants to transform the accuracy, transparency, and efficiency of the carbon offset industry with AI and data from a trillion trees across the globe. It just received a vote of confidence in the form of a €2mn seed round led by Concept Venture…",https://img-cdn.tnwcdn.com/image/tnw-blurple?filter_last=1&fit=1280%2C640&url=https%3A%2F%2Fcdn0.tnwcdn.com%2Fwp-content%2Fblogs.dir%2F1%2Ffiles%2F2023%2F09%2FTreefera-Founders-CRO-Caroline-Grey-and-CEO-Jonathan-Horn-e1694622377852.jpg&signature=a1bef682992c2dd1a6361198629e08d6,2023-09-13T16:39:22Z,,"Treefera says it wants to transform the accuracy, transparency, and efficiency of the carbon offset industry with AI and data from a trillion trees across the globe. It just received a vote of confid… [+2457 chars]",,en,'deforestation'
https://phys.org/news/2023-09-tackle-global-deforestation-crisis.html,https://phys.org/news/2023-09-tackle-global-deforestation-crisis.html,0,phys.org,How to tackle the global deforestation crisis,"Imagine if France, Germany and Spain were completely blanketed in forests—and then all those trees were quickly chopped down. That's nearly the amount of deforestation that occurred globally between 2001 and 2020, with profound consequences.",https://scx2.b-cdn.net/gfx/news/2023/how-to-tackle-the-glob.jpg,2023-09-19T14:53:10Z,,"Imagine if France, Germany and Spain were completely blanketed in forestsand then all those trees were quickly chopped down. That's nearly the amount of deforestation that occurred globally between 2… [+9494 chars]",,en,'deforestation'
https://phys.org/news/2023-09-deforestation-brazil-amazon-falls-indigenous.html,https://phys.org/news/2023-09-deforestation-brazil-amazon-falls-indigenous.html,0,phys.org,"Deforestation in Brazil Amazon falls, more Indigenous reserves approved","Deforestation in the Brazilian Amazon fell by 66 percent in August versus the same month last year, the government said Tuesday, while also announcing the demarcation of two new Indigenous reserves.",https://scx2.b-cdn.net/gfx/news/2023/a-forest-fire-burns-in.jpg,2023-09-06T08:21:44Z,,"Deforestation in the Brazilian Amazon fell by 66 percent in August versus the same month last year, the government said Tuesday, while also announcing the demarcation of two new Indigenous reserves.… [+3439 chars]",,en,'deforestation'
https://phys.org/news/2023-09-benefits-deforestation-reduction.html,https://phys.org/news/2023-09-benefits-deforestation-reduction.html,0,phys.org,Sharing benefits from the UN's deforestation reduction program remains challenging. Here's why,REDD+ is the United Nations' deforestation and forest degradation reduction program. It was established nearly 20 years ago and is still active in more than 65 countries.,https://scx2.b-cdn.net/gfx/news/hires/2021/1-forest.jpg,2023-09-04T15:31:04Z,,"REDD+ is the United Nations' deforestation and forest degradation reduction program. It was established nearly 20 years ago and is still active in more than 65 countries.
REDD+ allows people who pro… [+7228 chars]",,en,'deforestation'
https://phys.org/news/2023-09-qa-colonizing-space-humankind-commit.html,https://phys.org/news/2023-09-qa-colonizing-space-humankind-commit.html,0,phys.org,"Q&A: Rather than colonizing space, humankind needs to commit itself to saving the planet","Every day seems to bring news of multiplying ecological disasters—fires, floods, drought, deforestation, overfishing and coral reef die-offs.",https://scx2.b-cdn.net/gfx/news/hires/2023/pale-blue-dot-or-bust-1.jpg,2023-09-06T18:49:05Z,,"Every day seems to bring news of multiplying ecological disastersfires, floods, drought, deforestation, overfishing and coral reef die-offs.
Meanwhile, space flight is becoming increasingly common, … [+9838 chars]",,en,'deforestation'
http://grist.org/climate/amazon-deforestation-continues-to-plummet/,http://grist.org/climate/amazon-deforestation-continues-to-plummet/,0,grist.org,Amazon deforestation continues to plummet,"So far this year, the rate of deforestation is 48 percent lower than in 2022 and is at levels not seen since 2018.",https://grist.org/wp-content/uploads/2023/09/Amazon-rainforest-deforestation.jpeg,2023-09-07T17:50:36Z,,"August was another month of relatively good news for the Amazon rainforest: The rate of deforestation has continued to decline significantly.
Earlier this week, Marina Silva, Brazils environment min… [+3357 chars]",,en,'deforestation'
https://www.npr.org/sections/goatsandsoda/2023/09/21/1200816304/the-world-hopes-to-enact-a-pandemic-treaty-by-may-2024-will-it-succeed-or-flail,https://www.npr.org/sections/goatsandsoda/2023/09/21/1200816304/the-world-hopes-to-enact-a-pandemic-treaty-by-may-2024-will-it-succeed-or-flail,0,www.npr.org,The world hopes to enact a pandemic treaty by May 2024. Will it succeed or flail?,This week leaders at the U.N. adopted a declaration recognizing the need for nations to work together to address future pandemics. But Questions loom. How will it be enforced? Who's footing the bill?,https://media.npr.org/assets/img/2023/09/21/ljohnson-unpandemictreaty_wide-9d70d53c2353d8b936498b96158d5d0821974408-s1400-c100.jpg,2023-09-21T19:14:59Z,,"At the height of the pandemic, world leaders proposed a bold idea. They envisioned a pandemic treaty that would obligate countries to work together to prevent future health emergencies like COVID in … [+5794 chars]",,en,'deforestation'
https://www.greenlineprint.com/blog/is-there-enough-oxygen-for-a-growing-population,https://www.greenlineprint.com/blog/is-there-enough-oxygen-for-a-growing-population,0,www.greenlineprint.com,Is there enough oxygen for a growing population?,What are the lungs of the Earth? How much CO2 do humans breathe out? Read in our blog.,,2023-09-09T15:34:19Z,,"When breathing, our lungs only reduce the oxygen content in
air from  21% to 15%. This means the
total oxygen consumption per average human in a day is about 660 litres,
weighing less than a kilog… [+2079 chars]",,en,'deforestation'
https://biztoc.com/x/0711f38eff16d3fd,https://biztoc.com/x/0711f38eff16d3fd,0,biztoc.com,"In the battle against Amazon deforestation, Brazil offers cash rewards to municipalities","In a bid to slow down deforestation in the Amazon, Brazil will provide financial support to municipalities that have reduced deforestation rates the most. #amazon #brazil",https://c.biztoc.com/p/0711f38eff16d3fd/s.webp,2023-09-06T01:46:21Z,,"In a bid to slow down deforestation in the Amazon, Brazil will provide financial support to municipalities that have reduced deforestation rates the most.
#amazon#brazil
This story appeared on seat… [+14 chars]",,en,'deforestation'
https://news.yahoo.com/business-class-airline-passenger-shares-103000135.html,https://news.yahoo.com/business-class-airline-passenger-shares-103000135.html,0,news.yahoo.com,Business class airline passenger shares shocking photo of his ‘insulting’ in-flight meal: ‘[This] seems especially important’,"""Others are given a far more substantial and flavorful menu.""",https://s.yimg.com/ny/api/res/1.2/YFl3w8sgpWVgbvt9BMPUhg--/YXBwaWQ9aGlnaGxhbmRlcjt3PTEyMDA7aD04MDA-/https://media.zenfs.com/en/the_cool_down_737/ba2f9a2f39838a6a9bedbd3b4a52893d,2023-09-17T11:15:00Z,,"Kris Chari, a business class passenger on a seven-hour Japan Airlines flight, claimed that he was served a single banana as his vegan meal during the first meal service of the flight, Business Inside… [+2189 chars]",,en,'deforestation'
https://hbr.org/sponsored/2023/09/why-these-companies-are-choosing-collaboration-over-competition-for-a-climate-resilient-future,https://hbr.org/sponsored/2023/09/why-these-companies-are-choosing-collaboration-over-competition-for-a-climate-resilient-future,0,hbr.org,"Why These Companies Are Choosing Collaboration Over Competition, For a Climate Resilient Future - SPONSOR CONTENT FROM GLOBAL SALMON INITIATIVE",Sponsor content from GSI.,https://hbr.org/resources/images/article_assets/2023/08/gsi-HBR-hero_1200x675.jpg,2023-09-11T15:07:49Z,,"Sponsor content from GSI.
""&gt;
Sponsor content from GSI.
""&gt;
The global food system is facing the imperative to produce more with less, balancing the need to feed a growing population with the… [+7761 chars]",,en,'deforestation'
https://www.newscientist.com/article/2391648-humans-use-a-quarter-of-all-the-biomass-created-by-plants-on-land/,https://www.newscientist.com/article/2391648-humans-use-a-quarter-of-all-the-biomass-created-by-plants-on-land/,0,www.newscientist.com,Humans use a quarter of all the biomass created by plants on land,"To stay within safe planetary boundaries, humans should only use around 10 per cent of the biomass produced each year by plants on land, but we are currently way above that level",https://images.newscientist.com/wp-content/uploads/2023/09/13143519/SEI_171425854.jpg,2023-09-13T19:00:57Z,,"We are using more than our fair share
Charlie Rogers/Getty Images
Humans are now consuming over a quarter of the biomass produced each year by plants on land, leaving too little for wildlife and pu… [+4515 chars]",,en,'deforestation'
https://phys.org/news/2023-09-peru-mercury-illegal-gold-biodiversity.html,https://phys.org/news/2023-09-peru-mercury-illegal-gold-biodiversity.html,0,phys.org,Peru's Operation Mercury stopped most illegal gold mining in one biodiversity hotspot—then the COVID-19 pandemic hit,"Artisanal and small-scale gold mining is a lifeline for many who live in Madre de Dios, a region in southeastern Peru, where poverty is high and jobs are scarce. But the economic development in this part of the Amazon basin comes at a cost, as it causes defor…",https://scx2.b-cdn.net/gfx/news/hires/2023/perus-operation-mercur.jpg,2023-09-21T21:23:04Z,,"Artisanal and small-scale gold mining is a lifeline for many who live in Madre de Dios, a region in southeastern Peru, where poverty is high and jobs are scarce. But the economic development in this … [+6671 chars]",,en,'deforestation'
https://www.macworld.com/article/2062186/apple-huge-push-eco-friendly-accessories.html,https://www.macworld.com/article/2062186/apple-huge-push-eco-friendly-accessories.html,0,www.macworld.com,Apple may dump more than Lightning when it launches the iPhone 15,"Macworld







With less than a day to go until Apple unveils this year’s line-up of new iPhones with USB-C and Apple Watches with a faster S9 chip, evidence is growing to suggest that the company will also use the Wonderlust event to announce a radical cha…",https://www.macworld.com/wp-content/uploads/2023/09/iphone-leather-cases.jpg?quality=50&strip=all&w=1024,2023-09-11T14:19:17Z,,"Skip to contentType your search and hit enter
When you purchase through links in our articles, we may earn a small commission. This doesn't affect our editorial independence
.
With less than a day… [+3242 chars]",,en,'deforestation'
https://phys.org/news/2023-09-climate-affect-biodiversity-semi-arid-portion.html,https://phys.org/news/2023-09-climate-affect-biodiversity-semi-arid-portion.html,0,phys.org,Climate change may affect 40% of biodiversity in semi-arid portion of Brazil's Northeast by 2060,"The consequences of climate change in the Caatinga, the semi-arid shrubland and thorn forest biome in Brazil's Northeast region, will include species loss, substitution of rare plants by more generalist vegetation, biotic homogenization (in which previously d…",https://scx2.b-cdn.net/gfx/news/2023/climate-change-may-aff.jpg,2023-09-21T15:38:03Z,,"The consequences of climate change in the Caatinga, the semi-arid shrubland and thorn forest biome in Brazil's Northeast region, will include species loss, substitution of rare plants by more general… [+4597 chars]",,en,'deforestation'
