index,url,valid,domain,title,description,image,published,archive,content,quote,language,keyword
https://abcnews.go.com/US/wireStory/biden-administration-withdraws-rules-save-endangered-whales-collisions-117707878,https://abcnews.go.com/US/wireStory/biden-administration-withdraws-rules-save-endangered-whales-collisions-117707878,0,abcnews.go.com,Biden administration withdraws rules to save endangered whales from collisions,The federal government is withdrawing proposed rules that would have required more ships to slow down in East Coast waters to try to save a vanishing species of whale,https://i.abcnewsfe.com/a/727e1f6f-926d-4d04-b302-1ed260c3f9ff/wirestory_6e7c82b82c258317cf085e23ee7b9222_16x9.jpg?w=1600,2025-01-15T17:53:18Z,http://archive.md/20250115183437/https://abcnews.go.com/US/wireStory/biden-administration-withdraws-rules-save-endangered-whales-collisions-117707878,"PORTLAND, Maine -- The federal government is withdrawing a proposal that would require more ships to slow down in East Coast waters to try to save a vanishing species of whale, officials said Wednesd… [+4038 chars]",,en,'protected species'
https://www.digitaljournal.com/world/chinas-viral-wild-boar-hunters-attract-fame-and-concern/article,https://www.digitaljournal.com/world/chinas-viral-wild-boar-hunters-attract-fame-and-concern/article,0,www.digitaljournal.com,China’s viral wild boar hunters attract fame and concern,"In the frigid night of China’s Qinling mountains, hunters with huge social media followings scour the landscape in pursuit of wild boars menacing local farmers’ livelihoods. China’s wild boars — today numbering two million — were a protected species from 2000…",https://www.digitaljournal.com/wp-content/uploads/2025/01/9084caebdd8d3c53f40eca372d9a5c7b854f4a51.jpg,2025-01-08T04:12:21Z,,"Hunters put protective gear on a dog before a nighttime wild boar hunt in Weinan, in northern China's Shaanxi province - Copyright AFP JADE GAO
In the frigid night of China’s Qinling mountains, hunt… [+4708 chars]",,en,'protected species'
https://www.euractiv.com/section/politics/news/czechia-growls-at-slovakia-in-wolf-hunting-row/,https://www.euractiv.com/section/politics/news/czechia-growls-at-slovakia-in-wolf-hunting-row/,0,www.euractiv.com,Czechia growls at Slovakia in wolf hunting row,"Since the fourth Fico government came to power in Slovakia, hunting bears and wolves has increased dramatically.
The post Czechia growls at Slovakia in wolf hunting row appeared first on Euractiv.",https://www.euractiv.com/wp-content/uploads/sites/2/2025/01/GettyImages-1449695973.jpg,2025-01-24T05:07:54Z,,"Slovakias decision to reintroduce wolf hunting has outraged Czechia, who fear it could endanger the wolf population of the Beskid Mountains, which stretches from Czechia to Slovakia, as well as viola… [+3790 chars]",,en,'protected species'
https://www.digitaljournal.com/world/algerians-campaign-to-save-treasured-songbird-from-hunters/article,https://www.digitaljournal.com/world/algerians-campaign-to-save-treasured-songbird-from-hunters/article,0,www.digitaljournal.com,Algerians campaign to save treasured songbird from hunters,"With its vivid plumage and sweet trill, the goldfinch has long been revered in Algeria, but the national obsession has also driven illegal hunting, prompting calls to protect the songbird. Amid a persistent demand for the bird that many choose to keep in thei…",https://www.digitaljournal.com/wp-content/uploads/2025/01/529886d673607ea19d94a2ce0a621aa94c5c32c1.jpg,2025-01-06T02:02:22Z,,"Keeping goldfinches is common in Algeria, but conservationists are calling for the species to be safeguarded from illegal hunting and trading - Copyright AFP -
With its vivid plumage and sweet trill… [+2852 chars]",,en,'protected species'
https://financialpost.com/pmn/biden-administration-withdraws-rules-to-save-endangered-whales-from-collisions,https://financialpost.com/pmn/biden-administration-withdraws-rules-to-save-endangered-whales-from-collisions,0,financialpost.com,Biden administration withdraws rules to save endangered whales from collisions,"PORTLAND, Maine (AP) — The federal government is withdrawing a proposal that would require more ships to slow down in East Coast waters to try to save a vanishing species of whale, officials said Wednesday. The move in the waning days of the Biden administrat…",https://smartcdn.gprod.postmedia.digital/financialpost/wp-content/uploads/2025/01/nyps227-the-associated-press.jpg,2025-01-15T17:20:04Z,,"Author of the article:
FILE - This image provided by NOAA, shows a North Atlantic right whale in the waters off New England, May 25, 2024. (NOAA via AP, File)THE ASSOCIATED PRESS
Article content
P… [+7089 chars]",,en,'protected species'
https://www.cbc.ca/news/canada/nova-scotia/biden-administration-endangered-whales-collisions-1.7431973,https://www.cbc.ca/news/canada/nova-scotia/biden-administration-endangered-whales-collisions-1.7431973,0,www.cbc.ca,Biden administration withdraws rules to save endangered whales from collisions,"Conservation groups say the move will leave North Atlantic right whales vulnerable to extinction, but federal authorities said there's no way to implement the rules before president-elect Donald Trump takes office on Monday.",https://i.cbc.ca/1.7418714.1735848693!/fileImage/httpImage/image.jpg_gen/derivatives/16x9_1180/entangled-whales.jpg?im=Resize%3D620,2025-01-15T18:22:59Z,,"The U.S. government is withdrawing a proposal that would require more ships to slow down in East Coast waters to try to save a vanishing species of whale, officials said Wednesday.
The move in the w… [+4350 chars]",,en,'protected species'
https://phys.org/news/2025-01-world-largest-freshwater-crayfish-plentiful.html,https://phys.org/news/2025-01-world-largest-freshwater-crayfish-plentiful.html,0,phys.org,The world's second largest freshwater crayfish was once plentiful in Australia's longest river—we're bringing it back,Murray crayfish once thrived in the southern Murray-Darling Basin. The species was found everywhere from the headwaters of the Murray and Murrumbidgee Rivers in the Australian Alps all the way down to Wellington in South Australia.,https://scx2.b-cdn.net/gfx/news/2025/the-worlds-second-larg.jpg,2025-01-26T17:00:02Z,http://archive.md/20250127220441/https://phys.org/news/2025-01-world-largest-freshwater-crayfish-plentiful.html,Murray crayfish once thrived in the southern Murray-Darling Basin. The species was found everywhere from the headwaters of the Murray and Murrumbidgee Rivers in the Australian Alps all the way down t… [+6601 chars],,en,'protected species'
https://freerepublic.com/focus/f-chat/4291091/posts,https://freerepublic.com/focus/f-chat/4291091/posts,0,freerepublic.com,"California couple fined $165,000 for damaging rare Central Coast flower habitat","California couple fined $165,000 for damaging rare Central Coast flower habitat..... San Luis Obispo County District Attorney Dan Dow announced on Wednesday that his office had settled an environmental enforcement action against the couple, who agreed to pay …",,2025-01-19T15:39:56Z,,"Skip to comments.
California couple fined $165,000 for damaging rare Central Coast flower habitatSF Gate ^
 | 1/18/2025
 | Sam Mauhay-Moore
Posted on 01/19/2025 7:39:56 AM PST by cuz1961
Califor… [+4447 chars]",,en,'protected species'
https://www.cnbc.com/2025/01/17/construction-industry-tackles-climate-change-with-wood-lego-style-bricks-new-materials.html,https://www.cnbc.com/2025/01/17/construction-industry-tackles-climate-change-with-wood-lego-style-bricks-new-materials.html,0,www.cnbc.com,"From giant Lego-style bricks to artificial reefs, how the construction industry is using tech to tackle climate change","The building industry is ""by far"" the largest emitter of greenhouse gases of any sector, according to the U.N.",https://image.cnbcfm.com/api/v1/image/108087653-1737035287303-RENCO_Building_System_5_-_photo_source_RENCO_USA.jpg?v=1737035524&w=1920&h=1080,2025-01-17T06:13:28Z,,"The problem of stolen manhole covers in Turkey might seem an unlikely starting point for a new way for buildings to withstand earthquakes and tackle the construction industry's environmental issues, … [+9124 chars]",,en,'protected species'
https://www.thestar.com.my/news/nation/2025/01/13/pangolin-possession-gets-duo-fined-rm200000-each-plus-jail-in-tawau,https://www.thestar.com.my/news/nation/2025/01/13/pangolin-possession-gets-duo-fined-rm200000-each-plus-jail-in-tawau,0,www.thestar.com.my,"Pangolin possession gets duo fined RM200,000 each plus jail in Tawau","KOTA KINABALU: A Tawau court has jailed two men for a year and fined them RM200,000 each after they pled guilty to possessing pangolins, a species listed as ‘totally protected’ by law. Read full story",https://apicms.thestar.com.my/uploads/images/2025/01/13/3115519.jpg,2025-01-13T08:55:00Z,,"KOTA KINABALU: A Tawau court has jailed two men for a year and fined them RM200,000 each after they pled guilty to possessing pangolins, a species listed as totally protected by law.
The accused Azl… [+778 chars]",,en,'protected species'
https://journals.plos.org/plosone/article?id=10.1371/journal.pone.0315945,https://journals.plos.org/plosone/article?id=10.1371/journal.pone.0315945,0,journals.plos.org,The return of raptors to Scotland’s skies: Investigating the diets of reintroduced red kites and white-tailed eagles using stable isotopes,"Species reintroductions are increasingly seen as important methods of biodiversity restoration. Reintroductions of red kites Milvus milvus and white-tailed eagles Halieaeetus albicilla to Britain, which were extirpated in the late 19th and early 20th centurie…",https://journals.plos.org/plosone/article/figure/image?id=10.1371/journal.pone.0315945.g004&size=inline,2025-01-08T14:00:00Z,,"Abstract
Species reintroductions are increasingly seen as important methods of biodiversity restoration. Reintroductions of red kites Milvus milvus and white-tailed eagles Halieaeetus albicilla to B… [+42820 chars]",,en,'protected species'
https://www.thejournal.ie/investigates-invasive-species-council-cost-6592448-Jan2025/,https://www.thejournal.ie/investigates-invasive-species-council-cost-6592448-Jan2025/,0,www.thejournal.ie,Fight against invasive plants costing councils millions and may never end,Invasive species are destroying the environment and cost local authorities over €8.5 million in just four years.,https://img2.thejournal.ie/article/6592448/river/?height=400&version=6592450,2025-01-15T00:05:51Z,,"INVASIVE SPECIES MANAGEMENT cost councils an average of 1.7 million a year in recent years, The Journal Investigates can reveal.
Over 8.5 million was spent across all councils from July 2020 to Augu… [+12299 chars]",,en,'invasive alien species'
https://www.thejournal.ie/investigates-killarney-national-park-ecosystem-6595158-Jan2025/,https://www.thejournal.ie/investigates-killarney-national-park-ecosystem-6595158-Jan2025/,0,www.thejournal.ie,Invasive species are ‘destroying ecosystems’ in Killarney National Park,"But the NPWS, who manages the park, says there has been ‘huge progress’ in their control and eradication.",https://img2.thejournal.ie/article/6595158/river/?height=400&version=6595160,2025-01-17T06:30:35Z,http://wayback.archive-it.org/all/20250125224823/https://www.thejournal.ie/investigates-killarney-national-park-ecosystem-6595158-Jan2025/,"THE ECOSYSTEM IN Killarney National Park is dying due to the presence of invasive species.
That is according to Eoghan Daltun, a farmer, rewilder and an author of two books on Irish rainforests.
Rh… [+5906 chars]",,en,'invasive alien species'
https://www.thejournal.ie/investigates-invasive-species-garden-centres-6595112-Jan2025/,https://www.thejournal.ie/investigates-invasive-species-garden-centres-6595112-Jan2025/,0,www.thejournal.ie,Did you know you can buy invasive plants in garden centres?,"Cherry laurel, montbretia and the butterfly bush can impact biodiversity.",https://img2.thejournal.ie/article/6595112/river/?height=400&version=6595115,2025-01-19T07:00:41Z,http://wayback.archive-it.org/all/20250119070302/https://www.thejournal.ie/investigates-invasive-species-garden-centres-6595112-Jan2025/,"INVASIVE PLANTS PLAY havoc with the environment, causing species to go extinct and damaging ecosystems.
Despite this, if you walk into many garden centres and shops in Ireland, you will be able to b… [+5318 chars]",,en,'invasive alien species'
https://www.counterpunch.org/2025/01/15/guide-to-preserving-sacred-land-near-you/,https://www.counterpunch.org/2025/01/15/guide-to-preserving-sacred-land-near-you/,0,www.counterpunch.org,Guide to Preserving Sacred Land Near You,"Anthropogenic climate change and biodiversity loss are the most pressing issues for our planet. Carbon dioxide emissions in the atmosphere continue to rise due to the burning of fossil fuels and land use change, with the latter occurring primarily in the form…",https://www.counterpunch.org/wp-content/uploads/2025/01/IMG_6662-scaled.jpeg,2025-01-15T06:55:39Z,,"Photograph by Nathaniel St. Clair
Anthropogenic climate change and biodiversity loss are the most pressing issues for our planet. Carbon dioxide emissions in the atmosphere continue to rise due to t… [+10511 chars]",,en,'invasive alien species'
https://www.ipsnews.net/2025/01/reducing-food-waste-mediterranean/,https://www.ipsnews.net/2025/01/reducing-food-waste-mediterranean/,0,www.ipsnews.net,Reducing Food Waste in the Mediterranean,"While Mediterranean cities are meeting to discuss ways to address food waste considering land degradation and drought, former FAO communication specialist Issam Azouri focuses on tangible solutions led by consumers.   Follow @IPSNewsUNBureau",https://www.ipsnews.net/Library/2025/01/food-waste_.jpg,2025-01-27T06:56:02Z,https://web.archive.org/web/20250128164446/https://www.ipsnews.net/2025/01/reducing-food-waste-mediterranean/,"Food and Agriculture, Food Security and Nutrition, Food Sustainability, Global, Multimedia, VideoJan 27 2025 -  
While Mediterranean cities are meeting to discuss ways to address food waste consider… [+129 chars]",,en,'land degradation'
https://journals.plos.org/plosone/article?id=10.1371/journal.pone.0317851,https://journals.plos.org/plosone/article?id=10.1371/journal.pone.0317851,0,journals.plos.org,Evolutionary analysis of landscape ecological risk in Baili Rhododendron National Forest Park,It is significant to research the ecological risk of land use landscape to promote ecological conservation and restoration. The characteristics of land use dynamic change in Baili Rhododendron National Forest Park were analyzed based on GlobeLand30 data for t…,https://journals.plos.org/plosone/article/figure/image?id=10.1371/journal.pone.0317851.g012&size=inline,2025-01-24T14:00:00Z,,"Citation: Yu Y, Cui W, Liu S, Yu T, Song Y (2025) Evolutionary analysis of landscape ecological risk in Baili Rhododendron National Forest Park. PLoS ONE 20(1):
 e0317851.
https://doi.org/10.1371/j… [+41641 chars]",,en,'land degradation'
https://theconversation.com/industrial-scale-farming-is-flawed-what-ecologically-friendly-farming-practices-could-look-like-in-africa-245579,https://theconversation.com/industrial-scale-farming-is-flawed-what-ecologically-friendly-farming-practices-could-look-like-in-africa-245579,0,theconversation.com,Industrial scale farming is flawed: what ecologically-friendly farming practices could look like in Africa,Clearing huge tracts of land to plant one crop like maize has degraded land and put healthy food out of the reach of ordinary people. A new book has solutions.,https://images.theconversation.com/files/643233/original/file-20250117-15-d3128k.jpg?ixlib=rb-4.1.0&rect=9%2C657%2C5988%2C2989&q=45&auto=format&w=1356&h=668&fit=crop,2025-01-23T14:28:34Z,https://web.archive.org/web/20250123161232/https://theconversation.com/industrial-scale-farming-is-flawed-what-ecologically-friendly-farming-practices-could-look-like-in-africa-245579,"African Perspectives on Agroecology is a new book with 33 contributions from academics, non-governmental organisations, farmer organisations and policy makers. It is free to download, and reviewers h… [+6956 chars]",,en,'land degradation'
https://www.resilience.org/stories/2025-01-23/the-climate-narrative-ecosystem-is-changing/,https://www.resilience.org/stories/2025-01-23/the-climate-narrative-ecosystem-is-changing/,0,www.resilience.org,The Climate-narrative Ecosystem is Changing,"But like it’s subject, life, this movement is self-generating. Roots are spreading and it can only grow. Eventually, mainstream journalism will take notice. At that point, the narrative is generating its own rain.",https://www.resilience.org/wp-content/uploads/2025/01/robert-koorenny-aUktEE_NkXw-unsplash.jpg,2025-01-23T10:21:08Z,https://web.archive.org/web/20250123115746/https://www.resilience.org/stories/2025-01-23/the-climate-narrative-ecosystem-is-changing/,"At the end of 2024, I published a year in review for The Climate According to Life, sharing some of the years encounters, events and posts. Now I want to broaden the lens to consider the climate narr… [+8134 chars]",,en,'land degradation'
https://www.bbc.com/news/articles/cvgpnqe91j1o?xtor=AL-72-%5Bpartner%5D-%5Byahoo.north.america%5D-%5Bheadline%5D-%5Bnews%5D-%5Bbizdev%5D-%5Bisapi%5D,https://www.bbc.com/news/articles/cvgpnqe91j1o?xtor=AL-72-%5Bpartner%5D-%5Byahoo.north.america%5D-%5Bheadline%5D-%5Bnews%5D-%5Bbizdev%5D-%5Bisapi%5D,0,www.bbc.com,Stinky bloom of 'corpse flower' enthrals thousands,A livestream of an endangered plant's rare bloom in Sydney has captivated the internet.,https://media.zenfs.com/en/bbc_us_articles_995/589074305be9fb561d4bc47f51207ce5,2025-01-23T04:58:45Z,,"An endangered plant known as the ""corpse flower"" for its putrid stink is blooming in Australia - and captivating the internet in the process, with thousands already tuned in to a livestream to witnes… [+3407 chars]",,en,'land degradation'
https://www.bbc.com/news/articles/cvgpnqe91j1o,https://www.bbc.com/news/articles/cvgpnqe91j1o,0,www.bbc.com,Thousands await stinky plant's rare bloom,"A livestream of a ""corpse flower"" due to bloom in Sydney's botanic gardens has captivated the internet.",https://ichef.bbci.co.uk/news/1024/branded_news/000c/live/40e222a0-d8a5-11ef-87df-d575b9a434a4.jpg,2025-01-22T09:52:36Z,,"Putricia has been placed behind a velvet rope in Sydney's botanic gardens
An endangered plant known as the ""corpse flower"" for its putrid stink is about to bloom in Australia - and captivated in the… [+2592 chars]",,en,'land degradation'
https://www.resilience.org/stories/2025-01-21/last-call/,https://www.resilience.org/stories/2025-01-21/last-call/,0,www.resilience.org,Last Call?,"Yes, there is much work to do, and nothing is more worth doing than trying to save this place. But if in my rushed, dogged efforts I became distracted from Tahlequah’s call, then I need to ask what I’m doing.",https://www.resilience.org/wp-content/uploads/2025/01/Southern_Resident_orcas_hunting_salmon_SRKW_Sound_Strategy_NOAA_1280_khBt9tXW2y39.jpg,2025-01-21T10:49:53Z,,"Imagine a mother losing her infant daughter after birth and being so overwhelmed with grief she caries her daughters lifeless body with her wherever she goes. This happened here, in waters we call th… [+4779 chars]",,en,'land degradation'
https://www.bangkokpost.com/opinion/opinion/2943966/ai-alone-cannot-save-the-planet,https://www.bangkokpost.com/opinion/opinion/2943966/ai-alone-cannot-save-the-planet,0,www.bangkokpost.com,AI alone cannot save the planet,"<p>This year's annual meeting of the World Economic Forum in Davos held during Jan 20-24, where participants will address the theme of ""Collaboration for the Intelligent Age,"" comes at a critical juncture for the planet. Ecosystems are straining under the pre…",https://static.bangkokpost.com/media/content/dcx/2025/01/21/5433771_700.jpg,2025-01-20T21:00:00Z,http://archive.md/20250121033042/https://www.bangkokpost.com/opinion/opinion/2943966/ai-alone-cannot-save-the-planet,"This year's annual meeting of the World Economic Forum in Davos held during Jan 20-24, where participants will address the theme of ""Collaboration for the Intelligent Age,"" comes at a critical junctu… [+4253 chars]",,en,'land degradation'
https://www.forbes.com/sites/globalcitizen/2025/01/19/wef-2025-three-opportunities-for-cooperation-in-davos/,https://www.forbes.com/sites/globalcitizen/2025/01/19/wef-2025-three-opportunities-for-cooperation-in-davos/,0,www.forbes.com,WEF 2025: Three Opportunities For Cooperation In Davos,"The 2025 World Economic Forum in Davos presents three key opportunities for cooperation on health security, Amazon protection, and Africa's renewable energy transition.",https://imageio.forbes.com/specials-images/imageserve/678d8f5beb30263c41c196f0/0x0.jpg?format=jpg&height=900&width=1600&fit=bounds,2025-01-19T23:53:48Z,https://web.archive.org/web/20250120060002/https://www.forbes.com/sites/globalcitizen/2025/01/19/wef-2025-three-opportunities-for-cooperation-in-davos/,"Leaders at WEF 2025 in Davos have the opportunity to prioritize global cooperation on urgent issues ... [+] like children's health, climate action, and renewable energy, paving the way for transforma… [+6979 chars]",,en,'land degradation'
https://worldsensorium.com/talk-dirty-to-me-summary/,https://worldsensorium.com/talk-dirty-to-me-summary/,0,worldsensorium.com,Maintaining and sustaining soil health,"Photo by StockSnap, pixabay.com Talk Dirty to Me By Lewis Ziska Sign up for our monthly newsletter! “OK. There are more living organisms in one tablespoon of soil than there are people living on the earth.” S oil.  An immense, churning cauldron of living thin…",https://worldsensorium.com/wp-content/uploads/2024/12/IsaacLarsen.jpg,2025-01-15T13:42:45Z,,"OK. There are more living organisms in one tablespoon of soil than there are people living on the earth.
S oil.  An immense, churning cauldron of living things: earthworms, all kinds of small arachn… [+14013 chars]",,en,'land degradation'
https://martinfowler.com/bliki/ForestAndDesert.html,https://martinfowler.com/bliki/ForestAndDesert.html,0,martinfowler.com,Bliki: Forest And Desert,A metaphor for why two software development ecosystems have difficulty communicating.,https://martinfowler.com/bliki/images/forest-desert.png,2025-01-30T05:00:00Z,https://web.archive.org/web/20250131065310/https://martinfowler.com/bliki/ForestAndDesert.html,"The Forest and the Desert is a metaphor for thinking about software
 development processes, developed by Beth Anders-Beck and her father Kent Beck.
 It posits that two communities of software develop… [+1697 chars]",,en,'Desertification'
https://www.slashfilm.com/1761576/dune-golden-path-explained/,https://www.slashfilm.com/1761576/dune-golden-path-explained/,0,www.slashfilm.com,What Is The Golden Path In Dune?,"If you've read the Dune novels, you might have questions about some of their biggest ideas, like The Golden Path. Here's a spoilery breakdown of that concept.",https://www.slashfilm.com/img/gallery/what-is-the-golden-path-in-dune/l-intro-1736894570.jpg,2025-01-27T15:00:53Z,https://web.archive.org/web/20250128101223/https://www.slashfilm.com/1761576/dune-golden-path-explained/,"For a lot of reasons, perhaps the chief one being that Paul was born a generation earlier than expected and therefore was not quite the ultimate Kwisatz Haderach as predicted, Paul did not quite foll… [+1859 chars]",,en,'Desertification'
https://phys.org/news/2025-01-multiple-entwined-crises-policy-responses.html,https://phys.org/news/2025-01-multiple-entwined-crises-policy-responses.html,0,phys.org,We live in times of multiple entwined crises—but our policy responses aren't keeping up,"Existing policies to tackle environmental challenges fail to take into account that biodiversity loss, climate change and pollution are intertwined crises and produce compounding and intensifying impacts.",https://scx2.b-cdn.net/gfx/news/hires/2025/coral-reef.jpg,2025-01-25T17:10:01Z,https://web.archive.org/web/20250126110814/https://phys.org/news/2025-01-multiple-entwined-crises-policy-responses.html,"Existing policies to tackle environmental challenges fail to take into account that biodiversity loss, climate change and pollution are intertwined crises and produce compounding and intensifying imp… [+5951 chars]",,en,'Desertification'
https://energycentral.com/event/3rd-annual-world-biopolymers-and-bioplastics-innovation-forum-0,https://energycentral.com/event/3rd-annual-world-biopolymers-and-bioplastics-innovation-forum-0,0,energycentral.com,3rd Annual World Biopolymers and Bioplastics Innovation Forum,"The global bioplastics production will more than triple over the next five years (2021-2026), from around 2.4 million tons in 2021 to 7.5 million tons in 2026, according to market data compiled by European Bioplastics. The development of biodegradable, biobas…",https://energycentral.com/sites/default/files/styles/og_meta/public/ece/node_main/2025/1/3rd2020annual20world20biopolymers20and20bioplastics20innovation20forum20202_0.png?itok=Nnf7_IQj,2025-01-29T17:17:43Z,,"A global platform to discuss and learn about Environmental Impact and Sustainability, Sustainability of Materials Processes, Renewable Hadronic Energy, Green Technology, Biodiversity, Soil and Water … [+46 chars]",,en,'Desertification'
