index,url,valid,domain,title,description,image,published,archive,content,quote,language,keyword
https://www.verdict.co.uk/nvidia-alpamayo-2-super-robotaxis/,https://www.verdict.co.uk/nvidia-alpamayo-2-super-robotaxis/,0,www.verdict.co.uk,Nvidia rolls out 32bn-parameter Alpamayo 2 Super for robotaxis,"Nvidia released its Alpamayo 2 Super vision language action (VLA) model, designed to accelerate level 4 robotaxi and AV development.",https://www.techmonitor.ai/wp-content/uploads/sites/29/2026/06/Alpamayo-2-Super-1.jpg,2026-06-01T08:52:00Z,,"Nvidia has announced the release of its Alpamayo 2 Super vision language action (VLA) model, designed to accelerate level 4 robotaxi and autonomous vehicle (AV) development.
The model, now scaling t… [+4059 chars]",,en,'ecosystem'
https://www.windowscentral.com/hardware/asus/asus-proart-p16-and-p14-n1x-computex-2026,https://www.windowscentral.com/hardware/asus/asus-proart-p16-and-p14-n1x-computex-2026,0,www.windowscentral.com,"ASUS ProArt P16 and P14 N1X bring workstation‑class power, RTX graphics, and AI‑PC performance for creators","ASUS has announced the ProArt P16 and P14 N1X, two creator‑focused laptops built for the Windows AI‑PC era. Both models offer workstation‑class performance with N1X processors, optional NVIDIA RTX graphics, advanced cooling, and high‑end displays designed for…",https://cdn.mos.cms.futurecdn.net/AtCTkVJmEVZXHhZrL86HcS-1920-80.jpg,2026-06-01T08:48:15Z,,"I have been saying for months that Windows on Arm was about to hit a second gear that most people did not see coming. While much of the recent oxygen has been taken up by thin and light devices, ther… [+6359 chars]",,en,'ecosystem'
https://thenextweb.com/news/pld-space-kourou-launch-complex-investment/,https://thenextweb.com/news/pld-space-kourou-launch-complex-investment/,0,thenextweb.com,PLD Space raises its Kourou launch-complex investment to €35m,"The Spanish launch firm says it is the first private operator to commit capital at this scale to the historic Guiana spaceport, with a first MIURA 5 flight still slated for 2026. PLD Space is putting €35m into the launch complex it is building at the Guiana S…",https://media.thenextweb.com/2026/06/PLD-Space-Miura.avif,2026-06-01T08:48:13Z,,"The Spanish launch firm says it is the first private operator to commit capital at this scale to the historic Guiana spaceport, with a first MIURA 5 flight still slated for 2026.
PLD Space is puttin… [+3319 chars]",,en,'ecosystem'
https://cryptobriefing.com/nico-laqua-embracing-victories-is-key-to-success-the-importance-of-investor-branding-in-startups-and-why-commitment-beyond-the-workweek-is-essential-20vc/,https://cryptobriefing.com/nico-laqua-embracing-victories-is-key-to-success-the-importance-of-investor-branding-in-startups-and-why-commitment-beyond-the-workweek-is-essential-20vc/,0,cryptobriefing.com,"Nico Laqua: Embracing victories is key to success, the importance of investor branding in startups, and why commitment beyond the workweek is essential | 20VC","Startups thrive on intense work culture and strategic investor partnerships for long-term success.
The post Nico Laqua: Embracing victories is key to success, the importance of investor branding in startups, and why commitment beyond the workweek is essential…",https://static.cryptobriefing.com/wp-content/uploads/2026/02/11174231/20vc-cover-457x457.jpeg,2026-06-01T08:46:54Z,,"Startups thrive on intense work culture and strategic investor partnerships for long-term success. Key takeaways
<ul><li>Embracing victories in business is crucial for success.</li><li>Business stra… [+7656 chars]",,en,'ecosystem'
https://www.thehindubusinessline.com/markets/gold/augmont-launches-indias-first-ai-powered-gold-purity-evaluation-machine-in-suburban-chennai/article71047600.ece,https://www.thehindubusinessline.com/markets/gold/augmont-launches-indias-first-ai-powered-gold-purity-evaluation-machine-in-suburban-chennai/article71047600.ece,0,www.thehindubusinessline.com,Augmont launches India’s first AI-powered gold purity evaluation machine in suburban Chennai,"Augmont introduces India's first AI-powered gold purity evaluation machine in Chennai, offering instant, transparent assessments for gold ornaments.",https://bl-i.thgim.com/public/incoming/ucblby/article71047629.ece/alternates/LANDSCAPE_1200/2026-02-15T095423Z_55170278_RC2OFJAZ4CF0_RTRMADP_3_GLOBAL-PRECIOUS-GOLD-EGYPT.JPG,2026-06-01T08:43:37Z,,"Augmont, one of Indias leading digital gold platforms, has launched an AI-powered gold purity evaluation machine at its Poonamallee gold loan branch in suburban Chennai, Tamil Nadu. 
Powered by adva… [+2828 chars]",,en,'ecosystem'
https://abompard.fedorapeople.org/twif/from-may-25-to-may-31.html,https://abompard.fedorapeople.org/twif/from-may-25-to-may-31.html,0,abompard.fedorapeople.org,Aurélien Bompard: From May 25 to May 31,,,2026-06-01T08:35:00Z,,"This week's main focus was on community governance and future planning, with the announcement that F44 election interviews are now live for the Council, FESCo, and other committees. In parallel, many… [+26848 chars]",,en,'ecosystem'
https://www.forbes.com/sites/katehardcastle/2026/06/01/fever-pitch-as-world-cup-heats-up-to-8-billion-spending-spree/,https://www.forbes.com/sites/katehardcastle/2026/06/01/fever-pitch-as-world-cup-heats-up-to-8-billion-spending-spree/,0,www.forbes.com,Fever Pitch As World Cup Heats Up To $8 Billion Spending Spree,"How the 2026 FIFA World Cup is driving luxury travel, fashion, aviation and hospitality, creating a global spending boom far beyond the matches themselves.",https://imageio.forbes.com/specials-images/imageserve/6a1c9b2b9b71ed5e1a3f16ab/0x0.jpg?format=jpg&height=900&width=1600&fit=bounds,2026-06-01T08:30:00Z,,"Members of the U.S. Mens National Team gather in New York as the official 2026 FIFA World Cup roster is unveiled. For brands, hotels, airlines and luxury operators, the countdown to the tournament ha… [+11498 chars]",,en,'ecosystem'
https://cryptobriefing.com/nvidia-vera-rubin-gtc-taipei-2026/,https://cryptobriefing.com/nvidia-vera-rubin-gtc-taipei-2026/,0,cryptobriefing.com,Nvidia CEO Jensen Huang unveils Vera Rubin production timeline at GTC Taipei 2026,"Nvidia's Vera Rubin platform could revolutionize AI economics, significantly lowering inference costs and reshaping market expectations.
The post Nvidia CEO Jensen Huang unveils Vera Rubin production timeline at GTC Taipei 2026 appeared first on Crypto Briefi…",https://static.cryptobriefing.com/wp-content/uploads/2026/06/01042153/nvidia-gtc-taipei-at-computex-live-updates-on-what-s-next-in-800x420.jpeg,2026-06-01T08:22:00Z,,"The next-generation AI platform promises 10x cheaper inference than Blackwell, with full production starting this fall. Jensen Huang took the stage at the Taipei Music Center on June 1 and did what h… [+2559 chars]",,en,'ecosystem'
https://www.ibtimes.com.au/apples-foldable-iphone-2027-launch-1869874,https://www.ibtimes.com.au/apples-foldable-iphone-2027-launch-1869874,0,www.ibtimes.com.au,iPhone Foldable 2027 Rumors: Apple Eyes Slim Design with Advanced Hinges and Premium Pricing,"Apple is reportedly developing a foldable iPhone for a 2027 launch, featuring advanced hinge technology and premium pricing, aiming to address durability issues seen in competitors' foldable devices.",https://d.ibtimes.com.au/en/full/1892590/apples-foldable-iphone-expected-feature-minimal-nearly-invisible.jpg,2026-06-01T08:01:18Z,,"NEW YORK — Apple is reportedly accelerating development of its first foldable iPhone, with latest rumors pointing to a 2027 launch featuring a slim book-style design, advanced hinge technology and a … [+6516 chars]",,en,'ecosystem'
https://www.semrush.com/blog/google-to-add-ai-performance-report-to-merchant-center/,https://www.semrush.com/blog/google-to-add-ai-performance-report-to-merchant-center/,0,www.semrush.com,Google to add AI performance report to Merchant Center,A new AI performance insights report will give ecommerce brands a look at how they appear across AI-powered shopping experiences.,https://static.semrush.com/blog/uploads/media/ef/39/ef39b8495a220aeb442bfd40344e2022/43c32f2b470e5501a6b2e61cedac5433/ai-performance-report.png,2026-06-01T08:01:00Z,,Google announced a new AI performance insights report in Merchant Center that will give ecommerce brands their first native look at how they appear across AI-powered shopping experiences including AI… [+2786 chars],,en,'ecosystem'
http://opiniojuris.org/2026/06/01/symposium-on-advancing-effective-and-comprehensive-reparation-for-victims-of-the-war-in-ukraine-no-uncharted-territory-the-iccs-and-tfvs-role-in-the-ecosystem-of-justice-for-victims-in-u/,http://opiniojuris.org/2026/06/01/symposium-on-advancing-effective-and-comprehensive-reparation-for-victims-of-the-war-in-ukraine-no-uncharted-territory-the-iccs-and-tfvs-role-in-the-ecosystem-of-justice-for-victims-in-u/,0,opiniojuris.org,Symposium on Advancing Effective and Comprehensive Reparation for Victims of the War in Ukraine: No Uncharted Territory – The ICC’s and TFV’s Role in the Ecosystem of Justice for Victims in Ukraine,"[Deborah Ruiz Verduzco is  Executive Director of the Trust Fund for Victims (TFV) at the International Criminal Court (ICC). Prior to her appointment, she was Director of the Secretariat of the Coalition for the International Criminal Court. She previously le…",https://i0.wp.com/opiniojuris.org/wp-content/uploads/wolfgang-hasselmann-OCKADBZr4AM-unsplash.jpg?fit=1200%2C800,2026-06-01T08:00:56Z,,"[Deborah Ruiz Verduzco is  Executive Director of the Trust Fund for Victims (TFV) at the International Criminal Court (ICC). Prior to her appointment, she was Director of the Secretariat of the Coali… [+16821 chars]",,en,'ecosystem'
https://the-gadgeteer.com/2026/06/01/best-smart-home-devices-under-50-2026/,https://the-gadgeteer.com/2026/06/01/best-smart-home-devices-under-50-2026/,0,the-gadgeteer.com,10 Best Smart Home Devices Under $50,"The “smart home tax” is shrinking. Between Blink’s first sub-$50 2K doorbell, IKEA’s full Matter relaunch, and Philips’ new WiZ-based budget line that all dropped in May 2026, you can now build a real, voice-controlled, multi-room setup without ever crossing …",https://the-gadgeteer.com/wp-content/uploads/2026/06/10-Best-Smart-Home-Devices-Under-50.jpg,2026-06-01T08:00:25Z,,"If you buy something from a link in this article, we may earn a commission. Learn more
The smart home tax is shrinking. Between Blinks first sub-$50 2K doorbell, IKEAs full Matter relaunch, and Phil… [+9221 chars]",,en,'ecosystem'
https://www.globenewswire.com/news-release/2026/06/01/3304067/0/en/Asimily-Launches-Segmentation-Orchestration-to-Protect-Connected-Devices-from-AI-Era-Attacks.html,https://www.globenewswire.com/news-release/2026/06/01/3304067/0/en/Asimily-Launches-Segmentation-Orchestration-to-Protect-Connected-Devices-from-AI-Era-Attacks.html,0,www.globenewswire.com,Asimily Launches Segmentation Orchestration to Protect Connected Devices from AI-Era Attacks,"Segmentation Orchestration automatically turns device risk intelligence into dynamic segmentation policy, removing guesswork that leaves IoT, IT, OT, IoMT asset environments exposed Segmentation Orchestration automatically turns device risk intelligence into …",https://ml.globenewswire.com/Resource/Download/a3f8df48-4401-4793-92df-3a813a31df74,2026-06-01T08:00:00Z,,"SUNNYVALE, Calif., June 01, 2026 (GLOBE NEWSWIRE) -- Asimily
, the Proactive Cyber Defense Platform, today launched Segmentation Orchestration
. For the first time, connected-device risk intelligen… [+5991 chars]",,en,'ecosystem'
https://www.prnewswire.com/news-releases/equifax-partners-with-polands-leading-credit-bureau-to-expand-client-access-to-identity-and-fraud-solutions-302785810.html,https://www.prnewswire.com/news-releases/equifax-partners-with-polands-leading-credit-bureau-to-expand-client-access-to-identity-and-fraud-solutions-302785810.html,0,www.prnewswire.com,Equifax partners with Poland's leading credit bureau to expand client access to identity and fraud solutions,"WARSAW, June 1, 2026 /PRNewswire/ -- Equifax UK and Biuro Informacji Kredytowej S.A. (BIK), Poland's primary credit bureau, have partnered to broaden client access to their respective identity verification and fraud prevention capabilities, helping more busin…",,2026-06-01T08:00:00Z,,"WARSAW, June 1, 2026 /PRNewswire/ -- Equifax UK and Biuro Informacji Kredytowej S.A. (BIK), Poland's primary credit bureau, have partnered to broaden client access to their respective identity verifi… [+4072 chars]",,en,'ecosystem'
https://www.prnewswire.com/news-releases/equifax-partners-with-polands-leading-credit-bureau-to-expand-client-access-to-identity-and-fraud-solutions-302785824.html,https://www.prnewswire.com/news-releases/equifax-partners-with-polands-leading-credit-bureau-to-expand-client-access-to-identity-and-fraud-solutions-302785824.html,0,www.prnewswire.com,Equifax partners with Poland's leading credit bureau to expand client access to identity and fraud solutions,"WARSAW, June 1, 2026 /PRNewswire/ -- Equifax UK and Biuro Informacji Kredytowej S.A. (BIK), Poland's primary credit bureau, have partnered to broaden client access to their respective identity verification and fraud prevention capabilities, helping more busin…",,2026-06-01T08:00:00Z,,"WARSAW, June 1, 2026 /PRNewswire/ -- Equifax UK and Biuro Informacji Kredytowej S.A. (BIK), Poland's primary credit bureau, have partnered to broaden client access to their respective identity verifi… [+4025 chars]",,en,'ecosystem'
https://www.exchangewire.com/blog/2026/06/01/digest-walmart-names-yahoo-magnite-as-ad-tech-partners-meta-reaffirms-oversight-board-funding/,https://www.exchangewire.com/blog/2026/06/01/digest-walmart-names-yahoo-magnite-as-ad-tech-partners-meta-reaffirms-oversight-board-funding/,0,www.exchangewire.com,Digest: Walmart Names Yahoo & Magnite as Ad tech Partners; Meta Reaffirms Oversight Board Funding,"In today’s Digest, we discuss Walmart teaming up with Yahoo and Magnite on an ad tech overhaul, Meta renewing its funding pledge for the Oversight Board, and Anthropic nearing a USD$1tn valuation ahead of an IPO.
The post Digest: Walmart Names Yahoo & Magnite…",https://cdn.exchangewire.com/wp-content/uploads/2026/05/737a2ed5-3f9f-4ce7-9ec1-75d6c8e32f06.jpg,2026-06-01T08:00:00Z,,"In todays Digest, we discuss Walmart teaming up with Yahoo and Magnite on an ad tech overhaul, Meta renewing its funding pledge for the Oversight Board, and Anthropic nearing a USD$1tn valuation ahea… [+2342 chars]",,en,'ecosystem'
https://www.prnewswire.com/news-releases/gigabyte-event-unveils-the-full-stack-of-new-products-with-enter-infinity-at-computex-2026-302785587.html,https://www.prnewswire.com/news-releases/gigabyte-event-unveils-the-full-stack-of-new-products-with-enter-infinity-at-computex-2026-302785587.html,0,www.prnewswire.com,"GIGABYTE EVENT Unveils the Full-Stack of New Products with ""ENTER INFINITY"" at COMPUTEX 2026","TAIPEI, June 1, 2026 /PRNewswire/ -- GIGABYTE, the world's leading computer brand, today unveiled its most comprehensive product lineup to date under the theme ""ENTER INFINITY."" Celebrating its 40th anniversary, the company also introduced the INFINITY Series…",https://mma.prnewswire.com/media/2990627/Computex_2026_INFINITY_Series_1920X1080_KV.jpg?p=facebook,2026-06-01T08:00:00Z,,"TAIPEI, June 1, 2026 /PRNewswire/ -- GIGABYTE, the world's leading computer brand, today unveiled its most comprehensive product lineup to date under the theme ""ENTER INFINITY."" Celebrating its 40th … [+5819 chars]",,en,'ecosystem'
https://pythonbytes.fm/episodes/show/482/mr.-beasts-epidosde,https://pythonbytes.fm/episodes/show/482/mr.-beasts-epidosde,0,pythonbytes.fm,Python Bytes: #482 Mr. Beast's epidosde,"News and announcements from the Python community for the week of Jun 1st, 2026",https://cdn.pythonbytes.fm/episodes/youtube_image/kNEoGGXppe4?v=1,2026-06-01T08:00:00Z,,"Collapse transcript
00:00Hello and welcome to Python Bytes, where we deliver Python news and headlines directly
00:04to your earbuds.
00:05This is episode 482, recorded Monday,
00:09June 1st.
00… [+25935 chars]",,en,'ecosystem'
https://pythonbytes.fm/episodes/show/482/mr.-beasts-episode,https://pythonbytes.fm/episodes/show/482/mr.-beasts-episode,0,pythonbytes.fm,Python Bytes: #482 Mr. Beast's episode,"News and announcements from the Python community for the week of Jun 1st, 2026",https://cdn.pythonbytes.fm/episodes/youtube_image/kNEoGGXppe4?v=1,2026-06-01T08:00:00Z,,"Collapse transcript
00:00Hello and welcome to Python Bytes, where we deliver Python news and headlines directly
00:04to your earbuds.
00:05This is episode 482, recorded Monday,
00:09June 1st.
00… [+25935 chars]",,en,'ecosystem'
https://devops.com/microsoft-brings-mcp-to-geospatial-workflows-with-planetary-computer-pro-tools-for-vs-code/,https://devops.com/microsoft-brings-mcp-to-geospatial-workflows-with-planetary-computer-pro-tools-for-vs-code/,0,devops.com,Microsoft Brings MCP to Geospatial Workflows With Planetary Computer Pro Tools for VS Code,Microsoft's Planetary Computer Pro MCP Tools for VS Code bring 35+ geospatial tools into GitHub Copilot via natural-language prompts.,https://devops.com/wp-content/uploads/2026/05/Untitled-design-21.jpg,2026-06-01T07:56:49Z,,"Microsoft has added a new set of Model Context Protocol tools to the VS Code Marketplace, and they’re aimed squarely at developers and data engineers working with geospatial data. The Microsoft Plane… [+5074 chars]",,en,'ecosystem'
https://me.pcmag.com/en/laptops/37387/adobe-photoshop-and-premiere-just-got-2x-faster-on-nvidias-new-pcs-creators-take-note,https://me.pcmag.com/en/laptops/37387/adobe-photoshop-and-premiere-just-got-2x-faster-on-nvidias-new-pcs-creators-take-note,0,me.pcmag.com,"Adobe Photoshop and Premiere Just Got 2x Faster on Nvidia's New PCs — Creators, Take Note","Adobe rebuilt Photoshop and Premiere for Nvidia's RTX Spark — twice as fast, and now controllable by AI agents via MCP. Here's what it means.",https://sm.pcmag.com/t/pcmag_me/photo/default/9ejxmm_czwq.1200.jpg,2026-06-01T07:51:15Z,,"Amid the chips and robots, Nvidia slipped in the announcement most likely to matter to working creatives: Adobe has rebuilt Photoshop and Premiere for RTX Spark, claiming roughly double the performan… [+2758 chars]",,en,'ecosystem'
https://www.globenewswire.com/news-release/2026/06/01/3304063/0/en/AB-Ignitis-grup%C4%97-new-term-CEO-selection-announced.html,https://www.globenewswire.com/news-release/2026/06/01/3304063/0/en/AB-Ignitis-grup%C4%97-new-term-CEO-selection-announced.html,0,www.globenewswire.com,AB “Ignitis grupė” new term CEO selection announced,"AB “Ignitis grupė” (hereinafter – the Group) has announced a Group CEO selection, as the second term of the current CEO, Darius Maikštėnas, ends on February 28, 2027. According to the Law on Companies of the Republic of Lithuania, the same person may be appoi…",https://ml-eu.globenewswire.com/Resource/Download/49767d7a-f72c-43e4-92d5-655cc3c7dbbb,2026-06-01T07:50:00Z,,"AB Ignitis grup (hereinafter the Group) has announced a Group CEO selection, as the second term of the current CEO, Darius Maiktnas, ends on February 28, 2027. According to the Law on Companies of th… [+1866 chars]",,en,'ecosystem'
https://cheezburger.com/45571589/the-hype-is-way-overblown-15-employees-quietly-changing-their-career-plans-because-of-ai,https://cheezburger.com/45571589/the-hype-is-way-overblown-15-employees-quietly-changing-their-career-plans-because-of-ai,0,cheezburger.com,'The hype is way overblown': 15 Employees quietly changing their career plans because of AI,"AI hype is everywhere these days, but is the buzzword worth changing your entire career? 
For a graphic designer, it might be, but for a city planner, AI is just a fad and ultimately a useful tool in creating a better workflow. Depending on which way you sli…",https://i.chzbgr.com/original/45571589/hEE2EEACC/15-employees-quietly-changing-their-career-plans-because-of-ai,2026-06-02T20:00:00Z,,"For a graphic designer, it might be, but for a city planner, AI is just a fad and ultimately a useful tool in creating a better workflow. Depending on which way you slice it, AI can be equal parts te… [+2041 chars]",,en,'deforestation'
https://www.nature.com/articles/d41586-026-01158-8,https://www.nature.com/articles/d41586-026-01158-8,0,www.nature.com,Robust projections of risks to the Amazon rainforest,"Amazonian deforestation is altering atmospheric moisture transport; as a result, even low levels of global warming could trigger dieback of most of the remaining forest.",https://media.nature.com/lw1200/magazine-assets/d41586-026-01158-8/d41586-026-01158-8_52477218.jpg,2026-06-01T00:00:00Z,,"<li>Wunderling, N. et al.Nature654, 114120 (2026).
Article 
Google Scholar 
</li><li>Armstrong McKay, D. I. et al.Science377, eabn7950 (2022).
Article 
 PubMed 
Google Scholar 
</li><li>Schleu… [+969 chars]",,en,'deforestation'
https://www.aljazeera.com/economy/2026/6/2/us-targets-brazil-with-new-tariffs-over-trade-practices,https://www.aljazeera.com/economy/2026/6/2/us-targets-brazil-with-new-tariffs-over-trade-practices,0,www.aljazeera.com,US targets Brazil with new tariffs over trade practices,"The US plans new 25 percent tariffs on Brazilian imports, citing issues like deforestation and digital trade practices.",https://www.aljazeera.com/wp-content/uploads/2026/06/2026-05-26T230617Z_2024972437_RC28HKAB5FNX_RTRMADP_3_USA-TRADE-NORTH-AMERICA-1780413964.jpg?resize=1920%2C1440,2026-06-02T17:00:15Z,,"The administration of United States President Donald Trump has proposed a new 25 percent tariff on imports from Brazil amid allegations of unfair trading practices.
US Trade Representative Jamieson … [+3653 chars]",,en,'deforestation'
https://indianexpress.com/article/health-wellness/nipah-in-india-why-kerala-and-west-bengal-face-the-same-virus-but-different-outbreak-risks-10720102/,https://indianexpress.com/article/health-wellness/nipah-in-india-why-kerala-and-west-bengal-face-the-same-virus-but-different-outbreak-risks-10720102/,0,indianexpress.com,Nipah in India: Why Kerala and West Bengal face the same virus but different outbreak risks,"A ‘Nature’ report reveals how ecology, human behaviour and health-system preparedness shape Nipah spillovers and transmission patterns in two most affected states",https://images.indianexpress.com/2026/06/Photo-55.jpg,2026-06-02T09:20:36Z,,"In January 2026, two healthcare workers at a private hospital in Barasat, West Bengal, tested positive for Nipah virus infection. Investigators traced the outbreak to a 55-year-old woman who had cons… [+7570 chars]",,en,'deforestation'
https://theweek.com/environment/amazon-deforestation-the-good-the-bad-and-the-under-protection,https://theweek.com/environment/amazon-deforestation-the-good-the-bad-and-the-under-protection,0,theweek.com,"Amazon deforestation: the good, the bad and the under protection",Deforestation has fallen but harsh realities remain,https://cdn.mos.cms.futurecdn.net/oG8kjU2HTxmRhcjGBpU3US-2000-80.jpg,2026-06-01T00:26:19Z,,"Deforestation in the Brazilian Amazon fell last year to its lowest level since 2019, according to a report from the MapBiomas monitoring network.
The findings are “good news” for President Luiz Inac… [+3210 chars]",,en,'deforestation'
https://www.dw.com/en/is-nation-hopping-ruining-german-youth-football/a-77378920,https://www.dw.com/en/is-nation-hopping-ruining-german-youth-football/a-77378920,0,www.dw.com,Is 'nation hopping' ruining German youth football?,Many young German footballers are choosing other countries over Germany. DFB Director Andreas Rettig is aiming to change this and is calling for a compensation fee.,https://static.dw.com/image/77308049_6.jpg,2026-06-01T14:21:00Z,,"Some of the best young talents at the World Cup this summer include Bayer Leverkusen's Ibrahim Maza and Malik Tillman, Eintracht Frankfurt's Can Uzun, and Bayern Munich's domestic-double winner Josip… [+5652 chars]",,en,'poaching'
https://www.abc.net.au/news/2026-06-02/feral-deer-hunting-new-rules-missed-opportunity-farmers-say/106748526,https://www.abc.net.au/news/2026-06-02/feral-deer-hunting-new-rules-missed-opportunity-farmers-say/106748526,0,www.abc.net.au,New deer hunting rules not expected to bring numbers down,"The Tasmanian government is making changes to the rules for deer hunting in the state, but farmers say it won't be enough to bring numbers down, with the sector's peak body calling for the species to be declared a pest.",https://live-production.wcms.abc-cdn.net.au/5f42e27882debab61b9d2b01e0fad17e?impolicy=wcms_watermark_news&cropH=1088&cropW=1936&xPos=0&yPos=193&width=862&height=485&imformat=generic,2026-06-02T03:58:02Z,,"The Tasmanian government is loosening rules for shooting deer as their numbers continue to soar, but both farmers and shooters are arguing the changes still fall short.
A new permit system will allo… [+4409 chars]",,en,'invasive species'
https://www.lawyersgunsmoneyblog.com/2026/06/packwood,https://www.lawyersgunsmoneyblog.com/2026/06/packwood,0,www.lawyersgunsmoneyblog.com,Packwood,"Bob Packwood is dead. While his name became a joke of 1990s politics due to his serial sexual harassment and his resignation from the Senate due to that behavior, he is actually a far more interesting character than that and a man who represents what the Repu…",https://www.lawyersgunsmoneyblog.com/wp-content/uploads/2026/06/RWPackwood.jpg,2026-06-06T22:25:22Z,,"Bob Packwood is dead. While his name became a joke of 1990s politics due to his serial sexual harassment and his resignation from the Senate due to that behavior, he is actually a far more interestin… [+16730 chars]",,en,'endangered species'
