index,url,valid,domain,title,description,image,published,archive,content,quote,language,keyword
https://www.vox.com/future-perfect/393048/mirror-life-mirror-bacteria-existential-risk-science-biology-apocalypse,https://www.vox.com/future-perfect/393048/mirror-life-mirror-bacteria-existential-risk-science-biology-apocalypse,0,www.vox.com,A whole new thing that could end the world,We’re all inured to sensationalist headlines about some disaster or another on the horizon. So I don’t blame anyone who was exhausted when they saw last month that dozens of scientists were warning in the journal Science that mirror bacteria could bring about…,https://platform.vox.com/wp-content/uploads/sites/2/2025/01/GettyImages-523740754.jpg?quality=90&strip=all&crop=0%2C10.425730649165%2C100%2C79.148538701669&w=1200,2025-01-02T20:54:46Z,https://web.archive.org/web/20250103205203/https://www.vox.com/future-perfect/393048/mirror-life-mirror-bacteria-existential-risk-science-biology-apocalypse,Were all inured to sensationalist headlines about some disaster or another on the horizon. So I dont blame anyone who was exhausted when they saw last month that dozens of scientists were warning in … [+9578 chars],,en,'invasive species'
https://www.juancole.com/2025/01/precious-natural-world.html,https://www.juancole.com/2025/01/precious-natural-world.html,0,www.juancole.com,"In 2025, let’s make it Game On – not Game Over – for our precious natural World","By Darcy Watchorn, Deakin University and Marissa Parrott, The University of Melbourne It’s just past midnight in the cool, ancient forests of Tasmania. We’ve spent a long day and night surveying endangered Tasmanian devils. All around, small animals scurry th…",https://media.juancole.com/images/2024/12/bandicoot-5507641_640.jpg,2025-01-01T05:06:59Z,https://web.archive.org/web/20250102025730/https://www.juancole.com/2025/01/precious-natural-world.html,"By Darcy Watchorn, Deakin University and Marissa Parrott, The University of Melbourne
Its just past midnight in the cool, ancient forests of Tasmania. Weve spent a long day and night surveying endan… [+6639 chars]",,en,'invasive species'
https://www.palmbeachpost.com/story/entertainment/2025/01/02/florida-alligator-tows-colossal-python-through-everglades-water-video/76864251007/,https://www.palmbeachpost.com/story/entertainment/2025/01/02/florida-alligator-tows-colossal-python-through-everglades-water-video/76864251007/,0,www.palmbeachpost.com,Alligator nicknamed 'Godzilla' hauls massive Burmese python through water in Florida Everglades,A large alligator nicknamed 'Godzilla' was caught on video dragging an enormous Burmese python through the water in the Florida Everglades.,https://s.yimg.com/cv/apiv2/social/images/yahoo_default_logo-1200x1200.png,2025-01-02T10:05:29Z,,"A large alligator was recently caught on video towing an enormous Burmese python through the water in the Florida Everglades.
The video, shot from the observation tower at Shark Valley by Everglades… [+2127 chars]",,en,'invasive species'
https://journals.plos.org/plosone/article?id=10.1371/journal.pone.0307730,https://journals.plos.org/plosone/article?id=10.1371/journal.pone.0307730,0,journals.plos.org,Global prioritization schemes vary in their impact on the placement of protected areas,"In response to global declines in biodiversity, many global conservation prioritization schemes were developed to guide effective protected area establishment. Protected area coverage has grown dramatically since the introduction of several high-profile biodi…",https://journals.plos.org/plosone/article/figure/image?id=10.1371/journal.pone.0307730.g003&size=inline,2025-01-02T14:00:00Z,,"Abstract
In response to global declines in biodiversity, many global conservation prioritization schemes were developed to guide effective protected area establishment. Protected area coverage has g… [+44156 chars]",,en,'zero-extinction'
https://www.newsweek.com/quarter-freshwater-animals-extinction-study-2011944,https://www.newsweek.com/quarter-freshwater-animals-extinction-study-2011944,0,www.newsweek.com,"Quarter of Freshwater Animals Face Extinction, New Study Warns","Although freshwater habitats cover less than 1 percent of the Earth's surface, they support 10 percent of known animal species.",https://d.newsweek.com/en/full/2560001/freshwater-animals-facing-extinction.jpg,2025-01-08T20:50:25Z,,"Nearly a quarter of animals living in rivers, lakes, and other freshwater habitats face extinction, according to a new study published Wednesday in Nature.
Researchers found that 24 percent of fresh… [+3626 chars]",,en,'deforestation'
http://twistedsifter.com/2025/01/the-amazon-is-the-largest-river-system-in-the-world-but-there-are-no-bridges-that-actually-cross-over-it-heres-why/,http://twistedsifter.com/2025/01/the-amazon-is-the-largest-river-system-in-the-world-but-there-are-no-bridges-that-actually-cross-over-it-heres-why/,0,twistedsifter.com,"The Amazon Is The Largest River System In The World, But There Are No Bridges That Actually Cross Over It. Here’s Why.",The reason makes a lot of sense.,https://twistedsifter.com/wp-content/uploads/2024/12/Amazon-River-1.png,2025-01-08T18:48:46Z,,"If you live in a city with a river running through it, or even if you’ve just visited one, you have almost undoubtedly walked or driven over a bridge connecting the two sides. In fact, most major cit… [+2230 chars]",,en,'deforestation'
https://www.pbs.org/newshour/science/a-quarter-of-the-worlds-freshwater-animals-are-threatened-with-extinction-new-research-shows,https://www.pbs.org/newshour/science/a-quarter-of-the-worlds-freshwater-animals-are-threatened-with-extinction-new-research-shows,0,www.pbs.org,"A quarter of the world's freshwater animals are threatened with extinction, new research shows","New research shows about a quarter of animals living in rivers, lakes and other freshwater sources are threatened with extinction.",https://d3i6fh83elv35t.cloudfront.net/static/2025/01/2025-01-08T144545Z_1789319568_RC2PXC8MH2EI_RTRMADP_3_SCIENCE-FRESHWATER-1024x683.jpg,2025-01-08T18:22:24Z,,"WASHINGTON (AP) Nearly a quarter of animals living in rivers, lakes and other freshwater sources are threatened with extinction, according to new research published Wednesday.
Huge rivers like the A… [+2252 chars]",,en,'deforestation'
https://www.vox.com/future-perfect/393738/factory-farms-meat-dairy-production,https://www.vox.com/future-perfect/393738/factory-farms-meat-dairy-production,0,www.vox.com,How factory farming took over America — and why it isn’t going away anytime soon,"A Vox reader asks: Why is factory farming still around? Factory farming — the intensive confinement of chickens, pigs, and cows on a massive scale — developed in the second half of the 20th century to feed a growing, and increasingly prosperous, post-World Wa…",https://platform.vox.com/wp-content/uploads/sites/2/2025/01/GettyImages-1257163995.jpg?quality=90&strip=all&crop=0%2C10.737892056687%2C100%2C78.524215886627&w=1200,2025-01-08T17:07:56Z,,"A Vox reader asks: Why is factory farming still around?
Factory farming the intensive confinement of chickens, pigs, and cows on a massive scale developed in the second half of the 20th century to f… [+8416 chars]",,en,'deforestation'
https://abcnews.go.com/Technology/wireStory/new-research-shows-quarter-freshwater-animals-threatened-extinction-117463763,https://abcnews.go.com/Technology/wireStory/new-research-shows-quarter-freshwater-animals-threatened-extinction-117463763,0,abcnews.go.com,New research shows a quarter of freshwater animals are threatened with extinction,"New research shows about a quarter of animals living in rivers, lakes and other freshwater sources are threatened with extinction",https://i.abcnewsfe.com/a/734954d9-01f0-4810-b5fd-f61b398e7a68/wirestory_cec91afc657bb0922c1d2966adf031ee_16x9.jpg?w=1600,2025-01-08T16:55:31Z,,"WASHINGTON -- Nearly a quarter of animals living in rivers, lakes and other freshwater sources are threatened with extinction, according to new research published Wednesday.
Huge rivers like the Ama… [+2167 chars]",,en,'deforestation'
https://removed.com,https://removed.com,0,removed.com,[Removed],[Removed],,2025-01-08T16:01:20Z,https://wayback.library.yorku.ca/all/20250108000000mp_/http://removed.com/,[Removed],,en,'deforestation'
https://journals.plos.org/plosone/article?id=10.1371/journal.pone.0315896,https://journals.plos.org/plosone/article?id=10.1371/journal.pone.0315896,0,journals.plos.org,Shared governance increases marine protected area effectiveness,"Marine protected areas (MPAs) are widely used to conserve and manage coastal resources. Protected areas are governed by a variety of institutional arrangements, yet little is known concerning the relative performance of different governance approaches. This r…",https://journals.plos.org/plosone/article/figure/image?id=10.1371/journal.pone.0315896.g003&size=inline,2025-01-08T14:00:00Z,,"Abstract
Marine protected areas (MPAs) are widely used to conserve and manage coastal resources. Protected areas are governed by a variety of institutional arrangements, yet little is known concerni… [+63910 chars]",,en,'deforestation'
https://lifesciencesworld.com/why-do-i-like-milk-so-much/,https://lifesciencesworld.com/why-do-i-like-milk-so-much/,0,lifesciencesworld.com,Why do I like milk so much?,"Why Do I Like Milk So Much? The Simple yet Complex Reason Behind Our Love for Milk Milk has been […]
The post Why do I like milk so much? appeared first on Life Sciences World.",https://lifesciencesworld.com/wp-content/uploads/2024/12/featured.png,2025-01-08T10:50:21Z,,"Why Do I Like Milk So Much?
The Simple yet Complex Reason Behind Our Love for Milk
Milk has been a staple in many cultures for centuries, and its appeal is undeniable. From the creamy texture to th… [+5447 chars]",,en,'deforestation'
https://phys.org/news/2025-01-brazil-amazon-reforestation-redeem-carbon.html,https://phys.org/news/2025-01-brazil-amazon-reforestation-redeem-carbon.html,0,phys.org,"In Brazil, an Amazon reforestation project seeks to redeem carbon markets","In the Brazilian Amazon, workers use metal tubes to sow seedlings in rapid succession, as part of an effort to reforest the jungle with millions of trees.",https://scx2.b-cdn.net/gfx/news/2025/mombak-biologist-sever.jpg,2025-01-08T08:50:01Z,,"In the Brazilian Amazon, workers use metal tubes to sow seedlings in rapid succession, as part of an effort to reforest the jungle with millions of trees.
The project has financial backing from the … [+5651 chars]",,en,'deforestation'
https://www.archdaily.com/1025081/straw-earth-and-bamboo-innovative-use-of-natural-materials-in-2024-projects-from-the-global-south,https://www.archdaily.com/1025081/straw-earth-and-bamboo-innovative-use-of-natural-materials-in-2024-projects-from-the-global-south,0,www.archdaily.com,"Straw, Earth and Bamboo: Innovative Use of Natural Materials in 2024 Projects from the Global South","Sustainability has been a central theme in architectural discussions for years, encompassing not only the profession’s role in combating climate change and transitioning to low-carbon economies but also preserving cultural heritage and celebrating vernacular …",https://images.adsttc.com/media/images/6763/4c35/8e9a/3d01/7e5b/0b39/large_jpg/palha-terra-e-bambu-uso-inovador-de-materiais-naturais-em-projetos-do-sul-global-em-2024_5.jpg?1734560840,2025-01-08T07:30:00Z,,"Chaki Wasi, Artisanal Center of the Shalalá Community / La Cabina de la Curiosidad © JAG Studio
Sustainability has been a central theme in architectural discussions for years, encompassing not only … [+7495 chars]",,en,'deforestation'
https://www.digitaljournal.com/world/in-brazil-an-amazon-reforestation-project-seeks-to-redeem-carbon-markets/article,https://www.digitaljournal.com/world/in-brazil-an-amazon-reforestation-project-seeks-to-redeem-carbon-markets/article,0,www.digitaljournal.com,"In Brazil, an Amazon reforestation project seeks to redeem carbon markets","In the Brazilian Amazon, workers use metal tubes to sow seedlings in rapid succession, as part of an effort to reforest the jungle with millions of trees. The project has financial backing from the United States and lucrative contracts with companies such as …",https://www.digitaljournal.com/wp-content/uploads/2025/01/401fae606dfaeca79490db0ec907b219ac83469c.jpg,2025-01-08T03:17:20Z,,"By planting native species that will thrive in the Amazon, Mombak hopes to restore credibility to a scandal-ridden carbon market - Copyright AFP STR
In the Brazilian Amazon, workers use metal tubes … [+5137 chars]",,en,'deforestation'
https://www.ibtimes.com/brazil-amazon-reforestation-project-seeks-redeem-carbon-markets-3758220,https://www.ibtimes.com/brazil-amazon-reforestation-project-seeks-redeem-carbon-markets-3758220,0,www.ibtimes.com,"In Brazil, An Amazon Reforestation Project Seeks To Redeem Carbon Markets","In the Brazilian Amazon, workers use metal tubes to sow seedlings in rapid succession, as part of an effort to reforest the jungle with millions of trees.",https://d.ibtimes.com/en/full/4573659/first-trees-planted-are-those-that-grow-best-under-sweltering-amazon-sun.jpg,2025-01-08T03:12:22Z,,"In the Brazilian Amazon, workers use metal tubes to sow seedlings in rapid succession, as part of an effort to reforest the jungle with millions of trees.
The project has financial backing from the … [+4901 chars]",,en,'deforestation'
https://www.ibtimes.com.au/brazil-amazon-reforestation-project-seeks-redeem-carbon-markets-1854997,https://www.ibtimes.com.au/brazil-amazon-reforestation-project-seeks-redeem-carbon-markets-1854997,0,www.ibtimes.com.au,"In Brazil, An Amazon Reforestation Project Seeks To Redeem Carbon Markets","In the Brazilian Amazon, workers use metal tubes to sow seedlings in rapid succession, as part of an effort to reforest the jungle with millions of trees.",https://d.ibtimes.com.au/en/full/1870423/first-trees-planted-are-those-that-grow-best-under-sweltering-amazon-sun.jpg,2025-01-08T03:12:10Z,,"In the Brazilian Amazon, workers use metal tubes to sow seedlings in rapid succession, as part of an effort to reforest the jungle with millions of trees.
The project has financial backing from the … [+4901 chars]",,en,'deforestation'
https://biztoc.com/x/8b50434d7246d31e,https://biztoc.com/x/8b50434d7246d31e,0,biztoc.com,"Global deforestation is declining, but forests are still under extreme pressure","Demand for wood is projected to increase by up to 49 per cent by 2050, driven by expanding industrial needs.
The post Global deforestation is declining, but forests are still under extreme pressure appeared first on Euractiv.",https://biztoc.com/cdn/8b50434d7246d31e_s.webp,2025-01-08T02:02:33Z,,"Demand for wood is projected to increase by up to 49 per cent by 2050, driven by expanding industrial needs.The post Global deforestation is declining, but forests are still under extreme pressure ap… [+83 chars]",,en,'deforestation'
https://www.euractiv.com/section/agriculture-food/news/global-deforestation-declining-but-forests-are-still-under-extreme-pressure/,https://www.euractiv.com/section/agriculture-food/news/global-deforestation-declining-but-forests-are-still-under-extreme-pressure/,0,www.euractiv.com,"Global deforestation is declining, but forests are still under extreme pressure [Advocacy Lab Content]","Demand for wood is projected to increase by up to 49 per cent by 2050, driven by expanding industrial needs.
The post Global deforestation is declining, but forests are still under extreme pressure appeared first on Euractiv.",https://www.euractiv.com/wp-content/uploads/sites/2/2025/01/GettyImages-523639168-scaled.jpg,2025-01-08T01:57:21Z,,"This article is part of our special report Deforestation and reforestation dynamics, Europe is driving a critical response to carbon removal.
Global deforestation rates have declined, but forests re… [+4218 chars]",,en,'deforestation'
https://www.jpost.com/environment-and-climate-change/article-836556,https://www.jpost.com/environment-and-climate-change/article-836556,0,www.jpost.com,"Ten species facing extinction require monitoring in 2025, according to conservation group","Ten new species, including nine animals and one plant, have been listed as ""staring extinction in the face,"" according to the UK-based international conservation group.","https://images.jpost.com/image/upload/f_auto,fl_lossy/c_fill,g_faces:center,h_407,w_690/642709",2025-01-07T23:35:40Z,http://wayback.archive-it.org/all/20250108024528/https://www.jpost.com/environment-and-climate-change/article-836556,"Amid threats such as deforestation, habitat loss, climate change, disease, and hunting, ten species have been highlighted as particularly at risk, according to a report published on Tuesday by UK-bas… [+2252 chars]",,en,'deforestation'
https://www.bangkokpost.com/opinion/opinion/2934997/farms-and-solar-energy-can-co-exist,https://www.bangkokpost.com/opinion/opinion/2934997/farms-and-solar-energy-can-co-exist,0,www.bangkokpost.com,Farms and solar energy can co-exist,"<p>At first glance, the idea of combining agriculture with solar energy seems far-fetched. How can crops and solar panels compete for the same sunlight? My view changed after I visited the Sosa Mega Solar Sharing site in Chiba Prefecture, Japan, last month. A…",https://static.bangkokpost.com/media/content/dcx/2025/01/08/5415282_700.jpg,2025-01-07T21:00:00Z,,"At first glance, the idea of combining agriculture with solar energy seems far-fetched. How can crops and solar panels compete for the same sunlight? My view changed after I visited the Sosa Mega Sol… [+7107 chars]",,en,'deforestation'
https://journals.plos.org/plosntds/article?id=10.1371/journal.pntd.0012776,https://journals.plos.org/plosntds/article?id=10.1371/journal.pntd.0012776,0,journals.plos.org,"Continuous detection of Chikungunya Virus in a passive surveillance system in southern Thailand, 2012–2019",Author summary Chikungunya virus (CHIKV) infections found worldwide and can lead to significant long-lasting morbidity due to chronic joint pain. Although CHIKV vaccines are in development (with one recently receiving accelerated approval based on a surrogate…,https://journals.plos.org/plosntds/article/figure/image?id=10.1371/journal.pntd.0012776.g006&size=inline,2025-01-07T14:00:00Z,,"Abstract
Chikungunya virus (CHIKV) infections are distributed across the globe, causing significant and, often, lasting morbidity. CHIKV vaccines are in development, but their evaluation is limited … [+39549 chars]",,en,'deforestation'
https://www.forbes.com/councils/forbesbusinesscouncil/2025/01/07/why-corporations-must-look-beyond-supply-chains-to-pursue-landscape-level-solutions-for-climate-resilience/,https://www.forbes.com/councils/forbesbusinesscouncil/2025/01/07/why-corporations-must-look-beyond-supply-chains-to-pursue-landscape-level-solutions-for-climate-resilience/,0,www.forbes.com,Why Corporations Must Look Beyond Supply Chains To Pursue Landscape-Level Solutions For Climate Resilience,Landscape-level solutions recognize the complexity of the climate crisis.,https://imageio.forbes.com/specials-images/imageserve/677c1ef50a494fe4e22a74dd/0x0.jpg?format=jpg&height=900&width=1600&fit=bounds,2025-01-07T13:30:00Z,,"Azra Nurkic is the CEO and cofounder of the Institute for Development Impact.
getty
Corporate leaders are increasingly acknowledging the urgency of the climate crisis, but that knowledge doesn't ne… [+5965 chars]",,en,'deforestation'
http://eprints.lse.ac.uk/126605/,http://eprints.lse.ac.uk/126605/,0,eprints.lse.ac.uk,Accelerating forest landscape restoration monitoring in Africa: informing tangible actions from a practical perspective,"Elias, Faisal, Djenontin Epse Mensah, Ida ORCID: 0000-0003-0991-5701 , Kamoto, Judith F.M. and Mansourian, Stephanie (2024) Accelerating forest landscape restoration monitoring in Africa: informing tangible actions from a practical perspective. Restoration Ec…",,2025-01-07T11:18:03Z,,"Elias, Faisal, Djenontin Epse Mensah, IdaORCID: 0000-0003-0991-5701, Kamoto, Judith F.M. and Mansourian, Stephanie 
(2024)
Accelerating forest landscape restoration monitoring in Africa: informing … [+2044 chars]",,en,'deforestation'
https://www.livescience.com/planet-earth/earth-from-space-pakistans-bleeding-ink-lagoon-brings-life-to-harsh-desert-environment,https://www.livescience.com/planet-earth/earth-from-space-pakistans-bleeding-ink-lagoon-brings-life-to-harsh-desert-environment,0,www.livescience.com,Earth from space: Pakistan's 'bleeding ink' lagoon brings life to harsh desert environment,"This 2014 satellite photo shows Pakistan's Khor Kalmat tidal lagoon brimming with water at the heart of an arid desert. This fluctuating body of water, which looks like ""ink bleeding onto parchment,"" helps support life in this harsh environment.",https://cdn.mos.cms.futurecdn.net/y2ezvGrdnnoStmzBhXKt3D-1200-80.jpg,2025-01-07T10:58:54Z,http://wayback.archive-it.org/all/20250108023421/https://www.livescience.com/planet-earth/earth-from-space-pakistans-bleeding-ink-lagoon-brings-life-to-harsh-desert-environment,"Where is it? Khor Kalmat, Pakistan [25.412836978, 64.05686092]
What's in the photo? A vibrant blue lagoon in a harsh desert environment
Which satellite took the photo? Landsat 8
When was it taken?… [+3018 chars]",,en,'deforestation'
https://www.counterpunch.org/2025/01/07/how-the-world-hides-liability-for-climate-deaths/,https://www.counterpunch.org/2025/01/07/how-the-world-hides-liability-for-climate-deaths/,0,www.counterpunch.org,How the World Hides Liability for Climate Deaths,"Nearly half the world’s children “live in countries where risks to their health and safety due to the effects of climate change are extremely high,” according to UNICEF. By 2050, almost all children globally will be “exposed to heat waves,” resulting in the r…",https://www.counterpunch.org/wp-content/uploads/2025/01/Screenshot-2025-01-06-at-3.48.33-PM-896x630.png,2025-01-07T06:55:12Z,,"Nearly half the worlds children live in countries where risks to their health and safety due to the effects of climate change are extremely high, according to UNICEF. By 2050, almost all children glo… [+21521 chars]",,en,'deforestation'
https://lifesciencesworld.com/what-is-the-dumbest-animal/,https://lifesciencesworld.com/what-is-the-dumbest-animal/,0,lifesciencesworld.com,What is the dumbest animal?,"The Dumbest Animal: A Look into the World of Intelligent Creatures Introduction The concept of intelligence is often associated with […]
The post What is the dumbest animal? appeared first on Life Sciences World.",https://lifesciencesworld.com/wp-content/uploads/2024/12/featured.png,2025-01-07T06:34:05Z,,"The Dumbest Animal: A Look into the World of Intelligent Creatures
Introduction
The concept of intelligence is often associated with humans, and it’s easy to assume that all animals are equally int… [+3655 chars]",,en,'deforestation'
https://www.newsbreak.com/share/3745091246101-food-made-without-plants-or-animals-will-go-on-sale-in-the-us-in-2025?_f=app_share&pd=0HkLzmsc&lang=en_US&send_time=1736228003&trans_data=%7B%22platform%22:0%2C%22cv%22:%2224.52.0.21%22%2C%22languages%22:%22en%22%7D&sep=ns_foryou_blend_exp_25q1-v8%2Cns_foryou_model_exp_25q1-v1%2Cns_foryou_recall_exp_25q1-control%2Cns_push_exp_rt_bucketv12-v9%2Cns_foryou_rank_exp_25q1-v8&s=i2,https://www.newsbreak.com/share/3745091246101-food-made-without-plants-or-animals-will-go-on-sale-in-the-us-in-2025?_f=app_share&pd=0HkLzmsc&lang=en_US&send_time=1736228003&trans_data=%7B%22platform%22:0%2C%22cv%22:%2224.52.0.21%22%2C%22languages%22:%22en%22%7D&sep=ns_foryou_blend_exp_25q1-v8%2Cns_foryou_model_exp_25q1-v1%2Cns_foryou_recall_exp_25q1-control%2Cns_push_exp_rt_bucketv12-v9%2Cns_foryou_rank_exp_25q1-v8&s=i2,0,www.newsbreak.com,Food made without plants or animals will go on sale in the US in 2025,"Imagine a future where butter, chocolate, and ice cream are created without relying on farms or livestock. That future is closer than ever as farmless foo",https://img.particlenews.com/img/id/2xoV6d_0xudtCwG00,2025-01-07T05:34:11Z,,"Imagine a future where butter, chocolate, and ice cream are created without relying on farms or livestock. That future is closer than ever as farmless food prepares to make its debut in the United St… [+2691 chars]",,en,'deforestation'
https://clsbluesky.law.columbia.edu/2025/01/07/iss-discusses-the-latest-in-esg-and-stewardship-regulation/,https://clsbluesky.law.columbia.edu/2025/01/07/iss-discusses-the-latest-in-esg-and-stewardship-regulation/,0,clsbluesky.law.columbia.edu,ISS Discusses the Latest in ESG and Stewardship Regulation,"INTERNATIONAL
IOSCO
International Organization of Securities Commissions Publishes Report on Impact of Transition Plans Disclosures
The International Organization of Securities Commissions (IOSCO) published a report on November 13 covering the key impacts of,…",,2025-01-07T05:01:11Z,,"INTERNATIONAL
International Organization of Securities Commissions Publishes Report on Impact of Transition Plans Disclosures
The International Organization of Securities Commissions (IOSCO) publis… [+26587 chars]",,en,'deforestation'
https://www.newsweek.com/tap-water-salty-sea-level-rise-north-carolina-2010458,https://www.newsweek.com/tap-water-salty-sea-level-rise-north-carolina-2010458,0,www.newsweek.com,Millions of Americans' Tap Water Could Get Saltier,"""Losses due to low drinking water quality could be as high as $232 million by 2040,"" researchers wrote in a new study.",https://d.newsweek.com/en/full/2557600/tap-water-north-carolina.jpg,2025-01-06T19:28:07Z,,"Tap water in North Carolina might be about to get much saltier, possibly impacting tourism to the Tar Heel State.
Due to rising sea levels, the ocean is slowly encroaching into coastal land in North… [+4502 chars]",,en,'deforestation'
