index,url,valid,domain,title,description,image,published,archive,content,quote,language,keyword
https://pypi.org/project/cybergoatz-terraform-client/,https://pypi.org/project/cybergoatz-terraform-client/,0,pypi.org,cybergoatz-terraform-client added to PyPI,CyberGoatz platform Terraform orchestration client,https://pypi.org/static/images/twitter.abaf4b19.webp,2026-06-01T09:54:01Z,,"Terraform orchestration client for CyberGoatz Platform sandbox provisioning.
This package is a CyberGoatz-maintained fork of CyberRangeCZ's
backend-terraform-client. It keeps the existing crczp.ter… [+1533 chars]",,en,'ecosystem'
https://cryptobriefing.com/lewis-hart-commodity-markets-are-complex-due-to-financialization-traders-act-as-supply-chain-managers-and-flexibility-in-finance-is-key-to-managing-price-volatility-odd-lots/,https://cryptobriefing.com/lewis-hart-commodity-markets-are-complex-due-to-financialization-traders-act-as-supply-chain-managers-and-flexibility-in-finance-is-key-to-managing-price-volatility-odd-lots/,0,cryptobriefing.com,"Lewis Hart: Commodity markets are complex due to financialization, traders act as supply chain managers, and flexibility in finance is key to managing price volatility | Odd Lots","Commodity finance's role in global trade hinges on capital efficiency and managing price risks through futures markets.
The post Lewis Hart: Commodity markets are complex due to financialization, traders act as supply chain managers, and flexibility in financ…",https://static.cryptobriefing.com/wp-content/uploads/2026/02/11174241/odd-lots-cover-457x457.jpg,2026-06-01T09:51:30Z,,"Commodity finance's role in global trade hinges on capital efficiency and managing price risks through futures markets. Key takeaways
<ul><li>Commodity markets are complex due to significant financi… [+9514 chars]",,en,'ecosystem'
https://financialpost.com/globe-newswire/asus-republic-of-gamers-unveils-rog-g1000-edition-20-desktop-and-rog-xbox-ally-x20-bundle-at-computex-2026,https://financialpost.com/globe-newswire/asus-republic-of-gamers-unveils-rog-g1000-edition-20-desktop-and-rog-xbox-ally-x20-bundle-at-computex-2026,0,financialpost.com,ASUS Republic of Gamers Unveils ROG G1000 Edition 20 Desktop and ROG Xbox Ally X20 Bundle at Computex 2026,"Two new anniversary flagships lead ROG’s Computex showcase, joined by the new Strix SCAR 18 and the latest evolution of ROG Nebula HDR Displays KEY POINTS ROG Edition 20 debuts: ROG celebrates 20 years of gaming innovation with a limited anniversary collectio…",https://smartcdn.gprod.postmedia.digital/financialpost/wp-content/uploads/2026/06/asus-republic-of-gamers-unveils-rog-g1000-edition-20-desktop.jpeg,2026-06-01T09:48:58Z,,"ROG Xbox Ally X20 Bundle
The ROG Xbox Ally X20 Bundle brings the celebration to the handheld as the definitive expression of ROGs handheld vision. The chassis is finished in translucent black with g… [+3963 chars]",,en,'ecosystem'
https://www.globenewswire.com/news-release/2026/06/01/3304120/0/en/ASUS-Republic-of-Gamers-Unveils-ROG-G1000-Edition-20-Desktop-and-ROG-Xbox-Ally-X20-Bundle-at-Computex-2026.html,https://www.globenewswire.com/news-release/2026/06/01/3304120/0/en/ASUS-Republic-of-Gamers-Unveils-ROG-G1000-Edition-20-Desktop-and-ROG-Xbox-Ally-X20-Bundle-at-Computex-2026.html,0,www.globenewswire.com,ASUS Republic of Gamers Unveils ROG G1000 Edition 20 Desktop and ROG Xbox Ally X20 Bundle at Computex 2026,"ROG unveils G1000 Edition 20, Xbox Ally X20 Bundle and Strix SCAR 18 at Computex, celebrating 20 years of gaming innovation....",https://ml.globenewswire.com/Resource/Download/54feaf53-2bc8-4288-afd5-850f91b7be4f,2026-06-01T09:47:00Z,,"KEY POINTS
<ul><li>ROG Edition 20 debuts: ROG celebrates 20 years of gaming innovation with a limited anniversary collection spanning desktop, handheld, laptop, and more</li><li>Two anniversary flag… [+11639 chars]",,en,'ecosystem'
https://www.thehindubusinessline.com/economy/how-arai-is-expanding-from-cars-to-metro-rail-as-indias-mobility-rules-tighten/article71039023.ece,https://www.thehindubusinessline.com/economy/how-arai-is-expanding-from-cars-to-metro-rail-as-indias-mobility-rules-tighten/article71039023.ece,0,www.thehindubusinessline.com,How ARAI is expanding from cars to metro rail as India’s mobility rules tighten,The agency recently tested an Obstacle & Derailment Detection system for the Delhi Metro Rail Corporation to detect track obstructions and automatically trigger emergency braking if a train wheel derails,https://bl-i.thgim.com/public/incoming/l5sg1g/article71047774.ece/alternates/LANDSCAPE_1200/HJfC-ovaIAAdv68.jfif,2026-06-01T09:43:20Z,,"Indias largest automotive testing and certification agency, Pune-based ARAI, has begun validating metro rail safety systems as it expands beyond cars and trucks into EV battery testing, vehicle crash… [+4480 chars]",,en,'ecosystem'
https://www.windowscentral.com/hardware/laptops/qualcomm-responds-to-nvidias-new-rtx-spark-windows-on-arm-chips-welcome-to-the-family-were-excited,https://www.windowscentral.com/hardware/laptops/qualcomm-responds-to-nvidias-new-rtx-spark-windows-on-arm-chips-welcome-to-the-family-were-excited,0,www.windowscentral.com,"Qualcomm responds to NVIDIA's new RTX Spark Windows on Arm chips: ""Welcome to the family. We're excited""","Qualcomm SVP Kedar Kondap has shared his thoughts on NVIDIA entering the PC space, and he reckons it's good news for everybody.",https://cdn.mos.cms.futurecdn.net/DN246TZwQYnLVgscXHAfRh-2560-80.jpg,2026-06-01T09:43:20Z,,"On the back of NVIDIA's groundbreaking RTX Spark announcement, Qualcomm SVP of Computing Kedar Kondap has shared his thoughts on the Windows on Arm space heating up in a Q&amp;A session with media ho… [+3461 chars]",,en,'ecosystem'
https://www.prnewswire.com/news-releases/persistent-to-expand-eastern-european-presence-to-advance-ai-led-platform-transformation-302786952.html,https://www.prnewswire.com/news-releases/persistent-to-expand-eastern-european-presence-to-advance-ai-led-platform-transformation-302786952.html,0,www.prnewswire.com,Persistent to Expand Eastern European Presence to Advance AI-Led Platform Transformation,"European nearshore delivery capabilities to support the next generation of AI-enabled enterprise operations TALLINN, Estonia and PUNE, India, June 1, 2026 /PRNewswire/ -- Persistent Systems (BSE: 533179) (NSE: PERSISTENT), a global Digital Engineering and Ent…",https://mma.prnewswire.com/media/1022385/4851381/Persistent_Systems_Logo.jpg?p=facebook,2026-06-01T09:40:00Z,,"European nearshore delivery capabilities to support the next generation of AI-enabled enterprise operations
TALLINN, Estonia and PUNE, India, June 1, 2026 /PRNewswire/ -- Persistent Systems (BSE: 53… [+5221 chars]",,en,'ecosystem'
https://pypi.org/project/qualix/,https://pypi.org/project/qualix/,0,pypi.org,qualix added to PyPI,AI-native development quality gate — full-chain coverage from requirements to code,https://pypi.org/static/images/twitter.abaf4b19.webp,2026-06-01T09:39:54Z,,"AI-native development quality gates for requirements, designs, tests, and code reviews.
Qualix turns product requirements into traceable engineering checks. Instead of stopping at line coverage, it … [+8259 chars]",,en,'ecosystem'
https://www.electronicpaymentsinternational.com/features/interview-encryptus-ceo-shantnoo-saxsena/,https://www.electronicpaymentsinternational.com/features/interview-encryptus-ceo-shantnoo-saxsena/,0,www.electronicpaymentsinternational.com,Interview: Encryptus CEO Shantnoo Saxsena on scaling stablecoin settlement in Africa and Southeast Asia,Shantnoo Saxsena tells Satarupa Bhowmik about the company’s mid-term targets and its role in the broader ecosystem.,https://s.yimg.com/ny/api/res/1.2/TKjjR9qg_b_yQurDkoKWxw--/YXBwaWQ9aGlnaGxhbmRlcjt3PTEyMDA7aD02NzU-/https://media.zenfs.com/en/electronic_payments_938/dbefd492ba2f614df9515e87dd03f8cd,2026-06-01T09:37:14Z,,"Stablecoin settlement is transforming global finance through near-instant, low-cost, and programmable finality across borders. By bridging legacy systems with digital assets, stablecoins are becoming… [+5234 chars]",,en,'ecosystem'
https://www.prnewswire.com/news-releases/persistent-to-expand-eastern-european-presence-to-advance-ai-led-platform-transformation-302786950.html,https://www.prnewswire.com/news-releases/persistent-to-expand-eastern-european-presence-to-advance-ai-led-platform-transformation-302786950.html,0,www.prnewswire.com,Persistent to Expand Eastern European Presence to Advance AI-Led Platform Transformation,"European nearshore delivery capabilities to support the next generation of AI-enabled enterprise operations TALLINN, Estonia and PUNE, India, June 1, 2026 /PRNewswire/ -- Persistent Systems (BSE: 533179) (NSE: PERSISTENT), a global Digital Engineering and Ent…",https://mma.prnewswire.com/media/1022385/4851381/Persistent_Systems_Logo.jpg?p=facebook,2026-06-01T09:37:00Z,,"European nearshore delivery capabilities to support the next generation of AI-enabled enterprise operations
TALLINN, Estonia and PUNE, India, June 1, 2026 /PRNewswire/ -- Persistent Systems(BSE: 533… [+5248 chars]",,en,'ecosystem'
https://indianexpress.com/article/sports/football/fifa-world-cup-2026-zee-unite8-tv-channel-broadcast-live-streaming-india-rights-10718421/,https://indianexpress.com/article/sports/football/fifa-world-cup-2026-zee-unite8-tv-channel-broadcast-live-streaming-india-rights-10718421/,0,indianexpress.com,Zee lands 2026 FIFA World Cup rights in India 11 days before start of tournament,"Zee Entertainment Enterprises Ltd. announced that it has reached a deal with FIFA, football's global governing body, in which it will broadcast ""39 global football events"", including the World Cup this year, the 2027 FIFA Women's World Cup and the 2030 FIFA W…",https://images.indianexpress.com/2025/11/FIFA-World-Cup-1.jpg,2026-06-01T09:35:17Z,,The 2026 FIFA World Cup has finally got an official broadcaster in India just over a week before the start of the tournament. Zee Entertainment Enterprises Ltd. said on Monday that it has reached a d… [+2392 chars],,en,'ecosystem'
https://scholarlykitchen.sspnet.org/2026/06/01/guest-post-proposed-uniform-guidance-revisions-would-eliminate-journal-subscriptions-and-apcs-as-allowable-federal-grant-costs/,https://scholarlykitchen.sspnet.org/2026/06/01/guest-post-proposed-uniform-guidance-revisions-would-eliminate-journal-subscriptions-and-apcs-as-allowable-federal-grant-costs/,0,scholarlykitchen.sspnet.org,Guest Post — Proposed Uniform Guidance Revisions Would Eliminate Journal Subscriptions and APCs as Allowable Federal Grant Costs,"New guidance from the US government on research funding makes publishing and journal subscription costs unallowable.
The post Guest Post — Proposed Uniform Guidance Revisions Would Eliminate Journal Subscriptions and APCs as Allowable Federal Grant Costs appe…",https://scholarlykitchen.sspnet.org/wp-content/uploads/2026/05/iStock-1331282134.jpg,2026-06-01T09:30:58Z,,"Editors Note: Todays post is by Hilary Craiglow. Hilary leads library consulting at Attain Partners, a higher education consulting firm. For those interested in a full summary of the proposed changes… [+9821 chars]",,en,'ecosystem'
https://www.geeky-gadgets.com/wwdc-2026-hardware-leaks/,https://www.geeky-gadgets.com/wwdc-2026-hardware-leaks/,0,www.geeky-gadgets.com,Every New Apple Device Leaked Ahead of WWDC 2026,"Apple’s Worldwide Developers Conference (WWDC) 2026 is shaping up to be a pivotal event, with leaks pointing to the unveiling of nine new devices alongside significant software updates. This year’s conference is expected to highlight Apple’s latest advancemen…",https://www.geeky-gadgets.com/wp-content/uploads/2026/05/wwdc-1.jpg,2026-06-01T09:30:29Z,,"Apple’s Worldwide Developers Conference (WWDC) 2026 is shaping up to be a pivotal event, with leaks pointing to the unveiling of nine new devices alongside significant software updates. This years co… [+5953 chars]",,en,'ecosystem'
https://www.infosecurity-magazine.com/news/attackers-shared-content-chatgpt/,https://www.infosecurity-magazine.com/news/attackers-shared-content-chatgpt/,0,www.infosecurity-magazine.com,Attackers Abuse Shared Content for ChatGPT Phishing Campaign,Push Security says threat actors are delivering malware hosted on chatgpt.com/s/ domain,https://assets.infosecurity-magazine.com/webpage/og/5cac5c76-87ca-4b55-abbb-9b2757b369e6.jpg,2026-06-01T09:30:00Z,,"Threat actors are delivering malware from phishing pages hosted on legitimate ChatGPT domains, Push Security has warned.
The vendor claimed that hackers are abusing ChatGPT's code-rendering feature … [+2804 chars]",,en,'ecosystem'
https://fortune.com/2026/06/01/binance-adds-u-s-stocks-in-super-app-push-plans-to-launch-tokenized-shares/,https://fortune.com/2026/06/01/binance-adds-u-s-stocks-in-super-app-push-plans-to-launch-tokenized-shares/,0,fortune.com,"Exclusive: Binance adds U.S. stocks in ‘super app’ push, plans to launch tokenized shares","Binance is making over 7,000 stocks and ETFs available for zero commission to non U.S. users, and plans to soon let customers tokenize stock on its BNB blockchain.","https://fortune.com/img-assets/wp-content/uploads/2026/01/GettyImages-2232757227.jpg?resize=1200,600",2026-06-01T09:30:00Z,,"Binance, the worlds biggest cryptocurrency exchange, announced on Monday that its users will be able to trade more than 7,000 U.S. stocks and ETFs. The company also announced an upcoming plan to allo… [+3280 chars]",,en,'ecosystem'
https://www.thehindubusinessline.com/info-tech/black-box-aionos-join-hands-to-scale-enterprise-ai-infrastructure/article71047729.ece,https://www.thehindubusinessline.com/info-tech/black-box-aionos-join-hands-to-scale-enterprise-ai-infrastructure/article71047729.ece,0,www.thehindubusinessline.com,"Black Box, AIONOS join hands to scale enterprise AI infrastructure","In India, the alliance will specifically target the rapidly expanding Global Capability Centre (GCC) ecosystem",https://bl-i.thgim.com/public/incoming/f5kdu7/article71047773.ece/alternates/LANDSCAPE_1200/download%2010.jpg,2026-06-01T09:29:20Z,,"Essar Groups IT arm Black Box and AI-native enterprise technology firm AIONOS have partnered to help enterprises globally accelerate their artificial intelligence (AI) transformation.
The collaborat… [+1239 chars]",,en,'ecosystem'
https://www.thehindubusinessline.com/news/sports/zee-entertainment-bags-fifa-world-cup-broadcasting-rights-in-india-from-2026-to-2034/article71047728.ece,https://www.thehindubusinessline.com/news/sports/zee-entertainment-bags-fifa-world-cup-broadcasting-rights-in-india-from-2026-to-2034/article71047728.ece,0,www.thehindubusinessline.com,Zee Entertainment bags FIFA world cup broadcasting rights in India from 2026 to 2034,"The eight-year deal includes the FIFA World Cups in 2026 and 2030, the FIFA Women’s World Cup 2027, youth tournaments, futsal competitions and documentary content across television and ZEE5.",https://bl-i.thgim.com/public/incoming/v0uwlt/article71047759.ece/alternates/LANDSCAPE_1200/2025-07-07T134540Z_1037268322_RC2PHFA3FJ8V_RTRMADP_3_ZEE-ENTERTAINMENT-RESULTS.JPG,2026-06-01T09:24:30Z,,"The deal includes content such as the FIFA Mens U-17 World Cup (2026-2034), FIFA Womens U-17 World Cup (2026-2034), FIFA U-20 Mens World Cup (2027, 2029, 2031 and 2033), FIFA U-20 Womens World Cup (2… [+3024 chars]",,en,'ecosystem'
https://economictimes.indiatimes.com/industry/services/consultancy-/-audit/fpsb-india-names-ramesh-vishwanathan-ceo-to-drive-growth-of-financial-planning-profession/articleshow/131439082.cms,https://economictimes.indiatimes.com/industry/services/consultancy-/-audit/fpsb-india-names-ramesh-vishwanathan-ceo-to-drive-growth-of-financial-planning-profession/articleshow/131439082.cms,0,economictimes.indiatimes.com,FPSB India names Ramesh Vishwanathan CEO to drive growth of financial planning profession,FPSB India has appointed Ramesh Vishwanathan as its new Chief Executive Officer. Vishwanathan brings over 25 years of leadership experience in financial services. He will focus on strategic direction and growth for the financial planning profession in India. …,"https://img.etimg.com/thumb/msid-131439071,width-1200,height-630,imgsize-9770,overlay-economictimes/articleshow.jpg",2026-06-01T09:23:10Z,,"Bengaluru: FPSB India has appointed Ramesh Vishwanathan its new Chief Executive Officer (CEO), the company said in a statement on Monday.FPSB India is the Indian subsidiary of Financial Planning Stan… [+1973 chars]",,en,'ecosystem'
https://www.geeky-gadgets.com/framework-12-vs-macbook-neo/,https://www.geeky-gadgets.com/framework-12-vs-macbook-neo/,0,www.geeky-gadgets.com,Framework 12 vs MacBook Neo: Which Laptop Design Wins?,"The Framework 12 and Apple MacBook Neo represent two distinct philosophies in laptop design, catering to different user priorities. As explored by Jeff Geerling, the Framework 12 emphasizes modularity and repairability, appealing to users who value the abilit…",https://www.geeky-gadgets.com/wp-content/uploads/2026/05/framework-vs-macbook.jpg,2026-06-01T09:17:00Z,,"The Framework 12 and Apple MacBook Neo represent two distinct philosophies in laptop design, catering to different user priorities. As explored by Jeff Geerling, the Framework 12 emphasizes modularit… [+6365 chars]",,en,'ecosystem'
https://www.mindbodygreen.com/articles/artisan-cheese-has-gut-health-benefits-and-probiotics,https://www.mindbodygreen.com/articles/artisan-cheese-has-gut-health-benefits-and-probiotics,0,www.mindbodygreen.com,This Food Is A Probiotic Powerhouse & It's Hiding In Your Cheese Drawer,Good news for your next charcuterie board.,"https://mindbodygreen-res.cloudinary.com/image/upload/c_fill,w_2000,h_1200,g_auto,fl_lossy,f_jpg/org/2zuepnpaejyyxz08r.jpg",2026-06-01T09:11:00Z,,"Fermented foods are a staple for many people in the health community, and are often recommended by physicians to help support your microbiome. Kimchi, sauerkraut, and yogurt have all had their moment… [+7700 chars]",,en,'ecosystem'
https://www.techradar.com/computing/computing-components/welcome-to-the-family-qualcomm-says-its-glad-nvidia-is-joining-the-arm-race-with-the-rtx-spark,https://www.techradar.com/computing/computing-components/welcome-to-the-family-qualcomm-says-its-glad-nvidia-is-joining-the-arm-race-with-the-rtx-spark,0,www.techradar.com,'Welcome to the family' — Qualcomm says it's glad Nvidia is joining the Arm race with the RTX Spark,Qualcomm welcomes Nvidia to the Arm family — and I think it will have the edge over the RTX Spark with its affordable Snapdragon C chip.,https://cdn.mos.cms.futurecdn.net/9keNpqwmm7WYhzTs7QiGv3-2560-80.jpg,2026-06-01T09:09:50Z,,"I’ve been spending time with Qualcomm at Computex 2026, and if, like me, you were wondering how the company — which once had the Windows on Arm market pretty much all to itself — will respond to Nvid… [+2944 chars]",,en,'ecosystem'
https://www.exchangewire.com/blog/2026/06/01/markapp-and-vizio-ads-expand-premium-ctvreach-across-smart-tv-environments/,https://www.exchangewire.com/blog/2026/06/01/markapp-and-vizio-ads-expand-premium-ctvreach-across-smart-tv-environments/,0,www.exchangewire.com,MarkApp and VIZIO Ads Expand Premium CTV Reach Across Smart TV Environments,"MarkApp has announced a strategic collaboration with VIZIO Ads, expanding access to premium Connected TV opportunities across smart TV environments.
The partnership strengthens MarkApp’s ability to support advertisers, agencies, and trading partners with scal…",https://cdn.exchangewire.com/wp-content/uploads/2026/06/Untitled-design-18.png,2026-06-01T09:07:54Z,,"MarkApp has announced a strategic collaboration with VIZIO Ads, expanding access to premium Connected TV opportunities across smart TV environments.
The partnership strengthens MarkApps ability to s… [+3962 chars]",,en,'ecosystem'
https://www.verdictfoodservice.com/news/sagtec-global-40-stake-malaya-heritage/,https://www.verdictfoodservice.com/news/sagtec-global-40-stake-malaya-heritage/,0,www.verdictfoodservice.com,Sagtec Global to acquire 40% stake in Malaysia’s Malaya Heritage Holding,The company estimates that the deal could bring in $4m in potential revenue for the group.,https://s.yimg.com/ny/api/res/1.2/jMrJoAzI_6u_dqLX6QqBYw--/YXBwaWQ9aGlnaGxhbmRlcjt3PTEyMDA7aD02NzU-/https://media.zenfs.com/en/verdict_food_service_772/d0d049fc89fad739fc955f201a8f1fa8,2026-06-01T09:05:12Z,,"Hospitality software solutions provider Sagtec Global has signed a definitive agreement to purchase a 40% equity interest in Malaysian restaurant operator Malaya Heritage Holding.
Focusing on herita… [+2368 chars]",,en,'ecosystem'
https://www.thehindubusinessline.com/info-tech/2-million-extended-realities-xr-jobs-by-2030-in-india-iit-madras-report/article71047648.ece,https://www.thehindubusinessline.com/info-tech/2-million-extended-realities-xr-jobs-by-2030-in-india-iit-madras-report/article71047648.ece,0,www.thehindubusinessline.com,2 Million Extended Realities (XR) jobs by 2030 in India: IIT Madras Report,Report cautions that relying solely on a “service provider” model could limit long-term value creation and global competitiveness,https://bl-i.thgim.com/public/incoming/fhgi0e/article71047669.ece/alternates/LANDSCAPE_1200/CCI_UDHindu_KSL_UGO5DVNDA_R1550834959_4_340d1c82-2e28-4299-90b0-2f3668ee7025.jpg,2026-06-01T09:03:17Z,,"The Extended Realities (XR) sector has the potential to create around 2 million high value jobs by 2030, a new IIT-Madras study has found.
The report, released on Monday by the Experiential Technolo… [+1693 chars]",,en,'ecosystem'
https://www.prnewswire.com/news-releases/xiaohongshu-luxury-summit-2026-explores-how-life-moments-are-reshaping-luxury-growth-302785801.html,https://www.prnewswire.com/news-releases/xiaohongshu-luxury-summit-2026-explores-how-life-moments-are-reshaping-luxury-growth-302785801.html,0,www.prnewswire.com,"Xiaohongshu Luxury Summit 2026 Explores How ""Life Moments"" Are Reshaping Luxury Growth","SHANGHAI, June 1, 2026 /PRNewswire/ -- On May 28, 2026, Xiaohongshu hosted its ""Worth Every Glance"" Luxury Summit in Shanghai, bringing together more than 100 senior executives from leading luxury brands across categories including leather goods, jewelry, wat…",https://mma.prnewswire.com/media/2990735/image1__10.jpg?p=facebook,2026-06-01T09:00:00Z,,"SHANGHAI, June 1, 2026 /PRNewswire/ -- On May 28, 2026, Xiaohongshu hosted its ""Worth Every Glance"" Luxury Summit in Shanghai, bringing together more than 100 senior executives from leading luxury br… [+4366 chars]",,en,'ecosystem'
https://www.prnewswire.com/news-releases/cerracap-impact-venture-capital-appoints-former-silicon-valley-bank-and-equifax-cio-mark-rohrwasser-to-lead-cxo-council-302786722.html,https://www.prnewswire.com/news-releases/cerracap-impact-venture-capital-appoints-former-silicon-valley-bank-and-equifax-cio-mark-rohrwasser-to-lead-cxo-council-302786722.html,0,www.prnewswire.com,CerraCap Impact Venture Capital Appoints Former Silicon Valley Bank and Equifax CIO Mark Rohrwasser to Lead CXO Council,"COSTA MESA, Calif., June 1, 2026 /PRNewswire/ -- CerraCap Impact Venture Capital (""CIVC"") today announced the appointment of Mark Rohrwasser, former Chief Information Officer of Silicon Valley Bank and Equifax, to lead its CXO Council. The CXO Council is a st…",https://mma.prnewswire.com/media/955836/Cerra_New_Logo.jpg?p=facebook,2026-06-01T09:00:00Z,,"COSTA MESA, Calif., June 1, 2026 /PRNewswire/ -- CerraCap Impact Venture Capital (""CIVC"") today announced the appointment of Mark Rohrwasser, former Chief Information Officer of Silicon Valley Bank a… [+3466 chars]",,en,'ecosystem'
https://www.globenewswire.com/news-release/2026/06/01/3304099/0/en/PageUp-Expands-Partner-Ecosystem-with-Flockity-Vouch-and-Certn-to-Drive-Authentic-Integrated-Hiring.html,https://www.globenewswire.com/news-release/2026/06/01/3304099/0/en/PageUp-Expands-Partner-Ecosystem-with-Flockity-Vouch-and-Certn-to-Drive-Authentic-Integrated-Hiring.html,0,www.globenewswire.com,"PageUp Expands Partner Ecosystem with Flockity, Vouch, and Certn to Drive Authentic, Integrated Hiring","PageUp Expands Partner Ecosystem with Flockity, Vouch, and Certn to Drive Authentic, Integrated Hiring...",https://ml.globenewswire.com/Resource/Download/6e145076-7740-45de-bc41-b278f3111ab2,2026-06-01T09:00:00Z,,"NEW YORK, June 01, 2026 (GLOBE NEWSWIRE) -- PageUp
, a global leader in talent acquisition software, recently announced the addition of three new strategic partners, Flockity, Vouch, and Certn, to i… [+4114 chars]",,en,'ecosystem'
https://www.prnewswire.com/news-releases/from-commitment-to-classrooms-advancing-refugee-education-through-the-unhcrtecnos-global-partnership-302786736.html,https://www.prnewswire.com/news-releases/from-commitment-to-classrooms-advancing-refugee-education-through-the-unhcrtecnos-global-partnership-302786736.html,0,www.prnewswire.com,From Commitment to Classrooms: Advancing Refugee Education through the UNHCR-TECNO's Global Partnership,"Supporting high‑impact education initiatives for refugee children and youth in East Africa HONG KONG, June 1, 2026 /PRNewswire/ -- One year into their expanded global partnership, TECNO and UNHCR, the UN Refugee Agency, are translating shared commitments into…",https://mma.prnewswire.com/media/2991635/20260529_174224.jpg?p=facebook,2026-06-01T09:00:00Z,,"Supporting highimpact education initiatives for refugee children and youth in East Africa
HONG KONG, June 1, 2026 /PRNewswire/ -- One year into their expanded global partnership, TECNO and UNHCR, th… [+5345 chars]",,en,'ecosystem'
