index,url,valid,domain,title,description,image,published,archive,content,quote,language,keyword
https://sports.yahoo.com/f1/breaking-news/article/kimi-antonellis-dominance-continues-as-he-beats-max-verstappen-for-monaco-grand-prix-pole-position-152038317.html,https://sports.yahoo.com/f1/breaking-news/article/kimi-antonellis-dominance-continues-as-he-beats-max-verstappen-for-monaco-grand-prix-pole-position-152038317.html,0,sports.yahoo.com,Kimi Antonelli's dominance continues as he beats Max Verstappen for Monaco Grand Prix pole position,Antonelli is in a prime spot for his fifth straight win of the season.,https://s.yimg.com/ny/api/res/1.2/9i9hz5CrBMsTf7Qz9pULdw--/YXBwaWQ9aGlnaGxhbmRlcjt3PTEyMDA7aD04MDA7Y2Y9d2VicA--/https://d29szjachogqwa.cloudfront.net/images/2026-06/a7ece8b7-068c-4239-b66f-0b4175664706,2026-06-06T15:20:38Z,,"Kimi Antonellis dream season shows no signs of ending anytime soon.
The 19-year-old Mercedes driver beat Max Verstappen for the pole position of the Monaco Grand Prix on Saturday with a lap right as… [+2239 chars]",,en,'endangered species'
https://reason.com/volokh/2026/06/06/is-the-endangered-species-act-being-used-to-commandeer-state-governments/,https://reason.com/volokh/2026/06/06/is-the-endangered-species-act-being-used-to-commandeer-state-governments/,0,reason.com,Is the Endangered Species Act Being Used to Commandeer State Governments?,A webinar discussion of whether we are seeing conservation commandeering.,https://d2eehagpk5cl65.cloudfront.net/img/q60/uploads/2021/11/reason-logo-featured-placeholder.jpg.webp,2026-06-06T13:57:18Z,,"Environmental organizations have filed citizen suits against state and local governments alleging that their failure to regulate more stringently, or their issuance of permits to particular activitie… [+956 chars]",,en,'endangered species'
https://grist.org/energy/feds-to-open-tens-of-thousands-of-acres-of-colorado-wilderness-to-oil-drilling/,https://grist.org/energy/feds-to-open-tens-of-thousands-of-acres-of-colorado-wilderness-to-oil-drilling/,0,grist.org,Federal agency to open tens of thousands of acres of Colorado wilderness to oil drilling,"Wildlife habitat, endangered animals, and recreation could all be at risk in the state’s biggest public land sale in modern history.",https://grist.org/wp-content/uploads/2026/06/DinosaurColorado.jpg?quality=75&strip=all,2026-06-06T13:00:00Z,,"This story was originally published by Capital &amp; Main and is reproduced here with permission.
A federal agency will offer tens of thousands of acres in northwestern Colorado that the nations lar… [+10007 chars]",,en,'endangered species'
https://www.rt.com/africa/641067-four-arrested-pangolin-sale-sting/,https://www.rt.com/africa/641067-four-arrested-pangolin-sale-sting/,0,www.rt.com,Four arrested in South Africa pangolin sale sting,Four suspects have been arrested after allegedly trying to sell an endangered pangolin in South Africa Read Full Article at RT.com,https://mf.b37mrtl.ru/files/2026.06/article/6a22e14585f5401b5c220567.jpg,2026-06-06T08:56:47Z,,"Four suspects are expected to appear in the Welkom Magistrate’s Court in South Africa’s Free State province, following their arrest for attempting to sell an endangered pangolin for R80,000 ($5,000).… [+1297 chars]",,en,'endangered species'
https://www.wonkette.com/p/ivanka-trump-seeks-spiritual-enlightenment,https://www.wonkette.com/p/ivanka-trump-seeks-spiritual-enlightenment,0,www.wonkette.com,Ivanka Trump Seeks Spiritual Enlightenment By Building Giant Resort For Rich People,They paved paradise and put up a Trump hotel.,"https://substackcdn.com/image/fetch/$s_!5ToQ!,w_1200,h_675,c_fill,f_jpg,q_auto:good,fl_progressive:steep,g_auto/https%3A%2F%2Fsubstack-post-media.s3.amazonaws.com%2Fpublic%2Fimages%2F1d25e2ca-f2d6-4ffc-a987-20545d0e738b_1102x672.jpeg",2026-06-05T14:02:50Z,,Is there a more vapid human being alive than Ivanka Trump? And we say this knowing full well that shes married to a man so vapid that you can practically see cirrus clouds drifting out of his ears. W… [+5939 chars],,en,'endangered species'
https://e360.yale.edu/digest/squid-fishing-report,https://e360.yale.edu/digest/squid-fishing-report,0,e360.yale.edu,Former Crew Members Detail Harm Inflicted by Unregulated Squid Fishing,"Former crew members on squid fishing expeditions report environmental destruction and labor abuses, due to a regulatory vacuum.
Read more on E360 →",https://yale-threesixty.transforms.svdcdn.com/production/Whale-Shark_EJF.png?w=1200&q=60&auto=format&fit=max&dm=1780584981&s=de71b5aaac632b592329294d7d887f43,2026-06-05T12:12:00Z,,"Former crew members on squid fishing expeditions report environmental destruction and labor abuses, due to a regulatory vacuum.
While their dazzling bright lights are visible from space, much of the… [+7907 chars]",,en,'endangered species'
https://www.thejournal.ie/readme/donald-trump-7060969-Jun2026/,https://www.thejournal.ie/readme/donald-trump-7060969-Jun2026/,0,www.thejournal.ie,Larry Donnelly: The Senate battlegrounds that could shape an indifferent Trump's final years,"As Trump’s popularity wanes, three crucial Senate races could reveal whether his grip on the Republican Party remains an electoral asset or a growing liability.",https://img2.thejournal.ie/article/7060969/river/?height=400&version=7060998,2026-06-05T06:00:21Z,,"AS MARION MCKEONE has outlined in her column, President Donald Trump seems to be most concerned at the moment with a gaudy 80th birthday celebration in parallel with the marking of the 250th birthday… [+6490 chars]",,en,'endangered species'
https://www.dailymail.com/news/article-15875435/Graham-Platners-ex-girlfriends-make-explosive-allegations-against-sext-scandal-plagued-Democrat-Reckless-unsettling.html,https://www.dailymail.com/news/article-15875435/Graham-Platners-ex-girlfriends-make-explosive-allegations-against-sext-scandal-plagued-Democrat-Reckless-unsettling.html,0,www.dailymail.com,Graham Platner's ex-girlfriends make explosive allegations against sext-scandal plagued Democrat: 'Reckless and unsettling',Scandal-plagued Senate hopeful Graham Platner has been hit with a slew of new allegations of violent behavior and disturbing rhetoric from former girlfriends.,https://i.dailymail.com/1s/2026/06/05/00/109129243-0-image-a-6_1780616328678.jpg,2026-06-05T01:36:50Z,,"Scandal-plagued Senate hopeful Graham Platner has been hit with a slew of new allegations of violent behavior and disturbing rhetoric from former girlfriends. 
The Maine Democrat - who has been unde… [+7116 chars]",,en,'endangered species'
https://www.prnewswire.com/news-releases/escalating-anti-wolf-policies-threaten-wildlife-recovery-across-the-american-west-warns-living-with-wolves-org-302792106.html,https://www.prnewswire.com/news-releases/escalating-anti-wolf-policies-threaten-wildlife-recovery-across-the-american-west-warns-living-with-wolves-org-302792106.html,0,www.prnewswire.com,"Escalating Anti-Wolf Policies Threaten Wildlife Recovery Across the American West, Warns Living with Wolves Org.","KETCHUM, Idaho, June 4, 2026 /PRNewswire/ -- Conservation advocates warn that expanding anti-wolf legislation and wildlife policy rollbacks across the American West could undermine decades of Gray Wolf recovery and broader ecosystem conservation efforts. Rece…",,2026-06-04T22:04:00Z,,"KETCHUM, Idaho, June 4, 2026 /PRNewswire/ -- Conservation advocates warn that expanding anti-wolf legislation and wildlife policy rollbacks across the American West could undermine decades of Gray Wo… [+2611 chars]",,en,'endangered species'
https://nationalpost.com/news/ottawa-extends-consultation-on-major-projects-reform-to-july-22,https://nationalpost.com/news/ottawa-extends-consultation-on-major-projects-reform-to-july-22,0,nationalpost.com,Ottawa extends consultation on major projects reform to July 22,The government that promised to move at speeds not seen in generations is slowing down its pace to allow more consultation.,https://smartcdn.gprod.postmedia.digital/nationalpost/wp-content/uploads/2026/04/0423-biz-wire-cusma_302721452.jpg,2026-06-04T20:43:56Z,,"OTTAWA The government that promised to move at speeds not seen in generations is slowing down its pace to allow more consultation on its major projects reform.
THIS CONTENT IS RESERVED FOR SUBSCRIBE… [+3765 chars]",,en,'endangered species'
https://www.dailymail.com/news/article-15872047/graham-platner-maine-adviser-sex-fantasies.html,https://www.dailymail.com/news/article-15872047/graham-platner-maine-adviser-sex-fantasies.html,0,www.dailymail.com,Sex fantasies of 'rugged man' Democrat Graham Platner's top adviser exposed after explicit texts leak: 'His hands are shockingly gentle',A top adviser for scandal-plagued Maine Senate candidate Graham Platner has an online history as strange as that of the Congress hopeful.,https://i.dailymail.com/1s/2026/06/04/16/109129243-0-image-m-16_1780588602343.jpg,2026-06-04T19:59:59Z,,"A top adviser for scandal-plagued Maine Senate candidate Graham Platner has an online history as strange as that of the Congress hopeful.
Platner, 40, scurried out of Washington this week to avoid q… [+7336 chars]",,en,'endangered species'
https://www.commondreams.org/news/house-slashes-epa-funding,https://www.commondreams.org/news/house-slashes-epa-funding,0,www.commondreams.org,'Gift to Corporate Polluters': Republicans Advance Massive Assault on Wildlife and EPA,"Congressional Republicans on Wednesday approved an appropriations bill containing massive cuts to Environmental Protection Agency funding, more than 20 riders undermining the Endangered Species Act, and other provisions harmful to the environment and wildlife…",https://www.commondreams.org/media-library/image.png?id=66864405&width=1200&height=600&coordinates=0%2C119%2C0%2C119,2026-06-04T17:13:22Z,,"Congressional Republicans on Wednesday approved an appropriations bill containing massive cuts to Environmental Protection Agency funding, more than 20 riders undermining the Endangered Species Act, … [+5506 chars]",,en,'endangered species'
https://punchng.com/states-rush-to-deploy-forest-guards-as-insecurity-deepens/,https://punchng.com/states-rush-to-deploy-forest-guards-as-insecurity-deepens/,0,punchng.com,States rush to deploy forest guards as insecurity deepens,"Nigerian states are rapidly deploying forest guards to combat rising insecurity, with Kebbi, Gombe, Kwara, and others scaling up operations to secure fores

Read More: https://punchng.com/states-rush-to-deploy-forest-guards-as-insecurity-deepens/",https://cdn.punchng.com/wp-content/uploads/2025/12/27183955/Forest-guard-1040x630.jpeg,2026-06-08T00:36:05Z,,"The deployment of forest guards has gathered momentum, with Kebbi, Gombe, Kwara, Kaduna, Edo, Imo, Bayelsa, Anambra  and several other states scaling up operations under the Federal Government-backed… [+20644 chars]",,en,'poaching'
https://timesofindia.indiatimes.com/city/trichy/people-will-soon-realise-historic-blunder-of-choosing-tvk-ttv/articleshow/131571692.cms,https://timesofindia.indiatimes.com/city/trichy/people-will-soon-realise-historic-blunder-of-choosing-tvk-ttv/articleshow/131571692.cms,0,timesofindia.indiatimes.com,People will soon realise ‘historic blunder’ of choosing TVK: TTV,"TTV Dhinakaran says Tamil Nadu made a “historic blunder” choosing TVK, slams CM Joseph Vijay on law and order, alleges MLA poaching and resignations to be challenged.","https://static.toiimg.com/thumb/msid-131377614,width-1280,height-720,resizemode-6,overlay-toi_sw,pt-32,y_pad-600/photo.jpg",2026-06-07T17:42:32Z,,"Follow Us On Social Media
Copyright © 2026 Bennett, Coleman &amp; Co. Ltd. All rights reserved. For reprint rights: Times Syndication Service",,en,'poaching'
https://timesofindia.indiatimes.com/city/trichy/people-will-soon-realise-historic-blunder-of-choosing-tvk-ttv/articleshow/131571691.cms,https://timesofindia.indiatimes.com/city/trichy/people-will-soon-realise-historic-blunder-of-choosing-tvk-ttv/articleshow/131571691.cms,0,timesofindia.indiatimes.com,People will soon realise ‘historic blunder’ of choosing TVK: TTV,"TTV Dhinakaran says Tamil Nadu made a “historic blunder” choosing TVK, slams CM Joseph Vijay on law and order, alleges MLA poaching and resignations to be challenged.","https://static.toiimg.com/thumb/msid-131377614,width-1280,height-720,resizemode-6,overlay-toi_sw,pt-32,y_pad-600/photo.jpg",2026-06-07T17:42:29Z,,"Follow Us On Social Media
Copyright © 2026 Bennett, Coleman &amp; Co. Ltd. All rights reserved. For reprint rights: Times Syndication Service",,en,'poaching'
https://roundtable.io/sports/ncaa/alabama/news/alabama-lands-another-recruiting-win-flips-syracuse-tight-end-commit-michael-nnabuife,https://roundtable.io/sports/ncaa/alabama/news/alabama-lands-another-recruiting-win-flips-syracuse-tight-end-commit-michael-nnabuife,0,roundtable.io,"Alabama Lands Another Recruiting Win, Flips Syracuse Tight End Commit Michael Nnabuife","Kalen DeBoer secures a physical Maryland standout for the 2027 class, showcasing Alabama’s national reach by poaching the versatile 6-foot-5 playmaker from his previous Syracuse commitment.",https://s.yimg.com/ny/api/res/1.2/jh5aTh8LNoRAZwdbp53oeg--/YXBwaWQ9aGlnaGxhbmRlcjt3PTEyMDA7aD04MDA7Y2Y9d2VicA--/https://media.zenfs.com/en/roundtable_sports_alabama_articles_517/4abf7a615defb7e532c0ff5676dca77b,2026-06-07T03:39:36Z,,"Alabama added another piece to its growing 2027 recruiting class this weekend, flipping tight end Michael Nnabuife from Syracuse following his official visit to Tuscaloosa.
The 6-foot-5, 250-pound p… [+2756 chars]",,en,'poaching'
https://www.mmamania.com/latest-news/448714/what-are-you-gonna-do-dana-white-wont-force-tom-aspinall-to-fight-if-eddie-hearn-holds-ufc-champion-out-video,https://www.mmamania.com/latest-news/448714/what-are-you-gonna-do-dana-white-wont-force-tom-aspinall-to-fight-if-eddie-hearn-holds-ufc-champion-out-video,0,www.mmamania.com,Dana White Won’t ‘Force’ Tom Aspinall To Fight If Eddie Hearn Holds Champ Out,"If Eddie Hearn won’t allow UFC heavyweight champion Tom Aspinall to return to fighting until his contract is reworked don’t expect UFC CEO, Dana White, to step in and do any convincing. White is of the mindset that you “can’t force anybody to fight.” The last…",https://s.yimg.com/ny/api/res/1.2/Hh6e8bYz6OVUgU5mxfQUdw--/YXBwaWQ9aGlnaGxhbmRlcjt3PTEyMDA7aD04MDA7Y2Y9d2VicA--/https://media.zenfs.com/en/sb_nation_articles_115/2c889a6d374da21f24290eb88ca7189a,2026-06-06T23:00:05Z,,"If Eddie Hearn wont allow UFC heavyweight champion Tom Aspinall to return to fighting until his contract is reworked dont expect UFC CEO, Dana White, to step in and do any convincing. White is of the… [+1642 chars]",,en,'poaching'
https://thehillstimes.in/assam/30-species-of-raptors-six-of-storks-recorded-in-kaziranga-during-survey,https://thehillstimes.in/assam/30-species-of-raptors-six-of-storks-recorded-in-kaziranga-during-survey,0,thehillstimes.in,"30 species of raptors, six of storks recorded in Kaziranga during survey","GUWAHATI, June 6: A total of 30 species of raptors (birds of prey) and six types of storks have been recorded during a survey in the Kaziranga National Park and Tiger Reserve (KNTPR), officials said on Saturday. Altogether 271 raptors and 266 storks were foun…",https://thehillstimes.in/wp-content/uploads/2026/06/New-Project1-4.jpg,2026-06-06T22:30:00Z,,"GUWAHATI, June 6: A total of 30 species of raptors (birds of prey) and six types of storks have been recorded during a survey in the Kaziranga National Park and Tiger Reserve (KNTPR), officials said … [+2766 chars]",,en,'poaching'
https://the4thofficial.net/2026/06/celtic-register-interest-in-this-guadeloupe-number-9-why-he-should-be-brought-in-as-maedas-successor/,https://the4thofficial.net/2026/06/celtic-register-interest-in-this-guadeloupe-number-9-why-he-should-be-brought-in-as-maedas-successor/,0,the4thofficial.net,Celtic Register Interest In This Guadeloupe ‘Number 9’: Why He Should Be Brought In As Maeda’s Successor,"If a recent report from the French outlet FootMercato is believed to be true, Celtic are keeping close tabs on Taïryk Arconte ahead of a potential summer swoop. But they are not alone in the race, w...",https://s.yimg.com/ny/api/res/1.2/03aLn9VExJh9lKO8N.QlFA--/YXBwaWQ9aGlnaGxhbmRlcjt3PTEyMDA7aD04Mzk7Y2Y9d2VicA--/https://media.zenfs.com/en/the_4th_official_articles_868/5ecd3f164d422fae617ddab4918f906a,2026-06-06T20:05:00Z,,"If a recent report from the French outlet FootMercato is believed to be true, Celtic are keeping close tabs on Taïryk Arconte ahead of a potential summer swoop. But they are not alone in the race, wi… [+2642 chars]",,en,'poaching'
https://www.mmamania.com/boxing/448549/uh-oh-dana-whites-zuffa-boxing-already-hit-with-lawsuit-claiming-unlawful-poaching-of-two-u-k-fighters,https://www.mmamania.com/boxing/448549/uh-oh-dana-whites-zuffa-boxing-already-hit-with-lawsuit-claiming-unlawful-poaching-of-two-u-k-fighters,0,www.mmamania.com,Dana White’s Zuffa Boxing Hit With First Lawsuit Over Fighter Poaching,"Zuffa Boxing has only been staging fights for six months, but the growing promotion led by Ultimate Fighting Championship (UFC) CEO, Dana White, has already been hit with its first lawsuit. According to a report by Yahoo Sports, Zuffa Boxing is being sued by …",https://s.yimg.com/ny/api/res/1.2/hLKcWbHbzzR.JRmd8I5g3Q--/YXBwaWQ9aGlnaGxhbmRlcjt3PTEyMDA7aD04MDA7Y2Y9d2VicA--/https://media.zenfs.com/en/sb_nation_articles_115/e1414b69b2dc8347f5612d2bd604cf2d,2026-06-06T18:00:00Z,,"Zuffa Boxing has only been staging fights for six months, but the growing promotion led by Ultimate Fighting Championship (UFC) CEO, Dana White, has already been hit with its first lawsuit.
Accordin… [+1404 chars]",,en,'poaching'
https://www.dailymail.com/yourmoney/article-15878225/dudley-market-los-angeles-illegal-fishing.html,https://www.dailymail.com/yourmoney/article-15878225/dudley-market-los-angeles-illegal-fishing.html,0,www.dailymail.com,Trendy LA fish market admits false 'sustainable' claims after illegal fishing scandal sparks furious backlash,A swanky Venice seafood restaurant that built its reputation on 'sustainable' fish is facing a social media storm after admitting it misled customers about where its seafood came from.,https://i.dailymail.com/1s/2026/06/05/21/109161797-0-A_swanky_Venice_seafood_restaurant_that_built_its_reputation_on_-a-67_1780690399086.jpg,2026-06-06T16:47:56Z,,"A swanky Venice seafood restaurant that built its reputation on 'sustainable' fish is facing a social media storm after admitting it misled customers about where its seafood came from.
Dudley Market… [+4850 chars]",,en,'poaching'
https://www.ibtimes.com.au/harry-kane-peak-form-england-world-cup-preparation-1870241,https://www.ibtimes.com.au/harry-kane-peak-form-england-world-cup-preparation-1870241,0,www.ibtimes.com.au,Tuchel Backs Harry Kane in Top Form as England Launch World Cup Warmup Campaign,"Thomas Tuchel praises Harry Kane's fitness and leadership as England prepares for the 2026 World Cup in North America, with friendly matches against New Zealand and Costa Rica planned.",https://d.ibtimes.com.au/en/full/1890220/harry-kane-c-scored-twice-england-won-5-0-latvia-clinch-qualification-next-years-world-cup.jpg,2026-06-06T12:11:53Z,,"Thomas Tuchel has declared Harry Kane in peak condition and ready to lead England's bid for World Cup glory as the Three Lions begin their final preparations in the United States.
The back-to-back E… [+6089 chars]",,en,'poaching'
https://theconversation.com/ethiopian-communities-are-using-low-cost-methods-to-restore-eroded-land-283299,https://theconversation.com/ethiopian-communities-are-using-low-cost-methods-to-restore-eroded-land-283299,0,theconversation.com,Ethiopian communities are using low-cost methods to restore eroded land,"Ethiopian communities are cheaply filling destructive gullies with soil, stones and branches and replanting them to stop erosion and restore farmland.",https://images.theconversation.com/files/737009/original/file-20260520-57-thhcuu.JPG?ixlib=rb-4.1.0&rect=0%2C96%2C1246%2C623&q=45&auto=format&w=1356&h=668&fit=crop,2026-06-02T13:53:20Z,,"Nearly a quarter of the land in Ethiopia is degraded. It has lost its quality and can no longer grow crops, support plant life, or hold water as it used to. The causes are mainly human pressures (def… [+7752 chars]",,en,'land degradation'
https://punchng.com/gombe-hails-results-of-tree-planting-erosion-control-projects/,https://punchng.com/gombe-hails-results-of-tree-planting-erosion-control-projects/,0,punchng.com,"Gombe hails results of tree planting, erosion control projects","Gombe State celebrates significant achievements in tree planting and erosion control projects, positioning itself as a model for climate resilience in Nige

Read More: https://punchng.com/gombe-hails-results-of-tree-planting-erosion-control-projects/",https://cdn.punchng.com/wp-content/uploads/2017/03/24100129/Map-of-Gombe.jpg,2026-06-05T12:50:45Z,,"As the world commemorates World Environment Day 2026 under the theme, “Climate Action,” the Overseeing Director of Information in Gombe State, Richard James, has highlighted the state’s environmental… [+6536 chars]",,en,'land degradation'
https://punchng.com/ogun-advocates-clean-energy-distributes-3500-stoves/,https://punchng.com/ogun-advocates-clean-energy-distributes-3500-stoves/,0,punchng.com,"Ogun advocates clean energy, distributes 3,500 stoves","Ogun State partners with the Federal Government to distribute 3,500 clean cookstoves, advocating for green energy and environmental sustainability to comba

Read More: https://punchng.com/ogun-advocates-clean-energy-distributes-3500-stoves/",https://cdn.punchng.com/wp-content/uploads/2026/06/09195705/Stove-992x630.webp,2026-06-09T19:08:01Z,,"The First Lady of Ogun State, Mrs Bamidele Abiodun, on Tuesday called for greater commitment to environmental sustainability, climate resilience, and the adoption of clean energy solutions as part of… [+5373 chars]",,en,'land degradation'
https://www.thehindubusinessline.com/opinion/aquifer-management-key-to-addressing-water-stress/article71057713.ece,https://www.thehindubusinessline.com/opinion/aquifer-management-key-to-addressing-water-stress/article71057713.ece,0,www.thehindubusinessline.com,"Aquifer management, key to addressing water stress","Aquifers do not follow administrative boundaries. Community-based systems, as in Andhra Pradesh, Maharashtra, Gujarat have shown the way in aquifer management",https://bl-i.thgim.com/public/incoming/n365pi/article71057722.ece/alternates/LANDSCAPE_1200/VSP16_Buruga%20hamlet%2015.JPG,2026-06-03T15:57:34Z,,"Indias water crisis is no longer a distant warning; it is a lived reality. From drying borewells in peninsular India to falling water tables across the Indo-Gangetic plains, groundwater, the countrys… [+5851 chars]",,en,'land degradation'
https://www.thehindubusinessline.com/brandhub/pr-release/viraj-profiles-decarbonisation-journey-building-a-circular-responsible-and-future-ready-stainless-steel-enterprise/article71064293.ece,https://www.thehindubusinessline.com/brandhub/pr-release/viraj-profiles-decarbonisation-journey-building-a-circular-responsible-and-future-ready-stainless-steel-enterprise/article71064293.ece,0,www.thehindubusinessline.com,"Viraj Profiles’ Decarbonisation Journey: Building a Circular, Responsible and Future-Ready Stainless-Steel Enterprise","Viraj Profiles' Decarbonisation Journey: Building a Circular, Responsible and Future-Ready Stainless-Steel Enterprise",https://th-i.thgim.com/public/incoming/125f4u/article71064291.ece/alternates/LANDSCAPE_1200/Screenshot%202026-06-05%20115755.png,2026-06-05T13:05:02Z,,"MUMBAI, India, Jun. 4, 2026 /PRNewswire/ -- As the global manufacturing industry confronts the realities of climate change, decarbonisation is no longer merely an environmental aspiration; it has bec… [+10937 chars]",,en,'land degradation'
https://theconversation.com/ai-offers-promise-for-agriculture-but-smallholder-farmers-risk-being-left-behind-279013,https://theconversation.com/ai-offers-promise-for-agriculture-but-smallholder-farmers-risk-being-left-behind-279013,0,theconversation.com,"AI offers promise for agriculture, but smallholder farmers risk being left behind",AI tools for farming can play a role. But they need to be properly tailored for African and developing nations’ context.,https://images.theconversation.com/files/735614/original/file-20260513-57-1jva6j.jpg?ixlib=rb-4.1.0&rect=0%2C177%2C2120%2C1060&q=45&auto=format&w=1356&h=668&fit=crop,2026-06-03T13:42:04Z,,"Globally, agriculture faces mounting pressures. These are driven by climate change, land degradation, labour shortages, supply chain disruptions and the demand for food from a growing population.

At… [+7821 chars]",,en,'land degradation'
