index,url,valid,domain,title,description,image,published,archive,content,quote,language,keyword
https://cleantechnica.com/2025/12/07/new-china-funded-port-in-peru-may-have-ecological-drawbacks/,https://cleantechnica.com/2025/12/07/new-china-funded-port-in-peru-may-have-ecological-drawbacks/,0,cleantechnica.com,New China-Funded Port In Peru May Have Ecological Drawbacks,"A new port facility in Chancay, Peru was funded largely by China, but environmental impacts may be larger than expected, 
The post New China-Funded Port In Peru May Have Ecological Drawbacks appeared first on CleanTechnica.",https://cleantechnica.com/wp-content/uploads/2025/12/Peru-Chancay-Peru.png,2025-12-07T22:54:54Z,,"Support CleanTechnica's work through a Substack subscription or on Stripe.
In a recent article about Chinese cars making inroads in South America, we mentioned there is a new port in Chancay, Peru, … [+13371 chars]",,en,'reforestation'
https://www.dazeddigital.com/art-photography/article/69196/1/stefan-dotter-photos-profoundly-hopeful-life-rainforest-record-health-in-harmony?utm_source=Link&utm_medium=Link&utm_campaign=RSSFeed&utm_term=these-photos-show-a-profoundly-hopeful-side-to-rainforest-life,https://www.dazeddigital.com/art-photography/article/69196/1/stefan-dotter-photos-profoundly-hopeful-life-rainforest-record-health-in-harmony?utm_source=Link&utm_medium=Link&utm_campaign=RSSFeed&utm_term=these-photos-show-a-profoundly-hopeful-side-to-rainforest-life,0,www.dazeddigital.com,These photos show a ‘profoundly hopeful’ side to rainforest life,"Produced alongside the reforestation non-profit Health in Harmony, Stefan Dotter’s first monograph Record showcases beautiful, tangible examples of climate action and community",https://images-prod.dazeddigital.com/1200/0-395-1452-968/azure/dazed-prod/1430/2/1432239.jpg,2025-12-02T13:00:00Z,,"We must ask ourselves if we can truly fathom the disappearance of something we have never seen, writes Elaine ML Tam in the introduction to Record, a new monograph by the Tokyo-based photographer Ste… [+4971 chars]",,en,'reforestation'
https://matadornetwork.com/read/matador-network-readers-choice-awards-2025-sustainable-destination-costa-rica/,https://matadornetwork.com/read/matador-network-readers-choice-awards-2025-sustainable-destination-costa-rica/,0,matadornetwork.com,Matador Network Readers’ Choice Awards 2025: Sustainable Destination,"Costa Rica is the best sustainable destination in the 2025 Matador Network Travel Awards, Readers' Choice. Here's why.",https://cdn1.matadornetwork.com/blogs/1/2025/12/costa-rica-sustainable-destination-2025-social.jpeg,2025-12-05T23:24:38Z,,"Forests cover more than half the country, a dramatic reversal from the deforestation crisis of the 1970s and ’80s that inspired Costa Rica to reinvent itself as a global conservation reference point.… [+6852 chars]",,en,'reforestation'
https://ssir.org/articles/entry/ai-investment-divide,https://ssir.org/articles/entry/ai-investment-divide,0,ssir.org,Bridging the AI Investment Divide (Blog),The concentration of AI funding in profit-driven applications has the potential to drive widening inequalities in three critical ways.,https://ssir.org/images/blog/ai-investment-gap737x737.jpg,2025-12-01T16:00:00Z,,"While AI global venture capital investments exceeded $290 billion between 2019 and 2024, less than 1 percent of this funding went to initiatives aimed at social impact. This stark disparity reveals a… [+14087 chars]",,en,'reforestation'
https://www.dw.com/en/kenyan-woman-hugs-tree-for-72-hours-breaks-own-record/a-75116462,https://www.dw.com/en/kenyan-woman-hugs-tree-for-72-hours-breaks-own-record/a-75116462,0,www.dw.com,"Kenyan woman hugs tree for 72 hours, breaks own record",Truphena Muthoni has set a Guinness World Record by hugging a tree for three straight days.,https://static.dw.com/image/75116293_6.jpg,2025-12-11T16:05:00Z,,"Kenyan climate activist Truphena Muthoni has smashed her own previously held record, hugging a tree for 72 hours straight.
""This peaceful protest is important because it bypasses all differences. Du… [+1136 chars]",,en,'reforestation'
https://scholarlykitchen.sspnet.org/2025/12/10/guest-post-sustainable-practices-and-un-sdg-alignment-at-the-2025-ease-conference-in-oslo/,https://scholarlykitchen.sspnet.org/2025/12/10/guest-post-sustainable-practices-and-un-sdg-alignment-at-the-2025-ease-conference-in-oslo/,0,scholarlykitchen.sspnet.org,Guest Post — Sustainable Practices and UN SDG Alignment at the 2025 EASE Conference in Oslo,"Today's guest bloggers describe the efforts taken in organizing a sustainable 2025 conference of the European Association for Science Editors.
The post Guest Post — Sustainable Practices and UN SDG Alignment at the 2025 EASE Conference in Oslo appeared first …",https://scholarlykitchen.sspnet.org/wp-content/uploads/2025/12/ease-1.png,2025-12-10T10:30:55Z,,"Editor’s note: Today’s guest post is by Lovorka aja and Iva Grabari Andonovski. Lovorka is a librarian at Dubrava University Hospital in Zagreb, Croatia, passionate about everything libraries represe… [+7128 chars]",,en,'reforestation'
https://www.bostonherald.com/2025/12/08/colombia-amazon-defenders/,https://www.bostonherald.com/2025/12/08/colombia-amazon-defenders/,0,www.bostonherald.com,‘It’s not safe to live here.’ Colombia is deadliest country for environmental defenders,One group recorded 48 killings of activists in Colombia last year.,https://www.bostonherald.com/wp-content/uploads/2025/12/Colombia_Amazon_Defender_80003-1.jpg?w=1024&h=682,2025-12-08T18:24:54Z,,"By STEVEN GRATTAN, Associated Press
PUERTO ASIS, Colombia (AP) Jani Silva sits inside the wooden house she built on the banks of Colombias Putumayo River a home she hasnt slept in for more than eigh… [+7419 chars]",,en,'reforestation'
https://www.hospitalitynet.org/news/4130122.html,https://www.hospitalitynet.org/news/4130122.html,0,www.hospitalitynet.org,"Aahaasa Collection Debuts in Sri Lanka: a New Circuit of Soulful Boutique Sanctuaries - Transformative Odysseys Shaped by Landscape, Culture, and Emotion","What began as a quiet family dream in 2017 has evolved into Sri Lanka’s newest luxury boutique hospitality brand: Aahaasa Collection. Rooted in the ethos of “Infinite Horizons, Transformative Journeys, Rooted in Nature” and elevating Sri Lankan hospitality to…",https://www.hospitalitynet.org/picture/social_153192545.jpg?t=1765360600,2025-12-10T10:01:11Z,,"Colombo, Sri Lanka What began as a quiet family dream in 2017 has evolved into Sri Lankas newest luxury boutique hospitality brand: Aahaasa Collection. Rooted in the ethos of Infinite Horizons, Trans… [+16250 chars]",,en,'reforestation'
https://theconversation.com/sumatras-flood-crisis-how-deforestation-turned-a-cyclonic-storm-into-a-likely-recurring-tragedy-271302,https://theconversation.com/sumatras-flood-crisis-how-deforestation-turned-a-cyclonic-storm-into-a-likely-recurring-tragedy-271302,0,theconversation.com,Sumatra’s flood crisis: How deforestation turned a cyclonic storm into a likely recurring tragedy,"Extreme rain wasn’t the only cause of Sumatra’s deadly floods. Years of forest loss, eroded soils, and weakened watersheds turned a storm into a tragedy — one that could repeat.",https://images.theconversation.com/files/706327/original/file-20251202-66-43nuc1.jpeg?ixlib=rb-4.1.0&rect=0%2C200%2C1600%2C800&q=45&auto=format&w=1356&h=668&fit=crop,2025-12-04T09:13:09Z,,"Cyclone Senyar hit South and Southeast Asian countries in late November. In Indonesia, the island of Sumatra, especially its northern parts, took the worst hit.

The storm set off flash floods and la… [+6442 chars]",,en,'reforestation'
https://theconversation.com/top-climate-books-to-look-out-for-in-2026-recommended-by-experts-270105,https://theconversation.com/top-climate-books-to-look-out-for-in-2026-recommended-by-experts-270105,0,theconversation.com,Top climate books to look out for in 2026 – recommended by experts,"From dinosaur extinctions to a Himalyan memoir, climate science and creative writing experts review some of the best new and upcoming titles to look out for in 2026.",https://images.theconversation.com/files/709674/original/file-20251218-56-9002ny.jpg?ixlib=rb-4.1.0&rect=0%2C316%2C3180%2C1590&q=45&auto=format&w=1356&h=668&fit=crop,2025-12-24T14:40:55Z,,"Rumka Vodki/Shutterstock
From compelling stories to non-fiction, books can spark ideas that help us navigate the climate crisis. As part of The Conversation’s ongoing Climate Storytelling strand, we… [+11639 chars]",,en,'reforestation'
https://www.hurriyetdailynews.com/black-sea-steps-up-forest-renewal-as-climate-change-hits-iconic-woodlands-216764,https://www.hurriyetdailynews.com/black-sea-steps-up-forest-renewal-as-climate-change-hits-iconic-woodlands-216764,0,www.hurriyetdailynews.com,Black Sea steps up forest renewal as climate change hits iconic woodlands,"Türkiye’s eastern Black Sea region — long known for its emerald-green mountains and year-round rainfall — faces mounting ecological pressure as climate change disrupts weather cycles, necessitating faster reforestation to protect its vulnerable forests.",https://image.hurimg.com/i/hurriyet/75/200x200/693d09ac9217d56cb4528096.jpg,2025-12-13T06:37:34Z,,"RZE
Türkiyes eastern Black Sea region long known for its emerald-green mountains and year-round rainfall faces mounting ecological pressure as climate change disrupts weather cycles, necessitating f… [+2329 chars]",,en,'reforestation'
https://www.counterpunch.org/2025/12/16/fossil-fuel-subsidies-are-leading-u-s-and-eu-into-industrial-decline/,https://www.counterpunch.org/2025/12/16/fossil-fuel-subsidies-are-leading-u-s-and-eu-into-industrial-decline/,0,www.counterpunch.org,Fossil Fuel Subsidies Are Leading U.S. and EU into Industrial Decline,"The following is an interview with Hans-Josef Fell. Fell is the drafter of the Renewable Energy Sources Act (EEG), a law that came into force in Germany 25 years ago and has been copied over 100 times in more than 60 countries. Hans-Josef Fell was a member of…",https://www.counterpunch.org/wp-content/uploads/2025/12/getty-images-7gvZfy19sLY-unsplash-scaled.jpg,2025-12-16T06:55:22Z,,"Getty and Unsplash+.
The following is an interview with Hans-Josef Fell. Fell is the drafter of the Renewable Energy Sources Act (EEG), a law that came into force in Germany 25 years ago and has bee… [+12253 chars]",,en,'reforestation'
https://www.lifesciencesworld.com/what-is-the-national-haitian-animal/,https://www.lifesciencesworld.com/what-is-the-national-haitian-animal/,0,www.lifesciencesworld.com,What is the national Haitian animal?,"What is the National Haitian Animal? Unveiling a Symbol of Freedom The national animal of Haiti is the Hispaniolan Trogon (Priotelus roseigaster), a vibrant and beautiful bird representing the country’s independence and unique biodiversity. This bird is a sym…",,2025-12-27T05:41:08Z,,"The national animal of Haiti is the Hispaniolan Trogon (Priotelus roseigaster), a vibrant and beautiful bird representing the country’s independence and unique biodiversity. This bird is a symbol of … [+7443 chars]",,en,'reforestation'
https://www.theverge.com/podcast/839062/square-product-chief-willem-ave-block-jack-dorsey-ai-bitcoin-crypto,https://www.theverge.com/podcast/839062/square-product-chief-willem-ave-block-jack-dorsey-ai-bitcoin-crypto,0,www.theverge.com,Square’s product chief on the death of the penny and the future of money,"Today, I’m talking with Willem Avé, who’s head of product at Square. You know Square — it was started by billionaire Jack Dorsey, of Twitter fame, more than 15 years ago, and it got big on the back of that little magnetic reader that plugged into the headphon…",https://platform.theverge.com/wp-content/uploads/sites/2/2025/12/DCD_1208.jpg?quality=90&strip=all&crop=0%2C10.732984293194%2C100%2C78.534031413613&w=1200,2025-12-08T14:59:08Z,,"<ul><li></li><li></li><li></li></ul>
Squares Willem Avé on AI automation, investing in crypto, and what its like working for Jack Dorsey.
by
Nilay PatelClose
Nilay Patel
Posts from this author w… [+68989 chars]",,en,'ecosystem'
https://www.theverge.com/report/820656/valve-interview-arm-gaming-steamos-pierre-loup-griffais,https://www.theverge.com/report/820656/valve-interview-arm-gaming-steamos-pierre-loup-griffais,0,www.theverge.com,"Steam Machine today, Steam Phones tomorrow","It's a big deal that Valve is making a game console. But I'm beginning to think the Steam Machine may end up a footnote in gaming history. What if Valve could bring PC games not just to its own living room consoles, but also to the Arm chips that billions of …",https://platform.theverge.com/wp-content/uploads/sites/2/2025/11/258049_Valve_2025_EverythingTimeStudio_0008.jpg?quality=90&strip=all&crop=0%2C10.805700988947%2C100%2C78.388598022106&w=1200,2025-12-02T19:42:08Z,,"<ul><li></li><li></li></ul>
In an exclusive interview, Valve reveals its the architect behind a push to bring Windows games to Arm.
In an exclusive interview, Valve reveals its the architect behind… [+15973 chars]",,en,'ecosystem'
https://www.theverge.com/cs/features/831818/ai-mercor-handshake-scale-surge-staffing-companies,https://www.theverge.com/cs/features/831818/ai-mercor-handshake-scale-surge-staffing-companies,0,www.theverge.com,Feeding the machine,"When he was 19 years old, Brendan Foody started Mercor with two of his high school friends as a way for his other friends, who also had startups, to hire software engineers overseas. It launched in 2023 as essentially a staffing agency, albeit a highly automa…",https://platform.theverge.com/wp-content/uploads/sites/2/2025/12/lede.jpg?quality=90&strip=all&crop=0%2C10.732984293194%2C100%2C78.534031413613&w=1200,2025-12-15T12:02:11Z,,"When he was 19 years old, Brendan Foody started Mercor with two of his high school friends as a way for his other friends, who also had startups, to hire software engineers overseas. It launched in 2… [+27843 chars]",,en,'ecosystem'
https://www.theverge.com/features/839853/disinformation-wars-censorship-right-wing,https://www.theverge.com/features/839853/disinformation-wars-censorship-right-wing,0,www.theverge.com,The war on disinformation is a losing battle,"As he called the House Judiciary Committee into session on a cold and snowy February day in Washington, DC, Chairman Jim Jordan was ready to take a victory lap. American free speech had been critically threatened, and now it was saved - in large part thanks t…",https://platform.theverge.com/wp-content/uploads/sites/2/2025/12/258102_Disinformation_wars_CVirginia.jpg?quality=90&strip=all&crop=0%2C10.732984293194%2C100%2C78.534031413613&w=1200,2025-12-09T12:02:57Z,,"<ul><li></li><li></li></ul>
How the systems that fight misinformation and disinformation became misconstrued and dismantled.
by
James BallClose
James Ball
Posts from this author will be added to… [+38627 chars]",,en,'ecosystem'
https://www.theverge.com/podcast/844073/stack-overflow-ceo-ai-coding-chatgpt-code-red-interview,https://www.theverge.com/podcast/844073/stack-overflow-ceo-ai-coding-chatgpt-code-red-interview,0,www.theverge.com,Stack Overflow users don’t trust AI. They’re using it anyway,"Today, I’m talking with Prashanth Chandrasekar, who is the CEO of Stack Overflow. I last had Prashanth on the show in 2022, one month before ChatGPT launched. While the generative AI boom had tons of impact on all sorts of companies, it immediately upended ev…",https://platform.theverge.com/wp-content/uploads/sites/2/2025/12/DCD-Prashanth-Chandrasekar.png?quality=90&strip=all&crop=0%2C10.711631919237%2C100%2C78.576736161526&w=1200,2025-12-15T15:33:37Z,,"<ul><li></li><li></li><li></li></ul>
CEO Prashanth Chandrasekar on how ChatGPT became an existential moment for Stack Overflow.
by
Nilay PatelClose
Nilay Patel
Posts from this author will be add… [+61037 chars]",,en,'ecosystem'
https://gizmodo.com/sam-altmans-eyeball-scanning-startup-launches-super-app-2000699091,https://gizmodo.com/sam-altmans-eyeball-scanning-startup-launches-super-app-2000699091,0,gizmodo.com,Sam Altman’s Eyeball-Scanning Startup Launches ‘Super App’,Want to chat with your friends? Please look into this orb.,https://gizmodo.com/app/uploads/2023/05/365deef373b5ac9df6d3bb00d0339d17.jpg,2025-12-12T18:00:47Z,,"Sam Altmans Orwellian ID verification startup, World, issued a major update today for its mobile app, introducing new chat and banking features.
World is Altmans attempt to solve a problem he himsel… [+3387 chars]",,en,'ecosystem'
https://gizmodo.com/art-tvs-are-getting-smaller-and-im-here-for-it-2000697588,https://gizmodo.com/art-tvs-are-getting-smaller-and-im-here-for-it-2000697588,0,gizmodo.com,Art TVs Are Getting Smaller and I’m Here for It,"I can’t make room for a massive, expensive Frame TV, but I have space for an art monitor.",https://gizmodo.com/app/uploads/2025/12/HIsense-S5-DecoTV-2-1200x675.jpg,2025-12-10T13:23:23Z,,"Artwork TVs, epitomized by Samsungs The Frame series, are the type of big, hyper-specific screen that reminds me how art often feels gatekept by those with a big enough piggy bank. Hisenseone of the … [+2785 chars]",,en,'ecosystem'
https://gizmodo.com/googles-plan-to-win-the-ai-race-is-all-about-getting-a-little-too-personal-2000694726,https://gizmodo.com/googles-plan-to-win-the-ai-race-is-all-about-getting-a-little-too-personal-2000694726,0,gizmodo.com,Google’s Plan to Win the AI Race Is All About Getting a Little Too Personal,You've been giving Google the tools it needs for decades.,https://gizmodo.com/app/uploads/2025/12/shutterstock_2668436833-1200x675.jpg,2025-12-02T21:30:19Z,,"Google is envisioning a future where almost every interaction you may have with the internet is hyper-personalized for you.
According to Google’s VP of product for Search, Robby Stein, most people u… [+4781 chars]",,en,'ecosystem'
https://gizmodo.com/the-amazon-is-morphing-into-a-hypertropical-climate-and-its-as-apocalyptic-as-it-sounds-2000698491,https://gizmodo.com/the-amazon-is-morphing-into-a-hypertropical-climate-and-its-as-apocalyptic-as-it-sounds-2000698491,0,gizmodo.com,The Amazon Is Morphing Into a ‘Hypertropical’ Climate—and It’s as Apocalyptic as It Sounds,"A new study predicts that by 2100, the Amazon rainforest could experience up to 150 days of hot drought conditions each year, causing mass tree die-offs.",https://gizmodo.com/app/uploads/2025/12/Amazon-rainforest-drought-1200x675.jpg,2025-12-11T16:50:23Z,,"When it comes to regulating Earths climate, few ecosystems play a more important role than the Amazon rainforest. But what happens when global warming dramatically alters the Amazons climate?
A stud… [+3943 chars]",,en,'ecosystem'
https://www.yahoo.com/news/articles/officials-action-giant-crocodile-spotted-221500469.html,https://www.yahoo.com/news/articles/officials-action-giant-crocodile-spotted-221500469.html,0,www.yahoo.com,Officials take action after giant crocodile is spotted with shocking prey in its mouth: 'Just heartbreaking',"""Their worst fear had come true.""",https://s.yimg.com/ny/api/res/1.2/O5dakh3BlecZO1hnAMbxmA--/YXBwaWQ9aGlnaGxhbmRlcjt3PTEyMDA7aD04MDA7Y2Y9d2VicA--/https://media.zenfs.com/en/the_cool_down_737/2dd171c62b9ce082bf74fcba986e4275,2025-12-15T22:15:00Z,,"A troubling wildlife encounter in a Florida neighborhood is renewing conversations about rising human-animal conflict and the pressures pushing wild species into closer contact with communities.
Off… [+2747 chars]",,en,'threatened species'
https://www.oklahoman.com/story/news/local/2025/12/10/ota-oklahoma-turnpike-authority-construction-longest-bridge/87690536007/,https://www.oklahoman.com/story/news/local/2025/12/10/ota-oklahoma-turnpike-authority-construction-longest-bridge/87690536007/,0,www.oklahoman.com,Oklahoma Turnpike Authority awards $97M for what will be state's longest bridge,"It's the first project for the East-West Connector Turnpike near Moore, which is part of the agency’s $8.2 billion, 15-year ACCESS Oklahoma program.",https://s.yimg.com/ny/api/res/1.2/WlcJiBc9asY.a41RfbggUA--/YXBwaWQ9aGlnaGxhbmRlcjt3PTEyMDA7aD02NzU7Y2Y9d2VicA--/https://media.zenfs.com/en/the-oklahoman/a2afa8d212b306ee368bc0f9e400fa29,2025-12-10T11:25:18Z,,"Construction soon will start on what will become Oklahomas longest bridge, at least for a little while.
The Oklahoma Turnpike Authority Board on Tuesday, Dec. 9, awarded $97 million to construct the… [+3466 chars]",,en,'threatened species'
https://www.yahoo.com/news/articles/airport-officials-shocking-discovery-inspecting-223000300.html,https://www.yahoo.com/news/articles/airport-officials-shocking-discovery-inspecting-223000300.html,0,www.yahoo.com,Airport officials make shocking discovery after inspecting foul-smelling shipment: 'This is the first time I saw something like this',"""When they opened the box, [it was] very smelly.""",https://s.yimg.com/ny/api/res/1.2/isK_ogOftDAp6gt0OzgMTA--/YXBwaWQ9aGlnaGxhbmRlcjt3PTEyMDA7aD02NzU7Y2Y9d2VicA--/https://media.zenfs.com/en/the_cool_down_737/6a0faad2a7ed2d158fdd1502fe79111b,2025-12-24T22:30:00Z,,"Authorities at the Changi Airport in Singapore have seized a record amount of smuggled rhino horns.
What's happening?
According to a joint press release from the National Parks Board and air cargo … [+3573 chars]",,en,'threatened species'
https://www.nature.com/articles/d41586-025-04054-9,https://www.nature.com/articles/d41586-025-04054-9,0,www.nature.com,Giving a voice to animals: Laos’s national herpetologist on her day-to-day,Somphouthone Phimmachak studies amphibians and reptiles as one of the country’s few conservation researchers.,https://media.nature.com/lw1200/magazine-assets/d41586-025-04054-9/d41586-025-04054-9_51787070.jpg,2025-12-15T00:00:00Z,,"Because I am one of very few specialists in Laos, some people have started to describe me as the countrys first national herpetologist.
This is accurate to my knowledge; Im not aware of any other La… [+898 chars]",,en,'threatened species'
https://www.boredpanda.com/wildlife-photography-lions-simon-needham-msn/,https://www.boredpanda.com/wildlife-photography-lions-simon-needham-msn/,0,www.boredpanda.com,Photographer Immortalizes The King Of Animals In His 30 Incredible Photos,Los Angeles-based British photographer Simon Needham opens up a stunning world of wildlife for us to enjoy from up close. The highlight of his work is the awe-inspiring portraits of lions from different angles that show their beauty and powerful presence. But…,https://static.boredpanda.com/blog/wp-content/uploads/2020/12/wildlife-photography-lions-simon-needham-fb58-png__700.jpg,2025-12-11T12:21:24Z,,Los Angeles-based British photographer Simon Needham opens up a stunning world of wildlife for us to enjoy from up close. The highlight of his work is the awe-inspiring portraits of lions from differ… [+965 chars],,en,'threatened species'
https://www.abc.net.au/news/2025-12-30/rapid-decline-rhino-ray-indonesia-northern-australia/106168084,https://www.abc.net.au/news/2025-12-30/rapid-decline-rhino-ray-indonesia-northern-australia/106168084,0,www.abc.net.au,Australian researchers fight to protect globally threatened rays,"Australian researchers are leading the way in the fight to protect a group of globally threatened fish species, which look like ""a shark and ray joined together"".",https://live-production.wcms.abc-cdn.net.au/cc804214690e2f3717e5c89117ced43a?impolicy=wcms_watermark_news&cropH=2813&cropW=5000&xPos=0&yPos=143&width=862&height=485&imformat=generic,2025-12-29T20:25:51Z,,"Off the remote Riau Islands, east of Sumatra, local fishers venture into the saltwater each day to feed their families. 
Their lives are intimately tied to the surrounding seas.
These rich tropical… [+6628 chars]",,en,'threatened species'
https://mymodernmet.com/marine-wildlife-protection-treaty/,https://mymodernmet.com/marine-wildlife-protection-treaty/,0,mymodernmet.com,185 Countries Agree To Protect 70 Species of Endangered Sharks and Rays,"185 Countries Agree To Protect 70 Species of Endangered Sharks and Rays
At the 20th conference of the Convention on International Trade in Endangered Species of Wild Fauna and Flora (CITES), more than 185 countries voted to increase legal protections for 70 s…",https://mymodernmet.com/wp/wp-content/uploads/2025/12/Marine-wildlife-protection-treaty-FB-thumbnail.jpg,2025-12-19T17:35:18Z,,"At the 20th conference of the Convention on International Trade in Endangered Species of Wild Fauna and Flora (CITES), more than 185 countries voted to increase legal protections for 70 shark and ray… [+2329 chars]",,en,'threatened species'
https://www.scientificamerican.com/article/these-orcas-are-on-the-brink-and-so-is-the-science-that-could-save-them/,https://www.scientificamerican.com/article/these-orcas-are-on-the-brink-and-so-is-the-science-that-could-save-them/,0,www.scientificamerican.com,These Orcas Are on the Brink—And So Is the Science That Could Save Them,Inside the desperate rush to save the southern resident killer whales,https://static.scientificamerican.com/dam/m/25947c1d2533e788/original/saw0126Harp01.jpg?m=1764877326.568&w=1200,2025-12-16T11:00:00Z,,"Like many people who visit San Juan Island, I came here for the orcas. This little patch of forest and farmland off the coast of Washington State is one of the best places in the world to encounter t… [+25912 chars]",,en,'threatened species'
