index,url,valid,domain,title,description,image,published,archive,content,quote,language,keyword
https://www.yahoo.com/news/articles/trail-cameras-capture-incredible-footage-060000800.html,https://www.yahoo.com/news/articles/trail-cameras-capture-incredible-footage-060000800.html,0,www.yahoo.com,Trail cameras capture incredible footage of skirmish between rare predators: 'That's an amazing capture',Viewers marveled at the footage.,https://s.yimg.com/ny/api/res/1.2/20_NsfZ_Lo33xb0jF5FDKQ--/YXBwaWQ9aGlnaGxhbmRlcjt3PTEyMDA7aD02NzU7Y2Y9d2VicA--/https://media.zenfs.com/en/the_cool_down_737/ed0292640b5d2939f4a5486d068a9133,2025-12-01T06:00:00Z,,"Catching a brief glimpse of one Canada lynx on a trail camera is reason enough to celebrate. How about catching two in an extended confrontation?
KBJR shared a video of the remarkable brouhaha betwe… [+2273 chars]",,en,'rare species'
https://www.thejournal.ie/glen-of-the-downs-state-purchases-land-expand-nature-reserve-6892310-Dec2025/,https://www.thejournal.ie/glen-of-the-downs-state-purchases-land-expand-nature-reserve-6892310-Dec2025/,0,www.thejournal.ie,Glen of the Downs nature reserve to expand as State buys over 40 hectares of adjoining land,The Glen of the Downs is designated as a Special Area of Conservation for the habitat old sessile oak woods and is one of Ireland’s few remaining ancient woodlands.,https://img2.thejournal.ie/article/6892310/river/?height=400&version=6892312,2025-12-03T14:09:34Z,,"THE GLEN OF the Downs nature reserve in Co Wicklow is to be expanded after the State purchased over 40 hectares of land adjoining the ancient oak woodland. 
The Department of Housing, Local Governme… [+3659 chars]",,en,'rare species'
https://abcnews.go.com/Technology/wireStory/endangered-species-convention-proposes-new-rules-growing-exotic-128025123,https://abcnews.go.com/Technology/wireStory/endangered-species-convention-proposes-new-rules-growing-exotic-128025123,0,abcnews.go.com,Endangered species convention proposes new rules for growing exotic pet trade,"Conservationists are hoping to strengthen regulations at a wildlife trade conference on birds, reptiles and other animals that are seeing their numbers decline due to the exotic pet trade",https://i.abcnewsfe.com/a/faf78f1c-9697-49df-9b57-356a651ebd31/wirestory_3db6781c7a70b479d7087e899bd7aee5_16x9.jpg?w=1600,2025-12-02T05:25:55Z,,"A growing exotic pet trade has conservationists calling for stronger regulations to protect the reptiles, birds and other animals in the wild that are increasingly showing up for sale on internet mar… [+7521 chars]",,en,'rare species'
https://www.rte.ie/news/2025/1203/1547048-glen-of-the-downs/,https://www.rte.ie/news/2025/1203/1547048-glen-of-the-downs/,0,www.rte.ie,Glen of the Downs Nature Reserve to expand,One of Ireland's best known oak woodlands will increase in size by 68% after the State bought 100 acres (40.46 hectares) of land beside the Glen of the Downs nature reserve in Co Wicklow.,https://www.rte.ie/images/0023927f-1600.jpg,2025-12-03T12:06:57Z,,"One of Ireland's best known oak woodlands will increase in size by 68% after the State bought 100 acres (40.46 hectares) of land beside the Glen of the Downs nature reserve in Co Wicklow.
The area, … [+3389 chars]",,en,'rare species'
https://newatlas.com/biology/ai-wildlife-videos-issues/,https://newatlas.com/biology/ai-wildlife-videos-issues/,0,newatlas.com,Bunnies on a trampoline? How this 'harmless fun' is creating a huge issue,"In recent months, AI-generated wildlife clips have flooded social media, merging real animal behavior with playful fabrications. From leopards in backyards and raccoons riding crocodiles, to bunnies on trampolines, scientists warn that these digital deepfakes…",https://assets.newatlas.com/dims4/default/6bc577c/2147483647/strip/true/crop/2816x1478+0+29/resize/1200x630!/quality/90/?url=https%3A%2F%2Fnewatlas-brightspot.s3.amazonaws.com%2F79%2Faf%2F800c1859447b81d831cc13280204%2Funnamed-8.jpg&na.image_optimisation=0,2025-12-07T12:03:00Z,,"In recent months, AI-generated wildlife clips have flooded social media, merging real animal behavior with playful fabrications. From leopards in backyards and raccoons riding crocodiles, to bunnies … [+6091 chars]",,en,'rare species'
https://newsonjapan.com/article/147815.php,https://newsonjapan.com/article/147815.php,0,newsonjapan.com,Residents Reject Money Offered to Secure Support for Solar Project,"A large-scale solar project planned near the Kushiro Wetland in Hokkaido is facing renewed backlash after the developer offered local residents what it described as a “beautification cooperation payment,” prompting accusations that the company is trying to bu…",https://i2.ytimg.com/vi/4MyZadxjZnQ/mqdefault.jpg,2025-12-06T07:08:31Z,,"HOKKAIDO, Dec 06 (News On Japan) -
 A large-scale solar project planned near the Kushiro Wetland in Hokkaido is facing renewed backlash after the developer offered local residents what it described … [+2361 chars]",,en,'rare species'
https://www.irishtimes.com/environment/2025/12/02/lets-be-ambitious-for-a-plan-to-establish-a-real-record-of-the-majestic-shannons-condition/,https://www.irishtimes.com/environment/2025/12/02/lets-be-ambitious-for-a-plan-to-establish-a-real-record-of-the-majestic-shannons-condition/,0,www.irishtimes.com,Ella McSweeney: Let’s be ambitious for a plan to establish a real record of the majestic Shannon’s condition,"If 14 countries can come together to understand the Danube, surely Ireland can do the same for a far shorter river?",https://www.irishtimes.com/resizer/v2/WXX4KLLLWFHC7DMPBIV2S4ZWE4.jpg?smart=true&auth=cc0c4196e4840b6b26830a039cd544040031d67794ba0dd6f7993dc9979cef5d&width=1200&height=630,2025-12-06T06:00:00Z,,"Last month, in the pages of the Nenagh Guardian, biologist Dan Minchin the River Shannons sleuth of invasive and unwelcome organisms revealed his latest find. On September 30th, he spotted a creature… [+6192 chars]",,en,'rare species'
https://post.rlsbb.to/vantara-sanctuary-stories-s01e05-1080p-web-h264-frequency/,https://post.rlsbb.to/vantara-sanctuary-stories-s01e05-1080p-web-h264-frequency/,0,post.rlsbb.to,Vantara Sanctuary Stories S01E05 1080p WEB h264-FREQUENCY,"Season 1, Episode 05 – Forrest visits Vantara to see efforts securing a future for rare species. He joins a cheetah feeding circle, meets newborn cubs, and follows a once orphaned sun bear called Prince, thriving, and is ready to take on the world. Links: HOM…",,2025-12-06T04:07:47Z,,"Season 1, Episode 05 Forrest visits Vantara to see efforts securing a future for rare species. He joins a cheetah feeding circle, meets newborn cubs, and follows a once orphaned sun bear called Princ… [+441 chars]",,en,'rare species'
https://newatlas.com/biology/rare-meat-eating-plant/,https://newatlas.com/biology/rare-meat-eating-plant/,0,newatlas.com,Ultra-rare carnivorous 'killer plant' found lurking on city's doorstep,"There's an old saying that everything in Australia wants to eat you – and this apparently includes plants, with the island a global hotbed of carnivorous species. Now, scientists have made a particularly special find, stumbling across thousands of ultra-rare …",https://assets.newatlas.com/dims4/default/ab39c69/2147483647/strip/true/crop/2123x1115+0+239/resize/1200x630!/quality/90/?url=https%3A%2F%2Fnewatlas-brightspot.s3.amazonaws.com%2F1e%2Fbb%2Ff49c619a404c9efd9a55d9b6ebd9%2F5-drosera-silvicola-found-at-pauna-wildlife-sanctuary-thilo-alexander-krueger.JPG&na.image_optimisation=0,2025-12-06T02:03:00Z,,"There's an old saying that everything in Australia wants to eat you and this apparently includes plants, with the island a global hotbed of carnivorous species. Now, scientists have made a particular… [+3186 chars]",,en,'rare species'
https://www.lifesciencesworld.com/how-do-i-sell-my-corals/,https://www.lifesciencesworld.com/how-do-i-sell-my-corals/,0,www.lifesciencesworld.com,How do I sell my corals?,"How to Sell Your Corals: A Comprehensive Guide Want to turn your coral propagation skills into profit? This guide details exactly how to sell your corals successfully, covering everything from preparing your corals to building a loyal customer base and naviga…",,2025-12-06T00:42:23Z,,"How to Sell Your Corals: A Comprehensive Guide
Want to turn your coral propagation skills into profit? This guide details exactly how to sell your corals successfully, covering everything from prepa… [+9595 chars]",,en,'rare species'
https://www.irishtimes.com/opinion/an-irish-diary/2025/12/05/frank-mcnally-investigating-the-mystery-of-the-black-storks-irish-roots/,https://www.irishtimes.com/opinion/an-irish-diary/2025/12/05/frank-mcnally-investigating-the-mystery-of-the-black-storks-irish-roots/,0,www.irishtimes.com,Frank McNally: Investigating the mystery of the black stork’s Irish roots,"This beautiful and shy bird is a rare visitor now, but that may not always have been the case",https://www.irishtimes.com/resizer/v2/TMBVMFVUEVAZTGCXQEYYDOIYCM.jpeg?smart=true&auth=d8724547833a71537bc63f24fb0f667de8fadde13abdc6f6ce785d19b804ffd1&width=1200&height=630,2025-12-05T19:00:01Z,,"When Manchán Magan last emailed me, only a few months ago, he was part of what I called a benign conspiracy of ecologists trying to establish if the beaver was ever native to Ireland and, in the proc… [+4575 chars]",,en,'rare species'
https://indianexpress.com/article/lifestyle/pets-animals/the-mystery-of-how-anacondas-became-giant-12-million-years-ago-and-never-needed-to-grow-again-10401656/,https://indianexpress.com/article/lifestyle/pets-animals/the-mystery-of-how-anacondas-became-giant-12-million-years-ago-and-never-needed-to-grow-again-10401656/,0,indianexpress.com,The mystery of how anacondas became giant 12 million years ago and never needed to grow again,The new study confirms that the evolutionary stability shown by anaconda is extremely rare,https://images.indianexpress.com/2025/12/Green_anaconda_Sao_Paulo_Zoo_2539215201.jpg,2025-12-05T15:00:26Z,,"Anacondas, the heaviest snakes of the planet, are unarguably massive, intriguing, and dangerous. They can swallow prey even twice their size, with deer and caimans being their regular fare. Their gan… [+2960 chars]",,en,'rare species'
https://www.irishtimes.com/ireland/2025/12/05/specimen-of-rare-whale-spotted-off-donegal-last-year-sighted-almost-5000km-away-near-boston/,https://www.irishtimes.com/ireland/2025/12/05/specimen-of-rare-whale-spotted-off-donegal-last-year-sighted-almost-5000km-away-near-boston/,0,www.irishtimes.com,"Specimen of rare whale spotted off Donegal last year sighted almost 5,000km away near Boston","Scientists hail ‘very significant’ sighting of endangered  right whale individual, recognisable from unique pattern of crustaceans on head",https://www.irishtimes.com/resizer/v2/GDZZTAEMZNHFZBN7RIXKEJGQUM.jpg?smart=true&auth=d03f12d9dd476cb53c5e92e653256fb877dcbe41a30b4505cecec1fd19c0cc4d&width=1200&height=630,2025-12-05T07:30:00Z,,"A specimen of a rare species of whale spotted off the coast of Donegal last summer was recently sighted almost 5,000km (more than 3,000 miles) away in Boston.
In July 2024, the North American right … [+2437 chars]",,en,'rare species'
https://www.yahoo.com/news/articles/teen-invents-remarkable-device-making-001500268.html,https://www.yahoo.com/news/articles/teen-invents-remarkable-device-making-001500268.html,0,www.yahoo.com,Teen invents 'remarkable' device after making unusual discovery while camping: 'Vital to humanity',"""His project is truly world class.""",https://s.yimg.com/ny/api/res/1.2/KDBVHN88aeVxyX_INzkBqA--/YXBwaWQ9aGlnaGxhbmRlcjt3PTEyMDA7aD02NzU7Y2Y9d2VicA--/https://media.zenfs.com/en/the_cool_down_737/2dc29b5aaae0f962081df3057e6cd57b,2025-12-05T00:15:00Z,,"Ontario teen Evan Budz has developed an underwater bionic monitor that looks and moves like a turtle.
The 10th-grade student has been quickly stacking up accolades, including a first-place prize in … [+2413 chars]",,en,'rare species'
https://www.lifesciencesworld.com/what-happened-to-bali-tigers/,https://www.lifesciencesworld.com/what-happened-to-bali-tigers/,0,www.lifesciencesworld.com,What happened to Bali Tigers?,"What Happened to Bali Tigers? A Tragic Extinction The Balinese tiger, a unique subspecies, was driven to extinction primarily due to habitat loss and hunting. What happened to Bali tigers? They vanished entirely from their native island, a tragic consequence …",,2025-12-08T01:04:32Z,,"The Balinese tiger, a unique subspecies, was driven to extinction primarily due to habitat loss and hunting. What happened to Bali tigers? They vanished entirely from their native island, a tragic co… [+9423 chars]",,en,'species extinction'
https://www.gov.uk/government/news/a-greener-and-more-prosperous-future-with-new-environmentalimprovementplan,https://www.gov.uk/government/news/a-greener-and-more-prosperous-future-with-new-environmentalimprovementplan,0,www.gov.uk,A greener and more prosperous future with new Environmental Improvement Plan,"New plan sets course for cleaner rivers and air, as well as more nature and wildlife in England",https://www.gov.uk/assets/frontend/govuk-opengraph-image-4196a4d6333cf92aaf720047f56cfd91b3532d7635fc21ebcf0d5897df6b5f77.png,2025-12-01T11:35:48Z,,<ul><li>Targeted and measured delivery planstoset out progress towards environmental targetswhile supporting economic growth</li><li>£500 million to supercharge landscape-scale nature recovery across… [+10425 chars],,en,'species extinction'
https://www.cultofmac.com/news/born-to-be-wild-documentary-series,https://www.cultofmac.com/news/born-to-be-wild-documentary-series,0,www.cultofmac.com,Apple TV’s cloying Born to be Wild trailer puts cute face on extinction,"If the ""Born to Be Wild"" documentary series trailer is any indication, you're going to need lots of tissues when you watch this six-parter.
(via Cult of Mac - Your source for the latest Apple news, rumors, analysis, reviews, how-tos and deals.)",https://www.cultofmac.com/wp-content/uploads/2025/12/120425_Born_to_be_Wild_Trailer_Announcement_Big__Image_01_big_image_post.jpg.large_2x.jpg.webp,2025-12-05T16:23:05Z,,"The Born to Be Wild documentary series debuts on Apple TV December 19. Photo: Apple TV
The first trailer for Apple TV’s upcoming documentary series Born to be Wild means well, offering hope in the f… [+3183 chars]",,en,'species extinction'
https://journals.plos.org/plosone/article?id=10.1371/journal.pone.0338217,https://journals.plos.org/plosone/article?id=10.1371/journal.pone.0338217,0,journals.plos.org,"First evaluation of genetic diversity and population structure of Phelsuma inexpectata (Gekkonidae), a critically endangered gecko endemic to Reunion Island","The Manapany day gecko, Phelsuma inexpectata, is a critically endangered reptile endemic to Reunion Island (Southwestern Indian Ocean region). In the present study, we provide the first in-depth insights into the genetic diversity and population structure of …",https://journals.plos.org/plosone/article/figure/image?id=10.1371/journal.pone.0338217.g003&size=inline,2025-12-12T14:00:00Z,,"Abstract
The Manapany day gecko, Phelsuma inexpectata, is a critically endangered reptile endemic to Reunion Island (Southwestern Indian Ocean region). In the present study, we provide the first in-… [+41475 chars]",,en,'invasive alien species'
https://iasbaba.com/2025/12/upsc-quiz-2025-iasbabas-daily-current-affairs-quiz-10th-december-2025/,https://iasbaba.com/2025/12/upsc-quiz-2025-iasbabas-daily-current-affairs-quiz-10th-december-2025/,0,iasbaba.com,UPSC Quiz – 2025 : IASbaba’s Daily Current Affairs Quiz 10th December 2025,"For Previous Daily Quiz (ARCHIVES) – CLICK HERE The Current Affairs questions are based on sources like ‘The Hindu’, ‘Indian Express’ and ‘PIB’, which are very important sources for UPSC Prelims Exam. The questions are focused on both the concepts and facts. …",https://iasbaba.com/wp-content/uploads/2025/06/Daily-Current-Affairs-Quiz-2025.jpeg,2025-12-10T11:30:49Z,,"For Previous Daily Quiz (ARCHIVES) – CLICK HERE
The Current Affairs questions are based on sources like The Hindu, Indian Express and PIB, which are very important sources for UPSC Prelims Exam. The… [+7082 chars]",,en,'invasive alien species'
https://journals.plos.org/plosone/article?id=10.1371/journal.pone.0337230,https://journals.plos.org/plosone/article?id=10.1371/journal.pone.0337230,0,journals.plos.org,Maximum effect with minimum impact: A new selective control strategy for the Browsing ant Lepisiota frauenfeldi (Formicidae: Formicinae) minimize the impact on non-target species,"Early-stage control of invasive ants provides an opportunity to suppress establishment while conserving existing biodiversity. We developed and tested a selective control strategy targeting the Browsing ant Lepisiota frauenfeldi, an emerging omnivorous, polyg…",https://journals.plos.org/plosone/article/figure/image?id=10.1371/journal.pone.0337230.g006&size=inline,2025-12-03T14:00:00Z,,"Abstract
Early-stage control of invasive ants provides an opportunity to suppress establishment while conserving existing biodiversity. We developed and tested a selective control strategy targeting… [+48879 chars]",,en,'invasive alien species'
https://journals.plos.org/plosntds/article?id=10.1371/journal.pntd.0013803,https://journals.plos.org/plosntds/article?id=10.1371/journal.pntd.0013803,0,journals.plos.org,Cross-sectional assessment of Angiostrongylus cantonensis transmission risk mediated by invasive apple snails in Jiangsu province of China,"Author summary In this study, we investigated the risk of human infection with the rat lungworm, Angiostrongylus cantonensis, which can cause severe meningitis. This parasite is often spread through invasive apple snails, which are now widespread in Jiangsu P…",https://journals.plos.org/plosntds/article/figure/image?id=10.1371/journal.pntd.0013803.g001&size=inline,2025-12-02T14:00:00Z,,"Abstract
Background
Angiostrongylus cantonensis, a zoonotic nematode responsible for eosinophilic meningitis, is acquired in China principally through ingestion of raw or under-cooked invasive appl… [+33010 chars]",,en,'invasive alien species'
https://www.yahoo.com/news/trail-cameras-capture-incredible-footage-104507227.html,https://www.yahoo.com/news/trail-cameras-capture-incredible-footage-104507227.html,0,www.yahoo.com,Trail cameras capture incredible footage of one-of-a-kind herd for first time in years: 'Let's take care of them',"""Must preserve the area.""",https://s.yimg.com/ny/api/res/1.2/_D97UI1qdfvu3lYOcz.s6w--/YXBwaWQ9aGlnaGxhbmRlcjt3PTEyMDA7aD02NzU7Y2Y9d2VicA--/https://media.zenfs.com/en/the_cool_down_737/4a89fbb4e5bd4b007b310acdc48cf509,2025-12-01T11:30:00Z,,"A golden capture on a trail camera showcased the only herd of wild buffalo left in Thailand.
""Officials said Thailand's only population of wild water buffalo made up of 69 individuals is found in Hu… [+2043 chars]",,en,'species conservation'
https://www.sciencedaily.com/releases/2025/11/251130205421.htm,https://www.sciencedaily.com/releases/2025/11/251130205421.htm,0,www.sciencedaily.com,A lost Amazon world just reappeared in Bolivia,Researchers exploring Bolivia’s Great Tectonic Lakes discovered a landscape transformed over centuries by sophisticated engineering and diverse agricultural traditions. Excavations show how Indigenous societies adapted to dynamic wetlands through raised field…,https://www.sciencedaily.com/images/1920/raised-cultivation-platforms-near-lake-ginebra.webp,2025-12-01T04:45:19Z,,"In September 2021, a team of specialists traveled to one of the least-documented areas of the Bolivian Amazon: the Great Tectonic Lakes of Exaltación in the department of Beni. The expedition, organi… [+6854 chars]",,en,'species conservation'
https://www.abc.net.au/news/2025-12-16/act-government-considers-wombat-management-plan/106146098,https://www.abc.net.au/news/2025-12-16/act-government-considers-wombat-management-plan/106146098,0,www.abc.net.au,Advocates concerned over wombat management plan,"The ACT government is considering how to better manage the territory's wombat population, in response to challenges being experienced by farmers.",https://live-production.wcms.abc-cdn.net.au/6af7aa65c9453d865da00feb47562a8d?impolicy=wcms_watermark_news&cropH=2813&cropW=5000&xPos=0&yPos=521&width=862&height=485&imformat=generic,2025-12-15T21:47:28Z,,"The ACT government is considering how to better manage and care for the territory's wombat population amid challenges being experienced by farmers and the prevalence of mange.
A draft technical repo… [+6599 chars]",,en,'species conservation'
https://journals.plos.org/plosbiology/article?id=10.1371/journal.pbio.3003494,https://journals.plos.org/plosbiology/article?id=10.1371/journal.pbio.3003494,0,journals.plos.org,Are we over-conserving charismatic species?,Is all conservation good? This Perspective argues that the prevalent strategy of focusing on charismatic species may be counterproductive if conservation impact measures are oversimplistic and do not facilitate the restoration of long-term ecosystems and thei…,,2025-12-03T14:00:00Z,,"A balanced and healthy ecosystem requires the diversity and stability of many species that co-exist [1]. However, the local extinction of keystone, flagship, indicator, umbrella, and charismatic spec… [+11071 chars]",,en,'species conservation'
https://theconversation.com/ontarios-bill-5-erodes-good-governance-in-the-province-270424,https://theconversation.com/ontarios-bill-5-erodes-good-governance-in-the-province-270424,0,theconversation.com,Ontario’s Bill 5 erodes good governance in the province,Ontario’s Bill 5 eliminates key environmental protections and grants the provincial government sweeping powers to fast-track development with little to no oversight.,https://images.theconversation.com/files/705179/original/file-20251127-56-q4sbpg.jpg?ixlib=rb-4.1.0&rect=0%2C0%2C6346%2C3173&q=45&auto=format&w=1356&h=668&fit=crop,2025-12-07T14:40:49Z,,"Ontario passed Bill 5, the Protect Ontario by Unleashing Our Economy Act, in June 2025. The omnibus bill amended environmental laws and proposes special economic zones where the government can decide… [+5398 chars]",,en,'species conservation'
https://www.thelocal.de/20251218/today-in-germany-a-roundup-of-the-latest-news-on-thursday-100,https://www.thelocal.de/20251218/today-in-germany-a-roundup-of-the-latest-news-on-thursday-100,0,www.thelocal.de,Today in Germany: A roundup of the latest news on Thursday,"European leaders to decide on the use of Russian money for Ukraine support, German government moves to allow hunting of wolves, restaurants unlikely to pass VAT savings onto customers and more news on Thursday, December 18th.",https://assets.thelocal.com/cdn-cgi/rs:fit:1200/quality:75/plain/https://apiwp.thelocal.com/wp-content/uploads/2025/12/watermarks-logo-AFP__20251217__88EW84N__v1__MidRes__GermanyPoliticsDefencePoliceDrone.jpg@webp,2025-12-18T07:30:24Z,,"European leaders to decide on the use of Russian money for Ukraine support, German government moves to allow hunting of wolves, restaurants unlikely to pass VAT savings onto customers and more news o… [+6809 chars]",,en,'species conservation'
https://www.lifesciencesworld.com/do-blue-winged-kookaburras-laugh/,https://www.lifesciencesworld.com/do-blue-winged-kookaburras-laugh/,0,www.lifesciencesworld.com,Do blue winged kookaburras laugh?,"Do Blue-Winged Kookaburras Laugh? A Deep Dive into Their Vocalizations The unmistakable vocalizations of the blue-winged kookaburra sound remarkably like human laughter, but do blue-winged kookaburras laugh? The answer is complex: while they don’t laugh in th…",,2025-12-08T06:57:00Z,,"The unmistakable vocalizations of the blue-winged kookaburra sound remarkably like human laughter, but do blue-winged kookaburras laugh? The answer is complex: while they don’t laugh in the human emo… [+6795 chars]",,en,'species conservation'
https://www.lifesciencesworld.com/are-hawks-and-eagles-friends/,https://www.lifesciencesworld.com/are-hawks-and-eagles-friends/,0,www.lifesciencesworld.com,Are hawks and eagles friends?,"Are Hawks and Eagles Friends? A Complex Relationship Unveiled The relationship between hawks and eagles is complex and far from friendly. In short, hawks and eagles are not friends; their interactions are primarily driven by competition for resources, territo…",,2025-12-09T01:57:46Z,,"The relationship between hawks and eagles is complex and far from friendly. In short, hawks and eagles are not friends; their interactions are primarily driven by competition for resources, territory… [+7098 chars]",,en,'species conservation'
https://www.businessinsider.com/national-geographic-pictures-of-the-year-best-wildlife-photos-2025-12,https://www.businessinsider.com/national-geographic-pictures-of-the-year-best-wildlife-photos-2025-12,0,www.businessinsider.com,National Geographic unveiled its Pictures of the Year. Here are 7 of the most striking wildlife photos.,National Geographic's annual Pictures of the Year issue features stunning wildlife photos highlighting endangered species and fragile ecosystems.,https://i.insider.com/6938689404d0f0a114f1afad?width=1200&format=jpeg,2025-12-09T19:08:13Z,,"Wildlife in Botswana.Stephen Wilkes/National Geographic
<ul><li>National Geographic's December 2025 issue features its annual Pictures of the Year.</li><li>The issue features striking wildlife photo… [+4022 chars]",,en,'endangered species'
